X,Date,TweetID,Text,BTC Price,User Location,User follower count,UserFollowingCount,User Verified,Quote Status?,AccountCreationDate,Default Profile Theme?,DefaultProfileImage,TotalAccountLikes,Subjectivity,Polarity
1700,6/27/2021,1.41E+18,"Buy and sell cryptocurrency. Easy and fast... Use more than 100 instantly convertible alternative payment methods and 28 currencies in Bitcoin, Ethereum and many others - without the need for additional verification. Start now for free:  ",33319.37,,1678,5006,FALSE,FALSE,3/26/2012 8:51,TRUE,FALSE,5006,0.65,0.338888889
1703,6/27/2021,1.41E+18," For all those who are new to this working from home Bitcoin trading options Here's a little tip:Get a trusted Bitcoin expert and stick to him  Invest and play at similar times each day.Because :In times of chaos, your investment is your anchor to success️",33319.37,South Africa,1867,1422,FALSE,FALSE,2/12/2019 11:46,TRUE,FALSE,1422,0.451515152,-0.017045455
1726,6/27/2021,1.41E+18, Why ElonMusk? He's the foremost authority on stealing ideas. He's not qualified to talk about bitcoin. I know more than him....and I know fuck all,33319.37,United Kingdom,75,160,FALSE,FALSE,12/13/2020 13:38,TRUE,FALSE,160,0.55,0.05
1730,6/27/2021,1.41E+18,bitcoin trying to clear resistance. ,33319.37,,341,731,FALSE,TRUE,12/25/2017 19:07,TRUE,FALSE,731,0.383333333,0.1
1732,6/27/2021,1.41E+18,"Yes, Mercea said he's the first bitcoin millionaire. Is it true? Maybe, but I never believed him. He also said a lot of other bullshit that wasn't true. One thing is for certain..he understood how Bitcoin worked and was the pioneer behind bitcoin toxicity.",33319.37,1952,40504,2330,FALSE,FALSE,9/9/2011 19:45,FALSE,FALSE,2330,0.541666667,0.085
1740,6/27/2021,1.41E+18, THIS IS UTTER NONSENSEThe FCA is enforcing the futures ban on  trades and  is just outright misinforming his followersBITCOIN AND  ARE STILL LEGAL TO USE IN THE UK,33319.37,TimeChain,2662,426,FALSE,FALSE,2/27/2013 18:55,TRUE,FALSE,426,0.6,0.1
1754,6/27/2021,1.41E+18, We all have exactly as much bitcoin as we deserve.,33319.37,United Kingdom,102,422,FALSE,FALSE,6/10/2011 16:36,TRUE,FALSE,422,0.2,0.2
1791,6/27/2021,1.41E+18,Strong hands are aggressively buying bitcoin right now!! | Pomp Podcast ...  via ,33319.37,Bitcoin Blockchain,644,916,FALSE,FALSE,8/1/2009 9:43,FALSE,FALSE,916,0.63452381,0.439880952
1817,6/27/2021,1.41E+18,"Mexico's third richest man: 'Bitcoin should be part of every portfolio, period -- the finite supply is the key. The fiat system is a fraud; even in the US, money creation is going to the moon. The dollar as hard money is a joke' ",33319.37,Subscribe 👉,2603,1024,FALSE,TRUE,6/18/2011 6:30,FALSE,FALSE,1024,0.513888889,-0.097222222
1824,6/27/2021,1.41E+18,"  if CBDCs essentially replace stable coins is this a good thing? i would think governments could almost regulate stablecoins out of existence, i dont think it would really compromise bitcoin privacy if you know what youre doing. Im not an expert but this seems plausible",33319.37,,219,1223,FALSE,FALSE,8/6/2019 19:32,TRUE,FALSE,1223,0.4,0.35
1841,6/27/2021,1.41E+18, $2k car and much more in Bitcoin ,33319.37,near Cologne,67,325,FALSE,FALSE,10/29/2011 8:58,TRUE,FALSE,325,0.5,0.5
1844,6/27/2021,1.41E+18,"  For all those who are new to this working from home Bitcoin trading options Here's a little tip:Get a trusted Bitcoin expert and stick to him  Invest and play at similar times each day.Because :In times of chaos, your investment is your anchor to success️",33319.37,South Africa,1867,1422,FALSE,FALSE,2/12/2019 11:46,TRUE,FALSE,1422,0.451515152,-0.017045455
1858,6/27/2021,1.41E+18,PRO TIP:Don’t risk with leverage. Bitcoin does at least 2% movement per day. With my support/resistance levels and just spot buy/sell orders you can make at least 1% profit per day. This means 30% per month and 360% per year.,33319.37,Europe,5170,348,FALSE,FALSE,11/29/2020 19:06,TRUE,FALSE,348,0.4,-0.3
1863,6/27/2021,1.41E+18,3) Top 10 Underlying Tokens for Stablecoin Structured Savings (APY): 474.56% 397.05% 275.14% 198.89% 198.12% 181.11%1INCH 163.30% 158.62% 150.54% 137.29%Crypto Bitcoin Ethereum StableCoins USDT USDC TUSD,33319.37,hello@pokket.com,3283,264,FALSE,FALSE,4/25/2019 7:53,TRUE,FALSE,264,0.5,0.5
1865,6/27/2021,1.41E+18,"    For all those who are new to this working from home Bitcoin trading options Here's a little tip:Get a trusted Bitcoin expert and stick to him  Invest and play at similar times each day.Because :In times of chaos, your investment is your anchor to success️",33319.37,South Africa,1867,1422,FALSE,FALSE,2/12/2019 11:46,TRUE,FALSE,1422,0.451515152,-0.017045455
1878,6/27/2021,1.41E+18,   My setup is pretty bougie. But it pays for itself with time and the quality of cup will be next level. I'll go do a tweet thread directly on my feed. Give me a few minutes.,33319.37,United States of America,3970,1525,FALSE,FALSE,11/29/2020 2:53,TRUE,FALSE,1525,0.375,0.0375
1886,6/27/2021,1.41E+18,"    For all those who are new to this working from home Bitcoin trading options Here's a little tip:Get a trusted Bitcoin expert and stick to him  Invest and play at similar times each day.Because :In times of chaos, your investment is your anchor to success️",33319.37,South Africa,1867,1422,FALSE,FALSE,2/12/2019 11:46,TRUE,FALSE,1422,0.451515152,-0.017045455
1891,6/27/2021,1.41E+18,Reddit_BTC : History Lesson 01/2018: Stripe ending BTC support because it’s useless for payments … a true story  ,33319.37,,2238,2984,FALSE,FALSE,6/13/2017 3:20,TRUE,FALSE,2984,0.425,-0.075
1892,6/27/2021,1.41E+18," not sure that's the most American thing we can do on the 4th, but I admire and enjoy your enthusiasm! ",33319.37,United States of America,700,570,FALSE,FALSE,10/29/2008 4:57,FALSE,FALSE,570,0.472222222,0.1875
1925,6/27/2021,1.41E+18,"Interested in LightningNetwork, bitcoin, or  ?Ping me! I'll pay the fee and invite you. ",33319.37,here to popularize dailyness,762,810,FALSE,FALSE,10/25/2007 17:31,FALSE,FALSE,810,0.5,0.3125
1934,6/27/2021,1.41E+18,"We always selloff during the night when we’re asleep and then as we wake up, the price gets some support most days",33319.37,United States of America,10855,11885,FALSE,FALSE,1/3/2019 23:21,TRUE,FALSE,11885,0.5,0.5
1941,6/27/2021,1.41E+18,   Root is a good name for what bitcoin pumpers are doing to punters,33319.37,Inside the simulation,321,621,FALSE,FALSE,8/14/2019 8:16,TRUE,FALSE,621,0.6,0.7
1949,6/27/2021,1.41E+18,"“supercycle” don’t mean all you degens become multimillionaires from 100x longing btc until infinity. it means that the halving mechanism has less effect as macro environment gains more effect on bitcoin’s price, so predicting future cycles is pointless. we are in a supercycle",33319.37,,1540,2874,FALSE,FALSE,12/9/2020 19:04,TRUE,FALSE,2874,0.375833333,-0.045833333
1957,6/27/2021,1.41E+18," While we don’t regulate cryptoassets like Bitcoin or Ether, we do regulate certain cryptoasset derivatives (such as futures contracts, contracts for difference and options), as well as those cryptoassets we would consider ‘securities’ – find out more information.",33319.37,,8,101,FALSE,FALSE,3/12/2018 7:14,TRUE,FALSE,101,0.523809524,0.238095238
1961,6/27/2021,1.41E+18,"  This was true until the ""law"" (read cops) started telling their ""Confidential Informants"" (aka SNITCHES) to infiltrate the meetups.  It now is a place where you WILL get robbed in meatspace once you are IDed: ",33319.37,Triple Border - 🇦🇷🇵🇾🇧🇷,577,2250,FALSE,FALSE,10/1/2019 10:17,TRUE,FALSE,2250,0.65,0.35
1981,6/27/2021,1.41E+18,Ethereum  wil be the first coin to flip Bitcoin  . But there's only ONE cryptocurrency that threatens the filthcoin's very existence:                              ,33319.37,United Kingdom,2774,1185,FALSE,TRUE,1/9/2012 9:53,TRUE,FALSE,1185,0.544444444,0.15
1984,6/27/2021,1.41E+18, This is really an awesome project.. It will go beyond moon   Join now guysgiveaway bitcoin    ethereum bsc    bnb   crypto doge shib pancakeswap,33319.37,,40,611,FALSE,FALSE,9/23/2016 11:16,TRUE,FALSE,611,1,1
1998,6/27/2021,1.41E+18,Free Bitcoin instantly. I have recover all my scammed coins  ,33319.37,,96,270,FALSE,FALSE,7/5/2017 17:40,TRUE,FALSE,270,0.733333333,0.2
