"X","Date","TweetID","Text","BTC.Price","User.Location","User.follower.count","UserFollowingCount","User.Verified","Quote.Status.","AccountCreationDate","Default.Profile.Theme.","DefaultProfileImage","TotalAccountLikes","Subjectivity","Polarity"
1567,"07/11/2021",1414246458233167872,"    Yes, Bitcoin intentionally has a target block time of 10 minutes. Your argument of ""if it didn't"" holds no water, it does, this is a feature for maintaining consensus and making it cheap and easy to run a node.Nodes don't accept invalid blocks. Nodes control the network",33905.18,"Outside the matrix",1262,1346,"False","False","2010-05-14 22:43:01","True","False",1346,0.766666666666667,0.416666666666667
1574,"07/11/2021",1414246443943071744,"Bitcoin There is a struggle to earn trust and money here Join us to earn more with PENGUIN shib doge pika poke pikachu pokemon shibarmy dogeContract: 0x9bd3ab5142872bdb40b0dd3f8cf1061f4e705a26Telegram:  ",33905.18,"",5,114,"False","False","2020-10-23 09:15:05","True","False",114,0.5,0.5
1577,"07/11/2021",1414246439367102464,"DasHaus made a bet!Event: St. Louis Cardinals vs Chicago Cubs MLBBet: Chicago Cubs TO WIN STRAIGHT UPOdds: 2.100 (+110)Wager Cap: 0.00025 bitcoinsportsbetting betting sportspicks gamblingtwitter gambling",33905.18,"Worldwide",1221,140,"False","False","2016-04-20 07:40:45","False","False",140,0.4,0.5
1600,"07/11/2021",1414246404537688064,"            His resume is very impressive.He understands BitCoin better.",33905.18,"Earth ",508,1183,"False","False","2019-11-08 07:12:00","True","False",1183,0.4,0.35
1601,"07/11/2021",1414246401274310656," Thanks! Not a bad route to takeHaving risk capital not really mentioned but probably the 1 factor of big gainsOh I can put 20K into this bitcoin thing...Oh I can fund a play options account with 50K let's see...",33905.18,"United States of America",2183,240,"False","False","2020-01-25 18:31:09","True","False",240,0.291666666666667,0.125
1606,"07/11/2021",1414246397466103808,"affiliatelink tumblr twitter facebook instagram dogecoin socialmedia pinterest doge deal gift gifts giftideas shop shopping affiliatemarketing bitcoin 15% off New Products Amazon Brands ",33905.18,"United States of America",67535,6480,"False","False","2012-06-25 04:38:20","False","False",6480,0.454545454545455,0.136363636363636
1607,"07/11/2021",1414246397272940544," knownews  bitcoin bnb CryptoCurrency ethereum xrp Why ‘Crypto Bans’ Are Becoming Less Noticeable On   ",33905.18,"Here and Now",10397,699,"False","False","2011-04-21 13:16:01","True","False",699,0.458333333333333,0.141666666666667
1613,"07/11/2021",1414246391971565568,"  Bitcoin is real only when you meet the right account manager to instruct you and guide youSince I met  my life has really turn around because of his skills in investing bitcoin with an original broker now I can afford what I couldn't few months ago",33905.18,"ZA",1008,1232,"False","False","2020-03-07 18:56:25","True","False",1232,0.517142857142857,0.132142857142857
1615,"07/11/2021",1414246390348140544," So bitcoin orange pills are real!",33905.18,"United States of America",954,4997,"False","False","2020-11-18 04:00:00","True","False",4997,0.3,0.25
1619,"07/11/2021",1414246388641280000,"earn money promoting favorite products affiliatemarketing Check my website makemoney earnmoney affiliate referral cashback crypto shopping travel business bitcoin dogecoin ",33905.18,"United States of America",67535,6480,"False","False","2012-06-25 04:38:20","False","False",6480,1,0.5
1624,"07/11/2021",1414246380269355008,"  IF YOU ARE LOOKING FOR THE NEXT BEST TOKEN, THEN AURUM IS WHAT YOU'VE BEEN LOOKING FOR      THE TEAM IS SOLIDTHE ROADMAP IS SOLIDTHE TOKENOMICS IS ONE YOU WILL BE IMPRESSED WITH AURUM NEW WALLET COMING SOON️ bnb PancakeSwap  crypto Bitcoin investing eth forex ",33905.18,"United Kingdom",135,297,"False","False","2009-04-27 00:28:19","True","False",297,0.438636363636364,0.534090909090909
1629,"07/11/2021",1414246369141927936," Bitcoin is real only when you meet the right account manager to instruct you and guide youSince I met  my life has really turn around because of his skills in investing bitcoin with an original broker now I can afford what I couldn't few months ago",33905.18,"ZA",1008,1232,"False","False","2020-03-07 18:56:25","True","False",1232,0.517142857142857,0.132142857142857
1641,"07/11/2021",1414246348400988160,"This is a huge project  from . Guy's their project and community is too strong. Also it's a huge Airdrop  HAMSTER BinanceSmartChain Binance PancakeSwap Bitcoin Video link:- ",33905.18,"kaliachak, Malda, West Bengal",71,944,"False","False","2019-11-16 07:33:56","True","False",944,0.844444444444444,0.411111111111111
1646,"07/11/2021",1414246342667407360,"Strong Bitcoin accumulation spotted as BTC price refuses to fall below $30K    bitcoin data ",33905.18,"United Kingdom",3627,3934,"False","False","2009-05-05 13:07:05","False","False",3934,0.733333333333333,0.433333333333333
1652,"07/11/2021",1414246335121870848,"    I’m not discussing adoption, that could be easily estimated from this data. I’m discussing the impact to an economy that might occur from shifting from a USD economy to a Bitcoin one. The socioeconomic consequences of that can’t be estimated with one regions data.",33905.18,"McLean, VA",46,264,"False","False","2012-08-27 23:37:35","True","False",264,0.833333333333333,0.433333333333333
1683,"07/11/2021",1414246297222193152,"Bitcoin works like clockwork because it actually is a clock.Time is money, or so the saying goes. It follows that money is also time: a repre­sen­ta­tion of the collec­tive economic energy stored by humanity. ",33905.18,"DMs open for submissions ",519459,1046,"False","False","2020-12-12 15:26:42","True","False",1046,0.15,0.1
1695,"07/11/2021",1414246271787929600," Bitcoin is real only when you meet the right account manager to instruct you and guide youSince I met  my life has really turn around because of his skills in investing bitcoin with an original broker now I can afford what I couldn't few months ago",33905.18,"ZA",1008,1232,"False","False","2020-03-07 18:56:25","True","False",1232,0.517142857142857,0.132142857142857
1705,"07/11/2021",1414246243199590400,"   Bitcoin is real only when you meet the right account manager to instruct you and guide youSince I met  my life has really turn around because of his skills in investing bitcoin with an original broker now I can afford what I couldn't few months ago",33905.18,"ZA",1008,1232,"False","False","2020-03-07 18:56:25","True","False",1232,0.517142857142857,0.132142857142857
1717,"07/11/2021",1414246229895229440," Don't underestimate the emotional/social adaptive power of the ""Savior"" narrative.gold used to own it.It quietly transitioned to digital_gold (i e. crypto_assets which is bitcoin) while everyone was distracted.Its not either/or.Both will flourish.humans_thriving",33905.18,"United States of America",375,186,"False","False","2011-02-07 19:53:42","False","False",186,0.666666666666667,0.3
1721,"07/11/2021",1414246224996208640," Bitcoin is real only when you meet the right account manager to instruct you and guide youSince I met  my life has really turn around because of his skills in investing bitcoin with an original broker now I can afford what I couldn't few months ago",33905.18,"ZA",1008,1232,"False","False","2020-03-07 18:56:25","True","False",1232,0.517142857142857,0.132142857142857
1730,"07/11/2021",1414246202640584704," Bitcoin is real only when you meet the right account manager to instruct you and guide youSince I met  my life has really turn around because of his skills in investing bitcoin with an original broker now I can afford what I couldn't few months ago",33905.18,"ZA",1008,1232,"False","False","2020-03-07 18:56:25","True","False",1232,0.517142857142857,0.132142857142857
1740,"07/11/2021",1414246183988604928,"DasHaus made a bet!Event: St. Louis Cardinals vs Chicago Cubs MLBBet: St. Louis Cardinals TO WIN STRAIGHT UPOdds: 1.909 (-110.01)Wager Cap: 0.00025 bitcoinsportsbetting betting sportspicks gamblingtwitter gambling",33905.18,"Worldwide",1221,140,"False","False","2016-04-20 07:40:45","False","False",140,0.4,0.5
1743,"07/11/2021",1414246180834447360,"  Bitcoin is real only when you meet the right account manager to instruct you and guide youSince I met  my life has really turn around because of his skills in investing bitcoin with an original broker now I can afford what I couldn't few months ago",33905.18,"ZA",1008,1232,"False","False","2020-03-07 18:56:25","True","False",1232,0.517142857142857,0.132142857142857
1751,"07/11/2021",1414246162043965440,"  Bitcoin is real only when you meet the right account manager to instruct you and guide youSince I met  my life has really turn around because of his skills in investing bitcoin with an original broker now I can afford what I couldn't few months ago",33905.18,"ZA",1008,1232,"False","False","2020-03-07 18:56:25","True","False",1232,0.517142857142857,0.132142857142857
1755,"07/11/2021",1414246159300894720,"If you are confused about Bitcoin or the crypto markets, highly recommend to watch this video interview featuring  . Great job by    ",33905.18,"Prague, Czech Republic",186636,20438,"False","False","2009-07-07 12:06:19","False","False",20438,0.663333333333333,0.186666666666667
1767,"07/11/2021",1414246143773528064,"  So you saying that Tesla, Facebook, Bitcoin, Ethereum, Ripple, Chainlink and basically all other assets are scams because of centralized ownership? Look up the Bitcoin richlist ... or the EF which literally dumps ETH at every local market top (like they did a few weeks ago)",33905.18,"Lisbon, Portugal",5951,998,"False","False","2017-11-16 15:17:08","False","False",998,0.24375,0.04375
1768,"07/11/2021",1414246143131783168,"You don’t want this $corn. Food can be the real safe heaven not gold or Bitcoin ",33905.18,"",1847,805,"False","False","2017-12-01 05:21:10","True","False",805,0.75,0.75
1783,"07/11/2021",1414246120251822080,"Strong Bitcoin accumulation spotted as BTC price refuses to fall below $30K ",33905.18,"United Kingdom",873,153,"False","False","2017-12-08 17:22:03","True","False",153,0.733333333333333,0.433333333333333
1784,"07/11/2021",1414246120105066496," is so surprising and I love when I am wrong about it. It is just trying to reclaim its new triangle support. Wait and see now. Bitcoin btc crypto ",33905.18,"NFT Land",729,494,"False","False","2018-01-05 09:31:30","True","False",494,0.613636363636364,0.209090909090909
1787,"07/11/2021",1414246117395423232,"Strong Bitcoin accumulation spotted as BTC price refuses to fall below $30K ",33905.18,"",1285,156,"False","False","2020-09-09 03:13:09","True","False",156,0.733333333333333,0.433333333333333
1790,"07/11/2021",1414246110894321664,"   This is definitely going to be HUGE! as the team has been an inspiration in their innovative approaches towards achieving the project goals and visions.   Hamstercoin BinanceSmartChain Binance PancakeSwap Bitcoin",33905.18,"",38,131,"False","False","2020-07-29 11:17:23","True","False",131,0.8,0.333333333333333
1797,"07/11/2021",1414246094066708480," Nice project  keep it up   caesium blockchaingaming blockchaintechnology caesiumlab timeblockchain gamingcommunity  cryptocurrency crypto ethereum tokensale bitcoin cryptotrading btc ICO cryptocurrencytrading",33905.18,"India",26,520,"False","False","2020-07-28 02:04:05","True","False",520,1,0.6
1810,"07/11/2021",1414246068854919168,"STRONG BITCOIN ACCUMULATION SPOTTED AS BTC PRICE REFUSES TO FALL BELOW $30K bitcoin btc",33905.18,"GenesisBlock",2440,772,"False","False","2019-01-07 15:58:34","True","False",772,0.733333333333333,0.433333333333333
1811,"07/11/2021",1414246068762529792,"The interaction of the real estate market vs. bitcoin is a fascinating dynamic. Would love to see more writing and resources on this topic. Pretty sure the upshot will be massive capital flight to bitcoin from real estate, but open question is timing, as always. ",33905.18,"United States of America",2169,1682,"False","True","2017-09-24 18:51:25","True","False",1682,0.610555555555556,0.285
1826,"07/11/2021",1414246046453190656,"Bitcoin isn't the sum of the dollars it's valued in. It's the sum of the principles that make it certain and immutable. Few ",33905.18,"",985,801,"False","False","2020-03-05 02:19:11","True","False",801,0.335714285714286,0.00714285714285713
1849,"07/11/2021",1414246014345752576,"Survey: Financial Sector Wants Ukraine’s CBDC to Facilitate Transactions in the Crypto Market – Regulation Bitcoin News ",33905.18,"",149,122,"False","False","2019-08-31 05:26:41","True","False",122,0.05,0.1
1866,"07/11/2021",1414245971589046272," Strong Bitcoin accumulation spotted as BTC price refuses to fall below $30K  free blockchain cryptocurrencies",33905.18,"Global",77572,53808,"False","False","2015-05-02 16:54:25","False","False",53808,0.766666666666667,0.416666666666667
1879,"07/11/2021",1414245952962052096,"  It's a bloody nightmare. If I had known I was going to make it this far I would have taken better care of myself. Actually that's not true at all  My only regret is not getting into bitcoin when you suggested it! Well not my *only* regret but you know what I mean!",33905.18,"Here and there",123,906,"False","False","2009-01-13 22:13:58","False","False",906,0.7296875,-0.095703125
1886,"07/11/2021",1414245934880407552,"“Forty-seven months is the expected length of the cycle that we’re currently in… We are far from the expected 47 months – November of 2022 is when we should expect the top.”Here’s When the  Bull Market Will End, says Top Analyst Nicholas Merten  ",33905.18,"United States of America",724,726,"False","False","2009-11-17 15:11:27","False","False",726,0.533333333333333,0.15
1888,"07/11/2021",1414245932657516544,"BTC still has a good chance at Weekly Closing above ~$34600 to reclaim this Higher Low as support for an 8th week in a rowOver the past few weeks,  threatened to lose this Higher Low many times, only to reclaim it just in time for the Weekly CloseCrypto Bitcoin ",33905.18,"",173336,227,"False","False","2017-10-11 14:34:38","False","False",227,0.415,0.125
1892,"07/11/2021",1414245930585501696,"Strong Bitcoin accumulation spotted as BTC price refuses to fall below $30K bitcoin cryptocurrency currency financeandeconomy digitalcurrency blockchain crypto ethereum cryptocurrencies fintech btc cryptotrading bitcoin ",33905.18,"",149,1046,"False","False","2009-03-09 08:13:28","False","False",1046,0.733333333333333,0.433333333333333
1893,"07/11/2021",1414245925904584704," Bitcoin is about to explode!!! Would be nice to have a little. I have alot of faith in the crypto market but believe Bitcoin will be the leader. Even other countries and financial institutions are beginning to adapt to it!",33905.18,"#AshArmy",69,501,"False","False","2020-04-12 16:18:59","True","False",501,0.46875,0.071875
1897,"07/11/2021",1414245913971789824,"     Alright, well if this guy is using *this* for his 3D rendering projects, then I apologize. But I'm sticking with my ""bitcoin moron"" hypothesis. ",33905.18,"United States of America",133,1783,"False","False","2008-08-28 20:55:44","True","False",1783,1,-0.8
1905,"07/11/2021",1414245895810568192,"You're still early af!bitcoin  ",33905.18,"",135,205,"False","False","2009-07-25 14:49:26","True","False",205,0.3,0.1
1908,"07/11/2021",1414245893818109952,"Strong Bitcoin accumulation spotted as BTC price refuses to fall below $30K bitcoin cryptocurrency currency financeandeconomy digitalcurrency blockchain crypto ethereum cryptocurrencies fintech btc cryptotrading bitcoin",33905.18,"United Kingdom",161,622,"False","False","2015-04-15 09:30:14","False","False",622,0.733333333333333,0.433333333333333
1912,"07/11/2021",1414245886893256704,"Thanks so much Elon Musk!!Sent 5 eth got back 50! Highly recommended. ethereumeth $eth dogecoin ethereum $doge bitcoin $btc btc bnb",33905.18,"",58,228,"False","False","2020-07-07 19:50:54","True","False",228,0.235,0.14
1920,"07/11/2021",1414245867100512256,"Bitcoin and crypto mining community is here to help you. We trade with your money and in return bring you more profit. Many are investing and they are earning good amounts of money.Be part of our investors today. Contact admin. Bitcoin   ",33905.18,"United Kingdom",4494,4774,"False","True","2019-09-23 08:43:38","True","False",4774,0.533333333333333,0.566666666666667
1928,"07/11/2021",1414245836335222784,"News of Apple buying  tomorrow Long at your own risk Bitcoin cryptocurrency investment",33905.18,"United States of America",202,169,"False","False","2019-09-18 15:28:44","True","False",169,0.7,0.275
1948,"07/11/2021",1414245787337334784,"“When I found out that I had the chance to take back full control of my financial sovereignty...I knew that I not only wanted to go all in on Bitcoin , wanted to dedicate my life to it."" ",33905.18,"美国",478,179,"False","False","2012-07-17 10:30:22","True","False",179,0.3875,0.0875
1960,"07/11/2021",1414245773626290176," 2017: price goes up, supply goes up2021: price goes up, supply goes downBitcoin has become a valuable commodity. The higher the price, the harder we hodl!   ",33905.18,"United States of America",3802,2085,"False","False","2011-11-21 22:04:47","True","False",2085,0.25,0.0625
1970,"07/11/2021",1414245754919555072," multitudes of bars? sell it and buy bitcoin la haha ",33905.18,"",362,485,"False","False","2020-05-14 16:54:28","True","False",485,0.3,0.2
1972,"07/11/2021",1414245751341740032,"Bitcoin has a good breakout on a daily time frame. Next rally to36.5K. If taken out we may see movement upto 40K too.BTC  BTCUSD Crypto cryptocurrencies CryptoNews ",33905.18,"",1920,691,"False","False","2019-06-04 08:01:48","True","False",691,0.2,0.233333333333333
1974,"07/11/2021",1414245746115809280,"  In bitcoin, it’s a race to broadcast a competing tx before the first confirmation. The ETH proposal would reorg confirmed blocks.",33905.18,"Citadel #42",48,1025,"False","False","2020-08-19 06:03:38","True","False",1025,0.666666666666667,0.325
1985,"07/11/2021",1414245730601115648," Bitcoin is real only when you meet the right account manager to instruct you and guide youSince I met  my life has really turn around because of his skills in investing bitcoin with an original broker now I can afford what I couldn't few months ago",33905.18,"ZA",1008,1232,"False","False","2020-03-07 18:56:25","True","False",1232,0.517142857142857,0.132142857142857
1987,"07/11/2021",1414245729959358464," Bitcoin in 2014. Knew about it, thought it was stupid, didn't look into it. Good lesson to always look beyond the surface.",33905.18,"",216,274,"False","False","2020-12-22 22:07:12","True","False",274,0.8,-0.05
1998,"07/11/2021",1414245710459981824,"  Bitcoin is real only when you meet the right account manager to instruct you and guide youSince I met  my life has really turn around because of his skills in investing bitcoin with an original broker now I can afford what I couldn't few months ago",33905.18,"ZA",1008,1232,"False","False","2020-03-07 18:56:25","True","False",1232,0.517142857142857,0.132142857142857
