"X","Date","TweetID","Text","BTC.Price","User.Location","User.follower.count","UserFollowingCount","User.Verified","Quote.Status.","AccountCreationDate","Default.Profile.Theme.","DefaultProfileImage","TotalAccountLikes","Subjectivity","Polarity"
447,"07/12/2021",1414602792568721408,"This is a great and excellent project and also the reward is great. Thanks for shared this wonderful opportunity. Best wishes for all team members. Keep going and get to the success!Rocket   KUAPE KUCOIN KCC MEME BITCOIN KUAPEFINANCE ",33331,"Bandung",302,2224,"False","True","2011-12-03 07:05:50","False","False",2224,0.666666666666667,0.8
465,"07/12/2021",1414602773987958784,"FOR FREE 0.0001 bitcoin sign up bonus earn withdraw money going in your bank account and more ways available worldwide.FREE sign up on  For Free Money||||||||",33331,"For more money click on ",23,1407,"False","False","2020-11-25 20:00:55","True","False",1407,0.625,0.425
469,"07/12/2021",1414602771249127424,"Under relatively free market conditions, Bitcoin has repeatedly failed to become a popular medium-of-exchange. With the El Salvador experiment I suspect we'll see it once again fail—this time despite benefiting from a government that wants to force it into circulation.",33331,"Canada",21322,546,"False","False","2012-11-02 21:35:07","False","False",546,0.525,0.175
489,"07/12/2021",1414602748956454912,"linkedin twitter birthdaygift facebook instagram tiktok socialmedia tumblr dogecoin deal gift gifts giftideas shop shopping affiliatemarketing bitcoin popcorn Enjoy $10 off Orders of $50+ - Use code IR10 - ",33331,"United States of America",67542,6497,"False","False","2012-06-25 04:38:20","False","False",6497,0.5,0.4
492,"07/12/2021",1414602747035275264,"The Most Diversified Decentralized Meme Token Ecosystem For Kucoin Community ChainThis is KuApe FinanceKUAPE KUCOIN KCC GIVEAWAY MEME BITCOIN KUAPEFINANCE DEX IDO",33331,"",47,391,"False","False","2020-07-16 12:01:32","True","False",391,0.5,0.5
493,"07/12/2021",1414602745366171648," Great project. Hopefully the project would attract community members who would invest and be happy to harvest in due time.SwisDoge Airdrop Airdrops airdropalert bitcoin dogearmy dogecoin SOL BinanceSmartChain BinanceTurns4",33331,"",11,368,"False","False","2020-02-26 01:51:09","True","False",368,0.708333333333333,0.491666666666667
498,"07/12/2021",1414602739321950208," nice to be here..this project is very interesting don't miss the opportunity to join this community..success to all the team..this will be a very awesome project guys""    KUAPE KUCOIN KCC MEME BITCOIN KUAPEFINANCE "".",33331,"",136,812,"False","False","2020-06-08 13:15:50","True","False",812,0.883333333333333,0.75
503,"07/12/2021",1414602732439183360,"Good day, how are you doing guys? We will have a big campaign on Monday, are you guy ready to participate? Guess what?️‍️You are the pioneer in our communityKUAPE KUCOIN KCC MEME BITCOIN KUAPEFINANCE DEX IDO AIRDROP GIVEAWAY",33331,"Hải Phòng, Việt Nam",139,695,"False","False","2020-08-30 09:32:58","True","False",695,0.4,0.3
512,"07/12/2021",1414602721253023744,"  So if you have a Dollar to spend on food. Buying a Big Mac is the healtiest option? Wake up, Bitcoin is NOT a green Cryptocurency!! Go read up on ADA and XRP maxipads… Source: ",33331,"Blockchain",645,193,"False","False","2018-08-04 08:18:45","False","False",193,0.2,0.078125
514,"07/12/2021",1414602721101959168,"KuApe Finance is good project ( i hope )But ya i will support this project.Nice sir let's go build the future KUAPE KUCOIN KCC MEME BITCOIN KUAPEFINANCE",33331,"-",154,809,"False","False","2018-12-27 07:48:14","True","False",809,0.3625,0.35
528,"07/12/2021",1414602706136846336,"Good news for crypto holders looking for a tax break on Bitcoin (BTC) profits -  ",33331,"United Kingdom",1731,1970,"False","False","2012-03-20 16:31:53","False","False",1970,0.6,0.7
529,"07/12/2021",1414602706107338752,"The project is implemented very professionally and has a clear development plan. Made by a very professional and experienced team.     KUAPE KUCOIN KCC MEME BITCOIN KUAPEFINANCE ",33331,"",183,600,"False","True","2020-04-01 05:00:22","True","False",600,0.385833333333333,0.29
531,"07/12/2021",1414602704786116608,"Hey , how many CEOs signed up for next year’s conference?bitcoin ",33331,"United States of America",1027,563,"False","True","2014-03-03 16:44:34","False","False",563,0.25,0.25
539,"07/12/2021",1414602697794375680,"Looking for a CryptoTrip in Arizona? Red Rock is known for its 286-acre State Park full of wildlife and famous rock formations.CoinFlip has 10 Bitcoin ATMs within 50 miles of Red Rock, find one of our ATMs and other CryptoVenues on : ",33331,"United States of America",25077,490,"True","False","2016-05-27 16:41:54","False","False",490,0.385,0.145
542,"07/12/2021",1414602694535393280,"On the exact day of the top, Saylor indirectly advised people to mortgage their house to buy Bitcoin~40,000 people voted to agree ",33331,"United States of America",3844,447,"False","False","2020-12-15 05:17:56","True","False",447,0.375,0.375
544,"07/12/2021",1414602690433359872," lately i’m getting a lot of “when the power goes out globally, everyone will use gold not bitcoin” from millenials. wtaf are these people smoking? when the power goes out globally, you’ll die because you won’t have MSM telling you what to do and think",33331,"",654,901,"False","False","2019-11-08 11:36:40","True","False",901,0.2,-0.1
549,"07/12/2021",1414602686872244224,"This is definitely Going to be huge!  Thanks for giving us such a great opportunity to take part in this airdrop. Great project,I'm very interestedIn future This will make a huge contribution to the crypto worldKUAPE KUCOIN KCC MEME BITCOIN KUAPEFINANCE",33331,"",67,1075,"False","False","2020-10-19 18:41:56","True","False",1075,0.547222222222222,0.322222222222222
556,"07/12/2021",1414602681784569856," Best project ever Thumbs upI'm very happy to be participating in this projectI hope this project will gain more popularity in the futureKUAPE KUCOIN KCC MEME BITCOIN KUAPEFINANCE DEX IDO AIRDROP GIVEAWAY",33331,"",100,932,"False","False","2020-12-04 11:43:52","True","False",932,0.6,0.833333333333333
557,"07/12/2021",1414602681251860480," The project is implemented very professionally and has a clear development plan. Made by a very professional and experienced team.     KUAPE KUCOIN KCC MEME BITCOIN KUAPEFINANCE",33331,"",183,600,"False","False","2020-04-01 05:00:22","True","False",600,0.385833333333333,0.29
569,"07/12/2021",1414602666269945856," There are bitcoin options they just haven't taken off too muchthere was one I was looking into around Consensus but now I can't remember...But bitcoiners also have a critique of finance as we know it (fractional reserve banking, etc) and sticking to one's guns is cool too",33331,"United States of America",11905,997,"True","False","2008-04-24 15:56:06","False","False",997,0.65,0.35
573,"07/12/2021",1414602663149309952,"     99% there? Send an on chain tx with bitcoin and Monero. Pound for pound, monero is more private. “But coinjoins and lightning!” - coinjoins cost substantially more and doesn’t hide amounts. Lightning- u don’t 100% hold the coins until it’s settled on chain.",33331,"The Land of Bits and Bytes",123,365,"False","False","2020-06-25 04:20:23","True","False",365,0.458333333333333,0.333333333333333
576,"07/12/2021",1414602660985163776,"El Salvador went ahead and named the government's bitcoin exchange platform Chivo Cute but wondering if they know it's nothing like what goat stand for in English. It has a very different colloquial meaning in Spanish. From cheating, to suspicious, to pimp, to lie ",33331,"United States of America",2187,3699,"False","True","2009-04-28 19:36:45","False","False",3699,0.445,0.125
577,"07/12/2021",1414602660523614208,"I hope this project will gain more popularity in the futureI hope I'm the lucky one to join this amazing project  KUAPE KUCOIN KCC MEME BITCOIN KUAPEFINANCE",33331,"",55,319,"False","False","2015-12-26 08:52:17","True","False",319,0.744444444444444,0.477777777777778
585,"07/12/2021",1414602646497816576," Cool project, hopefully in the future it can be even more successful for the team KUAPE KUCOIN KCC MEME BITCOIN KUAPEFINANCE",33331,"",127,1705,"False","False","2020-01-14 21:24:36","True","False",1705,0.55625,0.4
586,"07/12/2021",1414602646485233664,"A good project and strong team, in a predictable and transparent road map, planned and projected. I trust in this project, and clearly sured that it will prove to be very powerfully in the nearest future, great progress I ever KUAPE KUCOIN KCC MEME BITCOIN KUAPEFINANCE",33331,"",47,1456,"False","False","2020-07-26 12:35:26","True","False",1456,0.58452380952381,0.317619047619048
589,"07/12/2021",1414602643905814528," knownews  bitcoin bnb CryptoCurrency ethereum xrp El Salvador’s Adoption Of Bitcoin As Legal Tender   ",33331,"Here and Now",10396,699,"False","False","2011-04-21 13:16:01","True","False",699,0.2,0.2
618,"07/12/2021",1414602600318701568,"    Yes, you lied about being in ""this space"" since 2013, wasn't able to understand a simple Bitcoin transaction.I don't care about shitcoins, do you HODL BTC ?",33331,"El Salvador",2121,1210,"False","False","2020-08-12 10:31:54","True","False",1210,0.491071428571429,0.25
622,"07/12/2021",1414602594601750528,"This project looks very interesting. I am interested, and I will support this project until it is successful according to the plan that has been set. KUAPE KUCOIN KCC GIVEAWAY MEME BITCOIN KUAPEFINANCE DEX IDO ",33331,"",320,1463,"False","True","2019-04-19 13:42:41","True","False",1463,0.7,0.55
627,"07/12/2021",1414602583046385664,"Fantastic project with great potential. The team's dedication and ingenuity with excellent fan support will make this the envy of the crypto world. Glad to be part. KUAPE KUCOIN KCC MEME BITCOIN KUAPEFINANCE",33331,"",125,638,"False","False","2019-08-09 11:12:31","True","False",638,0.93,0.54
628,"07/12/2021",1414602582983467008,"This is a strong community driven project with a great dev team and concept KUAPE KUCOIN LCC MEME BITCOIN KUAPEFINANCE ",33331,"Cannot show the location...",127,208,"False","True","2013-07-30 07:28:02","True","False",208,0.741666666666667,0.616666666666667
638,"07/12/2021",1414602572103516160,"  I want to participate in this project.  want to know more, I'm sure this project is good   KUAPE KUCOIN KCC GIVEAWAY MEME BITCOIN KUAPEFINANCE DEX IDO",33331,"pluto",123,819,"False","False","2020-05-22 18:47:24","True","False",819,0.662962962962963,0.566666666666667
639,"07/12/2021",1414602571839279104," This project looks very interesting. I am interested, and I will support this project until it is successful according to the plan that has been set. KUAPE KUCOIN KCC GIVEAWAY MEME BITCOIN KUAPEFINANCE DEX IDO",33331,"",320,1463,"False","False","2019-04-19 13:42:41","True","False",1463,0.7,0.55
646,"07/12/2021",1414602558543319040,"I believe this is a faithful project.The projector has a lot of attractions so hopefully the project will be better in the future and will be the best.I love it. Go moonKUAPE KUCOIN KCC MEME BITCOIN KUAPEFINANCE",33331,"",51,580,"False","False","2020-04-17 13:54:50","True","False",580,0.408333333333333,0.333333333333333
649,"07/12/2021",1414602557402451968,"I Think, this is very strong projectThanks for shared this wonderful opportunityBest wishes for all team members ️KUAPE KUCOIN KCC MEME BITCOIN KUAPEFINANCE",33331,"",57,629,"False","False","2019-10-11 22:44:35","True","False",629,0.976666666666667,0.781666666666667
650,"07/12/2021",1414602557222277120,"Bought BTC To Get Rich? No Problem, but Now, You Must Discover the 4 Rules of the Bitcoin Protocol Curated post from Publish0x Read articles, tip authors and get FreeCrypto! ad",33331,"",278,2000,"False","False","2015-12-20 13:49:51","False","False",2000,0.75,0.46875
651,"07/12/2021",1414602555183693824,"I want to participate in this project.  want to know more, I'm sure this project is good   KUAPE KUCOIN KCC GIVEAWAY MEME BITCOIN KUAPEFINANCE DEX IDO ",33331,"pluto",123,819,"False","True","2020-05-22 18:47:24","True","False",819,0.662962962962963,0.566666666666667
672,"07/12/2021",1414602529598439424,"Welcome words from KuApe Financejoin now... POTENTIAL PROJECT... DEV IS RIRC Almost 1200 followers on Twitter, let make Kucoin Community Chain great again  KUAPE KUCOIN KCC GIVEAWAY MEME BITCOIN KUAPEFINANCE DEX IDO ",33331,"",124,900,"False","False","2020-09-23 19:58:32","True","False",900,0.883333333333333,0.533333333333333
675,"07/12/2021",1414602527601946624,"with the opportunity to take part in this airdrop, I am very enthusiastic because this is an excellent project, let's take it to the moonKUAPE KUCOIN KCC MEME BITCOIN KUAPEFINANCE",33331,"Indonesia",104,1479,"False","False","2018-10-26 10:38:41","True","False",1479,1,0.89
678,"07/12/2021",1414602521935450112," Glad to be joined this communityI'm very happy to be participating in this projectI hope this project will gain more popularity in the future.I hope I'm the lucky one to join this   KUAPE KUCOIN KCC MEME BITCOIN KUAPEFINANCE",33331,"",66,682,"False","False","2020-05-26 23:47:21","True","False",682,0.833333333333333,0.583333333333333
680,"07/12/2021",1414602521616601088,"The Most Diversified Decentralized Meme Token Ecosystem For Kucoin Community Chain This is KuApe Finance. KUAPE KUCOIN KCC MEME BITCOIN KUAPEFINANCE",33331,"SG",6599,6983,"False","False","2015-10-13 23:12:47","True","False",6983,0.5,0.5
693,"07/12/2021",1414602507662159872,"Airdrop is liveI Think, this is very strong projectThanks for shared this wonderful opportunityBest wishes for all team membersKUAPE KUCOIN KCC MEME BITCOIN KUAPEFINANCE",33331,"",33,480,"False","False","2020-11-29 03:15:56","True","False",480,0.976666666666667,0.781666666666667
695,"07/12/2021",1414602505925791744,"This project looks very interesting. I am interested, and I will support this project until it is successful according to the plan that has been set KUAPE KUCOIN KCC MEME BITCOIN KUAPEFINANCE   ",33331,"Indonesia",194,742,"False","True","2013-07-08 14:34:39","False","False",742,0.7,0.55
696,"07/12/2021",1414602503170125824,"This is a GREAT and EXCELLENT project and also the reward is AMAZING. Thanks for shared this wonderful opportunity      KUAPE KUCOIN KCC MEME BITCOIN KUAPEFINANCE",33331,"",119,1031,"False","False","2012-10-29 19:17:42","True","False",1031,0.77,0.72
700,"07/12/2021",1414602499101577216,"I'm very happy to be participating in this projectI hope this project will gain more popularity in the futureI hope I'm the lucky one to join this amazing project   KUAPE KUCOIN KCC MEME BITCOIN  KUAPEFINANCE ",33331,"",117,309,"False","True","2018-10-16 16:58:38","True","False",309,0.808333333333333,0.608333333333333
701,"07/12/2021",1414602497855954944,"Best project ever Thumbs upI'm very happy to be participating in this projectI hope this project will gain more popularity in the future.I hope I'm the lucky one to join this amazing projectKUAPE KUCOIN KCC MEME BITCOIN KUAPEFINANCE ",33331,"",374,1013,"False","True","2012-08-06 12:47:09","False","False",1013,0.706666666666667,0.686666666666667
707,"07/12/2021",1414602491077951488,"Kuape Finance is a team of experienced blockchain and marketing experts in the field, this help us to complete this huge decentralized project.KUAPE KUCOIN KCC MEME BITCOIN KUAPEFINANCE ",33331,"Indonesia",105,1766,"False","True","2020-05-26 09:10:07","True","False",1766,0.733333333333333,0.433333333333333
710,"07/12/2021",1414602486850064384,"I think KuApe is a new breakthrough in the crypto world, I believe in the future KuApe can compete in the crypto market and I believe KuApe can beat Bitcon in the near future  KUAPE KUCOIN KCC MEME BITCOIN KUAPEFINANCE",33331,"",118,1171,"False","False","2020-10-23 09:34:09","True","False",1171,0.276136363636364,0.0590909090909091
712,"07/12/2021",1414602486321537024,"Nice project and I look forward to the growth and success of this project High reputation and strong real name, I hope more friends will participate in the understandKUAPE KUCOIN KCC MEME BITCOIN KUAPEFINANCE",33331,"",131,1299,"False","False","2013-11-13 08:43:20","False","False",1299,0.512222222222222,0.365555555555556
715,"07/12/2021",1414602481800081408," Best project ever Thumbs upI'm very happy to be participating in this projectI hope this project will gain more popularity in the futureI hope I'm the lucky one to join this amazing project   KUAPE KUCOIN KCC MEME BITCOIN KUAPEFINANCE",33331,"Kuningan",246,1147,"False","False","2012-02-25 14:29:18","False","False",1147,0.706666666666667,0.686666666666667
718,"07/12/2021",1414602477404569600," HIVE Buys 3,019 New Bitcoin Mining Rigs, Joins Foundry USA Pool  free eth cryptocurrencies",33331,"Global",77554,53797,"False","False","2015-05-02 16:54:25","False","False",53797,0.627272727272727,0.268181818181818
729,"07/12/2021",1414602466629361664," believe this is a faithful project.The projector has a lot of attractions so hopefully the project will be better in the future and will be the best.️️️KUAPE KUCOIN KCC MEME BITCOIN KUAPEFINANCE DEX IDO AIRDROP GIVEAWAY",33331,"Indonesia",37,725,"False","False","2018-12-25 18:21:58","True","False",725,0.3125,0.25
733,"07/12/2021",1414602460694523904,"We must set the truth as our foundation &amp; build upon a peaceful social order that's 100% interference-proof &amp; backed by trustworthy databases. blockchain cryptocurrency bitcoin ethereum crypto  ",33331,"",366,940,"False","False","2017-10-14 09:36:42","True","False",940,0.283333333333333,0.141666666666667
744,"07/12/2021",1414602450544205824,"hi friends, don't miss this opportunity, this project will be a good investment for you in the future and many surprises to comeClaim your airdrop, to the moon     KUAPE KUCOIN KCC MEME BITCOIN KUAPEFINANCE",33331,"Bandung",100,384,"False","False","2019-04-15 10:09:29","True","False",384,0.408333333333333,0.4
746,"07/12/2021",1414602448468070400,"   A lot of IRA’s offer bitcoin investing but you need a minimum amount in your account (like 10k) to invest simce they consider it very volatile.",33331,"Winston-Salem, NC",80,472,"False","False","2016-09-26 04:34:48","True","False",472,0.3,0.2
764,"07/12/2021",1414602437688664064,"  wkwkwkwk. trustwallet please help me, i have 100 bitcoin need to transfer it to my best friend orang gila",33331,"Indonesia",139,3148,"False","False","2011-08-12 04:51:06","True","False",3148,0.3,1
770,"07/12/2021",1414602433406193664," I believe this is a faithful project.The projector has a lot of attractions so hopefully the project will be better in the future and will be the best.I love KUAPE KUCOIN KCC GIVEAWAY MEME BITCOIN  KUAPEFINANCE DEX IDO",33331,"",374,1013,"False","False","2012-08-06 12:47:09","False","False",1013,0.408333333333333,0.333333333333333
775,"07/12/2021",1414602420995256320,"good team, potential project, i always support the development team to the moon, thanks for the great gift   KUAPE KUCOIN KCC MEME BITCOIN KUAPEFINANCE",33331,"",42,357,"False","False","2018-12-18 04:05:15","True","False",357,0.6375,0.425
781,"07/12/2021",1414602417937682432," good project, hopefully in the future it can be even more successful for the team KUAPE KUCOIN KCC MEME BITCOIN KUAPEFINANCE",33331,"Indonesia",29,502,"False","False","2020-11-07 18:47:50","True","False",502,0.54375,0.4875
786,"07/12/2021",1414602416318713856,"when I die I want an identifiable segment of my DNA to be published as a block note on a new mined block with an epitaph instead of being buried. donate my body to science. there has to be a market for this in funeral prep services - immortalize yourself with bitcoin",33331,"United States of America",57,208,"False","False","2020-10-21 00:55:06","True","False",208,0.477272727272727,0.118181818181818
793,"07/12/2021",1414602410484539392," That's why the State owns your timeYou don't actually own anything other than Bitcoin and other crypto assetsYou own real estate or shares with the permission of the State",33331,"",3564,267,"False","False","2007-12-29 11:25:02","False","False",267,0.61,0.23
811,"07/12/2021",1414602393874927616," Best project ever Thumbs upI'm very happy to be participating in this projectI hope this project will gain more popularity in the futureI hope I'm the lucky one to join this amazing projectKUAPE KUCOIN KCC MEME BITCOIN KUAPEFINANCE",33331,"",75,641,"False","False","2018-04-22 08:13:50","True","False",641,0.706666666666667,0.686666666666667
813,"07/12/2021",1414602390062309376,"Very amazing projects, this is running on KCC Network, amazingKUAPE KUCOIN KCC MEME BITCOIN KUAPEFINANCE ",33331,"",30,127,"False","False","2019-06-24 09:28:08","True","False",127,1,0.78
816,"07/12/2021",1414602387910651904,"This project looks very interesting. I am interested, and I will support this project until it is successful according to the plan that has been set KUAPE KUCOIN KCC MEME BITCOIN KUAPEFINANCE",33331,"",110,970,"False","False","2020-10-07 02:43:28","True","False",970,0.7,0.55
829,"07/12/2021",1414602371485769728,"thank you very much for holding an airdrop as good as this I am very enthusiastic to take part in this airdrop KUAPE KUCOIN KCC MEME BITCOIN KUAPEFINANCE ",33331,"",118,166,"False","True","2019-08-29 15:39:39","True","False",166,0.62,0.58
831,"07/12/2021",1414602369510166528,"  I believe this is a faithful project.The projector has a lot of attractions so hopefully the project will be better in the future and will be the best.I love it   KUAPE KUCOIN KCC GIVEAWAY MEME BITCOIN KUAPEFINANCE DEX IDO",33331,"",34,781,"False","False","2020-06-08 12:38:10","True","False",781,0.408333333333333,0.333333333333333
836,"07/12/2021",1414602367618584576," I believe this is a faithful project.The projector has a lot of attractions so hopefully the project will be better in the future and will be the best.I love  KUAPE KUCOIN KCC GIVEAWAY MEME BITCOIN  KUAPEFINANCE DEX IDO",33331,"",100,932,"False","False","2020-12-04 11:43:52","True","False",932,0.408333333333333,0.333333333333333
841,"07/12/2021",1414602359590719488,"  Fantastic project with great potential. The team's dedication and ingenuity with excellent fan support will make this the envy of the crypto world. Glad to be part.KUAPE KUCOIN KCC GIVEAWAY BITCOIN KUAPEFINANCE DEX",33331,"Natar Suck Town",20,198,"False","False","2013-07-21 09:10:13","True","False",198,0.93,0.54
844,"07/12/2021",1414602356168134656,"Well... This project its so nice. You must know this KUAPE KUCOIN KCC MEME BITCOIN KUAPEFINANCE",33331,"",41,192,"False","False","2020-05-26 08:57:05","True","False",192,1,0.6
849,"07/12/2021",1414602352720596992,"Amazing bitcoin ",33331,"United States of America",117,417,"False","True","2009-07-13 17:29:04","False","False",417,0.9,0.6
852,"07/12/2021",1414602348136067072," Thank you for giving us a good opportunity, I always support, development team to the moon    KUAPE KUCOIN KCC MEME BITCOIN KUAPEFINANCE",33331,"Indonesia",4931,1390,"False","False","2013-12-10 07:37:23","False","False",1390,0.6,0.7
858,"07/12/2021",1414602342306095104," Is the article wrong to argue that ""Ultra-low interest rates ...stop having a beneficial effect when they dip so low that they distort savings incentives and instead drive speculative investing like in Bitcoin or GameStop, to cite two current examples""?",33331,"",416,198,"False","False","2008-10-19 00:23:11","True","False",198,0.533333333333333,-0.166666666666667
863,"07/12/2021",1414602333116407808,"Bitcoin fixes the criminal elite ",33331,"",56,138,"False","True","2013-08-26 18:13:54","True","False",138,0.55,-0.4
871,"07/12/2021",1414602325910384640,"️‍️KuApe-DEX is a part of our ecosystem. This will become one of the cutting-edge decentralized exchange, together with our launchpad. We will release our beta version very soon KUAPE KUCOIN KCC MEME BITCOIN KUAPEFINANCE DEX IDO ",33331,"",137,1365,"False","False","2020-01-26 16:58:05","True","False",1365,0.3,0.2
881,"07/12/2021",1414602316120924160," Good day, how are you doing guys?This project looks very interesting. I am interested, and I will support this project until it is successful according to the plan that has been set KUAPE KUCOIN KCC MEME BITCOIN KUAPEFINANCE DEX IDO AIRDROP GIVEAWAY",33331,"Unknown",150,1294,"False","False","2020-07-22 15:51:40","True","False",1294,0.675,0.5875
897,"07/12/2021",1414602296516743168,"Kuape Finance is a team of experienced blockchain and marketing experts in the field, this help us to complete this huge decentralized project.KUAPE KUCOIN KCC MEME BITCOIN KUAPEFINANCE",33331,"",659,1604,"False","False","2013-03-25 15:07:40","True","False",1604,0.733333333333333,0.433333333333333
910,"07/12/2021",1414602282583269376," This project looks very interesting. I am interested, and I will support this project until it is successful according to the plan that has been set.    KUAPE KUCOIN KCC GIVEAWAY MEME BITCOIN KUAPEFINANCE DEX IDO",33331,"",66,682,"False","False","2020-05-26 23:47:21","True","False",682,0.7,0.55
911,"07/12/2021",1414602281283067904,"Nice project and I look forward to the growth and success of this project KUAPE KUCOIN KCC MEME BITCOIN KUAPEFINANCE",33331,"Indonesia",177,958,"False","False","2020-12-30 11:34:30","True","False",958,0.5,0.45
926,"07/12/2021",1414602262853398528," Hey thanks for the reminder, I just sold the rest of my stocks, to buy Bitcoin",33331,"United States of America",944,4891,"False","False","2009-05-25 03:19:03","True","False",4891,0.2,0.2
927,"07/12/2021",1414602262794539008,"I'm very interested in this project, Come on everyone join and learn how the project works   join now      KUAPE KUCOIN KCC MEME BITCOIN KUAPEFINANCE ",33331,"Indonesia",257,2020,"False","True","2019-04-29 08:19:56","True","False",2020,0.65,0.325
