"X","Date","TweetID","Text","BTC.Price","User.Location","User.follower.count","UserFollowingCount","User.Verified","Quote.Status.","AccountCreationDate","Default.Profile.Theme.","DefaultProfileImage","TotalAccountLikes","Subjectivity","Polarity"
18,"07/06/2021",1412376880624410624,"This is really amazing  guys join now    presale blockchain cryptotrading investing cryptocurrency bitcoin trading altcoin cryptonews ",33880.63,"Federal Capital Territory, Nig",591,1639,"False","True","2012-09-20 17:11:25","True","False",1639,0.9,0.6
19,"07/06/2021",1412376880364363776,"hello everyone am starting new crypto coin businessdonut shop that makes Bitcoin donutsthe donuts are all NFTsthe consensus is proof of digestionnow on binance smart chain",33880.63,"United States of America",57,184,"False","False","2020-10-21 00:55:06","True","False",184,0.399134199134199,0.116883116883117
31,"07/06/2021",1412376865822683136,"     I do support Bitcoin, but I also support Ethereum as the basis for DeFi, each with it's OWN PURPOSE, different purposes, different coins / tokens.And if you can't understand that, I'm not going to waste my time teaching you.",33880.63,"Santander, Spain",3255,1451,"False","False","2017-08-14 15:42:38","True","False",1451,0.55,0.1
38,"07/06/2021",1412376859765923840," Good project very interesting Airdrop Airdrops Airdropinspector BSC BinanceSmartChain WhaleFall Whale Crypto Bitcoin",33880.63,"Samarinda,kalimantan timur",95,624,"False","False","2012-02-12 20:58:30","True","False",624,0.625,0.675
39,"07/06/2021",1412376859736739840,"Although Bitcoin Rules can be changed by certain developers, if the developers propose a change that the nodes don't approve of, they won't make that update. More than 90% of the miners need to make the update in order for it to become part of the network..",33880.63,"Global",77610,53722,"False","False","2015-05-02 16:54:25","False","False",53722,0.535714285714286,0.357142857142857
45,"07/06/2021",1412376846650548224,"The latest The AAPI Daily!  Thanks to    americanrescueplan bitcoin",33880.63,"United States of America",1136,529,"False","False","2012-03-23 19:03:19","False","False",529,0.366666666666667,0.233333333333333
55,"07/06/2021",1412376822747127808,"China proves Bitcoin is an unstoppable machine: Bitcoin Center founder   bitcoin",33880.63,"",117,373,"False","False","2017-12-29 03:16:09","True","False",373,0.05,0.1
74,"07/06/2021",1412376781538136064,"Intertops Casino 50 Free Spins Sign Up Bonus and New $500/100% Match Bonus Coupon with 50 Free Spins After     Reliable Bitcoin Litecoin Crypto BitcoinCash or Fiat Casino est 1998. Canada, Australia Welcome (No UK, No France) ",33880.63,"Gambleville",12335,11463,"False","False","2009-02-28 23:13:57","False","False",11463,0.738636363636364,0.434090909090909
79,"07/06/2021",1412376771572477952," Alpha top gainer ",33880.63,"Lahore, Pakistan",263,528,"False","False","2017-07-10 12:24:04","False","False",528,0.5,0.5
93,"07/06/2021",1412376735203610624," The people who are bullish on Bitcoin and distrust financial institutions with their Bitcoin aren't that interested in selling naked puts - skewing the volatility calculation",33880.63,"United States of America",182,312,"False","False","2009-06-17 15:20:47","False","False",312,0.3,0.0833333333333333
98,"07/06/2021",1412376723455414272,"Virtual mining BITCOINbitcoinminingDaily withdrawal direct into your BitcoinWallet197% monthly returnsFree 1 th/s to 900 gh/s Hash power free So, please don't wate time mine free  Bitcoin ",33880.63,"Kamalia, Pakistan",47,120,"False","False","2015-12-20 12:27:18","True","False",120,0.666666666666667,0.3
107,"07/06/2021",1412376703247294464,"(China proves Bitcoin is an unstoppable machine: Bitcoin Center founder) - Cryptollic -  ",33880.63,"Global",1398,4066,"False","False","2015-03-28 09:56:34","False","False",4066,0.05,0.1
133,"07/06/2021",1412376604152635392,"Agree.. Maybe a stupid tought; but what if ""cryptoguys"" doing this to get liquidity in it, make ""victims"" buy bitcoin at higher prices, let them pay, ""bring some good guys in who recover 60%+ of the btc"", give them back at lower prices..They got money while acting robin hood ",33880.63,"Nederland",960,447,"False","True","2018-09-16 11:57:27","False","False",447,0.42,0.03
152,"07/06/2021",1412376556291334144,"Plastic finance ESG Compliant plasticfinance plastic bitcoin ico investment pollution waste plasticwaste environmentThis a very good project. This project team is Very strong. So everyone support the project. I hope one day This project Very rich and successful.",33880.63,"",5787,6392,"False","False","2020-10-18 11:47:11","True","False",6392,0.731666666666667,0.502166666666667
160,"07/06/2021",1412376540755554304," Bitcoin long road map not short form Bitcoin future brightBitcoin high return high risk fast research and investbitcoin cryptocurrency mining CCA environment digitalcurrency crypto",33880.63,"India",31,309,"False","False","2020-08-27 09:23:02","True","False",309,0.4175,0.0783333333333333
169,"07/06/2021",1412376527916855296,"Plastic finance ESG Compliant plasticfinance plastic bitcoin ico investment pollution waste plasticwaste environmentMost Powerful project awesome This will certainly be a successful project as it has a great team that is more than qualified and focused",33880.63,"",5787,6392,"False","False","2020-10-18 11:47:11","True","False",6392,0.7,0.525
179,"07/06/2021",1412376508845469696,"  So true, but Bitcoin grew at that rate while infrastructure wasn't in place like today and without all the new backers of billionaires and institutions and now nations",33880.63,"",1317,4484,"False","False","2019-06-10 14:18:51","True","False",4484,0.552272727272727,0.243181818181818
186,"07/06/2021",1412376494115020800," People really don't believe that Bitcoin fixes this",33880.63,"The Agora",345,687,"False","False","2011-10-04 23:52:43","False","False",687,0.2,0.2
187,"07/06/2021",1412376491225190400,"️grayscale'  140K GBTC shares to be released in July, the discount could fall to new lowsfind out more with 's CEO, James Bennettbitcoin btc $btc ",33880.63,"United Kingdom",7053,1758,"False","False","2013-02-19 12:40:51","False","False",1758,0.477272727272727,0.318181818181818
197,"07/06/2021",1412376473277812736,"Comparisons. This section attempts to provide an unbiased and objective ground for helping visitors to independently assess the magnitude of Bitcoin’s electricity consumption and compare it to other uses of electricity. ",33880.63,"Professor www.hiof.no",533,987,"False","False","2012-11-16 13:43:41","False","False",987,0.2,-0.0416666666666667
201,"07/06/2021",1412376457700065280,"Though the title of this article is 'What to do when your digitalassets take a dive.' It is a pretty good primer on basic investing. crypto cryptocurrency cryptocurrencies cryptomarkets altcoin altcoins Bitcoin btc ",33880.63,"United States of America",376,156,"False","False","2016-06-06 19:32:52","True","False",156,0.575,0.316666666666667
202,"07/06/2021",1412376453992353792,"China proves Bitcoin is an unstoppable machine ICO bitcoin via  ",33880.63,"United Kingdom",308,1020,"False","False","2011-03-07 02:06:02","True","False",1020,0,0.3
207,"07/06/2021",1412376448250355712,"  There is head and shoulders now present on the weekly, daily, hour, 15min, 5min and 1min. Not a good sign for Bitcoin.",33880.63,"United States of America",441,4893,"False","False","2016-04-23 13:27:00","False","False",4893,0.2,-0.116666666666667
210,"07/06/2021",1412376444425150464,"After shutting down mining, China continues to impede crypto ecosystem. They want control, Bitcoin is freedom ",33880.63,"close to the sea",297,308,"False","True","2011-05-28 12:21:24","True","False",308,0.288888888888889,-0.155555555555556
211,"07/06/2021",1412376443934412800,"More recently, however, bitcoin’s one-year rolling correlation to broader equity markets has risen, hovering between 0.25 and 0.35. ",33880.63,"United States of America",5539,332,"False","False","2009-02-26 22:35:08","False","False",332,0.375,0.25
226,"07/06/2021",1412376404465967104," Is one of them: ""converting it to bitcoin""?:D",33880.63,"Will Blog For Citizenship",9309,3294,"False","False","2014-02-18 23:06:07","False","False",3294,1,1
254,"07/06/2021",1412376333548666880," Digital currency is similar to Mercury in that it is one of the most excellent and powerful things in skilful hands. Our upcoming song ‘We Believe’cryptocurrency ethereum Dogecoin bitcoin tothmoon solarsystemTeaser link is here.  ",33880.63,"India",511,952,"False","False","2019-05-26 15:44:49","False","False",952,0.58,0.36
255,"07/06/2021",1412376333217370112,"EURUSD All Targets hit, 75 Pips Profit ️️Check out my Bio to get Telegram link of Free Forex or Crypto Channel. Cheers! WTI EURUSD NZDUSD USDTRY forexsignals GBPAUD DAX30 aapl xauusd forex usoil crudeoil bitcoin BTC 92276 ",33880.63,"",104,103,"False","False","2020-02-24 09:12:44","True","False",103,0.8,0.5
256,"07/06/2021",1412376332252631040,"Fair to say, Lark is my Hero…bitcoin ",33880.63,"Planet Earth",582,689,"False","True","2014-03-23 17:56:21","False","False",689,0.9,0.7
257,"07/06/2021",1412376332210782208,"Best place in the crypto world ←   blockchain bitcoin cryptocurrency btc bitcoinmining",33880.63,"United Kingdom",170,245,"False","False","2011-04-21 10:42:29","True","False",245,0.3,1
263,"07/06/2021",1412376317195075584,"linkedin twitter facebook instagram tiktok socialmedia tumblr dogecoin shoppingstaronline deal gift gifts giftideas shop shopping affiliatemarketing bitcoin popcorn Enjoy $10 off Orders of $50+ - Use code IR10 - ",33880.63,"United States of America",67445,6276,"False","False","2012-06-25 04:38:20","False","False",6276,0.5,0.4
274,"07/06/2021",1412376303207075840,"  Thanks. I've had some fraction of a bitcoin for a number of years, I felt the carbon footprint was getting unconscionable. So I converted it to ADA, ETH2 and XLM. The energy use is way smaller, but certainly interested in further moral hazard.",33880.63,"United Kingdom",506,1153,"False","False","2009-03-11 13:08:19","False","False",1153,0.39,0.09
311,"07/06/2021",1412376242360307712,"bitcoin[dot]com's explorer looks like the only one left that lets you export address history in an easy way",33880.63,"Seychelles",1300,2239,"False","False","2017-11-14 05:40:54","False","False",2239,0.611111111111111,0.144444444444444
345,"07/06/2021",1412376152149086208,"Ladies and gents   has a new discord channel that has giveaways and Trivia chanes to win actual   also we are having party on the 12th of July to celebrate 4 years with DeepOnion be there Crypto cryptocurrency Bitcoin doge",33880.63,"",114,363,"False","False","2017-12-14 18:55:51","False","False",363,0.318181818181818,0.312121212121212
347,"07/06/2021",1412376150773469184,"Be greedy when others are fearful. bitcoin ",33880.63,"Cyberspace",11380,409,"False","False","2009-04-14 14:54:04","False","False",409,1,-0.9
359,"07/06/2021",1412376129403604992," Give me bitcoins.I can not buy bitcoins.$ 1,000 &amp; $500 &amp;300 &amp; 200  is enough for me.I can not work.I can not.I really can not work, I need help.help meBitcoinBTC elonMask Michaelsaylor Wallet me:bc1qvm3pqyh8k396n5arc4aazgejk4g5fwe4l86nl8",33880.63,"United States of America",53,202,"False","False","2017-04-29 18:21:16","True","False",202,0.35,0.1
379,"07/06/2021",1412376065562062848,"On Saturday we witnessed Bitcoin's biggest ever downward difficulty adjustment.  analyses the latest on-chain data to see how it has impacted the network. Watch to end for an important update on btc fund flows. With  ",33880.63,"United Kingdom",3258,758,"False","False","2018-08-08 15:02:01","True","False",758,0.95,0.45
388,"07/06/2021",1412376041335574528,"The stronger Alts of today gave zero fucks about the Bitcoin price action other than USD value. , ,  and others I don't follow",33880.63,"Digital Citizen of Earth - BKK",946,345,"False","False","2009-03-11 19:51:49","False","False",345,0.2375,-0.0125
390,"07/06/2021",1412376040320667648,"  Lmao, price is higher, just Bitcoin down 4% but price us rising",33880.63,"",5159,2680,"False","False","2014-09-30 10:56:02","False","False",2680,0.596296296296296,0.231481481481481
395,"07/06/2021",1412376023879098368," Much respect! Another thing that should get more recognition in our country is investment. Much people are not investing and it really hurts me. I’m currently investing in Bitcoin mining on a huge platform with  and it’s superb. I’d advice anyone in the dark to dm her",33880.63,"South Africa",1079,1058,"False","False","2019-10-21 13:28:55","True","False",1058,0.475,0.3
418,"07/06/2021",1412375957625843712," It looks so sinister they want to track every single transaction person makes. But selling it as tracking just ""suspicious"" or ""criminal"" transactions makes it more palpable. What if every transaction is ""suspicious""?",33880.63,"",685,532,"False","False","2020-02-20 22:59:48","True","False",532,0.552857142857143,-0.0942857142857143
435,"07/06/2021",1412375911823982592," It took him 20 years to realize Apple is a good investment.  I know that's not an argument for Bitcoin, but understanding tech is clearly not his strong suit.",33880.63,"",118,403,"False","False","2009-06-05 05:03:31","False","False",403,0.572222222222222,0.361111111111111
445,"07/06/2021",1412375887203520512," Cmon Zuby spend a bit of that bitcoin on a new computer man ",33880.63,"L12",11,106,"False","False","2020-08-21 16:17:40","True","False",106,0.454545454545455,0.136363636363636
447,"07/06/2021",1412375880190595072,"Bitcoin Whales Accumulate 60,000 Bitcoins In A Day. What Happens Now? via  {tag} rt live follow viral meme tags tweet",33880.63,"United States of America",216,233,"False","False","2017-12-23 00:29:00","False","False",233,0.5,0.136363636363636
453,"07/06/2021",1412375871256772608,"Bitcoin Eyes $36K As Wyckoff Level As Altcoins Prepare To Surge via  {tag} rt live follow viral meme tags tweet",33880.63,"United States of America",216,233,"False","False","2017-12-23 00:29:00","False","False",233,0.5,0.136363636363636
456,"07/06/2021",1412375864948449280," Much respect! Another thing that should get more recognition in our country is investment. Much people are not investing and it really hurts me. I’m currently investing in Bitcoin mining on a huge platform with  and it’s superb. I’d advice anyone in the dark to dm her",33880.63,"South Africa",1079,1058,"False","False","2019-10-21 13:28:55","True","False",1058,0.475,0.3
462,"07/06/2021",1412375854529716224," is a decentralized token swapping, offering users higher liquidity and in theory more favorable rates. The protocol claims to offer minimal fees &amp; yield farmingMocktailFinance MocktailSwap MOK blockchain cryptocurrency technology bitcoin money crypto BNB",33880.63,"Indonesia",1161,3687,"False","False","2019-03-26 16:33:39","True","False",3687,0.533333333333333,0.216666666666667
464,"07/06/2021",1412375853212733440,"Re: [bitcoin-dev] Unlimited covenants, was Re: CHECKSIGFROMSTACK/{Verify} BIP for Bitcoin ",33880.63,"",18299,10233,"False","False","2009-11-04 18:04:28","False","False",10233,1,-0.75
481,"07/06/2021",1412375813681520640,"   Sorry I dont get your point. Bitcoin SV also relies on proof of work and therefore has the same problems as Bitcoin due to electricity consumption.",33880.63,"Berlin, Deutschland",159,422,"False","False","2019-10-16 15:33:52","True","False",422,0.5,-0.208333333333333
483,"07/06/2021",1412375804974088192,"“People who own property feel a sense of ownership in their future and their society. They study, save, work, strive and vote.” — Henry Gates Jr.Bitcoin is bringing property rights to 7 billion people.",33880.63,"",390,270,"False","False","2020-07-22 19:32:56","True","False",270,0.5625,0.3
487,"07/06/2021",1412375802415509504,"Good company with great project, I see you as great potential. the guys are really engaged in the project and its development.MorbexFinance Morbex BEX blockchain cryptocurrency technology bitcoin money crypto Binance BNB cryptocurrencies fintech",33880.63,"",4679,5284,"False","False","2018-12-28 09:54:45","True","False",5284,0.66,0.5
488,"07/06/2021",1412375800012226560," Much respect! Another thing that should get more recognition in our country is investment. Much people are not investing and it really hurts me. I’m currently investing in Bitcoin mining on a huge platform with  and it’s superb. I’d advice anyone in the dark to dm her",33880.63,"South Africa",1079,1058,"False","False","2019-10-21 13:28:55","True","False",1058,0.475,0.3
490,"07/06/2021",1412375796786860032," Thanks brother. Imagine when everyone can just go to Bitcoinwaffles, take all the assets, build a micro business, and have the incentive to work freely anywhere in the world to earn bitcoin? It's a silly idea but I think it could work to empower some people with limited resources",33880.63,"Guatemala City",3148,2894,"False","False","2009-01-29 16:20:31","False","False",2894,0.504464285714286,0.00714285714285717
503,"07/06/2021",1412375781590933504,"Live Bitcoin Price: $33,913 An increase of 0.68% in the last 24hrs! Invest today with Binance and save 20% on buying fees FOREVER if you sign-up using the link below...Bitcoin Binance Crypto  Doge",33880.63,"United Kingdom",39944,7517,"False","False","2011-03-09 18:59:44","False","False",7517,0.283333333333333,0.0681818181818182
506,"07/06/2021",1412375778759675904,"     Bitcoin is for anyone, not everyone. Subtle but important difference.",33880.63,"Prague",1116,272,"False","False","2009-08-20 20:49:49","False","False",272,0.75,0.0333333333333334
507,"07/06/2021",1412375777027493888,"True or False: One day Bitcoin will die.",33880.63,"United States of America",39,334,"False","False","2017-07-11 12:48:39","True","False",334,0.625,-0.025
512,"07/06/2021",1412375766743015424," Much respect! Another thing that should get more recognition in our country is investment. Much people are not investing and it really hurts me. I’m currently investing in Bitcoin mining on a huge platform with  and it’s superb. I’d advice anyone in the dark to dm her",33880.63,"South Africa",1079,1058,"False","False","2019-10-21 13:28:55","True","False",1058,0.475,0.3
520,"07/06/2021",1412375758186688512,"The gang behind a ""colossal"" ransomware attack has demanded $70m (£50.5m) paid in Bitcoin in return for a ""universal decryptor"" that it says will unlock the files of all victims.Ransomware REvil Bitcoin cybercrime",33880.63,"Phoenix, AZ",14440,9490,"True","False","2008-12-10 17:21:37","False","False",9490,0.5,-0.0333333333333333
532,"07/06/2021",1412375743485681664,"❹ Ransomware won't stop — UNTIL  THiNKs like a defensive driver❺ Putin's Game of Death❻ Gang behind huge cyber-attack demands $70m in BitcoinBusiness Security     ",33880.63,"United States of America",6871,6342,"False","False","2012-03-08 21:26:53","False","False",6342,0.666666666666667,-0.133333333333333
558,"07/06/2021",1412375677052063744,"“hey” Canada, is  with  coming to Quebec to invest &amp; use   cheap hydroelectricity helping power the Bitcoin network?Listen to him here: assnat Polqc cdnpoli   ",33880.63,"",2232,622,"False","False","2013-05-07 00:46:08","False","False",622,0.7,0.4
571,"07/06/2021",1412375647691755520,"Bitcoin should be made legal in India it should have  20% GST which will boost economy    ",33880.63,"India",124,2735,"False","False","2019-02-23 14:50:03","False","False",2735,0.2,0.2
573,"07/06/2021",1412375644604882944," Digital currency is similar to Mercury in that it is one of the most excellent and powerful things in skilful hands. Our upcoming song ‘We Believe’cryptocurrency ethereum Dogecoin bitcoin tothmoon solarsystemTeaser link is here.  ",33880.63,"India",511,952,"False","False","2019-05-26 15:44:49","False","False",952,0.58,0.36
579,"07/06/2021",1412375620751876096," An interesting project and strong team, in a predictable and transparent road map, planned and projected.SlowToken_  Bitcoin ETH",33880.63,"Nigeria",60,683,"False","False","2020-10-10 12:13:49","True","False",683,0.577777777777778,0.244444444444444
586,"07/06/2021",1412375608638705664,"Launch your own custom branded wireless service on America’s largest networks via the Valorus Wireless Enablement Platform! :  bitcoin BitCoinCash XRP LightCoin Ethereum FinTech mobilewallet ATM Money Cash ",33880.63,"United States of America",43,133,"False","False","2019-07-17 16:36:00","True","False",133,1,0.75
597,"07/06/2021",1412375594566926336,"linkedin twitter facebook instagram tiktok socialmedia tumblr shoppingstaronline dogecoin deal gift gifts giftideas shop shopping affiliatemarketing bitcoin popcorn Enjoy $10 off Orders of $50+ - Use code IR10 - ",33880.63,"United States of America",67445,6276,"False","False","2012-06-25 04:38:20","False","False",6276,0.5,0.4
601,"07/06/2021",1412375589235920896,"China proves Bitcoin is an unstoppable machine: Bitcoin Center founderBitcoin’s price goes up once regulatory setbacks are digested by the crypto community,",33880.63,"France",1554,1039,"False","False","2017-09-20 13:00:59","True","False",1039,0.05,0.1
607,"07/06/2021",1412375577760309248,"My whole feed is literally calling sub 30k again. Everyone was bullish 4 hours ago. That's one 4h candle backward.CT seriously needs a Xanax pill cz this is getting too much already Bitcoin cryptotwitter link $woo ",33880.63,"Mars",1534,440,"False","False","2011-01-28 08:26:29","True","False",440,0.422222222222222,0.0222222222222222
611,"07/06/2021",1412375576854339584," do the same thing to bitcoin and bitcoin bro idiots do the same thing but way worse.",33880.63,"United Kingdom",8016,101,"False","False","2012-02-11 16:01:51","False","False",101,0.4125,-0.3
615,"07/06/2021",1412375570483224576,"BTC again rejected from $35,000 resistance area. This is getting ugly now. Market liquidating both longs and shorts.Still no breakout either side with promising volume.Take some rest and do minimum trades. No doing trades is also an artbitcoinTradingView Binance",33880.63,"United States of America",1678,2977,"False","False","2010-03-06 16:33:18","False","False",2977,0.75,-0.25
624,"07/06/2021",1412375555387924480,"Let’s see if Bitcoin can hold the important trend line ...As of now the volume is still low! I’m not concerned at the moment...(Not financial advice!)BTC btcusd CTM ",33880.63,"",2069,274,"False","False","2020-05-25 21:06:44","True","False",274,0.433333333333333,0.133333333333333
627,"07/06/2021",1412375545757773824," Update Heavy rejection from the supply region again.. MacD twisting down, MOM negative slope... Closed 75% of my long at parody. I'll be watching these two scenarios carefully and will add at support if a good reaction. Bitcoin Hidden bear div 1D confirmed...  ",33880.63,"United Kingdom",304,296,"False","False","2020-04-24 18:08:39","True","False",296,0.51358024691358,0.00308641975308641
635,"07/06/2021",1412375532612763648,"     Much respect! Another thing that should get more recognition in our country is investment. Much people are not investing and it really hurts me. I’m currently investing in Bitcoin mining on a huge platform with  and it’s superb. I’d advice anyone in the dark to dm her",33880.63,"South Africa",1079,1058,"False","False","2019-10-21 13:28:55","True","False",1058,0.475,0.3
662,"07/06/2021",1412375478846033920,"Bitcoin targets $36K key Wyckoff level with altcoins set to 'grind up heavier'Conditions are conspiring to deliver fresh strength across altcoins, which suffered unduly as Bitcoin briefly hit levels below $30,000, a trader predicts.Bitcoin (BTC) head…  ",33880.63,"United States of America",390,462,"False","False","2014-03-05 09:42:32","True","False",462,0.611111111111111,0.1
671,"07/06/2021",1412375463855546368," Much respect! Another thing that should get more recognition in our country is investment. Much people are not investing and it really hurts me. I’m currently investing in Bitcoin mining on a huge platform with  and it’s superb. I’d advice anyone in the dark to dm her",33880.63,"South Africa",1079,1058,"False","False","2019-10-21 13:28:55","True","False",1058,0.475,0.3
710,"07/06/2021",1412375386042863616,"Cemex (NYSE: CX) Is One of 11 Best Materials Stocks for 2021  via  investing finance Memes investors Bitcoin money portfoliomanagers fundmanagershedgefunds CIO StockMarket",33880.63,"United States of America",518,1881,"False","False","2011-05-24 18:50:54","True","False",1881,0.3,1
711,"07/06/2021",1412375385094905856,"cryptotwitter CryptoNews StocksToWatch Stock forextrader forex Bitcoin You don't need a robot or a holy grail. You became the holy grail when you equip yourself with knowledge and be mentored by a successful trader click the link and discover more: ",33880.63,"India",230,985,"False","False","2015-01-26 17:52:54","False","False",985,0.725,0.625
746,"07/06/2021",1412375344372461568,"One of the unsung hero's of Bitcoin You can listen to Janine on  very couple of weeks when new episodes come out.Well worth it IMO.Thanks for all your hard work Janine.And you too  ",33880.63,"United States of America",15946,1076,"False","True","2017-11-26 13:26:32","True","False",1076,0.34905303030303,0.0861742424242424
748,"07/06/2021",1412375338668146688," Follow me on . Let's hunt for Bitcoins together! Get an exciting experience on 1 I-Gaming platform with BTC staking payouts!.My Username: User237447 betfurysuccess bitcoin staking",33880.63,"Brazil",32,466,"False","False","2019-12-03 18:11:59","True","False",466,0.8,0.3
760,"07/06/2021",1412375314332717056,"A controversial bitcoin mining operation has made a New York lake 'so warm you feel like you're in a hot tub'  ",33880.63,"Porto, Portugal",1509,2795,"False","False","2009-10-14 12:47:43","False","False",2795,0.713636363636364,0.384090909090909
