"X","Date","TweetID","Text","BTC.Price","User.Location","User.follower.count","UserFollowingCount","User.Verified","Quote.Status.","AccountCreationDate","Default.Profile.Theme.","DefaultProfileImage","TotalAccountLikes","Subjectivity","Polarity"
4,"07/27/2021",1419990264651911168," El Salvador proclaimed Bitcoin a legal tender; meanwhile, J.P. Morgan cauti        ",37943.91,"",1027,1158,"False","False","2009-06-21 14:09:42","True","False",1158,0.2,0.2
19,"07/27/2021",1419990238835970048," xircusnft nft BSC BinanceSmartChain Binance PancakeSwap DeFi Bitcoin cryptocurrency blockchainThis project is very good and I am very excited of this project.besides that I saw a team that was very reliable and experienced in managing this project.",37943.91,"India",9216,9210,"False","False","2019-08-14 03:30:28","True","False",9210,0.73875,0.599375
23,"07/27/2021",1419990234490671104," I'd rather have bitcoin it volatility is good and considering a  small population of humans own it I can only see it becoming more desirable to the younger generation",37943.91,"",118,329,"False","False","2011-10-15 13:58:04","True","False",329,0.621428571428571,0.285714285714286
31,"07/27/2021",1419990215205269504,"  Shame on you. Your article is full of ignorant statements. The hill should be banned instead. By the way Bitcoin will be among us much much much longer than you",37943.91,"Aitutaki-cook.isl.,Bantayan-Ph",624,889,"False","False","2017-05-06 02:05:45","True","False",889,0.375,0.275
38,"07/27/2021",1419990201464721408,"Here's what Bitcoin [BTC] whales are doing as market tussles with 'dead cat bounce'  -  ",37943.91,"",4080,621,"False","False","2016-11-30 18:19:59","True","False",621,0.4,-0.2
42,"07/27/2021",1419990195886297088,"""We believe a Bitcoin ETF is good for the market. It is going to happen."" –  founder to  ",37943.91,"United States of America",1194997,513,"True","False","2011-08-24 15:14:54","False","False",513,0.6,0.7
54,"07/27/2021",1419990166253436928,"this Project looks promising and there is a professional team working on it.hopefully this project will be success.Website : Plastic finance ESG Compliant plasticfinance plastic bitcoin ico investment pollution waste plasticwaste environment ",37943.91,"United States of America",7000,7682,"False","True","2019-12-04 05:24:50","True","False",7682,0.2,0.0333333333333333
55,"07/27/2021",1419990163984355328," First video on my YouTube recommendations this morning was a CNBC clip about the bitcoin impairment. Another one was ""Elon talks about factory shutdowns"".  They're trying very hard to negatively spin this.",37943.91,"United States of America",120,157,"False","False","2010-12-21 14:10:30","False","False",157,0.479166666666667,-0.143055555555556
59,"07/27/2021",1419990154459160576,"    asi wakakwana? Give us the bible verses which speak of coronavirus? SARS-COV2 is one variant on the many coronaviruses which exists, it is no longer novel as we now know it. Every virus mutates - does antigen drift and shift in the influenza virus ring a bell?",37943.91,"",36,196,"False","False","2018-12-22 08:26:19","True","False",196,0.5,0.5
62,"07/27/2021",1419990131063214080," No, fuck the government, markets are PvP and “manipulation” is part of the game",37943.91,"New Zealand",208,1290,"False","False","2018-09-04 03:26:22","True","False",1290,0.5,-0.1
66,"07/27/2021",1419990124725604352," I won't be alive to find out, but I'd bet all my money every the last Bitcoin won't ever be mined",37943.91,"YMH",26,201,"False","False","2009-04-08 11:29:51","False","False",201,0.233333333333333,0.05
71,"07/27/2021",1419990103712157696,"The  price is at $38003.60 right now. Compared to the last tweet, the price has increased by $153.45 (0.41%). In the last 24 hours the price has dropped by $456.57 (-1.19%).Bitcoin  BTC",37943.91,"Traveller",15417,701,"False","False","2018-11-11 11:26:20","False","False",701,0.223015873015873,0.0952380952380952
93,"07/27/2021",1419990060754030592,"Bitcoin price on a random Sunday ",37943.91,"India",34,109,"False","False","2015-02-01 09:59:09","True","False",109,0.5,-0.5
111,"07/27/2021",1419990016198021120,"“Tesla Inc. revealed on Tuesday that it realized gains of $128 million via sales of Bitcoin  in the first six months of 2021.”  Not bad at all btc  $btc",37943.91,"Traveller",15417,701,"False","False","2018-11-11 11:26:20","False","False",701,0.5,0.3
118,"07/27/2021",1419990005133545472,"  For all those who are new to this working from home Bitcoin trading options Here's a little tip:Get a trusted Bitcoin expert and stick to her  Invest and play at similar times each day.Because :In times of chaos, your investment is your anchor to success",37943.91,"",1114,1614,"False","False","2020-05-04 13:17:35","True","False",1614,0.338636363636364,0.0622159090909091
127,"07/27/2021",1419989992064049152,"I earned with the help of my friends!  Anyone can try how it is simple and fun on  i-Gaming platform. My Username: razzi betfurysuccess tron bitcoin referral",37943.91,"",409,1125,"False","False","2015-07-20 00:52:34","True","False",1125,0.278571428571429,0.15
129,"07/27/2021",1419989986691190784,"Join to receive the latest airdrop:  Airdrop UNIF Task: $100 to $10,000 worth of UNIF Ref: $50 worth of UNIF Airdrop link Airdrop Crypto claim Bitcoin BSC trastWalet BTC BNB ETH NFT ICO IEO DeFi ",37943.91,"Россия, Москва",51,854,"False","False","2011-08-08 10:32:17","True","False",854,0.366666666666667,0.366666666666667
145,"07/27/2021",1419989958941724672,"Happy Tuesday!*Here Are My Top5ThingsToKnowToday:-     Earnings-      Also Report- Stocks Set For Flat Open- China Tech Bloodbath Continues- Bitcoin Pulls Back To $37K*May The Trading Gods Be With You      ",37943.91,"Tel Aviv",30283,271,"True","False","2009-01-26 13:52:39","False","False",271,0.40625,0.19375
147,"07/27/2021",1419989953480740864,"I play and get Cashback!  The more you play on  - the higher Rank and Cashback amount you will get! My Username: razzi betfurysuccess bitcoin staking",37943.91,"",409,1125,"False","False","2015-07-20 00:52:34","True","False",1125,0.633333333333333,-0.0833333333333333
150,"07/27/2021",1419989948485177344,"""Bitcoin promises to further liberate us from the clutches of time scarcity, eliminate time theft via inflation, reinvigorate individual sovereignty, and, as a cumulative result, radically increase social scalability worldwide"".",37943.91,"",110,292,"False","False","2017-01-12 07:36:31","True","False",292,0.322222222222222,0.0111111111111111
154,"07/27/2021",1419989936850169856,"Poetic and inspirational take aways from 's piece. Thank you.  ",37943.91,"",110,292,"False","False","2017-01-12 07:36:31","True","False",292,0.875,0.4375
161,"07/27/2021",1419989923474575360,"  For all those who are new to this working from home Bitcoin trading options Here's a little tip:Get a trusted Bitcoin expert and stick to her  Invest and play at similar times each day.Because :In times of chaos, your investment is your anchor to success",37943.91,"",1114,1614,"False","False","2020-05-04 13:17:35","True","False",1614,0.338636363636364,0.0622159090909091
165,"07/27/2021",1419989913894748160,"  That's right, show the class of people who pump the bitcoin scam.",37943.91,"",192,130,"False","False","2020-11-04 01:36:27","True","False",130,0.535714285714286,0.285714285714286
169,"07/27/2021",1419989900590419968," For all those who are new to this working from home Bitcoin trading options Here's a little tip:Get a trusted Bitcoin expert and stick to her  Invest and play at similar times each day.Because :In times of chaos, your investment is your anchor to success",37943.91,"",1114,1614,"False","False","2020-05-04 13:17:35","True","False",1614,0.338636363636364,0.0622159090909091
182,"07/27/2021",1419989880717852672,"  For all those who are new to this working from home Bitcoin trading options Here's a little tip:Get a trusted Bitcoin expert and stick to her  Invest and play at similar times each day.Because :In times of chaos, your investment is your anchor to success",37943.91,"",1114,1614,"False","False","2020-05-04 13:17:35","True","False",1614,0.338636363636364,0.0622159090909091
185,"07/27/2021",1419989866125856768,"Should we be watching out for Amazon’s own crypto? amazon aws cryptocurrency Bitcoin Ethereum",37943.91,"United States of America",479,347,"False","False","2009-12-12 03:37:33","False","False",347,1,0.6
194,"07/27/2021",1419989847608020992," Follow me on . Let's hunt for Bitcoins together! Get an exciting experience on 1 I-Gaming platform with BTC staking payouts!.My Username: razzi betfurysuccess bitcoin staking",37943.91,"",409,1125,"False","False","2015-07-20 00:52:34","True","False",1125,0.8,0.3
202,"07/27/2021",1419989834387623936,"“As national currency, cryptoassets—including Bitcoin—come with substantial risks to macro-financial stability, financial integrity, consumer protection, and the environment,” the IMF wrote in a blog post. IMF - Intense and Massive FUD ",37943.91,"Israel",3282,1944,"False","True","2014-03-26 19:07:12","False","False",1944,0.666666666666667,0.0666666666666667
249,"07/27/2021",1419989736786210816," Bitcoin reached an all-time high (ATH) of $64,888.99 in Q2 this year and concluded at $35,046.22, down  ",37943.91,"",1027,1158,"False","False","2009-06-21 14:09:42","True","False",1158,0.414444444444444,0.00222222222222221
250,"07/27/2021",1419989735817285632," Someone bought 41 mln dollars worth of Bitcoin now at 38! Just think.",37943.91,"United States of America",959,4755,"False","False","2019-11-15 09:41:56","True","False",4755,0.1,0.375
252,"07/27/2021",1419989734307233792,"Daily Trending StoriesSunday's price rise follows an unconfirmed report Amazon is looking to accept bitcoin payments by year's end. Bitcoin briefly traded above $39K for the first time since Jun16 &amp; is currently trading its sixth consecutive day in the greenCryptoNews MEXC ",37943.91,"Singapore",194736,759,"False","False","2018-03-27 09:35:43","False","False",759,0.233333333333333,0.05
260,"07/27/2021",1419989729521635328," Top for AXS ?   trading bitcoin",37943.91,"France",1587,162,"False","False","2008-05-26 19:57:13","False","False",162,0.5,0.5
264,"07/27/2021",1419989720038133760,"US Dollar Flips Net Long, CAD, AUD &amp; GBP See Large Sellers – COT Report: US Dollar flips net long for the first time since March 2020 amid the unwind in reflation…   |   |  cryptocurrency Bitcoin Forex ",37943.91,"",6992,15970,"False","False","2015-10-13 01:53:50","False","False",15970,0.26031746031746,0.0607142857142857
271,"07/27/2021",1419989709988798464,"There is! I chose the lucky cell and won 4.664812125 TRX! My Username: sirlance betfurysuccess bitcoin staking",37943.91,"Sevilla (España)",315,5000,"False","False","2012-06-09 11:39:19","True","False",5000,0.833333333333333,0.416666666666667
272,"07/27/2021",1419989709632069632,"Market Sentiment Still Fragile Ahead of Fed, Corporate Earnings | Webinar: Trader confidence remains brittle, with many markets range-trading ahead of the Federal…   |   |  cryptocurrency Bitcoin Forex ",37943.91,"",6992,15970,"False","False","2015-10-13 01:53:50","False","False",15970,0.333333333333333,0.166666666666667
273,"07/27/2021",1419989707195179008,"Bitcoin and Blockchain focused Blockstream Introduces Latest Lightning Network Service, Greenlight  ",37943.91,"Global",119,132,"False","False","2018-10-29 20:03:47","False","False",132,0.9,0.5
293,"07/27/2021",1419989666552434688,"       I'd say this type of stereotyping is quite naive and arrogant. I know of gen x and z who are just outright idiots and think bitcoin is a scam!BTW, you missed  and   from your list.",37943.91,"🇦🇺",1164,1046,"False","False","2017-10-10 22:14:33","True","False",1046,0.9,-0.55
321,"07/27/2021",1419989613515583488,"Hey I joined a network called SurveyJ and earned $262 today! You get paid for surveys and posting on social media. Sign up with my link for an instant $40 signup bonus!  SurveyJ cashapp bitcoin",37943.91,"القاهرة, مصر",183,2041,"False","False","2020-07-04 11:03:59","True","False",2041,0.366666666666667,0.0166666666666667
322,"07/27/2021",1419989610512457728,"An investor showing video of the money he made from our investment. Thank you for your wonderful feedback. Contact invest  stock bb23 Bitcoin    Binance    investment money AcceptDoge 1inch amcstock amcsqeeze believe  ",37943.91,"US",207,1702,"False","False","2020-12-06 09:02:00","True","False",1702,1,1
323,"07/27/2021",1419989610290159616," Bitcoin reached an all-time high (ATH) of $64,888.99 in Q2 this year and concluded at $35,046.22, down  ",37943.91,"",1027,1158,"False","False","2009-06-21 14:09:42","True","False",1158,0.414444444444444,0.00222222222222221
326,"07/27/2021",1419989603558191104,"   Hm, seems the consensus protocol requires a degree of trust in humans not to run two different miners, or two different nodes. If the receiver of Bitcoin only accepts the gold coins off ebay, or even worse, SV, all the consensus protocol in the world won't help you.",37943.91,"",517,291,"False","False","2012-01-19 10:22:36","True","False",291,0.7,-0.1
337,"07/27/2021",1419989568103845888,"     People buy things they can use in the face of inflation like food, mostly it's food but it rots so they buy other things that don't like metals and wood, they'll never buy something with no real value like bitcoin.",37943.91,"",91,178,"False","False","2017-11-01 12:07:22","True","False",178,0.391666666666667,0.0916666666666667
343,"07/27/2021",1419989561845944320," Bitcoin reached an all-time high (ATH) of $64,888.99 in Q2 this year and co        ",37943.91,"",1027,1158,"False","False","2009-06-21 14:09:42","True","False",1158,0.54,0.16
345,"07/27/2021",1419989556703625216,"A great project that is strong and a good known team, which definitely inspires confidence. dex trust is great way to invest your money to get a good benefits.  xircusnft  Binance PancakeSwap DeFi Bitcoin cryptocurrency blockchain",37943.91,"",1733,3688,"False","False","2020-12-11 11:40:38","True","False",3688,0.655555555555556,0.572222222222222
350,"07/27/2021",1419989546842923008,"businessowner businessgoals businessgrowth tips businesses businesstips  bitcoin dogecoin affiliatemarketing Check my website for my top recommended business tools and programs ",37943.91,"United States of America",67792,6954,"False","False","2012-06-25 04:38:20","False","False",6954,0.5,0.5
357,"07/27/2021",1419989527742099456,"“The key is whatever size at cost you’re comfortable with, let the bull market play out, tolerate the volatility and have confidence that ultimately by the end of this year you will be at a meaningfully higher price.”  Cryptocurrency Bitcoin InvestSmart",37943.91,"Bengaluru",501,692,"False","False","2011-07-02 21:43:09","False","False",692,0.825,0.1625
365,"07/27/2021",1419989519814758400," Bitcoin cannot be controlled or censored. That's the whole point why it was created with a decentralised network as a response to the corruption of central banks and the control digital currencies they are trying to implement.",37943.91,"☯",1176,1576,"False","False","2009-02-24 11:23:45","False","False",1576,0.216666666666667,0.0666666666666667
377,"07/27/2021",1419989491767447552," Bitcoin reached an all-time high (ATH) of $64,888.99 in Q2 this year and co        ",37943.91,"",1027,1158,"False","False","2009-06-21 14:09:42","True","False",1158,0.54,0.16
391,"07/27/2021",1419989452475146240,"BTC Bitcoin trading Daytrader I start a new long position  ",37943.91,"Indonesia",85,247,"False","False","2020-09-06 16:25:37","True","False",247,0.427272727272727,0.0431818181818182
393,"07/27/2021",1419989440085336064,"I spent two hours explaining Bitcoin to my 16 year old grandson. He has been watching YouTube videos about it. Helped him start an  wallet and I deposited $50usd at $30k Bitcoin. He loved seeing the balance in the $60s yesterday! orangepilled",37943.91,"United States of America",83,419,"False","False","2018-01-24 16:34:08","False","False",419,0.366666666666667,0.291666666666667
403,"07/27/2021",1419989417582866432," Doubt it. Bitcoin operates 100% on pumps. There isn’t any true value behind it.",37943.91,"Fed Basement",29,103,"False","False","2020-07-04 14:10:07","True","False",103,0.675,-0.025
412,"07/27/2021",1419989400541229056," Bitcoin: Own it or Risk not owning it. ",37943.91,"",360,111,"False","True","2020-09-10 15:01:36","True","False",111,1,0.6
421,"07/27/2021",1419989388717608960,"Deep negative real – or inflation-adjusted – returns on bonds tend to boost the attractiveness of other assets, including bitcoin. Reports  ",37943.91,"EU",1446,778,"False","False","2015-07-29 07:19:00","False","False",778,0.36875,-0.05625
446,"07/27/2021",1419989319771697152,"Just a reminder before ~6$ goes exponential.A video before 's FUD about GreenHashRate Backs Energy Web’s Project to Help Bitcoin Miners Support Green Energy CCA  P.S. For ""I told you so"" use this tweet",37943.91,"Croatia",277,337,"False","False","2019-12-25 19:22:46","True","False",337,0.3,-0.2
452,"07/27/2021",1419989314495254528,"  For all those who are new to this working from home Bitcoin trading options Here's a little tip:Get a trusted Bitcoin expert and stick to her  Invest and play at similar times each day.Because :In times of chaos, your investment is your anchor to success",37943.91,"",1114,1614,"False","False","2020-05-04 13:17:35","True","False",1614,0.338636363636364,0.0622159090909091
454,"07/27/2021",1419989309998866432,"After turning its direction upwards, it reached the first target without giving much opportunity after the 4-hour closing on the green box. But after the green zone approval, it is now at the first target again. I'm selling some of my stocks here… Bitcoin BTC ",37943.91,"Traveller",15417,701,"False","False","2018-11-11 11:26:20","False","False",701,0.293333333333333,0.06
461,"07/27/2021",1419989293355913216,"  For all those who are new to this working from home Bitcoin trading options Here's a little tip:Get a trusted Bitcoin expert and stick to her  Invest and play at similar times each day.Because :In times of chaos, your investment is your anchor to success",37943.91,"",1114,1614,"False","False","2020-05-04 13:17:35","True","False",1614,0.338636363636364,0.0622159090909091
475,"07/27/2021",1419989273005068288," yess, the future is super bright for uquid bitcoin",37943.91,"United States of America",165,977,"False","False","2012-01-22 20:16:50","True","False",977,0.530555555555556,0.344444444444444
482,"07/27/2021",1419989264968912896,"  For all those who are new to this working from home Bitcoin trading options Here's a little tip:Get a trusted Bitcoin expert and stick to her  Invest and play at similar times each day.Because :In times of chaos, your investment is your anchor to success",37943.91,"",1114,1614,"False","False","2020-05-04 13:17:35","True","False",1614,0.338636363636364,0.0622159090909091
486,"07/27/2021",1419989262242615296,"Hey I joined a network called SurveyJ and earned $64 today! You get paid for testing out new free apps and posting on social media. Sign up with my link for an instant $40 signup bonus!  surveyj cashapp bitcoin",37943.91,"Nmz",337,2177,"False","False","2019-04-30 12:11:53","True","False",2177,0.496969696969697,0.142424242424242
493,"07/27/2021",1419989244697796608," Hey Travis, me and the team noticed that you're interested in Bitcoin &amp; DeFi.We wanted to introduce you to Mintlayer, which is a Bitcoin sidechain for tokenization and DeFi that will enable bitcoin-based DEXs, confidential transactions, and more...",37943.91,"Lebanon",75,3895,"False","False","2011-09-27 16:28:01","True","False",3895,0.5,0.375
495,"07/27/2021",1419989241849843712,"  For all those who are new to this working from home Bitcoin trading options Here's a little tip:Get a trusted Bitcoin expert and stick to her  Invest and play at similar times each day.Because :In times of chaos, your investment is your anchor to success",37943.91,"",1114,1614,"False","False","2020-05-04 13:17:35","True","False",1614,0.338636363636364,0.0622159090909091
506,"07/27/2021",1419989229904535552," 1: Wise 2: Coinbase3: RevolutHonorary mention, bitcoin !",37943.91,"France",1019,1271,"False","False","2015-03-19 07:50:00","False","False",1271,0.9,0.875
509,"07/27/2021",1419989226687447040,"Stacks through its programming language Clarity is taking Bitcoin to another level. The potential is limitless , Smart contracts and DeFi on BTC is now possible.DeFionBTC Clarity Stacks BTC ",37943.91,"Harare Bulawayo Gweru Zimbabwe",10008,2722,"False","False","2017-04-22 11:22:55","False","False",2722,0.821428571428571,0.107142857142857
533,"07/27/2021",1419989177073082368,"KeyFundFinance KeyFund KEY blockchain cryptocurrency technology bitcoin   The project deserves attention. Ideas, team competence, results, partnerships. All this indicates that this project has a great future. The project is very promising for successful investors",37943.91,"",2312,5002,"False","False","2020-07-05 09:24:09","True","False",5002,0.695,0.362
557,"07/27/2021",1419989122572300288,"“You will never always be motivated. You have to learn to be disciplined.”Next Fixed 100% games are UP!  message me for Info️This will be very limited places , who is interesed just take your place ️fixedmatches winning Bitcoin  GamblingTwitter bettingexpert ",37943.91,"United States of America",88,752,"False","False","2020-07-14 00:40:22","True","False",752,0.283928571428571,0.133035714285714
581,"07/27/2021",1419989066825846784,"Bitcoin shorters  fresh meme for your consideration Elon the Meme lord. ",37943.91,"United Kingdom",98,191,"False","False","2010-01-05 05:42:10","False","False",191,0.5,0.3
587,"07/27/2021",1419989042389684224,"  Best believe I will.. everyone knows when I long, that's when you really short but today I'm doing the world a favor. I'm intentionally crashing bitcoin",37943.91,"signals📊",9960,1561,"False","False","2019-07-24 22:23:21","True","False",1561,0.333333333333333,0.316666666666667
595,"07/27/2021",1419989020302528512,"     you are not entirely wrong and you are not entirely correct either. vaccination does reduce the incidence of covid positive cases after similar exposure between vaccinated and non-vaccinated people. It also reduces transmission by 40-60%.",37943.91,"",36,196,"False","False","2018-12-22 08:26:19","True","False",196,0.617613636363636,0.119318181818182
607,"07/27/2021",1419988999146393600,"We're talking Artificial Intelligence in this week's episode of TheBitcoinBridge! Expectations, reality, and what blockchain can do for AI   Bitcoin BSV",37943.91,"United States of America",3539,1176,"False","False","2015-03-13 05:07:27","False","False",1176,1,-0.75
608,"07/27/2021",1419988998437568512,"I dunno boys and girls - this Bitcoin thing might be worth looking into..",37943.91,"Australia",603,517,"False","False","2017-11-10 07:31:29","True","False",517,0.1,0.3
621,"07/27/2021",1419988977076080640,"  CRY HARDER is the underlying technology behind Number Go Up which is the underlying technology behind bitcoin.Few.",37943.91,"",139724,470,"False","False","2008-12-30 04:21:14","True","False",470,0.466666666666667,-0.3
627,"07/27/2021",1419988963243212800,"Interesting bc I have 8/1-8/2 as being sell days for Bitcoin on my calendar. (I always look to Mercury aspects for that) but didn’t realize it can mean bad news, but makes sense! ",37943.91,"not financial advice:)",583,1237,"False","True","2018-01-24 09:52:14","False","False",1237,0.618055555555555,-0.229166666666667
629,"07/27/2021",1419988962043596800,"Tesla: ""..., strip that out, and its pre-tax margin was still healthy at just shy of 9%. Conversely in the three months to the end of March, for example, gains on selling Bitcoin equated to more than a fifth of profit..."" ",37943.91,"Barquisimeto-Venezuela",12223,12599,"False","True","2013-05-28 00:11:26","False","False",12599,0.5,0.166666666666667
631,"07/27/2021",1419988958256238592,"Buy HoboNickels while it is cheap       Bitcoin",37943.91,"Moon",1584,2485,"False","False","2017-08-30 19:56:45","False","False",2485,0.7,0.4
638,"07/27/2021",1419988942548520960,"       babydoge is the next best traded token on huobi ",37943.91,"",328,1450,"False","False","2012-07-26 18:41:11","True","False",1450,0.15,0.5
647,"07/27/2021",1419988927239360512,"   I fell in love with Bitcoin Twitter instantly. Finally real friction to cut my chops against with people who actually cared about truth. You guys taught me so much so fast",37943.91,"United States of America",9879,3914,"False","False","2017-02-10 17:07:47","False","False",3914,0.4,0.225
652,"07/27/2021",1419988917751844864,"Invest with us and experience what it means to invest and earn. Inbox For more inquiringamcsqeeze Binance   Bb23 Cryptocurency Bitcoin   altcoin amcstock believe BabyDoge bitcoinmining binary Covid_19 Bitfinex  ",37943.91,"US",207,1702,"False","False","2020-12-06 09:02:00","True","False",1702,0.5,0.5
665,"07/27/2021",1419988878916788224,"Relai was mentioned in this popular Swiss newspaper as a direct way of acquiring bitcoin!  ",37943.91,"Switzerland",4626,1601,"True","False","2019-03-14 10:11:34","True","False",1601,0.65,0.3625
669,"07/27/2021",1419988875842179072,"Do you really want passive income from your Bitcoin ?Try lending on Might be a better option than BlockFi, especially now.",37943.91,"United States of America",870,557,"False","False","2014-06-01 22:30:22","False","False",557,0.566666666666667,0.233333333333333
673,"07/27/2021",1419988869622026240,"Buy BTC With Your Credit Card / Fast Crypto Exchange  Bitcoin BTC ETH XRP Cryptocurrency 07:51 ",37943.91,"",10267,3328,"False","False","2013-12-05 23:34:07","True","False",3328,0.6,0.2
