"X","Date","TweetID","Text","BTC.Price","User.Location","User.follower.count","UserFollowingCount","User.Verified","Quote.Status.","AccountCreationDate","Default.Profile.Theme.","DefaultProfileImage","TotalAccountLikes","Subjectivity","Polarity"
1474,"07/30/2021",1421116129662078976,"FinancialAdvisors are being asked more and more questions about Bitcoin. To help them, we created our Digital Currency Toolkit. It’s a straightforward and objective educational resource. Download your copy here: ",38991.71,"United States of America",426040,401,"True","False","2014-10-02 16:44:43","False","False",401,0.2875,0.270833333333333
1480,"07/30/2021",1421116109021908992,"Hard work does not bring wealth. That is a myth the upper class sold the working class to suppress them. So, what brings wealth? Smart work, not hard work. The smarter you work, the wealthier you get. The harder you work, the unhealthier you get. Bitcoin",38991.71,"Youngsville, LA",1746,632,"False","False","2015-12-29 08:01:45","True","False",632,0.345238095238095,-0.00630952380952382
1502,"07/30/2021",1421116049882296320,"Put this date in your diary N3 mainnet the new version of eo will be going live on August 2ndWell done to everyone over at    &amp;many others involved for all their hard work and commitment  BITCOIN     ",38991.71,"United Kingdom",849,810,"False","True","2013-06-09 10:26:55","False","False",810,0.498737373737374,-0.00631313131313133
1515,"07/30/2021",1421116023554646016,"Rising High: Bitcoin falls after Amazon cryptocurrency rumors                ",38991.71,"United States of America",27314,166,"False","False","2010-07-14 15:10:34","False","False",166,0.54,0.16
1516,"07/30/2021",1421116023038791680,"Bitcoin’s price prediction decline as corporates point to technical breakdown It's past time for Bitcoin's business advocates to take responsibility for the  bitcointechnicalbreakdown bitcoinprice",38991.71,"India",7411,7570,"False","False","2009-05-29 11:35:24","False","False",7570,0.175,-0.125
1529,"07/30/2021",1421115997415673856,"Bitcoin Price Tanks, Did The Halt of Binance Futures &amp; Derivatives Trading Fuel The Plunge? The crypto market witnessed a little sigh of relief as most of the assets after a 50% freefall was able to gain a minimum of 10% to 15%. The market sentiments ch…",38991.71,"Kolkata, West Bengal",111,576,"False","False","2009-08-09 15:31:28","True","False",576,0.541666666666667,0.270833333333333
1534,"07/30/2021",1421115991774347264,"Crypto race between geopolitical powers might be even more signficant than a space race in 20th-century. crypto bitcoin blockchain fintech geopolitics eu usa ",38991.71,"The Netherlands",27,425,"False","False","2013-05-25 14:03:00","True","False",425,0.5,0.5
1544,"07/30/2021",1421115977824038912,"Greenidge Generation To Repurpose Old Coal Ash Landfill Into A New Solar FarmToplist Crypto Casino &amp; SportsBook   ",38991.71,"",145,427,"False","False","2018-01-16 13:26:51","True","False",427,0.327272727272727,0.118181818181818
1548,"07/30/2021",1421115970551177216,"New NFT art or creative cryptos? Sometimes the internet gets creative and unexpectedly gifts you great things. bitcoin btc ETC Crypto digitalartwork ",38991.71,"United States of America",70739,6372,"False","False","2009-04-07 15:19:56","False","False",6372,0.840909090909091,0.407272727272727
1555,"07/30/2021",1421115964368769024,"I'm sure if Maslow could revise his hierarchy he'd approve of this addition bitcoin btc Would you agree  ",38991.71,"Minnesota",386,687,"False","False","2012-07-20 02:39:47","True","False",687,0.888888888888889,0.5
1557,"07/30/2021",1421115959163691008,"linkedin twitter facebook instagram wedding tiktok socialmedia tumblr dogecoin deal gift gifts giftideas shop shopping affiliatemarketing bitcoin popcorn Enjoy $10 off Orders of $50+ - Use code IR10 - ",38991.71,"United States of America",67853,7040,"False","False","2012-06-25 04:38:20","False","False",7040,0.5,0.4
1562,"07/30/2021",1421115951462817792," best project    bitcoin ethereum cryptocurrency blockchain BTC iNf4mation",38991.71,"",45,403,"False","False","2019-11-01 04:31:15","True","False",403,0.3,1
1570,"07/30/2021",1421115947780296704,"Bitcoin Update. The top of the trading range is a logical spot for profit taking. The quality of the supply on the next reaction will be key to confirm a Minor Sign of Strength one of three scenarios we looked at in the last Wyckoff Crypto Discussion  ",38991.71,"",12411,157,"False","False","2015-03-11 14:23:48","True","False",157,0.336111111111111,0.116666666666667
1572,"07/30/2021",1421115947243429888," Without a doubt it is. People cant think for themselves. Imagine waiting on your government to tell you what to do. This is the fight for power right now. Bring on the Bitcoin  standard",38991.71,"",40,273,"False","False","2020-07-30 10:36:53","True","False",273,0.267857142857143,0.142857142857143
1580,"07/30/2021",1421115934220210176," this is a great project AirdropDetective  OpenExhibition  Bitcoin",38991.71,"Bangladesh",19,459,"False","False","2020-04-29 11:09:54","True","False",459,0.75,0.8
1583,"07/30/2021",1421115928629039104,"Bitcoin sentiment breaks free from 'extreme fear' — returning to 'neutral' for the first time since May ",38991.71,"🌋",18286,10238,"False","False","2009-11-04 18:04:28","False","False",10238,0.711111111111111,0.175
1588,"07/30/2021",1421115924086673408,"Business intelligence company MicroStrategy will continue investing in its “digital asset strategy” The company now holds more than 105,000 Bitcoin... just WOW!BTCUSD btc crypto cryptocurrency CryptoNews Ethereum",38991.71,"NOAH City",11614,940,"False","False","2015-12-07 05:21:49","False","False",940,0.25,0.25
1595,"07/30/2021",1421115917744889856,"New Post: Bitcoin Mining Difficulty Set to Break the 2nd-Longest Drop Streak cryptonews cryptocurrency blockchain crypto ethereum btc eth litecoin altcoins bitcoinnews bitcoins ripple cryptomining coinbase cryptocurrencies investing ",38991.71,"Antwerp",553,387,"False","False","2014-12-22 20:22:53","False","False",387,0.454545454545455,0.136363636363636
1605,"07/30/2021",1421115894009368576," winnings of initial BTC investment$154843843 (11.47 %) (Realized: 272 M)(Estimating an average buy price of $35000/BTC with now 38,700 BTC holdings )Tesla Bitcoin crypto",38991.71,"",1310,865,"False","False","2018-06-20 08:50:17","True","False",865,0.2,-0.075
1626,"07/30/2021",1421115867752972288,"Privacy is more than a hot topic in the tech world Tune into  for a weekly dose of commentary on technology, privacy, and Internet freedom in the digital age On the latest episode, host  talks bitcoin &amp; privacy w/!",38991.71,"",279,277,"False","False","2019-10-03 10:04:05","True","False",277,0.5625,0.34375
1633,"07/30/2021",1421115850984017920,"As a White-label Cryptocurrency Exchange Script Development Company we are Expertise in ready made Bitcoin Trading Software.  cryptocurrency crypto btc bitcoin trading defi Blockchain Bitcoin coinbaseclone Website:  Contact us: info.com ",38991.71,"United States of America",201,375,"False","False","2016-09-20 06:34:42","True","False",375,0.5,0.2
1641,"07/30/2021",1421115832713814016," ...and a dollar invested in Bitcoin will be worth thousands of times more than that.The only difference is that stocks can't ever be a good medium of exchange or unit of account.",38991.71,"United States of America",1412,603,"False","False","2020-04-28 12:51:25","True","False",603,0.55,0.375
1652,"07/30/2021",1421115810123243520,"   Do you know, you can be making more than $5000 in 24hours, if you have Bitcoin wallet Blockchain wallet, Coin base wallet, Luno wallet, Coinph wallet, BTC wallet. You can make up to $5000 BITCOIN with your Phone or Computer",38991.71,"United States of America",138,1359,"False","False","2020-12-04 18:37:50","True","False",1359,0.75,-0.15
1654,"07/30/2021",1421115803257249792,"The goal of Stable Blockchain project is to provide the user of the Stable Blockchain ecosystem with a full range of tools for handling cryptocurrencies (SBW-SBS-SBL-SBC).presale blockchain cryptotrading investing cryptocurrency bitcoin trading altcoin cryptonews",38991.71,"",3084,1879,"False","False","2012-03-09 10:34:06","True","False",1879,0.55,0.35
1669,"07/30/2021",1421115758961074176,"Morbex is new cryptocurrency platform token. This project running huge bounty campaign. Everyone join this bounty campaign. Don't miss this good opportunity. MorbexFinance Morbex BEX blockchain cryptocurrency bitcoin money crypto Binance BNB ",38991.71,"",5072,5047,"False","False","2019-07-11 15:20:14","True","False",5047,0.651515151515151,0.412121212121212
1682,"07/30/2021",1421115718926536704,"  Do you know, you can be making more than $5000 in 24hours, if you have Bitcoin wallet Blockchain wallet, Coin base wallet, Luno wallet, Coinph wallet, BTC wallet. You can make up to $5000 BITCOIN with your Phone or Computer",38991.71,"United States of America",138,1359,"False","False","2020-12-04 18:37:50","True","False",1359,0.75,-0.15
1695,"07/30/2021",1421115692603019264," When this happens the fiat currencies of the world will get rekt and will never recover.  Central bank digital currencies will be rolled out as the savioursBitcoin might suffer also short term but it's decentralized, censorship resistant nature will see it eventually win out.",38991.71,"The Moon",2115,1693,"False","False","2010-06-27 12:59:03","False","False",1693,0.2375,0.2
1706,"07/30/2021",1421115656792072192,"  Do you know, you can be making more than $5000 in 24hours, if you have Bitcoin wallet Blockchain wallet, Coin base wallet, Luno wallet, Coinph wallet, BTC wallet. You can make up to $5000 BITCOIN with your Phone or Computer",38991.71,"United States of America",138,1359,"False","False","2020-12-04 18:37:50","True","False",1359,0.75,-0.15
1713,"07/30/2021",1421115641973547008,"Nonprofits Get a New Type of Donation: Cryptocurrency - The New York Times: * Nonprofits Get a New Type of Donation: Cryptocurrency  The New York Times * Cryptocurrency prices today: Bitcoin falls marginally, other virtual coins trade higher  India Today…  ",38991.71,"United States of America",239,186,"False","False","2018-09-23 21:28:47","False","False",186,0.448863636363636,0.111742424242424
1720,"07/30/2021",1421115622604230656,"The system Stable Blockchain completely secure, with to the CryptoNote ring signature system, users will not have to worry about anonymity on the Stable Blockchain network.presale blockchain cryptotrading investing cryptocurrency bitcoin trading altcoin cryptonews",38991.71,"",6298,309,"False","False","2011-11-13 10:45:08","False","False",309,0.6,0.4
1727,"07/30/2021",1421115616015101952," It wouldn’t be a good idea anyway. Bitcoin wastes energy and there are better technologies out there. Like XRP",38991.71,"",42,336,"False","False","2014-05-19 19:44:59","True","False",336,0.366666666666667,0.333333333333333
1737,"07/30/2021",1421115595278401536,"Free Stocks on Webull up to $1200 when you deposit at least $100 within 30 days  wealth success finance Amc cryptocurrency bitcoin  ",38991.71,"United States of America",113,116,"False","False","2012-04-14 22:55:07","False","False",116,0.4,0.133333333333333
1748,"07/30/2021",1421115575359651840,"Cryptocurrencies have been on a roller coaster ride for most of the year, so is it wise to buy a bit of bitcoin? ICPAS member and Insight columnist Mark Gilbert, CPA/PFS weighs in on whether cryptocurrencies should be part of your financial plan. ",38991.71,"United States of America",6857,838,"False","False","2009-09-01 19:52:53","False","False",838,0.466666666666667,0.4
1756,"07/30/2021",1421115560260161536," A unique project with a solid background to be part of. Guys check it out and be a part of it.    All tasks completedAirdrop giveaway potatoe bitcoin coins Crypto",38991.71,"",1704,3935,"False","False","2020-11-16 21:39:22","True","False",3935,0.55,0.1875
1763,"07/30/2021",1421115549942272000,"    Spencer’s prefrontal cortex isnt even fully developed. Once it is he will realize how much Bitcoin is a ponzu scheme",38991.71,"",215,215,"False","False","2013-12-22 20:34:31","False","False",215,0.25,0.15
1767,"07/30/2021",1421115534305857536,"   Do you know, you can be making more than $5000 in 24hours, if you have Bitcoin wallet Blockchain wallet, Coin base wallet, Luno wallet, Coinph wallet, BTC wallet. You can make up to $5000 BITCOIN with your Phone or Computer",38991.71,"United States of America",138,1359,"False","False","2020-12-04 18:37:50","True","False",1359,0.75,-0.15
1789,"07/30/2021",1421115496343212032,"New post (Wealthfront Adds Grayscale Bitcoin, Ethereum Shares) has been published on CRYPTO INFO SITE - ",38991.71,"",798,2143,"False","False","2011-06-14 04:13:37","True","False",2143,0.454545454545455,0.136363636363636
1797,"07/30/2021",1421115478945189888,"  Do you know, you can be making more than $5000 in 24hours, if you have Bitcoin wallet Blockchain wallet, Coin base wallet, Luno wallet, Coinph wallet, BTC wallet. You can make up to $5000 BITCOIN with your Phone or Computer",38991.71,"United States of America",138,1359,"False","False","2020-12-04 18:37:50","True","False",1359,0.75,-0.15
1808,"07/30/2021",1421115452244340736,"Coinbase and Bank of America Join Series D Funding Round of Paxos bitcoin crypto blockchain eth cryptocurrency cryptonews",38991.71,"CryptoFarmLand",489,1894,"False","False","2020-04-09 11:02:22","True","False",1894,0.4,-0.2
1815,"07/30/2021",1421115439413932032,"Medicated MIX+MATCH Edibles (500-600mg THC). Professionally manufactured, accurately dosed edibles, best on the market. No minimum! trial orders-bulkShop now! Buy tasty, highly potent, candy/Gummy THC edibles. Best quality! Accurately dosedBitcoin BTC CashApp Venmo ",38991.71,"",87,487,"False","False","2020-11-28 03:01:28","True","False",487,0.411111111111111,0.566666666666667
1820,"07/30/2021",1421115428403916800,"Even universities are holding bitcoin.. while their “top economiest” are speaking against it..That should tell you something..Stack sats or they’ll do before you ",38991.71,"",1082,1749,"False","True","2011-02-09 03:18:07","True","False",1749,0.5,0.5
1821,"07/30/2021",1421115428273786880,"  Do you know, you can be making more than $5000 in 24hours, if you have Bitcoin wallet Blockchain wallet, Coin base wallet, Luno wallet, Coinph wallet, BTC wallet. You can make up to $5000 BITCOIN with your Phone or Computer",38991.71,"United States of America",138,1359,"False","False","2020-12-04 18:37:50","True","False",1359,0.75,-0.15
1823,"07/30/2021",1421115423920164864,"Thank God it's FRIDAYCheck the updates:  and   Claim free spins =&gt; See promotions for detailsBitcoin  gamble cryptocurrency crypto BTCUSD  Ethereum blockchain BTC dogecoin Binance retweet ",38991.71,"Nederland",1419,3798,"False","False","2017-11-24 09:33:34","True","False",3798,0.8,0.4
1826,"07/30/2021",1421115419092525056,"Another gym sesh done, would post a pic for proof but I'm sweating as much as a bitcoin investor every time Elon Musk tweets.",38991.71,"In Utero",446,293,"False","False","2014-03-20 06:45:29","False","False",293,0.2,0.2
1849,"07/30/2021",1421115363643727872,"Morbex very good project with interesting and informative knowledge. Team behind the project is well experienced and hope it will go longer and proper their goals.MorbexFinance Morbex BEX blockchain cryptocurrency bitcoin money crypto Binance BNB ",38991.71,"",5072,5047,"False","False","2019-07-11 15:20:14","True","False",5047,0.596,0.362
1850,"07/30/2021",1421115363018878976,"  Do you know, you can be making more than $5000 in 24hours, if you have Bitcoin wallet Blockchain wallet, Coin base wallet, Luno wallet, Coinph wallet, BTC wallet. You can make up to $5000 BITCOIN with your Phone or Computer",38991.71,"United States of America",138,1359,"False","False","2020-12-04 18:37:50","True","False",1359,0.75,-0.15
1855,"07/30/2021",1421115348313591808,"bitcoin staying above 40k TODAY is top priority. But if it goes lower why not stay calm and DCA.Ill look more into this. Crypto",38991.71,"On SafeMoon ",5198,373,"True","False","2010-07-16 01:32:02","False","False",373,0.4625,0.325
1860,"07/30/2021",1421115334074015744,"Bitcoin Hits Key Test to Make Gains Above $40,000.  ""The cloud uses a series of mathematical formulas to help define resistance and support relative to the price, with a breakout over the top suggesting the potential for further gains.""  ",38991.71,"Caracas, Venezuela",1261,1168,"False","False","2013-11-14 23:19:43","True","False",1168,0.442857142857143,0.0714285714285714
1867,"07/30/2021",1421115320421560320,"Bitcoin And Other Top Cryptocurrencies Are Trading Sideways, But Solana Is On The Move Bitcoin and other cryptocurrencies are wrapping the week up strongly, with the total market rising 11.9% in the past seven days but the rally is slowing down. ",38991.71,"World Wide Web",1602,282,"False","False","2015-06-29 19:54:17","False","False",282,0.467460317460317,0.0396825396825397
1870,"07/30/2021",1421115315992285184,"      . you're so right that 1000 hrs at least is required to speak on this topic. Every politician may have an opinion on the subject matter, none yet have proven to be a true subject matter expert. Bitcoin is a self-propagating force that pushes one to think about it.",38991.71,"United States of America",301,762,"False","False","2008-05-03 22:30:36","False","False",762,0.45047619047619,0.000476190476190475
1882,"07/30/2021",1421115300108509184,"  They still think growth hacking is the name of the game. Most ppl I know have no interest in what crypto has to offer other than number go up. But they all own a majority in bitcoin. I’m ok with ppl getting richer. Many will fail. Many will learn about risk.",38991.71,"Moscow",1885,1317,"False","False","2016-09-15 22:03:21","True","False",1317,0.509375,0.196875
1887,"07/30/2021",1.42111529021e+18,"  Do you know, you can be making more than $5000 in 24hours, if you have Bitcoin wallet Blockchain wallet, Coin base wallet, Luno wallet, Coinph wallet, BTC wallet. You can make up to $5000 BITCOIN with your Phone or Computer",38991.71,"United States of America",138,1359,"False","False","2020-12-04 18:37:50","True","False",1359,0.75,-0.15
1893,"07/30/2021",1421115269125132288,"Bitcoin accumulation accelerates among ‘whales’ and ‘fish’ with BTC rallying to $40K""This is just on-chain sentiment, though. The big question is, how does that correlate to the price action in general?""Both small and rich Bitcoin (BTC) traders accum…  ",38991.71,"United States of America",392,461,"False","False","2014-03-05 09:42:32","True","False",461,0.37,0.055
1895,"07/30/2021",1421115265471979520,"  So first step is to define bitcoin as digital asset, shitcoins as digital asset securities? That’s my interpretation. The way the digital asset security is worded seems like anything that is proof of stake is a security since staking gives you input on the network, no?",38991.71,"",155,950,"False","False","2011-09-09 04:45:12","False","False",950,0.0833333333333333,0.0625
1898,"07/30/2021",1421115251383283712," Hey I joined a network called SurveyJ and earned $56 today! You get paid for testing out new free apps and posting on social media. Sign up with my link for an instant $40 signup bonus!  surveyj cashapp bitcoin",38991.71,"Port Elizabeth",3040,3113,"False","False","2014-10-10 17:50:25","True","False",3113,0.496969696969697,0.142424242424242
1912,"07/30/2021",1421115227207241728,"  Do you know, you can be making more than $5000 in 24hours, if you have Bitcoin wallet Blockchain wallet, Coin base wallet, Luno wallet, Coinph wallet, BTC wallet. You can make up to $5000 BITCOIN with your Phone or Computer",38991.71,"United States of America",138,1359,"False","False","2020-12-04 18:37:50","True","False",1359,0.75,-0.15
1915,"07/30/2021",1421115220961943552,"Best bitcoin cloud mining and passive income site We make industrial bitcoin mining accessible for everyone Everything you need for bitcoin cloud mining today Click the Link to start earning Free Bitcoin  Bitcoin Cryptocurency Crypto cryptocurrency ",38991.71,"United States of America",242,591,"False","False","2017-04-27 22:28:12","False","False",591,0.491666666666667,0.591666666666667
1917,"07/30/2021",1421115214167089152,"you don't look at chart before buying real estate, you just buy it.Do the same with Bitcoin and pump it to 200k asap, dumb fcks. ",38991.71,"Kepler 452b",2047,544,"False","True","2009-08-30 17:53:27","True","False",544,0.308333333333333,-0.0583333333333333
1929,"07/30/2021",1421115185243295744,"Inside The Bitcoin Mine With Its Own Power Plant  news",38991.71,"Worldwide",46670,164,"False","False","2008-11-14 05:38:03","False","False",164,1,0.6
1931,"07/30/2021",1421115181476765696,"     The Bitcoin Blockchain is not optimized for IoT. In other news: water is wet",38991.71,"Vienna",361,701,"False","False","2009-06-12 11:44:34","False","False",701,0.3875,-0.1125
1934,"07/30/2021",1421115173146796032,"Great project    Airdrops AirdropDetective Bitcoin Summarizer SMR ",38991.71,"",21,490,"False","True","2019-11-15 16:02:17","True","False",490,0.75,0.8
1938,"07/30/2021",1421115164632440832,"RETWEET!!! URGENT a true banger if you will dogecoin crypto BITCOIN         ",38991.71,"the moon",137,406,"False","False","2017-12-15 19:22:59","True","False",406,0.65,0.35
1940,"07/30/2021",1421115162136809472,"linkedin twitter facebook wedding instagram tiktok socialmedia tumblr dogecoin deal gift gifts giftideas shop shopping affiliatemarketing bitcoin popcorn Enjoy $10 off Orders of $50+ - Use code IR10 - ",38991.71,"United States of America",67852,7040,"False","False","2012-06-25 04:38:20","False","False",7040,0.5,0.4
1943,"07/30/2021",1421115152817025024," good project, hopefully in the future it can be even more successful for the teamAirdrop Bitcoin Ethereum Crypto crypto GuppyNetwork GPN  Airdropstario",38991.71,"",96,1826,"False","False","2020-09-29 12:45:45","True","False",1826,0.54375,0.4875
1957,"07/30/2021",1421115123352145920,"   Do you know, you can be making more than $5000 in 24hours, if you have Bitcoin wallet Blockchain wallet, Coin base wallet, Luno wallet, Coinph wallet, BTC wallet. You can make up to $5000 BITCOIN with your Phone or Computer",38991.71,"United States of America",138,1359,"False","False","2020-12-04 18:37:50","True","False",1359,0.75,-0.15
1961,"07/30/2021",1421115115034890240," What about decentralized marketing executions for decentralized open-source projects like ano and Bitcoin?Maybe comparing what has been done with Bitcoin before and what is being done with Nano today.I would love that.",38991.71,"Brazil",503,670,"False","False","2018-03-08 19:49:09","True","False",670,0.6,0.5
1966,"07/30/2021",1421115105316540416,"Good morning. Bitcoin is digital water rights.",38991.71,"United States of America",11398,279,"False","False","2009-12-07 18:53:31","True","False",279,0.3,0.35
1981,"07/30/2021",1421115080142331904," I believe this is a faithful project.The projector has a lot of attractions so hopefully the project will be better in the future.   Crypto Bitcoin Ethereum ETH Airdrop BSC BNB DuelistKing MysteryBox",38991.71,"",12,275,"False","False","2020-09-30 17:42:14","True","False",275,0.3125,0.25
