"X","Date","TweetID","Text","BTC.Price","User.Location","User.follower.count","UserFollowingCount","User.Verified","Quote.Status.","AccountCreationDate","Default.Profile.Theme.","DefaultProfileImage","TotalAccountLikes","Subjectivity","Polarity"
729,"07/08/2021",1413102977183895552," Peter is trying to stay relevant by constantly tweeting about bitcoin.  If only his rocks were this exciting",32606.42,"",436,4996,"False","False","2011-03-08 01:10:21","True","False",4996,0.758333333333333,0.175
744,"07/08/2021",1413102941704183808," Trading Bitcoin  is highly volatile and that's why am getting with  which is massively pumping currently and is poised to pump harder when xCVP is launched soon.So buying now isn't a bad idea.CVP xCVP DeFi altcoin ",32606.42,"Nigeria",163,359,"False","False","2018-07-05 23:11:24","True","False",359,0.521333333333333,-0.128
751,"07/08/2021",1413102917448519680,"Bitcoin is just MLM for boring nerds",32606.42,"",253,191,"False","False","2017-01-15 13:20:04","False","False",191,1,-1
756,"07/08/2021",1413102910490120192," What it might take to convert the largest bitcoin fund into the U.S.'s first ETF ",32606.42,"United States of America",12287,5776,"False","False","2016-02-03 00:16:43","False","False",5776,0.333333333333333,0.25
757,"07/08/2021",1413102904857272320,"The price of Bitcoin declined by 6.24% on Thursday after People's Bank of China (PBoC) Vice Governor Fan Yifei labeled cryptocurrencies ""speculative tools"" that endanger global financial and social...See more on ",32606.42,"",72,1432,"False","False","2020-05-16 14:48:32","True","False",1432,0.166666666666667,0.166666666666667
767,"07/08/2021",1413102879053778944,"  Peter has been mumbling about Bitcoin since it was $10 He is like an International version of our own Great Martis, except he has the personality of a chalkboard and doesn't post amusing gifs.",32606.42,"",78,1171,"False","False","2013-03-25 21:17:39","True","False",1171,0.6875,0.5
789,"07/08/2021",1413102822095208448," You have less BTC  mined, many bullish news but this price is disastrous.  Market Makers need to stop this manipulation as we are losing alot of people from this market.  Keep up the honest work mate",32606.42,"Singapore",45,259,"False","False","2019-01-13 00:19:52","True","False",259,0.566666666666667,0.0583333333333333
813,"07/08/2021",1413102775404224512,"Komodo KMD Analysis &amp; Price Prediction THIS IS WHY KMD WILL HIT HiGH L...  via  Please look for more Videos at my Youtube channel Bitcoin BTC Ripple XRP Stellar XLM VeChain VET Chainlink LINK ZIL Dogecoin ",32606.42,"",1280,4991,"False","False","2020-06-05 03:32:47","True","False",4991,0.43,0.303333333333333
818,"07/08/2021",1413102761256886272,"Bitcoin maximalism shouldn’t even have to be a thing. Why does the absence of stupidity need a name?",32606.42,"Moon",275,1428,"False","False","2017-06-07 19:44:55","True","False",1428,0.5,-0.30625
821,"07/08/2021",1413102753019166720,"Never equate the 2018 program with 2021, these are all very different, did bitcoin previously have the same program and support this year? now is the modern era of sustainable development, we will see in the future.Bitcoin",32606.42,"Indonesia",477,1441,"False","False","2011-04-01 03:42:16","False","False",1441,0.342916666666667,0.00833333333333334
828,"07/08/2021",1413102724678365184,"Bitcoin 1D TimeframeStill trading in this disgusting range.Price broke a symmetrical triangle today...Might the price fall? BTC cryptocurrency Crypto ",32606.42,"Pure Trading, Pure Profit",1403,193,"False","False","2020-12-01 23:13:28","True","False",193,1,-1
830,"07/08/2021",1413102713743675392,"   what was the point of eip1559? take a look at what the Bat emoji people were tweeting the past few months.""a triple halvening""""more deflationary than Bitcoin so superior store of value""""Ultrasound money"" The Bat people are obviously trying to pump the price of Eth.",32606.42,"",256,588,"False","False","2014-02-12 21:46:48","True","False",588,0.45,0.15
831,"07/08/2021",1413102713538220032," We're excited. ",32606.42,"United Kingdom",39314,2845,"True","False","2008-09-10 10:45:22","False","False",2845,0.75,0.375
840,"07/08/2021",1413102693900505088,"With second-layer building enabled, other solutions to the scalability problem seek to maintain the structure of the original Bitcoin protocol and focus on off-chain methods to boost scalability. lightningnetwork",32606.42,"Global",77598,53789,"False","True","2015-05-02 16:54:25","False","False",53789,0.5625,0.125
848,"07/08/2021",1413102683796430848," Vaccines are the only way to be bullish about moving beyond this pandemic any time soon.Network effects of a pandemic probably the only thing thats grown quicker than Bitcoin! Suppress Covids buy action, get the jab!  Expecting no replies ",32606.42,"",12,178,"False","False","2020-07-22 17:13:12","True","False",178,0.7,0.0416666666666667
851,"07/08/2021",1413102674862657536,"Bitcoin, Litecoin, XRP, ETH Stock Exchange, ETH Bullish, XRP PWC &amp; Litecoin UFC |   | The Modern Investor | ",32606.42,"United States of America",1440,4564,"False","False","2019-03-29 20:26:15","False","False",4564,0.3,0.2
854,"07/08/2021",1413102672257945600,"“Everybody I know has gotten rug-pulled.” Billions are lost annually through a variety of cryptocurrency scams. The way things are going—this will only get worse.  via ",32606.42,"",12,369,"False","False","2020-07-21 13:01:06","True","False",369,0.8,-0.2
873,"07/08/2021",1413102632550424576,"linkedin twitter facebook instagram tiktok socialmedia tumblr dogecoin deal gift shoppingstaronline gifts giftideas shop shopping affiliatemarketing bitcoin popcorn Enjoy $10 off Orders of $50+ - Use code IR10 - ",32606.42,"United States of America",67461,6353,"False","False","2012-06-25 04:38:20","False","False",6353,0.5,0.4
888,"07/08/2021",1413102601113989120,"Giannis' free throws take longer than these iconic sports moments   ️  Bitcoin Sportsbook ",32606.42,"",649,827,"False","False","2016-12-16 21:14:48","False","False",827,0.65,0.45
912,"07/08/2021",1413102541206872064,"  Honestly you'd probably poach a good many yubikey customers if you would market this angle harder. I know a lot of infosec people who wouldn't be thrilled at the idea of a bitcoin wallet at this price point, but would jump on the SSH/GnuPG features.",32606.42,"sprawl",751,1678,"False","False","2009-06-13 05:11:26","False","False",1678,0.54,0.46
915,"07/08/2021",1413102537582866432,"So far... ",32606.42,"United States of America",43310,1786,"False","False","2009-01-11 18:01:37","False","False",1786,1,0.1
921,"07/08/2021",1413102526090653696,"Ethereum ETH URGENT!!! Analysis&amp; Price Prediction- ETH HOLDERS MUST WA...  via  Please look for more Videos at my Youtube channel Bitcoin BTC Ripple XRP Stellar XLM VeChain VET Chainlink LINK ZIL Dogecoin ",32606.42,"",1280,4991,"False","False","2020-06-05 03:32:47","True","False",4991,0.375,0.375
926,"07/08/2021",1413102507904049152," I've had experience with insomnia and have absolutely had psychedelic experiences due to sleep deprivation.",32606.42,"",26,321,"False","False","2017-11-15 04:23:12","True","False",321,0.6375,0.0375
931,"07/08/2021",1413102501121908736,"  Great take here. A lot of galaxy minds focused on this.",32606.42,"United States of America",413,207,"False","False","2012-05-06 23:59:08","True","False",207,0.75,0.8
953,"07/08/2021",1413102431098056704,"   The futures and options markets create short-term volatility waves and currently, it has suffered the greatest attack in China.But the fact is, Bitcoin is valuable to millions worldwide daily and its adoption grows day by day. ",32606.42,"Santiago de Compostela",794,849,"False","False","2011-09-27 09:20:58","False","False",849,0.466666666666667,0.333333333333333
958,"07/08/2021",1413102411678461952,"    i remember when he finally flipped to ""officially bullish"" at 14k, just before it started a major down trendi just feel sorry for the people who actually follow himmissed a decent accumulation zone between 4 and 6k , just to finally fomo at 14",32606.42,"Springfield",946,410,"False","False","2017-12-07 14:12:03","False","False",410,0.650793650793651,-0.0609126984126984
961,"07/08/2021",1413102405340762112," Yes this is great. Bitcoin is now free so you might as well just give it to me, DM me for further information.",32606.42,"Norway",1085,4978,"False","False","2010-07-10 11:44:15","False","False",4978,0.683333333333333,0.4
969,"07/08/2021",1413102385237397504,"  Bitcoin is a child of Fed printing/liquidity since '08. The long 12+ yr ""prosperity"" has given a false of security to those investing in bubbles like Bitcoin. Next crash will occur because Feds bubble since 08 will pop. Bitcoin won't survive this crash, as Feds power will peak",32606.42,"",46,204,"False","False","2020-03-13 11:34:03","True","False",204,0.333333333333333,-0.15
984,"07/08/2021",1413102348621295616,"Intertops Casino 50 Free Spins Sign Up Bonus and New 150% Slot of the Month Deposit Bonus with 50 Added Spins    Reliable Bitcoin Litecoin Crypto BitcoinCash or Fiat Casino est 1998. Canada, Australia Welcome (No UK, No France) ",32606.42,"Gambleville",12337,11462,"False","False","2009-02-28 23:13:57","False","False",11462,0.718181818181818,0.445454545454545
985,"07/08/2021",1413102345454489600,"EGLD URGENT!!!! Analysis&amp; Price Prediction- EGLD HOLDERS MUST WATCH Bes...  via  Please look for more Videos at my Youtube channel Bitcoin BTC Ripple XRP Stellar XLM VeChain VET Chainlink LINK ZIL Dogecoin ",32606.42,"",1280,4991,"False","False","2020-06-05 03:32:47","True","False",4991,0.375,0.375
1008,"07/08/2021",1413102316161490944," Free Trading Signals (BETA)SYMBOL:  /  bitcoinDIRECTION: SELL @ 32616.06TIMEFRAME: 5 MINPLATFORM: ZentraderStrategy: Short term trend reversal. BETA testing. Read pinned tweet for full info!forexsignals zentrader ゼントレーダー ゼン・トレーダー",32606.42,"Singapore",328,107,"False","False","2020-01-08 22:21:32","True","False",107,0.6625,0.125
1017,"07/08/2021",1413102301020147712,"Bitcoin is the Wild West of price discovery: it’s true freedom. ",32606.42,"Gratis cursussen en eBook 👉🏼",42336,1522,"False","True","2016-04-29 23:01:52","False","False",1522,0.525,0.225
1045,"07/08/2021",1413102240924110848,": With Bitcoin, businesses that receive frequent payments probably want to run their own nodes for more independent security and quicker verification.Is this also the case for XRP transactions? Would it be more beneficial for those businesses to run an XRP node?",32606.42,"United Kingdom",10407,574,"False","False","2018-01-08 13:25:03","True","False",574,0.485,0.34
1071,"07/08/2021",1413102183344713728,"Dogecoin DOGE URGENT!!! Analysis&amp; Price Prediction - DOGE HOLDERS MUST...  via  Please look for more Videos at my Youtube channel Bitcoin BTC Ripple XRP Stellar XLM VeChain VET Chainlink LINK ZIL Dogecoin ",32606.42,"",1280,4991,"False","False","2020-06-05 03:32:47","True","False",4991,0.375,0.375
1080,"07/08/2021",1413102159034568704,"That shit was epic Lmaooo ",32606.42,"₿itcoinVegan, Mars",4208,1331,"False","True","2017-01-08 16:28:15","True","False",1331,0.6,-0.05
1093,"07/08/2021",1413102127015211008,"they tryna hoe Bitcoin rn .. I see past it tho",32606.42,"United States of America",210,721,"False","False","2019-10-23 00:19:11","True","False",721,0.25,-0.25
1108,"07/08/2021",1413102087034920960," $3,499Premium Domainname ForSale  CryptoFinance cryptotrading be Germany Cryptoart bitcoin crypto AI DeFi NFT BigData 5G AR Robotics ML BTC IoT futureofwork fintech Blockchain LIVE Berlin Germany Binance Domains ",32606.42,"Global ",646,4994,"False","False","2020-11-23 13:58:03","True","False",4994,0.5,0.136363636363636
1131,"07/08/2021",1413102044987146240,"As a cryptocurrency and Bitcoin trader I see ~9%  as a rookie numberAPESNOTLEAVING - true apes are in crypto and HODL  ",32606.42,"World",4090,274,"False","False","2017-08-30 22:39:20","False","False",274,0.65,0.35
1136,"07/08/2021",1413102034396581888,"Iconic Funds Physical bitcoin ETP Listing in Paris and Amsterdam on Euronext  ",32606.42,"Matter Doesn't Matter",59272,13903,"False","False","2014-01-07 23:52:46","False","False",13903,0.321428571428571,0.25
1138,"07/08/2021",1413102033444474880,"Baru racun my Rohingya neighbor to use Bitcoin to transfer money with his siblings in other countries ",32606.42,"",1496,713,"False","False","2020-12-21 16:34:25","True","False",713,0.375,-0.125
1150,"07/08/2021",1413101999273488384,"bitcoin is free now, please pay attention guys for BINANCE:BTCUSD by pirahi2   ",32606.42,"Matter Doesn't Matter",59272,13903,"False","False","2014-01-07 23:52:46","False","False",13903,0.8,0.4
1164,"07/08/2021",1413101966461386752," another incredible show with  . Had no idea PoS already failed in the 90’s ..I’m wanting to dive deeper on historical context to help a better understand strength of PoW. any credible sources you are aware of I can research about the topic? bitcoin",32606.42,"Arlington, VA",126,425,"False","False","2013-09-26 20:42:32","False","False",425,0.441666666666667,0.258333333333333
1174,"07/08/2021",1413101951143735296," Good news! Kusama-based parachain  has benn listed on Genshiro trading on KuCoin, DoDoex and BKEX! More chances to secure Kusama parachain now. Polkadot defi blockchain",32606.42,"Lunacian",4922,4358,"False","False","2012-07-26 11:01:45","False","False",4358,0.566666666666667,0.633333333333333
1192,"07/08/2021",1413101921087361024," I'd say KLV is the next bitcoin. No better timing to buy now or regret later. Klever",32606.42,"Philippines",1243,704,"False","False","2016-10-12 01:45:47","True","False",704,0.166666666666667,-0.0833333333333333
1200,"07/08/2021",1413101908231917568,"New post (Bitcoin price will likely shrug off $530M GBTC unlock in July — analysis) has been published on CRYPTO INFO SITE -  ",32606.42,"",641,1955,"False","False","2011-06-14 04:13:37","True","False",1955,0.727272727272727,0.0681818181818182
1201,"07/08/2021",1413101906076094464,"Will people have to have more technical skills for Blockchain and Bitcoin to flourish? ",32606.42,"United States of America",91833,476,"False","False","2013-06-02 23:14:27","False","False",476,0.3,0.25
1218,"07/08/2021",1413101867962359808," The best part of this whole thing is Bitcoin maxi’s say f the banks and use Bitcoin...if Bitcoin never became a functional asset would this even be an interview? I blame Bitcoin...but who created it again....right",32606.42,"Bilderburg,earth",569,442,"False","False","2018-11-16 21:03:10","True","False",442,0.35,0.6
1222,"07/08/2021",1413101855891152896,"Where do these ppl get their analysis from? Total FAKE NEWS!fakenews btc bitcoineth ethereum Ethereum could overtake Bitcoin as a dominant store of value, Goldman Sach says - ",32606.42,"United Kingdom",43,262,"False","False","2020-04-02 13:48:46","True","False",262,0.875,-0.25
1224,"07/08/2021",1413101853924118528,"linkedin twitter facebook instagram tiktok socialmedia tumblr dogecoin deal shoppingstaronline gift gifts giftideas shop shopping affiliatemarketing bitcoin popcorn Enjoy $10 off Orders of $50+ - Use code IR10 - ",32606.42,"United States of America",67461,6353,"False","False","2012-06-25 04:38:20","False","False",6353,0.5,0.4
1229,"07/08/2021",1413101849155014656,"bid4bit 4 blockchain cryptocurrency bitcoin crypto Binance Tron cryptocurrencies This Project will put a lot of people on the right track and towards success in investing in particular and in the financial sector",32606.42,"WORLD WIDE",19103,7554,"False","False","2014-02-07 07:36:21","False","False",7554,0.217261904761905,0.188095238095238
1239,"07/08/2021",1413101817022631936,"Bitcoin  Price: $32,579.80Areas of SupportMUST Hold Above: $28,996.02TrendsNear: Short: Medium: Long: Macro: Levels of interestShort: $28,467.82Med: $43,829.46Long: $97,695.68",32606.42,"cryptosbulls.com",4547,1045,"False","False","2019-12-22 05:35:01","True","False",1045,0.266666666666667,-0.0166666666666667
1242,"07/08/2021",1413101809682444288,"Altcoin prices are rising, much like Bitcoin, which shows that the fall may be ending.Cryptonews",32606.42,"British Virgin Islands",5642,337,"False","False","2018-09-18 13:21:22","True","False",337,0.2,0.2
1247,"07/08/2021",1413101804175380480," Follow me on . Let's hunt for Bitcoins together! Get an exciting experience on 1 I-Gaming platform with BTC staking payouts!.My Username: Cross betfurysuccess bitcoin staking",32606.42,"",152,1355,"False","False","2018-01-01 02:29:21","True","False",1355,0.4,0.15
1249,"07/08/2021",1413101803391045632," Zenapay offers its users a secure and simple Bitcoin Wallet that allows users to buy different products  ",32606.42,"",1020,1159,"False","False","2009-06-21 14:09:42","True","False",1159,0.389285714285714,0.125
1257,"07/08/2021",1413101784453636096,"CryptoKnowledge What is Deflation?Deflation is when consumer and asset prices decrease over time, and purchasing power increases. Essentially, you can buy more goods or services tomorrow with the same amount of money. Bitcoin is a Deflationary Asset! ",32606.42,"India",322,1294,"False","False","2009-03-28 16:38:39","False","False",1294,0.308333333333333,0.166666666666667
1294,"07/08/2021",1413101679197753344," This review is definitely not investment advice. Yooshi Token you are amazing we will fly with you when the market gets better YOOSHI YooshiArmy YooShifamily yooshiTotheMoon SHIBARMY SHIB Bitcoin ElonMusk XRP CHZ",32606.42,"İstanbul, Türkiye",961,810,"False","False","2018-08-22 15:08:12","True","False",810,0.7,0.475
1307,"07/08/2021",1413101647212032000," Zenapay offers its users a secure and simple Bitcoin Wallet that allows users to buy different products  ",32606.42,"",1020,1159,"False","False","2009-06-21 14:09:42","True","False",1159,0.389285714285714,0.125
1316,"07/08/2021",1413101628538990592,"This week's reading centered around Bitcoin Economics.  For this week's research paper, search the Internet and explain why some organizations are accepting and other organizations are rejecting the use of Bitcoins as a standard form of currency.  ",32606.42,"",64,788,"False","False","2020-08-30 07:25:04","True","False",788,0.1875,-0.0625
1323,"07/08/2021",1413101612604743680,"CTSI Analysis &amp; Price Prediction CTSI  via  Please look for more Videos at my Youtube channel Bitcoin BTC Ripple XRP Stellar XLM VeChain VET Chainlink LINK ZIL Dogecoin ",32606.42,"",1280,4991,"False","False","2020-06-05 03:32:47","True","False",4991,0.375,0.375
1325,"07/08/2021",1413101610524233728,"It's very rare that things work out so perfectly in life.",32606.42,"United States of America",43310,1786,"False","False","2009-01-11 18:01:37","False","False",1786,1,0.695
1349,"07/08/2021",1413101565708324864,"Chinese Crypto Ban Could Be Long-Term Good For Bitcointech news ",32606.42,"This Parallel Universe",6552,392,"False","False","2015-11-24 14:36:12","False","False",392,0.3,0.35
1357,"07/08/2021",1413101550965243904,"Mechanicville hydro plant gets new life; Some of the energy is now mining bitcoin.  ""We can actually make more money with bitcoin than selling the electricity to National Grid,"" said Jim Besha Sr., CEO of Albany Engineering Corp. ",32606.42,"Cyberspace",11453,406,"False","False","2009-04-14 14:54:04","False","False",406,0.351515151515152,0.212121212121212
1368,"07/08/2021",1413101531742752768,"  So why not Eth or any other crypto  everyone saying only Bitcoin but sounds like the Federal Reserve 2.0 ",32606.42,"United States of America",85,213,"False","False","2013-06-11 00:51:46","True","False",213,0.6875,-0.0625
1369,"07/08/2021",1413101531411402752,"Check out ’s Poll Whether The Apartment Rental Industry Should Accept Crypto Currency as Payment! Amazing Results vs. Where We Had Believed CryptoCurrency  Had Become More Mainstream (w/  Accepting BitCoin. Another Poll Coming Soon &amp; Thank YOU for Voting! ",32606.42,"Canada",77014,43918,"True","True","2009-10-23 19:32:40","False","False",43918,0.7,0.6125
1370,"07/08/2021",1413101531369549824,"Looks like Bitcoin has proven to be a very liquid asset in 2021",32606.42,"United Kingdom",677,254,"False","False","2019-02-17 07:45:21","True","False",254,0.3,0.2
1374,"07/08/2021",1413101525438713856,"Truth be told, we cannot expect the market to continue its uptrend if it is not led by BITCOIN first. And it doesn't…bitcoin cryptocurrency  bitcoin hive",32606.42,"",118,185,"False","False","2020-01-11 10:29:13","True","False",185,0.333333333333333,0.25
1383,"07/08/2021",1413101505918509056,"  That was early! It was cheap then. I remember back around the same time reading this (&amp; thinking I wasn't ready just yet)... ""There is currently about USD 50 million in the bitcoin system, and just over six million coins in circulation, valued at $8 each.""",32606.42,"〇△□吾唯足知",8235,658,"False","False","2008-10-09 11:35:47","False","False",658,0.3375,0.120833333333333
1411,"07/08/2021",1413101440118181888,"  Long Bitcoin ",32606.42,"",45,214,"False","False","2012-03-12 17:26:28","True","False",214,0.4,-0.05
1415,"07/08/2021",1413101423869325312,"Take a look at this project, it has a magnificent and wonderful future! we look forward to the success of this project. presale blockchain cryptotrading investing cryptocurrency bitcoin trading altcoin cryptonews",32606.42,"Bangladesh",6547,7166,"False","False","2017-12-18 18:06:25","True","False",7166,0.53125,0.575
1416,"07/08/2021",1413101420597948416,"BitTorrent BTT BitTorrent BTT Analysis &amp; Price Prediction- BTT HOLDERS...  via  Please look for more Videos at my Youtube channel Bitcoin BTC Ripple XRP Stellar XLM VeChain VET Chainlink LINK ZIL Dogecoin ",32606.42,"",1280,4991,"False","False","2020-06-05 03:32:47","True","False",4991,0.375,0.375
1430,"07/08/2021",1413101397143298048," great project   0x71e93A52623503b7983e5554da94F962C0cF3592BSC BNB ETH BTC Bitcoin DeFi yieldfarming",32606.42,"",23,514,"False","False","2020-11-01 22:00:21","True","False",514,0.75,0.8
1432,"07/08/2021",1413101395293655040," Free Trading Signals (BETA)SYMBOL:  /  bitcoinDIRECTION: SELL @ 32614.97TIMEFRAME: 5 MINPLATFORM: ZentraderStrategy: Short term trend reversal. BETA testing. Read pinned tweet for full info!forexsignals zentrader ゼントレーダー ゼン・トレーダー",32606.42,"Singapore",328,107,"False","False","2020-01-08 22:21:32","True","False",107,0.6625,0.125
1458,"07/08/2021",1413101329598275584," World adoption of Bitcoin will show governments, that the printing of unbacked paper is not a solution. International trade requires that paper be backed by natural resources or an internationally accepted hard cap money such as Bitcoin",32606.42,"",16,117,"False","False","2018-10-21 12:23:19","True","False",117,0.288333333333333,-0.0383333333333333
1476,"07/08/2021",1413101299328069632," Zenapay offers its users a secure and simple Bitcoin Wallet that allows users to buy different products on   ",32606.42,"",1020,1159,"False","False","2009-06-21 14:09:42","True","False",1159,0.389285714285714,0.125
1479,"07/08/2021",1413101295486050304,"Chiliz CHZ Analysis &amp; Price Prediction THIS IS WHY Chiliz CHZ WILL HIT...  via  Please look for more Videos at my Youtube channel Bitcoin BTC Ripple XRP Stellar XLM VeChain VET Chainlink LINK ZIL Dogecoin ",32606.42,"",1280,4991,"False","False","2020-06-05 03:32:47","True","False",4991,0.375,0.375
1497,"07/08/2021",1413101256080601088,"True Lovenftcollector NFTCommunity NFTs NFTcollectibles NFTartwork art artwork opensea ETH Bitcoin",32606.42,"the World of NFT",576,1724,"False","False","2018-02-09 14:50:36","True","False",1724,0.65,0.35
1502,"07/08/2021",1413101245577846784," Bitcoin This is where you bounce you little shit.. BOUNCE ",32606.42,"ₑₓₚₑcₜ cₕₐₒₛ",1769,308,"False","False","2020-06-28 14:37:44","True","False",308,0.65,-0.19375
1509,"07/08/2021",1413101228205170688," Zenapay offers its users a secure and simple Bitcoin Wallet that allows users to buy different products on   ",32606.42,"",1020,1159,"False","False","2009-06-21 14:09:42","True","False",1159,0.389285714285714,0.125
1553,"07/08/2021",1413101150879076352,"Top story: Crypto Price Warning: Goldman Sachs Issues Surprise Future Of Bitcoin And Ethereum Prediction  see more ",32606.42,"The Netherlands",259,583,"False","False","2019-12-28 14:20:21","False","False",583,0.375,0.333333333333333
1556,"07/08/2021",1413101146554748928,"Active Bitcoin miners now ‘unlikely’ sellers thanks to profit boost — data  ethereum bitcoin cryptocurrencies cryptocurrency bitcoinmining",32606.42,"United Kingdom",172,244,"False","False","2011-04-21 10:42:29","True","False",244,0.433333333333333,-0.144444444444444
1567,"07/08/2021",1413101130792513536," That is true, and if Bitcoin crashes to 6500$ it would be an 90% collapse.",32606.42,"",22,154,"False","False","2012-12-09 17:27:13","False","False",154,0.65,0.35
1575,"07/08/2021",1413101122827526144,"linkedin twitter facebook instagram tiktok socialmedia tumblr dogecoin shoppingstaronline deal gift gifts giftideas shop shopping affiliatemarketing bitcoin popcorn Enjoy $10 off Orders of $50+ - Use code IR10 - ",32606.42,"United States of America",67461,6353,"False","False","2012-06-25 04:38:20","False","False",6353,0.5,0.4
1581,"07/08/2021",1413101112526262272," under the key $34k this morning, if it continues to sell the next important price is $29k In order for any “bullish” activity to continue, it must trade back over $34k and ultimately $43k bitcoin  ",32606.42,"",504,140,"False","True","2019-07-29 03:20:06","True","False",140,0.6,0.08
1592,"07/08/2021",1413101089998610432,"Conor says he was 'looking past' Poirier in Jan.   ️  Bitcoin Sportsbook ",32606.42,"",649,827,"False","False","2016-12-16 21:14:48","False","False",827,0.25,-0.25
