"X","Date","TweetID","Text","BTC.Price","User.Location","User.follower.count","UserFollowingCount","User.Verified","Quote.Status.","AccountCreationDate","Default.Profile.Theme.","DefaultProfileImage","TotalAccountLikes","Subjectivity","Polarity"
672,"07/30/2021",1421118036724142080," The sexual tension between them is unreal",38991.71,"United Kingdom",401,786,"False","False","2016-12-25 21:57:08","True","False",786,0.833333333333333,0.5
675,"07/30/2021",1421118022857625600,"$25B investment firm adds 'riskier' Grayscale GBTC and ETHE for clients  Bitcoin Ethereum GBTC Grayscale ",38991.71,"Gothem",2562,2556,"False","False","2011-04-27 06:25:55","False","False",2556,0.4,-0.2
679,"07/30/2021",1421118011360956416,"Bitcoin surprised bulls haven’t sent  moon shot yet",38991.71,"",287,232,"False","False","2020-10-01 23:16:46","True","False",232,0.9,0.1
689,"07/30/2021",1421117979664818176,"    I bought gold, silver, Bitcoin, real estate, commodities ... Even in its worst scenario, how does Bitcoin prevent me from getting rich?Yet if you're wrong...",38991.71,"United States of America",216,426,"False","False","2018-06-19 23:11:40","True","False",426,0.733333333333333,-0.433333333333333
708,"07/30/2021",1421117920881430528," Best project ever , I am very happy to be participating in this project.   CoinMarketCap Crypto Cryptocurrency Bitcoin Ethereum Dogecoin Altcoin DeFi SpaceY SPAY Airdrop",38991.71,"",4,262,"False","False","2020-05-20 07:56:43","True","False",262,0.65,1
725,"07/30/2021",1421117865990688768,"I have Fuck You money and can easily walk away from my job. No experimental vaccine for me. bitcoin ",38991.71," ₿itcoin Timechain",508,1008,"False","True","2020-07-06 22:09:51","True","False",1008,0.611111111111111,-0.00555555555555556
754,"07/30/2021",1421117800396083200,"  HEY MOTHERFUCKER! BITCOIN IS DIGITAL FUCKING REAL ESTATE! ",38991.71,"Higher than giraffe pussy",374,1033,"False","False","2020-11-06 21:51:01","True","False",1033,0.15,0.125
762,"07/30/2021",1421117782519947264,"Biden to Step Up Crypto Tax Enforcement to Help Fund $1 Trillion US Infrastructure PlanU.S. President Joe Biden and lawmakers have agreed on the details of a roughly $1 trillion bipartisan infrastructure package with measures to step up tax enforcement ",38991.71,"",1391,103,"False","False","2019-04-02 19:00:44","True","False",103,0.4,-0.1
775,"07/30/2021",1421117768196411392,"Wealthfront users will now be able to have up to 10% of their portfolios composed of the Grayscale Bitcoin and Ethereum Trusts.crypto $doge",38991.71,"United States of America",117,266,"False","False","2019-09-03 13:13:20","True","False",266,0.625,0.5
781,"07/30/2021",1421117751536537600,"  Bitcoin na. Wtf cares about naira. Naira isonu",38991.71,"Nigeria",2304,2406,"False","False","2019-10-27 12:34:54","True","False",2406,1,-0.5
783,"07/30/2021",1421117749078552576," Of course! If Bitcoin is valued at $40000, a better version of Bitcoin can’t be valued $4",38991.71,"",75,334,"False","False","2009-09-03 15:25:22","True","False",334,0.5,0.5
796,"07/30/2021",1421117721710714880," More Bitcoin",38991.71,"United Kingdom",31,324,"False","False","2020-08-28 16:38:04","True","False",324,0.5,0.5
799,"07/30/2021",1421117712626032640,"In a move that surprises no one, bitcoin is down a few % after 8 days straight green.Come back tomorrow, resume the green.",38991.71,"",128,315,"False","False","2020-02-13 20:37:07","True","False",315,0.217777777777778,-0.0711111111111111
837,"07/30/2021",1421117645944856576,"Bitcoin Ethereum GBTC Grayscale Wealthfront $25B investment firm adds 'riskier' Grayscale GBTC and ETHE for clients  ",38991.71,"Schiphol-Rijk, Haarlemmermeer",1794,157,"False","False","2016-09-27 15:32:02","False","False",157,0.4,-0.2
838,"07/30/2021",1421117645382766592,"MicroStrategy to Buy More Bitcoin Despite Q2 Impairment Loss  ",38991.71,"Gothem",2562,2556,"False","False","2011-04-27 06:25:55","False","False",2556,0.5,0.5
845,"07/30/2021",1421117633013899264,"  In binance and in cryptos case it would mean that if instead of bitcoin the exchange uses i.e. M-coin to actually make trades to swap assets they would cease that completely. If they don't have enough btc in their balance sheet to facilitate trades,trades comes to a complete halt",38991.71,"",55,211,"False","False","2014-03-06 05:32:01","False","False",211,0.4175,-0.0225
858,"07/30/2021",1421117598251438080,"Hey I joined a network called SurveyJ and earned $276 today! You get paid for testing out new free apps and posting on social media. Sign up with my link for an instant $40 signup bonus!  surveyj cashapp bitcoin",38991.71,"United States of America",522,635,"False","False","2012-08-12 00:24:52","False","False",635,0.496969696969697,0.142424242424242
861,"07/30/2021",1421117590882115584,"Bitcoin and Ethereum serve totally different purposes and will thrive together. Don’t be a Bitcoin maximalist who says only Bitcoin will win or an Ethereum maximalist who says Bitcoin is outdated and Ethereum is taking its place.",38991.71,"",248,503,"False","False","2020-05-17 16:32:40","True","False",503,0.658333333333333,0.1
875,"07/30/2021",1421117561396150272,"Why bitcoin, Dogecoin, and ethereum Investors Are Panicking Today  The Motley Fool cryptocurrency  ",38991.71,"Matter Doesn't Matter",59424,13896,"False","False","2014-01-07 23:52:46","False","False",13896,0.9,0.6
880,"07/30/2021",1421117553502531584,"  Like how the Protestant reformation moved the Renaissance &amp; development from the South to the North. Perhaps LatAm becomes a center for bitcoin in time.",38991.71,"United States of America",707,3497,"False","False","2010-07-01 06:43:27","True","False",3497,0.1,-0.1
882,"07/30/2021",1421117549249507328,"Good project, glad to find this project. KITE  Airdrop Binance Bitcoin BakerySwap BNB PanCakeSwap cryptocurrency NFT DeFi BTC BinanceSmartChain BSC"". ",38991.71,"",350,834,"False","True","2018-02-06 17:34:08","True","False",834,0.8,0.6
887,"07/30/2021",1421117537035694080,"  Isn't Bitcoin in the toilet?",38991.71,"United Kingdom",427,832,"False","False","2009-04-27 09:45:58","False","False",832,0,-0.0333333333333333
893,"07/30/2021",1421117519398641664,"Then there is DeFi....Crypto derivatives allow traders to place leveraged bets on whether bitcoin, dogecoin or other digital currencies will rise or fall. In the U.S., such products are regulated by the Commodity Futures Trading Commission.",38991.71,"United States of America",5983,663,"False","False","2016-05-18 16:03:45","False","False",663,0.291666666666667,-0.0416666666666667
894,"07/30/2021",1421117518589145088,"Michael Saylor: ""Bitcoin has done wonders for our brand. It's elevated are brand by a factor of 100...It's better than real real estate....You literally can take it w/you to the grave...It's enormously appealing to people that are looking for economic security right now."" (1/6) ",38991.71,"Cyberspace",12003,402,"False","False","2009-04-14 14:54:04","False","False",402,0.437142857142857,0.357142857142857
915,"07/30/2021",1421117468010029056,"Inside The Bitcoin Mine With Its Own Power Plant ",38991.71,"Worldwide",9457,593,"False","False","2011-11-25 07:17:06","False","False",593,1,0.6
917,"07/30/2021",1421117466709676032,"Buy Crypto With Your Credit Card / Fast Crypto Exchange  Bitcoin BTC ETH XRP Crypto 10:36 ",38991.71,"",10264,3327,"False","False","2013-12-05 23:34:07","True","False",3327,0.6,0.2
924,"07/30/2021",1421117444115124224,"linkedin twitter facebook instagram tiktok socialmedia wedding tumblr dogecoin deal gift gifts giftideas shop shopping affiliatemarketing bitcoin popcorn Enjoy $10 off Orders of $50+ - Use code IR10 - ",38991.71,"United States of America",67853,7040,"False","False","2012-06-25 04:38:20","False","False",7040,0.5,0.4
928,"07/30/2021",1421117442126974976,"The Best Bitcoin Casinos: Top Sites for Cryptocurrency Slots, Betting, and Live Dealer Games",38991.71,"United Kingdom",366,912,"False","False","2018-11-15 17:22:52","False","False",912,0.433333333333333,0.545454545454545
934,"07/30/2021",1421117432610148352," True but let’s not forget about privately held companies that own Bitcoin",38991.71,"United States of America",146,126,"False","False","2009-07-22 14:35:40","False","False",126,0.675,0.316666666666667
965,"07/30/2021",1421117315505135616," Probably means more people stay at home and use the money they would spend on going out and having to wear a mask to instead buy bitcoin",38991.71,"Minneapolis, MN",55,354,"False","False","2020-12-19 02:08:11","True","False",354,0.5,0.5
972,"07/30/2021",1421117300317556736,"He bought  in the single digits. ",38991.71,"The Swamp",10974,11974,"False","False","2019-01-03 23:21:43","True","False",11974,0.214285714285714,-0.0714285714285714
984,"07/30/2021",1421117266993745920," It needs some Bitcoin miners there LOL",38991.71,"",55,109,"False","False","2017-03-31 06:38:49","False","False",109,0.7,0.8
1000,"07/30/2021",1421117221426843648,"This is going to turn into FOMO Nation real soon ️Bitcoin Ethereum DeFi Crypto Cryptocurency",38991.71,"NOT FINANCIAL ADVISE",1100,444,"False","False","2017-12-01 17:28:39","False","False",444,0.3,0.2
1013,"07/30/2021",1421117202070179840,"Sad to see a pensioner scammed. But anyone reading this who is thinking about buying bitcoin or any other coin or token… never EVER part with your money if you CANNOT custody the bitcoin yourself. 'We lost our life savings in a cryptocurrency scam' ",38991.71,"Sovereign, Interweb",7018,2835,"False","False","2010-04-18 10:38:42","False","False",2835,0.6875,-0.3125
1017,"07/30/2021",1421117199729766400,"MicroStrategy reported a paper loss of roughly $700 million on its BTC investment in Q2 2021 but vowed to continue purchasing more coins.",38991.71,"",22941,5788,"False","False","2014-03-01 13:32:43","False","False",5788,0.45,0.2
1023,"07/30/2021",1421117185011900416,"I used to watch Bob’s videos in 2017 for a calm rational perspective, now this is where he’s at 4 years later.  stick to the Bitcoin cycles buddy. There’s more people voting in Catalyst on Cardano than who watched your last 2 yt videos. $ada ",38991.71,"United States of America",215,493,"False","True","2020-03-22 00:59:41","True","False",493,0.329166666666667,0.2
1032,"07/30/2021",1421117170944253952,"While the Lightning NetWork Solves two of Bitcoin""s Key issues of Slow Transaction Speeds and High fees, it does not deal with the most Crucial - distribution. does.flipcash  !!!lightningnetwork ",38991.71,"Global",77489,56146,"False","False","2015-05-02 16:54:25","False","False",56146,0.688,0.072
1037,"07/30/2021",1421117155551051776,"      Great projectCrypto Bitcoin Ethereum ETH Airdrop bounty BSC BNB MuskSwap MUSK",38991.71,"",162,1104,"False","False","2014-10-08 08:43:48","True","False",1104,0.75,0.8
1055,"07/30/2021",1421117124962095104,"I was so tired, now it's vacation time!Ethereum bitcoin dogecoin chainlink                       doge crypto tsla news btc  cardano ada ",38991.71,"京都",831,283,"False","False","2010-01-27 13:04:57","False","False",283,0.7,-0.4
1056,"07/30/2021",1421117124911697920,""" -  Recycle and earn crypto for a clean world One Earth One Family Get your spot in the recycling event and win $2750 in Register Link bellow: convertcarbon crb bitcoin ethereum crypto  blockchain ERC21"" ",38991.71,"România",123,806,"False","False","2017-02-15 21:46:40","False","False",806,0.55,0.583333333333333
1057,"07/30/2021",1421117124815249408,"Major Cryptocurrencies—Including Bitcoin, Ethereum, Dogecoin—Plummet As China Widens Crackdown. (Forbes) Crypto CryptoCurrency   ",38991.71,"Canada",62185,67724,"False","False","2008-06-24 17:20:55","True","False",67724,0.5,0.0625
1063,"07/30/2021",1421117108918751232,"Bitcoin blazed the trail, creating the first generation of crypto billionaires and blockchain entrepreneurs.Although this crypto craze brings great opportunity, it also brings a wealth of cryptocurrency scams.cryptocurrency Blockchain ",38991.71,"United States of America",13913,12161,"False","False","2011-07-13 14:57:22","True","False",12161,0.541666666666667,0.525
1067,"07/30/2021",1421117103516618752,"Great to see, despite all the recent FUD, global crypto users have doubled this year!Up to 221 million from 106 million.cryptocurrency bitcoin ",38991.71,"",250,282,"False","False","2012-02-14 22:29:56","True","False",282,0.333333333333333,0.266666666666667
1075,"07/30/2021",1421117087208988672," I got confused because bitcoin exits for transparent money transaction right, that is was be like What’s big deal in it",38991.71,"India",234,269,"False","False","2013-10-23 08:56:22","False","False",269,0.445238095238095,-0.0380952380952381
1078,"07/30/2021",1421117070339710976," So Grayscale made a huge profit off the premium, correct? Is there any reason why people invest in LTCN or GBTC instead of buying Litecoin/Bitcoin on an exchange? I know you're invested in GBTC yourself and was curious about that.",38991.71,"",48,182,"False","False","2020-09-08 14:24:45","True","False",182,0.95,0.15
1081,"07/30/2021",1421117060248051712,"1. Join a Reddit group 2. Post a Polygon address as a new OP in the Reddit group 3. Receive 0.01 ASTRAL 4. Bonus: Answer the questions and receive another 0.01 ASTRAL bitcoin  10107",38991.71,"",466,1068,"False","False","2014-12-18 07:17:44","False","False",1068,0.454545454545455,0.136363636363636
1094,"07/30/2021",1421117022297935872," Almost all Bitcoin critics are from extremely privileged US centric backgrounds where the financial plumbing, institutions and currency works.Bitcoin works extremely well for people outside that narrow bubble, but the former struggle to appreciate that.",38991.71,"United States of America",20340,924,"False","False","2018-01-12 20:54:28","False","False",924,0.364285714285714,-0.0642857142857143
1103,"07/30/2021",1421116999720050688,"The case for Bitcoin jumping by $500,000. Kiril Sokoloff interviews Cathie Wood as she describes a provocative case for BTC to replace bonds in a 60/40 portfolio. Available for Advantage Ultra members. Join us for only $9.99+tax/mth cancel anytime.  ",38991.71,"Canada",807,162,"False","False","2011-08-18 00:46:57","False","False",162,0.7,0.2
1105,"07/30/2021",1421116993126666240,"Warshall Wace, a 55 billion hedge fund is planning it's first investment into cryptocurrency. This is alongside Rothschild investment corps interest in bitcoin. Institution players continue to get involved in the sector.",38991.71,"United States of America",11996,107,"False","False","2014-11-08 22:35:07","False","False",107,0.333333333333333,0.25
1107,"07/30/2021",1421116991537045504,"  I would like to see Bitcoin go to the moon, but also want to be real, I know the markets are manipulated. If I have to wait and trade with Robin Moore's trading signals to make more profits so let it be.",38991.71,"Trivandrum",31,152,"False","False","2010-12-29 08:00:33","False","False",152,0.4,0.35
1160,"07/30/2021",1421116883382771712,"This is an underrated announcement.  is a beast of a company with immense influence on personal finance for young professionals. I'm assuming this is just the beginning of their Bitcoin ambitions. Plus  is a legendary operator and fellow  alum  ",38991.71,"United States of America",2710,1397,"False","True","2009-05-30 02:24:15","True","False",1397,0.675,0.275
1163,"07/30/2021",1421116873966555136,"I know my friend  likes these bitcoin miner comparisons. For all the fear recently there is one clear Olympic gold medal winner  ARB       ",38991.71,"United Kingdom",636,1114,"False","False","2014-03-18 11:03:31","False","False",1114,0.316666666666667,0.05
1164,"07/30/2021",1421116871684808704,"But it's not all. Other interesting things you can find here ",38991.71,"Estonia",48590,240,"False","False","2014-04-12 21:34:03","False","False",240,0.4375,0.1875
1183,"07/30/2021",1421116833642450944,"  Made a WSB crypto video for the culturePart 1.Part 2 below :) Bitcoin ",38991.71,"Butt, Hole",366,1104,"False","False","2017-09-10 03:27:13","False","False",1104,1,0.5
1200,"07/30/2021",1421116781591212032," Not sure if the card is quite right for Bitcoin but it fits the general mood ",38991.71,"",214,286,"False","False","2019-11-07 13:10:18","True","False",286,0.641534391534392,0.0285714285714286
1206,"07/30/2021",1421116764935577600,"  You mean 20% of it being interest payment, right?",38991.71,"",2411,1928,"False","False","2020-03-27 13:50:25","True","False",1928,0.611607142857143,-0.0133928571428572
1226,"07/30/2021",1421116710531256320,"Lucky One on bitcoin blockchain 'sSomeone put an empty block ...And get the reward for it !Block height : 693406[ See more on  ] ",38991.71,"56",43,219,"False","False","2011-06-12 08:11:41","True","False",219,0.611111111111111,0.236111111111111
1249,"07/30/2021",1421116675013885952,"Crypto Mining Firm Core Scientific Set for ""Public Debut"" | Live Bitcoin News  via  techiestuff seo tech",38991.71,"",197,555,"False","False","2019-01-08 07:27:23","True","False",555,0.322222222222222,-0.0212121212121212
1252,"07/30/2021",1421116668747657216,"linkedin twitter facebook instagram tiktok wedding socialmedia tumblr dogecoin deal gift gifts giftideas shop shopping affiliatemarketing bitcoin popcorn Enjoy $10 off Orders of $50+ - Use code IR10 - ",38991.71,"United States of America",67853,7040,"False","False","2012-06-25 04:38:20","False","False",7040,0.5,0.4
1259,"07/30/2021",1421116657825615872,"mask and vaccine debates really divide us in ways we never thought possible, times are crazy rn. the gov is trying to use money to warp our minds, buy bitcoin",38991.71,"Underwater",3541,644,"False","False","2017-03-04 20:11:02","False","False",644,0.7,-0.133333333333333
1278,"07/30/2021",1421116611449266176,"Bitcoin [BTC] sees resurgence in active entities as price flirts with $40K -  ",38991.71,"",4084,621,"False","False","2016-11-30 18:19:59","True","False",621,0.6,-0.133333333333333
1289,"07/30/2021",1421116581866782720,"limitededition digitalart analogart digitalartist analogartist nfts nftart nft cryptoart opensea nftcommunity bitcoin contemporaryart All works are also available as classic analog print. Check out this account on OpenSea  via ",38991.71,"",39,273,"False","False","2015-08-04 09:46:29","True","False",273,0.283333333333333,0.283333333333333
1297,"07/30/2021",1421116553244839936,"Get 250 INDCoins. Use these INDCoins to buy Bitcoin, Ethereum, and other top cryptocurrencies on INDmoney App for FREE. Tap on the following link to claim shivam004 indcoin indmoney",38991.71,"Bhopal, Madhya Pradesh",53,285,"False","False","2017-12-21 06:49:07","True","False",285,0.44375,0.19375
1302,"07/30/2021",1421116540125171712,"The movement of Bitcoin price: Up as a rocket. Down as a rock from sky. Stile as death water. feeling the vibration of  , you never loss money. ""DO NOT trust me, trust your feeling. Do not read news about Bitcoin, most of them are fool people.""",38991.71,"Canada",196,738,"False","False","2020-10-21 22:50:39","True","False",738,0.394444444444444,0.172222222222222
1307,"07/30/2021",1421116524983504896," knownews AMBCrypto bitcoin bnb CryptoCurrency ethereum xrp Ethereum Classic: Is there a shorting  ",38991.71,"Here and Now",10397,697,"False","False","2011-04-21 13:16:01","True","False",697,0.166666666666667,0.166666666666667
1312,"07/30/2021",1421116509569617920,"Put this date in your diary Its finally hereN3 mainnet the new version of eo will be going live on August 2ndWell done to everyone at   &amp; many others involved for all their hard work and commitment  BITCOIN     ",38991.71,"United Kingdom",849,810,"False","True","2013-06-09 10:26:55","False","False",810,0.599242424242424,0.0962121212121212
1315,"07/30/2021",1421116500342190080,"  Lol Bitcoin maxi  donut even own a single sat, just like that much smarter person in the clip you judge superficially… absolutely clueless, good day and mey you vaccinate your self 5 times a year like a good pharma corporate and government dog ",38991.71,"",56,321,"False","False","2011-09-22 21:57:56","False","False",321,0.526785714285714,0.391071428571429
1316,"07/30/2021",1421116498878291968,"I hope that amc squeezes before btc hits a new ATH, would be great if I could own a full bitcoin before",38991.71,"India",68,247,"False","False","2020-04-10 17:00:40","True","False",247,0.688636363636364,0.471590909090909
1324,"07/30/2021",1421116464959008768,"145 votes!! Wow! Thanks guys for participating. Look out for these polls every Sunday. For those that didn't get in early, don't worry. We could still be in the early days assuming Bitcoin hits $100K one day . So keep buying and HODL! ",38991.71,"Global",4495,879,"False","False","2016-05-26 20:00:49","False","False",879,0.45,0.1375
1337,"07/30/2021",1421116437289127936,"BTCUSD - New Technical Analysis   Bitcoin CryptoCurrency Trading TechnicalAnalysis ",38991.71,"https://discord.gg/5sZ4vTWZnk",750,101,"False","False","2020-09-03 16:11:57","True","False",101,0.277272727272727,0.0681818181818182
1338,"07/30/2021",1421116432398622720," Bitcoin, Litecoin, Dash and also Dogecoin will do fine in the long run",38991.71,"Ciudad de Mexico",1945,2387,"False","False","2011-03-13 23:10:12","True","False",2387,0.45,0.183333333333333
1345,"07/30/2021",1421116404527370240," Thinking like this, what do you do with all the money  bitcoin is gonna make you? Wear crap clothes that cover your body, get a cheap car that takes you from a to b. A small Cozy apartment, the list is endless",38991.71,"ji aapse matlab? ",122,403,"False","False","2009-12-19 10:00:00","False","False",403,0.68,-0.195
1346,"07/30/2021",1421116404271616000,"Hey! Want to get the best rewards card in Canada? Sign up for Mogo to get 2% bitcoin cashback &amp; help the Amazon Rainforest with the MogoCard. Use my link when you sign up! P.S. It’s free.",38991.71,"Canada",206,887,"False","False","2012-11-20 21:09:11","True","False",887,0.55,0.7
1350,"07/30/2021",1421116393865588736," Exactly! That’s why I’m bullish on Bitcoin!",38991.71,"United States of America",3925,1491,"False","False","2012-07-28 00:42:23","False","False",1491,0.25,0.390625
1354,"07/30/2021",1421116380863102976,"Plastic Finance aims to be a Dapps, internal exchanger, DeFi and recycle plastic grinds index all together. Plastic finance ESG Compliant plasticfinance bitcoin ico investment pollution waste plasticwaste environment",38991.71,"Indonesia",3063,3018,"False","False","2018-11-26 13:45:13","True","False",3018,0,-0.1
1356,"07/30/2021",1421116376891092992," Not only is ano feeless and instant, the network, at full scale (7000 TPS), runs on the power of a single wind turbine on layer 1! This is solution to the first layer scaling problems of Bitcoin ",38991.71,"",495,1841,"False","False","2014-12-07 11:51:43","False","False",1841,0.552857142857143,0.102142857142857
1358,"07/30/2021",1421116376249507840,"Bitcoin haters love to pretend in their minds that there's not an overarching bull market going on with Bitcoin. They zoom in on recent drops, as though that tells the whole story.",38991.71,"",91690,1709,"False","False","2010-12-25 20:52:10","False","False",1709,0.416666666666667,0.233333333333333
1373,"07/30/2021",1421116339897335808,"   Great projectCrypto Bitcoin Ethereum ETH Airdrop bounty BSC BNB MuskSwap MUSK",38991.71,"",273,877,"False","False","2020-06-13 08:23:03","True","False",877,0.75,0.8
1395,"07/30/2021",1421116292178890752,"Reminder: YOU DON'T HAVE TO BUY A HOLE BITCOIN(BETER TO DO SO). YOU CAN BUY !! INVEST HOW MUCH YOU CANYOU CAN BETER HAVE SOME IN CASE IT CATCHES once said a wise man ",38991.71," the moon",1372,1594,"False","True","2020-04-09 12:22:41","True","False",1594,0.55,0.45
1411,"07/30/2021",1421116236591681536," Any PoW with no premined coins are suitable in the long run. Bitcoin has the biggest free marketing",38991.71,"Ciudad de Mexico",1945,2387,"False","False","2011-03-13 23:10:12","True","False",2387,0.65,0.3
1424,"07/30/2021",1421116216593174528,"Gold mining risks: possible death. Bitcoin mining risks: spilling your coffee on the table. Bitcoin    is not digital gold, it’s better than gold! Makanya gw saat ini share link2 free sklgs bisa depo (buat yg ada duit). ",38991.71,"Indonesia",902,5005,"False","False","2012-09-14 17:53:14","False","False",5005,0.575,0.25625
1437,"07/30/2021",1421116197156835328,"  We don't  buy bitcoinWe earn bitcoin From Mining I'm ready to show 10 lucky people on how to earn 1BTC ($39,727) and more daily!No referral No withdrawal feesIf interested, kindly send a DM",38991.71,"",209,130,"False","False","2019-07-15 20:10:43","True","False",130,0.646666666666667,0.376666666666667
1446,"07/30/2021",1421116179309948928," Impresive and great  I trust this project can be successfullycryptocurrency Crypto Bitcoin Ethereum ETH Airdrop bounty BSC BNB NutPie NUT",38991.71,"Indonesia",34,567,"False","False","2020-11-07 18:47:50","True","False",567,0.75,0.8
1451,"07/30/2021",1421116168417447936,"Unpopular take: I’m glad bitcoin is taking a breather",38991.71,"United States of America",202,221,"False","False","2018-01-08 03:01:09","True","False",221,1,0.5
1454,"07/30/2021",1421116163736678400,"Good to see  moving up today while bitcoin corrects a bit",38991.71,"Alemania",83,206,"False","False","2019-08-24 20:23:19","True","False",206,0.6,0.7
1455,"07/30/2021",1421116160578244608,"Damn bitcoin gonna rocket the more shorts we get ",38991.71,"Canada",1676,1020,"False","True","2017-10-23 04:15:39","True","False",1020,0.5,0.5
1465,"07/30/2021",1421116143343964160,"More Bitcoin ",38991.71,"Argentina",90,765,"False","True","2020-05-29 13:28:41","True","False",765,0.5,0.5
