"X","Date","TweetID","Text","BTC.Price","User.Location","User.follower.count","UserFollowingCount","User.Verified","Quote.Status.","AccountCreationDate","Default.Profile.Theme.","DefaultProfileImage","TotalAccountLikes","Subjectivity","Polarity"
1439,"06/30/2021",1410213928135802880,"   For all those who are new to this working from home Bitcoin trading options Here's a little tip:Get a trusted Bitcoin expert and stick to him  Invest and play at similar times each day.Because :In times of chaos, your investment is your anchor to success️",34724.33,"South Africa",1883,1455,"False","False","2019-02-12 11:46:13","True","False",1455,0.451515151515151,-0.0170454545454545
1455,"06/30/2021",1410213889032306688,"R. v. Huynh, 2021 ONSC 4438 (CanLII) — 2021-06-21 “The Crown pointed out the bitcoin dealing business is a dangerous way to earn an insubstantial amount of money.” ",34724.33,"Canada",3970,892,"False","False","2009-10-31 00:27:33","False","False",892,0.9,-0.6
1457,"06/30/2021",1410213879985197056,"  The main thing they are resetting is our money.Get Bitcoin and stay well clear of everything else.If you dont understand Bitcoin make time for it. Bitcoin is Money - based on the Internet not on rougue Governments. Praying is good too :-)",34724.33,"United States of America",97,274,"False","False","2020-07-04 10:29:42","True","False",274,0.579166666666667,0.366666666666667
1478,"06/30/2021",1410213854324346880," For all those who are new to this working from home Bitcoin trading options Here's a little tip:Get a trusted Bitcoin expert and stick to him  Invest and play at similar times each day.Because :In times of chaos, your investment is your anchor to success️",34724.33,"South Africa",1883,1455,"False","False","2019-02-12 11:46:13","True","False",1455,0.451515151515151,-0.0170454545454545
1480,"06/30/2021",1410213851656867840," - Wyckoff update. A new month in 12 hours! July may see Bitcoin testing the AR level (green line) and moving into the D Zone of the Wyckoff accumulation. ",34724.33,"Kuwait الكويت ",1427,3580,"False","False","2020-04-13 14:12:34","True","False",3580,0.377272727272727,-0.0147727272727273
1490,"06/30/2021",1410213838025285632," For all those who are new to this working from home Bitcoin trading options Here's a little tip:Get a trusted Bitcoin expert and stick to him  Invest and play at similar times each day.Because :In times of chaos, your investment is your anchor to success️",34724.33,"South Africa",1883,1455,"False","False","2019-02-12 11:46:13","True","False",1455,0.451515151515151,-0.0170454545454545
1493,"06/30/2021",1410213831201067008,"Bitcoin forecast: Prices move to continue to rise higher. Trade with to      see the development of Bitcoin and grab more value ",34724.33,"Indonesia",2036,3715,"False","False","2010-06-11 18:22:51","False","False",3715,0.5,0.375
1495,"06/30/2021",1410213827463892992,"   When have people not been able to use their bank accounts to buy Bitcoin",34724.33,"",338,580,"False","False","2020-10-02 02:10:39","True","False",580,0.625,0.5
1500,"06/30/2021",1410213820174307328," For all those who are new to this working from home Bitcoin trading options Here's a little tip:Get a trusted Bitcoin expert and stick to him  Invest and play at similar times each day.Because :In times of chaos, your investment is your anchor to success️",34724.33,"South Africa",1883,1455,"False","False","2019-02-12 11:46:13","True","False",1455,0.451515151515151,-0.0170454545454545
1503,"06/30/2021",1410213816152080384,"   There was no timeline or expectations in the Bitcoin white paper for when it would achieve these goals...in fact, there were no goals or expectations on future adoption in the whitepaper...these are all arbitrary constructs that you and critics are placing on Bitcoin.",34724.33,"",32,473,"False","False","2018-04-07 02:31:19","True","False",473,0.241666666666667,-0.0333333333333333
1504,"06/30/2021",1410213812385501184,"Bitcoin Price Prediction – Failure to Revisit $35,500 Levels Would Bring Support Levels into Play bitcoin bitcoinprice bitcoinpriceprediction btc btcusd $btc crypto trading",34724.33,"Tel Aviv",7029,1918,"False","False","2011-07-20 10:59:20","False","False",1918,0.3,-0.316666666666667
1511,"06/30/2021",1410213801350385664,"It just feels right Bitcoin ",34724.33,"United States of America",9178,2501,"False","False","2011-02-08 02:55:04","True","False",2501,0.535714285714286,0.285714285714286
1518,"06/30/2021",1410213782169718784," For all those who are new to this working from home Bitcoin trading options Here's a little tip:Get a trusted Bitcoin expert and stick to him  Invest and play at similar times each day.Because :In times of chaos, your investment is your anchor to success️",34724.33,"South Africa",1883,1455,"False","False","2019-02-12 11:46:13","True","False",1455,0.451515151515151,-0.0170454545454545
1521,"06/30/2021",1410213779661598720,"Binance bitcoin exchange untouched by UK regulator ‘action’  TheLegalHour cryptotwitter",34724.33,"",1027,406,"False","False","2009-11-13 18:15:52","False","False",406,0.1,0.1
1532,"06/30/2021",1410213753837309952," For all those who are new to this working from home Bitcoin trading options Here's a little tip:Get a trusted Bitcoin expert and stick to him  Invest and play at similar times each day.Because :In times of chaos, your investment is your anchor to success️",34724.33,"South Africa",1883,1455,"False","False","2019-02-12 11:46:13","True","False",1455,0.451515151515151,-0.0170454545454545
1549,"06/30/2021",1410213735944310784,"Impressive Bitcoin Buy Signal (28,000 bought)  via ",34724.33,"Canada",418,3825,"False","False","2009-06-23 02:00:02","True","False",3825,1,1
1561,"06/30/2021",1410213719255179264," Hmm that’s good news.. that’s why bitcoin down.. need another country blocking Binance or something like that to make it go higher ",34724.33,"Canada",116,1093,"False","False","2015-04-22 20:22:01","True","False",1093,0.462962962962963,0.264814814814815
1572,"06/30/2021",1410213700225622016," For all those who are new to this working from home Bitcoin trading options Here's a little tip:Get a trusted Bitcoin expert and stick to him  Invest and play at similar times each day.Because :In times of chaos, your investment is your anchor to success️",34724.33,"South Africa",1883,1455,"False","False","2019-02-12 11:46:13","True","False",1455,0.451515151515151,-0.0170454545454545
1575,"06/30/2021",1410213695486058496," Good project guys    ortcoin ort okratech bitcoin airdrop freelancer crypto",34724.33,"",14,590,"False","False","2011-02-04 06:18:36","True","False",590,0.6,0.7
1584,"06/30/2021",1410213680713814016,"  How is monero a shitcoin when it's taking over where Bitcoin got started cause BTC lacks some certain cash-like properties (untraceability):Please, I'd like to hear, why is monero a shitcoin?",34724.33,"",387,476,"False","False","2012-11-16 21:10:38","True","False",476,0.571428571428571,0.214285714285714
1598,"06/30/2021",1410213658404306944," For all those who are new to this working from home Bitcoin trading options Here's a little tip:Get a trusted Bitcoin expert and stick to him  Invest and play at similar times each day.Because :In times of chaos, your investment is your anchor to success️",34724.33,"South Africa",1883,1455,"False","False","2019-02-12 11:46:13","True","False",1455,0.451515151515151,-0.0170454545454545
1599,"06/30/2021",1410213657846427648,"Bitcoin fails to hold $36,000, continues to trade in range  Good source of Financialnews Investing realestatenotes ",34724.33,"Illinois",772,798,"False","False","2012-06-07 13:18:29","True","False",798,0.45,0.1
1601,"06/30/2021",1410213654499368960,"   Bitcoin doesnt use more electricity than it needs to secure the trillion or so investmentAs a percentage of mcap, the electricity spend is nothing.",34724.33,"United States of America",530,660,"False","False","2009-01-27 03:33:57","False","False",660,0.55,0.45
1623,"06/30/2021",1410213617295937536,"Congrats  holders we have bagged Central banks..Why SDX tweet about $qnt makes it 100% sure that QNT is definitely working with central banks ... Your answer is given in the tweet below..$btc $eth $link $xrp $zil eth Ethereum btc bitcoin ksm shibainu dogecoin ",34724.33,"United States of America",3899,214,"False","True","2017-11-23 18:20:24","True","False",214,0.472222222222222,0.125
1624,"06/30/2021",1410213615395823616," For all those who are new to this working from home Bitcoin trading options Here's a little tip:Get a trusted Bitcoin expert and stick to him  Invest and play at similar times each day.Because :In times of chaos, your investment is your anchor to success️",34724.33,"South Africa",1883,1455,"False","False","2019-02-12 11:46:13","True","False",1455,0.451515151515151,-0.0170454545454545
1625,"06/30/2021",1.41021361501e+18," Going through my first active halving and watching the community come together on that day to discuss everything good with Bitcoin. Also, getting my CC up and running",34724.33,"",154,168,"False","False","2020-09-17 13:22:42","True","False",168,0.511111111111111,0.272222222222222
1633,"06/30/2021",1410213606071865344," Damn this sucks. Oh well, if I can't play games I guess I'll mine bitcoin.",34724.33,"",477,355,"False","False","2019-06-02 19:51:16","True","False",355,0.3,-0.3
1640,"06/30/2021",1410213595997159424,"New Bitcoin exposure Index to track equities that perform like BTC CryptoCurrency bitcoin ui via  ",34724.33,"India",108,203,"False","False","2020-12-14 09:25:12","True","False",203,0.454545454545455,0.136363636363636
1642,"06/30/2021",1410213593765777408," For all those who are new to this working from home Bitcoin trading options Here's a little tip:Get a trusted Bitcoin expert and stick to him  Invest and play at similar times each day.Because :In times of chaos, your investment is your anchor to success️",34724.33,"South Africa",1883,1455,"False","False","2019-02-12 11:46:13","True","False",1455,0.451515151515151,-0.0170454545454545
1652,"06/30/2021",1410213580981551104,"Exciting times aheadBitcoin  ",34724.33,"",30313,304,"False","True","2018-01-06 12:32:33","False","False",304,0.8,0.3
1683,"06/30/2021",1410213543178342400," Welcome back. You missed the launch of dual farming on  dex. Staking has started and you too can enjoy enticing APRs on the platform where users are earning brew and mocha seamlessly. bitcoin cafeswap bsc altcoin",34724.33,"I'm everywhere bitch!!!",4843,3751,"False","False","2012-10-12 03:47:25","True","False",3751,0.375,0.325
1731,"06/30/2021",1410213470667161600,"  I think there is some truth to zyphyr and pogo but then 'Tom' came in and told ppl to invest in bitcoin and move to South America because they would otherwise be kept alive for 1K years and tortured. Now, as 'Mike,' he says everyone is gong to hell via vaxxx shedders.",34724.33,"BabaKiueria",1519,991,"False","False","2019-05-14 12:22:05","False","False",991,0.4,0.1
1742,"06/30/2021",1410213453399212032,"bitcoin fails to hold $36,000, continues to trade in range By Investingcom  ",34724.33,"Matter Doesn't Matter",59129,13907,"False","False","2014-01-07 23:52:46","False","False",13907,0.3,-0.5
1753,"06/30/2021",1410213443731279872,"Slow, but not steady: India’s stance on Bitcoin and crypto is evolving  ",34724.33,"🇺🇸",27915,13364,"False","False","2008-08-25 03:17:30","False","False",13364,0.45,-0.191666666666667
1759,"06/30/2021",1410213434910777344,"This is how we bottom out, we dip back down but not as far. Could be a great day to buy bitcoin ethereum defipulseindex metaverseindex",34724.33,"",51,247,"False","False","2020-05-26 16:15:16","True","False",247,0.509722222222222,0.186111111111111
1767,"06/30/2021",1410213427134406656,"Bitcoin fails to hold $36,000, continues to trade in range ",34724.33,"",719,1179,"False","False","2013-06-24 02:52:53","True","False",1179,0.3,-0.5
1770,"06/30/2021",1410213423250427904," Somewhere on earth someone has compiled a list of all the painful lessons along the bitcoin journey and pretty much any expense outside of Bitcoin and land is on there. You name it: cars, weddings, homes, jewelry, stocks, bonds. bitcoin showed us 99% of assets are depreciating.",34724.33,"NorCal",334,825,"False","False","2009-03-06 20:15:20","True","False",825,0.5375,-0.0625
1784,"06/30/2021",1410213403956846592,"  For all those who are new to this working from home Bitcoin trading options Here's a little tip:Get a trusted Bitcoin expert and stick to him  Invest and play at similar times each day.Because :In times of chaos, your investment is your anchor to success️",34724.33,"South Africa",1883,1455,"False","False","2019-02-12 11:46:13","True","False",1455,0.451515151515151,-0.0170454545454545
1790,"06/30/2021",1410213397996748800,"Bitcion was built with hexadecimal line of code called nonce... For you to change or hack its block chain you have to start from the first transaction ever of bitcoin... The joke is on them ",34724.33,"Bitcoin",1343,121,"False","True","2018-11-03 17:07:55","True","False",121,0.333333333333333,0.25
1807,"06/30/2021",1410213377561989120," For all those who are new to this working from home Bitcoin trading options Here's a little tip:Get a trusted Bitcoin expert and stick to him  Invest and play at similar times each day.Because :In times of chaos, your investment is your anchor to success️",34724.33,"South Africa",1883,1455,"False","False","2019-02-12 11:46:13","True","False",1455,0.451515151515151,-0.0170454545454545
1810,"06/30/2021",1410213369878024192," Still sticking to bitcoin even if it was at 20k....its going to rocket soon, I really believe it. Too many countries, companies, and regulators starting to accept it.",34724.33,"#AshArmy",58,827,"False","False","2020-04-12 16:18:59","True","False",827,0.266666666666667,0.233333333333333
1817,"06/30/2021",1410213365771902976," For all those who are new to this working from home Bitcoin trading options Here's a little tip:Get a trusted Bitcoin expert and stick to him  Invest and play at similar times each day.Because :In times of chaos, your investment is your anchor to success️",34724.33,"South Africa",1883,1455,"False","False","2019-02-12 11:46:13","True","False",1455,0.451515151515151,-0.0170454545454545
1819,"06/30/2021",1410213363636838400,"Many countries worldwide have discussed banning cryptocurrencies; however, as cryptocurrencies are simply pieces of computer code, they can’t be banned. Follow us for more interesting facts about crypto and blockchain.blockchain cryptocurrency bitcoin crypto btc  eth ",34724.33,"",2804,130,"False","False","2017-12-14 07:34:07","False","False",130,0.464285714285714,0.375
1828,"06/30/2021",1410213355013513216,"  For all those who are new to this working from home Bitcoin trading options Here's a little tip:Get a trusted Bitcoin expert and stick to him  Invest and play at similar times each day.Because :In times of chaos, your investment is your anchor to success️",34724.33,"South Africa",1883,1455,"False","False","2019-02-12 11:46:13","True","False",1455,0.451515151515151,-0.0170454545454545
1838,"06/30/2021",1410213344661979136,"bitcoin is doing what it does best - maximum disappointment. LFG",34724.33,"",91160,625,"False","False","2017-02-02 19:30:54","False","False",625,0.35,0.2
1842,"06/30/2021",1410213341369225216,"What Crypto Investment is Best  PancakeSwap Bitcoin NFTs nft BTT  DOGE btc Ripple dogecoin Litecoin  bitcoin blockchain Token TRON safemoon  Crypto   XRP  cryptocurrency trx GBITS      … ",34724.33,"Off the 'chain",42598,40742,"False","False","2009-04-04 14:38:18","False","False",40742,0.3,1
1843,"06/30/2021",1410213340559908864,"    We don't buy bitcoin we earn bitcoin from  Mining I'm ready to show 10 lucky people on how to earn 0.1BTC (3,200)and more daily!No referral No withdrawal feesInterested people only Kindly send us aDM",34724.33,"United States of America",439,242,"False","False","2020-12-08 23:20:44","True","False",242,0.746666666666667,0.326666666666667
1848,"06/30/2021",1410213334742339584,"Slow, but not steady: India’s stance on Bitcoin and crypto is evolving  crypto",34724.33,"Los Altos",314,1127,"False","False","2020-08-25 01:07:08","True","False",1127,0.45,-0.191666666666667
1850,"06/30/2021",1410213333844770816,"linkedin twitter facebook instagram tiktok socialmedia tumblr dogecoin shoppingstar deal gift gifts giftideas shop shopping affiliatemarketing bitcoin popcorn Enjoy $10 off Orders of $50+ - Use code IR10 - ",34724.33,"United States of America",67400,6169,"False","False","2012-06-25 04:38:20","False","False",6169,0.5,0.4
1886,"06/30/2021",1410213294560874496,"First Bitcoin ETF in Latam Debuts on Brazil Stock Exchange  ",34724.33,"Venezuela",84,163,"False","False","2019-02-27 21:03:49","False","False",163,0.333333333333333,0.25
1887,"06/30/2021",1410213292123901952,"The biggest project with a strong team. I really loved to be a part of this great project. I'm sure this project will reach successful.Their community is getting bigger and bigger everyday. adonxEXCHANGER BITCOIN ",34724.33,"Indonesia",2032,2012,"False","False","2020-10-14 13:39:14","True","False",2012,0.681746031746032,0.319047619047619
1890,"06/30/2021",1410213285505294336," Recovering stage sound really great to me while  will be on their ATH soon.  goodnews bitcoin",34724.33,"",89,340,"False","False","2020-12-29 06:39:40","True","False",340,0.575,0.6
1895,"06/30/2021",1410213279134277632," The problem with measurement in economics is that there are no constants, but I think bitcoin's 21 million is the first constant in economics. You can measure against it because it is constant, like the meter or pound. Also, I've read a bit of Mises. ",34724.33,"",137059,465,"False","False","2008-12-30 04:21:14","True","False",465,0.333333333333333,0.0833333333333333
1897,"06/30/2021",1410213277540532224," Bitcion was built with hexadecimal line of code called nonce... For you to change or hack its block chain you have to start from the first transaction ever of bitcoin... The joke is on them",34724.33,"Bitcoin",1343,121,"False","False","2018-11-03 17:07:55","True","False",121,0.333333333333333,0.25
1916,"06/30/2021",1410213249593790464,"Think of Bitcoin as Mercedes Benz in 1886, Ethereum as Ford in 1903, and other coins as all the other manufacturers, hot(wheels) on their heels. $btc $eth $alts",34724.33,"",945,644,"False","False","2012-12-28 01:08:14","False","False",644,0.375,-0.125
1931,"06/30/2021",1410213229515743232,"   Bitcoin will always recover its been proven many times before",34724.33,"South Africa",628,1396,"False","False","2011-06-11 11:19:13","True","False",1396,0.5,0.5
1934,"06/30/2021",1410213224809582592,"Getart NFT Marketplace simplifying NFT trading at the lowest rate to encourage artists, creators and collectors, A multi platform for the whole community. Getart GAX BNB BSC Bitcoin",34724.33,"Indonesia",6154,6393,"False","False","2014-06-25 05:25:39","False","False",6393,0.4,0.2
1952,"06/30/2021",1410213189506187264,"   dont late bossAirdrops Sapa SapaArmy Bitcoin  BSC  BSCGem BNB ",34724.33,"Nigeria",1017,1495,"False","True","2017-08-28 12:31:03","True","False",1495,0.6,-0.3
1957,"06/30/2021",1410213181906046976,"  The fully decentralized Ravencoin that copied Bitcoin source code is not well known. It's not too late. Distributed, tokenized all assets in the world, POWER Ravencoin!",34724.33,"",166,1023,"False","False","2020-09-29 20:25:29","True","False",1023,0.6,-0.375
1986,"06/30/2021",1410213137916121088,"Bitcoin is above $50000, I rarely visit linkedin Bitcoin is below $35000, I am only found on linkedin",34724.33,"India",23507,489,"False","False","2015-02-03 19:44:46","True","False",489,0.666666666666667,0.1
1991,"06/30/2021",1410213130781741056,"  Bitcoin needs to be spent to be truly appreciated.",34724.33,"Worldwide",48230,3922,"False","False","2012-02-06 20:15:11","False","False",3922,0.1,0.05
1995,"06/30/2021",1410213127807934464," there she is welcome  Brazil  was thinking about you one or vet or “if it’s not bitcoin it’s a shit coin “",34724.33,"United States of America",3241,3522,"False","False","2009-02-12 07:27:02","False","False",3522,0.85,0.3
