"X","Date","TweetID","Text","BTC.Price","User.Location","User.follower.count","UserFollowingCount","User.Verified","Quote.Status.","AccountCreationDate","Default.Profile.Theme.","DefaultProfileImage","TotalAccountLikes","Subjectivity","Polarity"
1,"06/30/2021",1410216137464418304," Yes and interestingly,  says Bitcoins when he announces his Bitcoin purchases for MicroStrategy. I think I might go with Bitcoin, since  has been in the space for a longer time.",34724.33,"United States of America",10850,1181,"False","False","2019-09-22 02:54:58","True","False",1181,0.5,0.5
30,"06/30/2021",1410216092895748096,"  I dont think its too hard to figure out...bitcoin still a Pile of $shyte..plus lack of $theta $tfuel mainnet pump...$$ that came in hoping for a $theta mainnet pump giving up and dumping",34724.33,"",334,915,"False","False","2011-03-05 00:27:58","True","False",915,0.541666666666667,-0.291666666666667
36,"06/30/2021",1410216077754355712,"   Nah no extras... sorry boss.",34724.33,"",5447,2965,"False","False","2020-10-24 15:23:24","True","False",2965,1,-0.5
41,"06/30/2021",1410216071672512512,"Bitcoin is dead, Long live Bitcoin! ",34724.33,"International",16086,1634,"False","True","2010-04-15 15:46:39","False","False",1634,0.433333333333333,-0.0265151515151515
45,"06/30/2021",1410216067188899840," Bitcoin will always be crypto’s first and be valued as such. Now is the time to pass that crown to ETH. Because Ethereum has the power to take crypto all the way",34724.33,"United States of America",45,148,"False","False","2013-12-18 22:37:27","False","False",148,0.416666666666667,0.125
58,"06/30/2021",1410216048222081024,"  DGFI Airdrop Binance Bitcoin BakerySwap BNB PanCakeSwap cryptocurrency NFT DeFi BTC BinanceSmartChain BSC"".    nice",34724.33,"",17,905,"False","False","2018-05-23 06:44:50","True","False",905,1,0.6
63,"06/30/2021",1410216037585465344,"    It sounds a great project  ortcoin ort okratech bitcoin airdrop freelancer crypto",34724.33,"",128,435,"False","False","2018-12-05 22:14:14","True","False",435,0.75,0.8
70,"06/30/2021",1410216026197876736,"Market Wrap: Bitcoin Pushes Higher as Short Bets Unwind, bitcoin btc crypto cryptonews etherium eth blockchain blockchainNews",34724.33,"The Blockchain",556,743,"False","False","2017-10-21 08:33:11","True","False",743,0.4,0.125
131,"06/30/2021",1410215936532045824,"Everyone talking about variants.. I’m loving this new El Salvador Variant of bitcoin.. very contagious.",34724.33,"",81,300,"False","False","2017-06-05 22:41:45","True","False",300,0.568181818181818,0.312121212121212
134,"06/30/2021",1410215927086526464,"Magic internet money, come join us. crypto bitcoin hodl",34724.33,"MOON SOON 🌔",79,228,"False","False","2018-08-06 18:04:39","True","False",228,1,0.5
140,"06/30/2021",1410215913744261120," Great project for crypto assets and I really like it. a team spirit that works hard and good cooperation will make this project great   ortcoin ort okratech bitcoin airdrop freelancer crypto",34724.33,"Deoghar,Jharkhand",10,602,"False","False","2020-09-04 06:02:54","True","False",602,0.568333333333333,0.441666666666667
144,"06/30/2021",1410215907700314112," It's amazing to me that there's all this gnashing of teeth about the yuan or bitcoin taking away the global reserve keys. If they would just run some kind of a reasonable stable economy for more than a couple of years no one would be looking to leave.",34724.33,"",315,520,"False","False","2012-05-08 02:46:04","True","False",520,0.58,0.38
153,"06/30/2021",1410215891405574144,"Wine Wednesday CardThe BrewCrew are taking over the account for the afternoon MLB games!!! Hell I might let them take the whole night!!!! Give these boys some energy stay tuned for picks!!Gamblingtwitter Bitcoin   $amc $doge $gme StayDusty ",34724.33,"Canada",2194,290,"False","False","2012-07-05 17:03:30","True","False",290,0.4,0.48828125
155,"06/30/2021",1410215886691082240,"Mad Money's Jim Cramer Moves From Bitcoin to Ethereum — Says 'It's More of a Currency'  via ",34724.33,"Canada",6984,5044,"False","False","2015-02-04 18:03:57","False","False",5044,0.75,-0.0625
172,"06/30/2021",1410215865153298432," And then we have Indian tv ads by bitcoin waalas right in the middle of a Euro match claiming football popular hai kyunki koi bhi khel skta hai ",34724.33,"India",103,2401,"False","False","2018-07-24 16:27:14","True","False",2401,0.478571428571429,0.295238095238095
179,"06/30/2021",1410215858446770176,"We could still see  drop a bit further. My accumulation zone is round 2k. ETH bitcoin cryptocurrency",34724.33,"United States of America",26,134,"False","False","2020-06-15 14:20:52","True","False",134,0.45,-0.1
181,"06/30/2021",1410215854755680256,"Bitcoin (BTC) Bounces Back But Fails to Reclaim $36,000 (cryptopys) Bitcoin (BTC) has been moving upwards since bouncing on June 22. So far, it has managed to reach a local high of $36,623 on June 29. ",34724.33,"United Kingdom",5503,246,"False","False","2018-02-07 10:38:30","True","False",246,0.368,-0.048
185,"06/30/2021",1410215851790319616,"  Many people aren't thinking this way because it's not yet well known and accepted that the original BitCoin design was always capable of encapsulating this entire ecosystem. That and bias toward their favorite chains / tribes.",34724.33,"Bitcoin",2280,853,"False","False","2009-03-01 22:07:40","False","False",853,0.655,0.315
203,"06/30/2021",1410215823046754304,"Are the lemons made of Bitcoin or something ? Lmao  ",34724.33,"Longisland",3211,384,"False","False","2013-01-13 03:12:24","False","False",384,1,0.6
210,"06/30/2021",1410215816168198144,"Great to finally be able to share some of the bitcoin initiatives I’ve been working on . Spot on insights by  and  in last week’s Weekly Roundup at 24:28 ",34724.33,"United States of America",353,730,"False","False","2010-10-03 20:39:48","True","False",730,0.480555555555556,0.433333333333333
220,"06/30/2021",1410215804323328000," Bitcoin maxi from 2015 - February 2021 here. That’s exactly what I did and what a lot of smart money is doing. I’ve made more in BTC terms by doing that, but I denominate in ETH now.",34724.33,"",580,1361,"False","False","2014-06-05 18:06:04","False","False",1361,0.464285714285714,0.321428571428571
230,"06/30/2021",1410215795322327040,"650 U.S. banks will soon be able to offer bitcoin purchases to an estimated 24 million total customers. ",34724.33,"Canada",233,165,"False","False","2010-09-19 20:16:37","False","False",165,0.6875,0.25
236,"06/30/2021",1410215789634801664,"Decentralized Exchange Volumes Double Overnight — A Look at the Top 3 Dex Platforms in 2021  via ",34724.33,"Canada",6984,5044,"False","False","2015-02-04 18:03:57","False","False",5044,0.25,0.25
266,"06/30/2021",1410215745640964096,"What’s wrong with this story? bitcoin millionaire many...bitcoin billionaire possibly were only 2. ",34724.33,"United States of America",6814,7379,"False","False","2017-11-29 05:42:59","True","False",7379,0.966666666666667,-0.166666666666667
276,"06/30/2021",1410215731208232960,"Isn't it? Look at the upgrades of Ethereum and Bitcoin, a lot of interpretations are basically good.",34724.33,"Singapore",128,321,"False","False","2020-08-02 18:10:27","True","False",321,0.6,0.7
301,"06/30/2021",1410215689814564864,"Buy Crypto With Your Credit Card / Fast Crypto Exchange  Bitcoin BTC ETH XRP Crypto 08:36 ",34724.33,"",10272,3331,"False","False","2013-12-05 23:34:07","True","False",3331,0.6,0.2
317,"06/30/2021",1410215681023479808,"Xrp Unique Tweet Quantity Last 7 Daysbtc bitcoin cryptocurrencyMore Detail ",34724.33,"",3957,298,"False","False","2017-04-04 17:07:54","True","False",298,0.533333333333333,0.1875
321,"06/30/2021",1410215679102361600,"Bitcoin Bounces as Gold Continues its June Downtrend of Nearly 8%  BitcoinBTCPrice",34724.33,"United Kingdom",11108,10052,"False","False","2018-11-06 20:50:01","False","False",10052,0.4,0.1
330,"06/30/2021",1410215668440469504,"He even used Samuel for a personal agenda like that bitcoin thingy. That’s how he’s desperate for money since he’s almost hitting rock bottom and he only got BG and Samuel  to bring him profit. But now he got two grps bringing him profit (BG really gave him huge profit this year)",34724.33,"Multi Stan ",38,344,"False","False","2020-04-01 11:20:17","True","False",344,0.68,2.22044604925031e-17
338,"06/30/2021",1410215659544449024,"Gold wins against physical entropy But…. The reason Bitcoin is replacing Gold is that it wins against cerebral entropy (ie laziness) BTC is uplifting our species Gold can’t do this No shitcoin either (if it’s not BTC it’s a shitcoin - including ETH) ",34724.33,"",351878,1433,"False","False","2009-02-08 16:09:24","False","False",1433,0.180952380952381,0.2
340,"06/30/2021",1410215658210709504,"30 Million Crypto Users represent 3.8% of World Population. Who says crypto users are less than 1 % of world population? Binance  Bitcoin Ethereum cryptocurrencies blockchain 100xCoin  CoinMarketCap bitcoin ADA BNB dogecoin",34724.33,"Islamabad, Pakistan",68,429,"False","False","2014-10-08 07:40:11","True","False",429,0.0666666666666667,-0.166666666666667
341,"06/30/2021",1410215656927158272," Bitcoin started this whole thing, but now it’s time to pass that crown to ETH. Ethereum will take us the rest of the way",34724.33,"United States of America",45,148,"False","False","2013-12-18 22:37:27","False","False",148,0.4,0.2
357,"06/30/2021",1410215640498163712,"This opening sentence smashing together old and new worlds in the Bloomberg newsletter about migratory Chinese bitcoin miners: tell me it doesn't make your head spin!   ",34724.33,"United Kingdom",698,363,"False","False","2009-12-11 12:20:24","False","False",363,0.218181818181818,0.0787878787878788
359,"06/30/2021",1410215637994061824,"   Your first statement has nothing to do with fungibility at all, it's about bitcoin being unconfiscatable...Off course confiscatability has nothing to do with fungibility, I never claimed this and you're using a strawman...",34724.33,"",387,476,"False","False","2012-11-16 21:10:38","True","False",476,0.333333333333333,0.25
377,"06/30/2021",1410215608885600256,"linkedin twitter facebook instagram tiktok socialmedia tumblr dogecoin deal gift gifts shoppingstar giftideas shop shopping affiliatemarketing bitcoin popcorn Enjoy $10 off Orders of $50+ - Use code IR10 - ",34724.33,"United States of America",67400,6169,"False","False","2012-06-25 04:38:20","False","False",6169,0.5,0.4
388,"06/30/2021",1410215593559666688,"Them: How many mics do we rip on the daily?Me: Say, me say many, Bitcoin, say, me say many, many, many",34724.33,"United Kingdom",124,587,"False","False","2020-12-22 15:53:17","True","False",587,0.5,0.5
395,"06/30/2021",1410215579345162240,"Banks have kept an arm on the market  I believe because of the rate of cash existing their institutions to exchanges…with the ruling at the end of 2020 and roll out today of banks custodian crypto we may be witnessing a major transition Bitcoin ",34724.33,"",4958,560,"False","False","2017-08-18 17:32:40","True","False",560,0.5,0.0625
402,"06/30/2021",1410215570524446720,"GBPCHF TP1 done booked profitFor more signals DM: Link in bio       fx   ポンドドル gbpusd  ゴールド 先出しトレード 先出し XAUUSD gold Bitcoin comex  外汇 外汇  GBPUSD  ",34724.33,"World Resident ",2114,4995,"False","True","2020-03-09 09:25:41","True","False",4995,0.5,0.5
410,"06/30/2021",1410215559631880192,"Slow, but not steady: India’s stance on bitcoin and crypto is evolving cryptocurrency bitcoin crypto blockchain ",34724.33,"Pune",1301,517,"False","False","2010-06-06 16:01:22","False","False",517,0.45,-0.191666666666667
418,"06/30/2021",1410215549834039296,"Bitcoin Bounced Back From $30,000 Price Area - Will Continue Higher?  ",34724.33,"Canada",751,4979,"False","False","2011-11-17 01:47:59","False","False",4979,0.25,0.125
426,"06/30/2021",1410215541814538240,"Ethereum Classic price has nearly doubled days after Digital Currency Group's $50M bet Ethereum altcoin bitcoin via  ",34724.33,"",259,815,"False","False","2020-12-18 17:34:04","True","False",815,0.188888888888889,0.0888888888888889
457,"06/30/2021",1410215501070954496,"Gateio Crypto Bitcoin Doge ETH TRX LTC XLM One of the best crypto exchange market.There are so many cryptocurrencies that can make it easier for us to choose what crypto currency we want.Liquidity very juicy Interested?Sign up here:",34724.33,"",712,1259,"False","False","2017-07-31 23:19:31","True","False",1259,0.366666666666667,0.566666666666667
512,"06/30/2021",1410215408704045056,"$1M right now and then just use half to buy Bitcoin and make other moves with the rest ",34724.33,"Aurora, IL",613,643,"False","True","2009-03-25 05:16:05","True","False",643,0.359126984126984,-0.00198412698412699
530,"06/30/2021",1410215382112161792,"Gwen Goldman, a retired social worker from Westport, Conn., got to be a Yankees’ bat person on Monday night at age 70. Your Daily Update.  via ",34724.33,"United States of America",42627,1659,"False","False","2009-01-15 16:27:30","False","False",1659,0.0333333333333333,0.0166666666666667
541,"06/30/2021",1410215369055166464,"  weird that  didn’t do this until after that fake ass MDX went on his little adventure … Fisshhhyyyy  freeMDX IBB fishy Bitcoin",34724.33,"",38,168,"False","False","2013-05-03 03:54:51","True","False",168,0.833333333333333,-0.395833333333333
545,"06/30/2021",1410215363300806656,"reddit : Westerners Can Envision a Failure of Bitcoin, Not the Rest of the World, Which Has No Other Option. Bitcoin... ",34724.33,"",2252,2986,"False","False","2017-06-13 03:20:00","True","False",2986,0.3375,-0.127083333333333
591,"06/30/2021",1410215298725298176,"Is China's Crackdown on Bitcoin Mining Good News for North American Crypto Miners?  bitcoin",34724.33,"United States of America",18434,13557,"False","False","2014-07-22 16:41:06","False","False",13557,0.3,0.35
595,"06/30/2021",1410215295332012032,"️ ECONOMICAS T. &amp; M. WALL STREET, Right Now, PETRÓLEO ️ US$ 74. 04 = 1. 45 %  EL BARRIL, WTI LIGHT DE TEXAS  BITCOIN A US$ 34, 890 ️ - 4 %. ",34724.33,"Dominican Republic",534,419,"False","False","2009-04-20 16:51:52","False","False",419,0.617857142857143,0.342857142857143
601,"06/30/2021",1410215287954214912,"This is huge bullish news for Bitcoin.The mass adoption continues. Still early. ",34724.33,"Vienna, Austria",56,226,"False","True","2016-12-20 14:19:23","True","False",226,0.6,0.25
605,"06/30/2021",1410215282040205312," I’m waiting until I can buy five acres in a prime growing zone with super low APR just by showing a bank my Bitcoin account, and my 20% down is only 10% of my stack. I figure that is closer than we imagine. Plus, a home/land is relatively forever.",34724.33,"NorCal",334,825,"False","False","2009-03-06 20:15:20","True","False",825,0.451111111111111,0.0355555555555555
626,"06/30/2021",1410215251707039744,"Implementing jejudoge as a real pay method on jeju island has finally started. Gasten your seatbelts ladies and gentlemen. We're going up!!  ",34724.33,"",16,125,"False","False","2020-02-11 20:48:19","True","False",125,0.65,0.1
633,"06/30/2021",1410215242466922496,"SAPA TOKEN AIRDROP (Round 1)   ParticipateAirdrops Sapa SapaArmy Bitcoin BSC BSCGem BNB ",34724.33,"malang",146,1391,"False","True","2015-05-13 15:42:56","True","False",1391,0.4,-0.2
655,"06/30/2021",1410215188465340416,"    You gave it away with the: &gt;""If I want to use bitcoin as currency for some reason"" comment.You don't want to use bitcoin as a currency - even though that was its original intended purpose - because its failed as a currency.",34724.33,"United Kingdom",2790,1193,"False","False","2012-01-09 09:53:43","True","False",1193,0.525,-0.0625
660,"06/30/2021",1410215178541568000,"Slow, but not steady: India’s stance on Bitcoin and crypto is evolving  ",34724.33,"United States of America",1805,1137,"False","False","2015-02-21 16:27:59","False","False",1137,0.45,-0.191666666666667
661,"06/30/2021",1410215178331779072,"Slow, but not steady: India’s stance on Bitcoin and crypto is evolving  ",34724.33,"Canada",48,233,"False","False","2017-12-26 23:21:52","False","False",233,0.45,-0.191666666666667
665,"06/30/2021",1410215173290397696," It looks like a good idea to me, too bad they don't know that BSV is Bitcoin.",34724.33,"",13737,791,"False","False","2009-05-01 07:16:28","False","False",791,0.633333333333333,5.55111512312578e-17
667,"06/30/2021",1410215172589817856,"Live Better, Eat Better, Think Better, Trade Better, Perform Better, Be Better  Hodl bitcoin doge ripple Cardano  SafeMoon doge  DOGECOIN  eth BTC crypto cryptoart SafeMoon NFT      ",34724.33,"Off the 'chain",42598,40742,"False","False","2009-04-04 14:38:18","False","False",40742,0.5,0.448051948051948
668,"06/30/2021",1410215170979381248,"Bitcoin live stream is gonna be a little late today, forgot i had electricians coming this morn",34724.33,"👇YouTube Channel👇",5376,182,"False","False","2015-08-17 14:01:30","True","False",182,0.533333333333333,-0.117045454545455
669,"06/30/2021",1410215170014691328,"If you see/compare stuff like CME Non Com. positions (which closed short on Jan 2021) and Binance CVD spot selloff, what do you make from it? Hedge? Or wrong direction? Leveraged funds supposed to be speculators, not hedgers as Asset mangers. But this is glimpse .. Bitcoin ",34724.33,"Worldwide",20383,300,"False","False","2009-04-16 03:01:38","True","False",300,0.433333333333333,-0.2
696,"06/30/2021",1410215129543806976," For all those who are new to this working from home Bitcoin trading options Here's a little tip:Get a trusted Bitcoin expert and stick to him  Invest and play at similar times each day.Because :In times of chaos, your investment is your anchor to success️",34724.33,"South Africa",1883,1455,"False","False","2019-02-12 11:46:13","True","False",1455,0.451515151515151,-0.0170454545454545
709,"06/30/2021",1410215105262981120,"For bitcoin and crypto, regulation is the “single biggest driver of the bull market,” with fundamentals remaining “very strong” and retail investors still interested.",34724.33,"Blockchain",4841,1248,"False","False","2017-05-18 19:16:09","False","False",1248,0.555873015873016,0.247301587301587
711,"06/30/2021",1410215104424120320,"Bitcoin Bounces as Gold Continues its June Downtrend of Nearly 8%: $34,878.51 (-2.54% 24h)",34724.33,"Blockchain",4841,1248,"False","False","2017-05-18 19:16:09","False","False",1248,0.4,0.1
723,"06/30/2021",1410215067531071488," For all those who are new to this working from home Bitcoin trading options Here's a little tip:Get a trusted Bitcoin expert and stick to him  Invest and play at similar times each day.Because :In times of chaos, your investment is your anchor to success️",34724.33,"South Africa",1883,1455,"False","False","2019-02-12 11:46:13","True","False",1455,0.451515151515151,-0.0170454545454545
727,"06/30/2021",1410215061075988480," My first introduction to bitcoin was the bitconnect video lol",34724.33,"Jackistan",184,326,"False","False","2015-12-10 13:55:44","True","False",326,0.516666666666667,0.525
729,"06/30/2021",1410215059385630720," For all those who are new to this working from home Bitcoin trading options Here's a little tip:Get a trusted Bitcoin expert and stick to him  Invest and play at similar times each day.Because :In times of chaos, your investment is your anchor to success️",34724.33,"South Africa",1883,1455,"False","False","2019-02-12 11:46:13","True","False",1455,0.451515151515151,-0.0170454545454545
730,"06/30/2021",1410215058911727616,"  For all those who are new to this working from home Bitcoin trading options Here's a little tip:Get a trusted Bitcoin expert and stick to him  Invest and play at similar times each day.Because :In times of chaos, your investment is your anchor to success️",34724.33,"South Africa",1883,1455,"False","False","2019-02-12 11:46:13","True","False",1455,0.451515151515151,-0.0170454545454545
735,"06/30/2021",1410215051043217408," For all those who are new to this working from home Bitcoin trading options Here's a little tip:Get a trusted Bitcoin expert and stick to him  Invest and play at similar times each day.Because :In times of chaos, your investment is your anchor to success️",34724.33,"South Africa",1883,1455,"False","False","2019-02-12 11:46:13","True","False",1455,0.451515151515151,-0.0170454545454545
736,"06/30/2021",1410215050145636352," For all those who are new to this working from home Bitcoin trading options Here's a little tip:Get a trusted Bitcoin expert and stick to him  Invest and play at similar times each day.Because :In times of chaos, your investment is your anchor to success️",34724.33,"South Africa",1883,1455,"False","False","2019-02-12 11:46:13","True","False",1455,0.451515151515151,-0.0170454545454545
743,"06/30/2021",1410215039844356096,"I don't like much Bitcoin, but  is a Patriot.",34724.33,"1° Circuito.",48,185,"False","False","2009-11-06 06:34:32","False","False",185,0.2,0.2
753,"06/30/2021",1410215026196111360,"bitcoin is a medium of exchange. You never hear about the LightningNetwork in MSM (except when  schools some host). We are still so early. Run a node and be an early adopters of financial sovereignty.  plebnet",34724.33,"Left Coast",165,382,"False","False","2009-05-06 15:50:10","True","False",382,0.2,0.0666666666666667
758,"06/30/2021",1410215012686254080," For all those who are new to this working from home Bitcoin trading options Here's a little tip:Get a trusted Bitcoin expert and stick to him  Invest and play at similar times each day.Because :In times of chaos, your investment is your anchor to success️",34724.33,"South Africa",1883,1455,"False","False","2019-02-12 11:46:13","True","False",1455,0.451515151515151,-0.0170454545454545
770,"06/30/2021",1410214997377028096,"I found bitcoin in a User vault at this location! Join me playing coinhuntworld, It's awesome!  cryptocurrency 16238 ",34724.33,"",40,372,"False","False","2013-04-20 00:47:40","True","False",372,1,1
772,"06/30/2021",1410214994684284928,"     I’m just saying for someone who’s professed to be deeply into bitcoin to not know Stoneridge/NYDIG is very surprising. They’re behind almost all the major moves recently (sans Saylor/Musk), like Strike/El Salvador, insurance companies, bank/trading middleware, ETF filing, etc…",34724.33,"",89,785,"False","False","2020-11-22 15:46:44","True","False",785,0.5,0.1145
775,"06/30/2021",1410214992759169024,"  most secure, fast  bitcoin Ethereum and $egld wallet. ",34724.33,"United Kingdom",1117,239,"False","False","2008-03-19 18:23:44","False","False",239,0.566666666666667,0.366666666666667
792,"06/30/2021",1410214970554343424,"Crypto Top Gainers (30D)  TON Crystal $0.7192 (100.40%) Quant $75.38 (85.99%) Bitcoin Cash ABC $34.02 (81.76%) Amp $0.0581 (54.37%) XDC Network $0.0729 (36.23%)",34724.33,"United States of America",1242,158,"False","False","2018-01-15 02:10:54","False","False",158,0.5,0.5
795,"06/30/2021",1410214962459549696,"  ""I think bitcoin's 21 million is the first constant in economics.""This way of phrasing it really speaks to me.  In physics, the discovery of a new universal constant can bring about a millennia of scientific progress.  Satoshi's constant has the potential to do the same.",34724.33,"El Salvador",239,733,"False","False","2018-05-03 15:03:08","True","False",733,0.345875420875421,0.0651515151515152
798,"06/30/2021",1410214956151173120,"Have you heard of Spot? Get your $20 worth of free Bitcoins after your first purchase!  bitcoin via ",34724.33,"United States of America",641,256,"False","False","2011-01-12 03:18:02","False","False",256,0.411111111111111,0.3375
800,"06/30/2021",1410214947313917952," For all those who are new to this working from home Bitcoin trading options Here's a little tip:Get a trusted Bitcoin expert and stick to him  Invest and play at similar times each day.Because :In times of chaos, your investment is your anchor to success️",34724.33,"South Africa",1883,1455,"False","False","2019-02-12 11:46:13","True","False",1455,0.451515151515151,-0.0170454545454545
815,"06/30/2021",1410214922395570176," He bought the top of Bitcoin",34724.33,"Pittsburgh",386,268,"False","False","2012-02-27 02:26:30","False","False",268,0.5,0.5
832,"06/30/2021",1410214893572313088," Sorry, but we chop first. Will probably see &gt;37.4K by July 4th though.Hate to see you goHope Bitcoin dgaf about what I think and pumps rn though",34724.33,"Europe",129,262,"False","False","2019-01-24 09:47:19","True","False",262,0.666666666666667,-0.125
839,"06/30/2021",1410214866946822144,"  For all those who are new to this working from home Bitcoin trading options Here's a little tip:Get a trusted Bitcoin expert and stick to him  Invest and play at similar times each day.Because :In times of chaos, your investment is your anchor to success️",34724.33,"South Africa",1883,1455,"False","False","2019-02-12 11:46:13","True","False",1455,0.451515151515151,-0.0170454545454545
849,"06/30/2021",1410214857459355648,"bitcoin ( buttcoin ) a ponzi scam and useless computer program .Why someone with healthy brain spend 35000 usd on this shit?",34724.33,"Kingdom of Saudi Arabia",57,237,"False","False","2016-10-11 00:20:34","True","False",237,0.5,-0.0666666666666667
851,"06/30/2021",1410214856507072512,"Just been catching up with the market to see what you guys have been facing.What . on. earth. is that on bitcoin omg.That might be the literal worst price action (that's not market capitulation) I have ever seen. 1 day 6 hours of down only, painful. ",34724.33,"I'm not on TG, beware of fakes",73097,256,"False","False","2020-06-23 12:25:17","True","False",256,0.698148148148148,-0.192592592592593
852,"06/30/2021",1410214855127273472," Great project with prospects guys!   altcoin Bitcoin cryptocurrency QuarashiNetwork",34724.33,"",226,780,"False","False","2020-12-26 02:24:01","True","False",780,0.75,1
