"X","Date","TweetID","Text","BTC.Price","User.Location","User.follower.count","UserFollowingCount","User.Verified","Quote.Status.","AccountCreationDate","Default.Profile.Theme.","DefaultProfileImage","TotalAccountLikes","Subjectivity","Polarity"
1560,"07/06/2021",1412373762381467648," Ethereum Treads on Persistence as the London Upgrade ApproachesThis upgrade will introduce the highly anticipated EIP-1559 aimed at reducing gas costs on the Ethereum networkETH crypto hodl Bitcoin altseason ",33880.63,"info@cryptoadventure.org",82796,4076,"False","False","2016-11-14 10:15:36","False","False",4076,0.54,0.16
1567,"07/06/2021",1412373746745290752," Gold is the new Bitcoin.",33880.63,"Canada",12006,990,"False","False","2012-11-07 18:23:23","True","False",990,0.454545454545455,0.136363636363636
1574,"07/06/2021",1412373727212359680," Society; corrupted by weak, irresponsible &amp; malevolent fiscal &amp; monetary policy, imposed by the state &amp; central banks which has perverted incentive structures - leading to the enslaving of the proletariat &amp; decimation of the middle class, all whilst empowering elites!bitcoin ",33880.63,"",1076,1904,"False","False","2020-06-16 21:54:31","True","False",1904,0.46875,-0.29375
1603,"07/06/2021",1412373666575392768,"Bitcoin is trading sideways after choppy trading during Asian hours, $36,000 next resistence level. crypto cryptocurrency cryptocurrencies cryptomarkets bitcoin2021 btc ",33880.63,"United States of America",376,156,"False","False","2016-06-06 19:32:52","True","False",156,0.0666666666666667,-0.0666666666666667
1608,"07/06/2021",1412373654055305216,"  Positive news. However, of greater consern to me are how UK banks in cahoots with the FCA issued ""notice"" think its reasonable to impeded UK consumers making purchases relating to FPO &gt; BinanceUK perhaps better regulatory guidance is required Bitcoin BTC GBP",33880.63,"United Kingdom",727,722,"False","False","2012-07-18 22:14:38","False","False",722,0.536363636363636,0.356818181818182
1616,"07/06/2021",1412373635482984448,"China proves Bitcoin is an unstoppable machine: Bitcoin Center founder ",33880.63,"",1237,294,"False","False","2010-12-04 12:27:21","True","False",294,0.05,0.1
1625,"07/06/2021",1412373607435571200,"""It’s become both easier and more profitable to mine Bitcoin,"" says Zap Protocol co-founder Nick Spanos. ",33880.63,"India",113,434,"False","False","2017-03-07 02:15:05","True","False",434,0.5,0.5
1634,"07/06/2021",1412373594156539904,"    What absolute bollocks, Ethereum was created to enable developers to build and publish smart contracts.But Ethereum's supreme leader changed the rules because its fees got out of hand and they saw a threat from bitcoin and stacks.",33880.63,"United Kingdom",1120,216,"False","False","2010-11-30 10:42:48","False","False",216,0.771428571428571,0.207142857142857
1660,"07/06/2021",1412373538078613504," Would also say graphics cards are a mess at the moment because of bitcoin miners so you may have trouble getting anything current or most recent generation on that front, but things like gtx 1650s are available and run anything at the moment (cyberpunk/apex etc)",33880.63,"United Kingdom",976,987,"False","False","2008-10-08 08:28:38","False","False",987,0.320833333333333,0.0875
1665,"07/06/2021",1412373533561339904," Shitcoins are an attack vector on Bitcoin. Few.",33880.63,"",141,721,"False","False","2020-10-10 09:15:48","True","False",721,0.1,-0.2
1672,"07/06/2021",1412373525332172800,"Who wants to see a Casinocoin logo Animation? Are You Ready?GetCasinoCoin CSCNation CSC CasinoCoin  Bitcoin CryptoNews",33880.63,"United Kingdom",1121,1419,"False","False","2017-06-27 19:57:16","True","False",1419,0.1,0.2
1675,"07/06/2021",1412373520156401664,"Ethereum Price Analysis: ETH Reaches Key Juncture Near $2,200 crypto bitcoin cryptopostio",33880.63,"",1100,3020,"False","False","2020-10-08 04:08:02","True","False",3020,0.7,0.05
1699,"07/06/2021",1412373472605581312," Great project Join now    Airdrop NFT Crypto BNB Bitcoin",33880.63,"",427,972,"False","False","2018-07-17 09:50:43","True","False",972,0.75,0.8
1713,"07/06/2021",1412373440355606528," What an amazing project   SlowToken_  Bitcoin ETH",33880.63,"Nigeria",16,358,"False","False","2020-12-17 14:35:37","True","False",358,0.9,0.6
1726,"07/06/2021",1412373412287287296,"IBC GROUP TO END BITCOIN MINING IN CHINA. THEY EMPLOY 1500 PEOPLE IN MORE THAN 40 CITIES IN CHINA.  bitcoin",33880.63,"Cyberspace",11380,409,"False","False","2009-04-14 14:54:04","False","False",409,0.5,0.5
1727,"07/06/2021",1412373411066789888,"Bitcoin mining firm Argo Blockchain explores secondary listing on Nasdaq Blockchain bitcoin  ",33880.63,"the world",45219,17325,"False","False","2014-03-01 16:45:26","True","False",17325,0.35,-0.25
1759,"07/06/2021",1412373349062254592,"Old faithful Litecoin turns 10 years old on October 7th. After a decade of activity, it’s still going strong. A faster and lighter Bitcoin fork, LTC’s obje...Read more: ",33880.63,"United States of America",5748,4652,"False","False","2018-10-17 11:18:24","False","False",4652,0.408333333333333,0.283333333333333
1765,"07/06/2021",1412373339142864896,"   See if it works now. I could be wrong, but TOR should mean it doesn’t matter what ports your router blocks.Just go to bitcoin app from main page and watch peer count to see if it changes from zero to and number &gt;0",33880.63,"United Kingdom",3385,1966,"False","False","2019-03-02 16:08:18","True","False",1966,0.640277777777778,-0.215277777777778
1781,"07/06/2021",1412373317957341184,"linkedin twitter facebook instagram shoppingstaronline tiktok socialmedia tumblr dogecoin deal gift gifts giftideas shop shopping affiliatemarketing bitcoin popcorn Enjoy $10 off Orders of $50+ - Use code IR10 - ",33880.63,"United States of America",67445,6276,"False","False","2012-06-25 04:38:20","False","False",6276,0.5,0.4
1787,"07/06/2021",1412373308981534720,"Beijing regulators shut down firm providing services used for crypto trading  btc bitcoin cryptocurrency ethereum 仮想通貨 ビットコイン 日経平均 リップル ドル xrp crypto 暗号通貨 ripple dontstopwontstop blockchain",33880.63,"United Kingdom",4300,307,"False","False","2017-07-11 18:14:29","True","False",307,0.344444444444444,-0.177777777777778
1792,"07/06/2021",1412373293760487424," Lol! Open your eyes. Ice caps are melting, record heat in North America, we are in the midst of an environmental crisis due to global warming. Last thing we need is a protocol using a massive amount of energy. Bitcoin was first, we get it, but there are better alternatives now.",33880.63,"Amsterdam, The Netherlands",686,1574,"False","False","2017-06-30 20:36:20","True","False",1574,0.434375,0.203125
1796,"07/06/2021",1412373282385543168," winnings of initial BTC investment$-45055671 (-3.34 %) (Realized: 272 M)(Estimating an average buy price of $35000/BTC with now 38,700 BTC holdings )Tesla Bitcoin crypto",33880.63,"",1291,850,"False","False","2018-06-20 08:50:17","True","False",850,0.2,-0.075
1814,"07/06/2021",1412373253641760768,"World Economic Forum: Blockchain can help dismantle corruptioncrypto $btc bitcoin ",33880.63,"",38,148,"False","False","2012-07-07 22:31:38","True","False",148,0.2,0.2
1822,"07/06/2021",1412373229440806912,"All we need are more TX’s, Still early.  vechain July VET $0,5Sept VET $1 ",33880.63,"Vechain to the moon",510,235,"False","False","2020-01-01 11:34:00","True","False",235,0.4,0.3
1834,"07/06/2021",1412373196058267648," Digital currency is similar to Mercury in that it is one of the most excellent and powerful things in skilful hands. Our upcoming song ‘We Believe’cryptocurrency ethereum Dogecoin bitcoin tothmoon solarsystemTeaser link is here.  ",33880.63,"India",511,952,"False","False","2019-05-26 15:44:49","False","False",952,0.58,0.36
1841,"07/06/2021",1412373174658895872," Impresive and great project. I trust this project can be successfully  cryptocurrency BSC Bitcoin Ethereum ETH Airdrop bounty Kawris KWC KawrisCoin AirdropStario",33880.63,"",11,473,"False","False","2020-11-12 10:57:06","True","False",473,0.85,0.775
1842,"07/06/2021",1412373173257990144," Chinese fud is more dominant today. Chill ! bitcoin fud china crypto",33880.63,"Binancian Planet besides MARS",235,981,"False","False","2017-06-03 12:20:28","False","False",981,0.25,0.3125
1844,"07/06/2021",1412373167578955776," Freedom scares the fiat money establishment...They are so desperate against Bitcoin. ",33880.63,"Mars",243,449,"False","False","2011-05-18 19:34:09","False","False",449,1,-0.6
1855,"07/06/2021",1412373142719324160," Of course! These payment providers all wish to stop Bitcoin and they are not afraid of BTC as it is no threat to them. They will fail though",33880.63,"",2057,257,"False","False","2015-10-07 14:33:33","False","False",257,0.6,-0.1
1856,"07/06/2021",1412373141444173824,"Let’s go EarnBnb be the best Check out their Fair Launch form: $bsc $btc BNB  Bitcoin  BSC EarnBNB BTC ",33880.63,"Indonesia",76,1870,"False","True","2020-01-31 07:37:55","True","False",1870,0.6,0.85
1875,"07/06/2021",1412373091603333120," And BSV also works the way bitcoin should work. Cheap (1/100 cent per transaction). Fast (instant). Scales (capable of million transactions per second)",33880.63,"",125,205,"False","False","2016-10-07 20:57:01","True","False",205,0.473333333333333,0.16
1901,"07/06/2021",1412373048540352512," Thank you for sharing this wonderful opportunity. My fav is link NFTGiveaway nftart NFT NFTartists  NFTartwork dogearmy chainlink DogeFather Bitcoin OpenSeaNFT opensea 0x4EA50EeA5D64Aa52444cfa60da62F6f30f40c92d",33880.63,"Delhi",50,1109,"False","False","2014-07-08 04:54:44","True","False",1109,1,1
1906,"07/06/2021",1412373038730039296,"EZ TuesdayMotivationGetVaccinated &amp; beTaking actionUnmitigatedEagerSuccessfulDeterminedAstonishingYouthfulbitcoin coaching coffee diet exercise fitness health inspiration motivation meditation paleo running success weightloss yoga snrtg ",33880.63,"United States of America",2014,2795,"False","False","2015-07-27 15:55:15","False","False",2795,0,0.3
1912,"07/06/2021",1412373030538338304,"JUST IN – Billing tech provider Allied Payment is now offering customers the ability to buy and sell Bitcoin . The firm will hold  on its corporate balance sheet. ",33880.63,"United States of America",2335,3975,"False","False","2018-01-02 22:01:13","True","False",3975,0.2,-0.1
1920,"07/06/2021",1412373023328555008,"Procrastination Solutions For College Students: The Underground Playbook For ...  via  success  motivation networking lifestyle residualincome forex bisnisonline  business entrepreneur money mlmsuccess workfromhome marketing bitcoin",33880.63,"United States of America",3775,869,"False","False","2010-11-24 19:26:13","False","False",869,0,0.3
1921,"07/06/2021",1412373020769931264," Meanwhile in more balanced newsChina crackdown further on bitcoin and crypto",33880.63,"Global ",1647,986,"False","False","2020-04-19 19:00:17","True","False",986,0.5,0.25
1941,"07/06/2021",1412372994438074368,"Most Institutional Investors Expect to Increase Crypto Exposure by 2023: Study  fintech bitcoin ethereum   ",33880.63,"All Over the World",110653,16975,"True","False","2014-08-06 05:20:16","False","False",16975,0.5,0.5
1942,"07/06/2021",1412372993540595712,"  Or possibly these hacking groups are affiliated with one of the (corrupted) US Intel agencies..slight variation of what you suggest. It’s definitely fishy and seems dumb. Watch, then the F B I will “recover” the ransomed Bitcoin like with the pipeline attack",33880.63,"United States of America",14033,5125,"False","False","2018-03-20 15:24:05","True","False",5125,0.666666666666667,-0.125
1958,"07/06/2021",1412372962775236608,"Shorting $btc from here. Hoping it went lower to 33200 &amp; might go long from there Bitcoin",33880.63,"Mars",335,452,"False","False","2012-08-31 09:32:58","False","False",452,0.4,-0.05
1965,"07/06/2021",1412372950586597376," Kawris It is a project of great expectation, I dare say that soon they will be trends in the market cap Airdrop Bitcoin Ethereum Crypto crypto Kawris KWC KawrisCoin AirdropStario",33880.63,"",11,473,"False","False","2020-11-12 10:57:06","True","False",473,0.75,0.8
