"X","Date","TweetID","Text","BTC.Price","User.Location","User.follower.count","UserFollowingCount","User.Verified","Quote.Status.","AccountCreationDate","Default.Profile.Theme.","DefaultProfileImage","TotalAccountLikes","Subjectivity","Polarity"
8,"07/08/2021",1413104479541415936," While Richard Heart tears down Satoshi for leaving Bitcoin, I love the irony that Richard is oblivious to the fact that his existence as the figurehead of Hex guarantees no serious players would ever consider it.",32606.42,"",83,980,"False","False","2020-06-07 09:50:54","True","False",980,0.518518518518518,0.17037037037037
13,"07/08/2021",1413104473405370368,"Bitcoin fell below the $33,000 crucial level of support.The IOMAP indicator reveals stiff resistance ahead and one last key level of support that could prevent  from falling below $30,000.Between $30,5k and $31.1k, over 314 thousand addresses previously bought 241k BTC. ",32606.42,"",16166,1564,"False","False","2019-02-13 11:53:24","False","False",1564,0.546666666666667,-0.0761904761904762
28,"07/08/2021",1413104453801201664," congrats on the discussion on  regarding CryptoCurrency becoming more mainstream!We recently ran a poll about accepting Crypto for rental payments and check out the results below! Amazing Fascinating CryptoCurrencies MainStream HowWillCrytoEvolve Bitcoin ",32606.42,"Canada",77014,43909,"True","True","2009-10-23 19:32:40","False","False",43909,0.67,0.45
35,"07/08/2021",1413104443667587072,"   Literally all his pics got people wrecked including that trash Bitcoin. 50% down from the highs. Alts down 60-90%His so-called ""fundamental"" research is based off emotion. He also shows centralized counterparty risk including leveraged Trading exchanges. Garbage human being ",32606.42,"Hexagon on Saturn's North Pole",1123,1853,"False","False","2017-09-07 06:31:54","False","False",1853,0.225925925925926,-0.103703703703704
49,"07/08/2021",1413104415045652480,"   Yes, even Bitcoin bashers are it's bulls &amp; promotors. It might scare of a small portion of who they reach. The other portion will take a deeper look &amp; join the BTC, crypto, token &amp; Blockchain train. Thanks  for being such a good bull. Much better than ",32606.42,"World Wide",46,113,"False","False","2019-06-09 06:33:17","True","False",113,0.429166666666667,0.170833333333333
50,"07/08/2021",1413104412801785856,"When will the leverage Traders learn the exchange can see all you're position and counter you with you're own money LOL REKT crytocrash",32606.42,"United States of America",217,772,"False","False","2018-05-12 19:46:48","True","False",772,0.85,0.7
51,"07/08/2021",1413104408380981248,"Bitcoin, Ethereum and Dogecoin Prices Slump Overnight via  {tag} rt live follow viral meme tags tweet",32606.42,"United States of America",216,233,"False","False","2017-12-23 00:29:00","False","False",233,0.5,0.136363636363636
69,"07/08/2021",1413104349111152640,"  Most investors in Bitcoin aren't in it because they are enthusiastic about technology - they're in it purely to ""profit"" from price rise / speculation. Bitcoin has no true foundations &amp; will go out of fashion once Feds limits to paper over the economy will be laid bare.",32606.42,"",46,204,"False","False","2020-03-13 11:34:03","True","False",204,0.53,0.237857142857143
74,"07/08/2021",1413104342127693824,"Running the show: Falcons draftee picked many lessons from his mom on set of 'CSI: NY'   ️  Bitcoin Sportsbook ",32606.42,"",649,827,"False","False","2016-12-16 21:14:48","False","False",827,0.5,0.5
75,"07/08/2021",1413104339313315840,"ECB Strategy Review: ECB Sets Symmetrical Inflation Target: ECB announces new inflation target as expected. Lagarde to speak from 1330BST. Read More   |   |  cryptocurrency Bitcoin Forex ",32606.42,"",6958,15994,"False","False","2015-10-13 01:53:50","False","False",15994,0.451515151515151,0.178787878787879
80,"07/08/2021",1413104331193266176,"NFT PERFORMS THE BEST [Details]cryptonews bitcoin cryptocurrency ",32606.42,"",266,110,"False","False","2020-05-11 17:13:01","True","False",110,0.3,1
93,"07/08/2021",1413104312155361280," What happens if governments programme cbdcs to be unable to purchase bitcoin?",32606.42,"United Kingdom",60,490,"False","False","2017-08-21 18:24:29","True","False",490,0.5,-0.5
106,"07/08/2021",1413104282988171264,"It is interesting that there are Crypto ATMs all over Central Europe. cryptoworld Bitcoin ",32606.42,"United States of America",64,164,"False","False","2010-05-23 08:44:53","False","False",164,0.375,0.25
107,"07/08/2021",1413104282312790016,"  “Wrong on Bitcoin since 2007” ",32606.42,"The Beach",375,908,"False","False","2015-09-28 16:26:49","True","False",908,0.9,-0.5
115,"07/08/2021",1413104271856390144," ""He converts the thousandths of a bitcoin they make each week to cash, rather than holding onto it. He’s skeptical of bitcoin as a long-term investment; he’s just doing it to bring in cash.""hahaha",32606.42,"United States of America",1042,935,"False","False","2010-04-30 23:42:20","False","False",935,0.45,-0.15
128,"07/08/2021",1413104242894807040,"NFTs are the newest “fad” that is exciting the market. I remember when Bitcoin was a fad Cathie Woods is creating a new Bitcoin ETF, following that, Michael Saylor issues a half a billion dollar bond to buy Bitcoin and then we have El Salvador the list goes on…",32606.42,"United Kingdom",94,114,"False","False","2020-11-28 17:21:02","True","False",114,0.38030303030303,0.0674242424242424
132,"07/08/2021",1413104230781566976," DONE RULES  Good project and good luck all My BSC : 0xE485Da7aC404c2A8f1C8e3Ea69638000E51bEE5eTg : BSC BNB ETH BTC Bitcoin DeFi yieldfarming  ",32606.42,"Venezuela ",118,642,"False","False","2010-11-26 22:39:28","False","False",642,0.6,0.7
152,"07/08/2021",1413104201647804416,"Nothing Great Comes, Without Risk bitcoin",32606.42,"United States of America",3237,2971,"False","False","2012-12-14 06:08:24","True","False",2971,0.75,0.8
161,"07/08/2021",1413104178637979648,"Hey I joined a network called SurveyJ and earned $730 today! You get paid for testing out new free apps and posting on social media. Sign up with my link for an instant $40 signup bonus!  surveyj cashapp bitcoin",32606.42,"United States of America",1135,1081,"False","False","2009-04-23 17:42:32","False","False",1081,0.496969696969697,0.142424242424242
171,"07/08/2021",1413104156093648896,"DONE RULES  Good project and good luck all My BSC : 0xE485Da7aC404c2A8f1C8e3Ea69638000E51bEE5eTg : BSC BNB ETH BTC Bitcoin DeFi yieldfarming  ",32606.42,"Venezuela ",118,642,"False","True","2010-11-26 22:39:28","False","False",642,0.6,0.7
175,"07/08/2021",1413104147084189696,"100X Potential IDO -  KCCPADBlueZilla is the team behind the super successful BSCPad which did 300x, TronPad which did 255x and soon to launch ETHPad. Join here:  Launch Date: 12th July ,2021.Initial Marketcap: $25,000 only KCCPAD  Bitcoin",32606.42,"",101,128,"False","False","2013-11-07 08:42:21","True","False",128,0.863333333333333,0.136666666666667
184,"07/08/2021",1413104139501019136,"Bitcoin’s 10-day volatility fell back to 106% from a high of nearly 162% on May 24.  BTC InvestSmart AutoTrading",32606.42,"Bengaluru",500,693,"False","False","2011-07-02 21:43:09","False","False",693,0.313333333333333,0.0866666666666667
185,"07/08/2021",1413104138947284992,"linkedin twitter facebook instagram tiktok socialmedia tumblr dogecoin deal gift gifts giftideas shoppingstaronline shop shopping affiliatemarketing bitcoin popcorn Enjoy $10 off Orders of $50+ - Use code IR10 - ",32606.42,"United States of America",67461,6353,"False","False","2012-06-25 04:38:20","False","False",6353,0.5,0.4
199,"07/08/2021",1413104121612099584,"2/Long-term Bitcoin secular bull market still looking scrumptious.Fantastic buying opportunity at 12-month moving average ($32,070), IMO.Well above 48-month (4-year) MA of $13,761.I am buying and holding.  ",32606.42,"United States of America",13647,3341,"False","False","2014-01-10 15:05:39","False","False",3341,0.25,-0.075
204,"07/08/2021",1413104116897697792,"Bitcoin technical update: First real test of Wyckoff accumulation pattern. A daily close below June 25 low of ~$31,550 would obsolete model in short-term.Macro: BullishNews: NeutralOn-chain: NeutralOpinion: Testing day! Watching daily close closely. Still accumulating btc ",32606.42,"United States of America",13647,3341,"False","False","2014-01-10 15:05:39","False","False",3341,0.172222222222222,0.075
250,"07/08/2021",1413104041010286592,"    Can't wait to see how  will roll out :)",32606.42,"",341,557,"False","False","2017-04-12 17:43:28","True","False",557,1,0.5
258,"07/08/2021",1413104022412726272," Bitcoin is unpredictable at this point. But I can tell you once the first decentralized index on  is launched, he price if  will definitely rise to the sky ",32606.42,"Nigeria",89,407,"False","False","2011-05-02 06:16:55","True","False",407,0.611111111111111,0.0277777777777778
261,"07/08/2021",1413104004976971776," Hello Peter! When was the last emerging tech that you have supported ? Or are you just playing mind games so that you can buy the Bitcoin when it drops to $10k? Be honest to yourself young man. Time is short stay truth ️",32606.42,"",9,303,"False","False","2010-01-21 01:57:47","True","False",303,0.416666666666667,0.175
265,"07/08/2021",1413103996911464448,"Insecurity: Governor Ishaku says NYSC should be for two years, one year for military training and the other year for social worksRead More:NYSC Borno Bitcoin Davido bornelectricm Lockdowns Nengi Basilica  KIDD WAYA X5 WDG LongCovid Corpers Ishaku ",32606.42,"Nigeria",941,1021,"False","False","2020-07-13 15:43:57","True","False",1021,0.180555555555556,-0.0638888888888889
267,"07/08/2021",1413103992633188352,"Ask any Bitcoin enthusiast whether the network is currently secure, and they will undoubtedly respond with ""Yes"". Hash rate is down 50% from its highs so if the network is still secure, doesn't that mean that lost hash rate was all energy waste previously? ",32606.42,"United States of America",3380,132,"False","False","2010-02-02 06:34:20","False","False",132,0.390509259259259,-0.00578703703703703
285,"07/08/2021",1413103935439605760," knownews  bitcoin bnb CryptoCurrency ethereum xrp Russia to Bring More Legislation to Crypto — New B  ",32606.42,"Here and Now",10399,699,"False","False","2011-04-21 13:16:01","True","False",699,0.477272727272727,0.318181818181818
299,"07/08/2021",1413103909132849152," Excellent project and congratulations to the team for their efforts to make this happen and best regard for the future.Airdrop Bitcoin Ethereum Crypto crypto Kawris KWC KawrisCoin AirdropStario",32606.42,"",141,565,"False","False","2013-01-09 06:32:45","True","False",565,0.65,1
301,"07/08/2021",1413103907748864000,"  If by fraud you mean restoring the true power of bitcoin, then you must be the biggest anti-bitcoin troll ever",32606.42,"",29,192,"False","False","2020-10-28 22:35:09","True","False",192,0.66875,0.01875
308,"07/08/2021",1413103886647234560,"Excellent project and congratulations to the team for their efforts to make this happen and best regard for the future.Airdrop Bitcoin Ethereum Crypto crypto Kawris KWC KawrisCoin AirdropStario ",32606.42,"",141,565,"False","True","2013-01-09 06:32:45","True","False",565,0.65,1
311,"07/08/2021",1413103880502595584,"She wanna go back to Malaysia but cases keep increasing. Bet she misses her lǎo gōng, instea and bitcoin so much ",32606.42,"Neo City ",2139,1874,"False","False","2020-04-14 20:46:48","True","False",1874,0.1,0.1
315,"07/08/2021",1413103862743855104," A good project and strong team in a predictable and transparent road map,planned and projected.I think in the near future.   Cryptocurrency ULTI ICOAnnouncement Bitcoin BNB blockchain UltiArena",32606.42,"Purwokerto",87,492,"False","False","2013-09-22 09:17:09","False","False",492,0.471666666666667,0.206666666666667
317,"07/08/2021",1413103851503300608,"The guys are really engaged in the project and its development and popularization. This is a good sign of success and good things to come in the cryptocurrency industry. Presale blockchain cryptotrading investing cryptocurrency bitcoin trading altcoin cryptonew",32606.42,"",3546,3884,"False","False","2019-07-12 11:44:59","True","False",3884,0.35,0.475
327,"07/08/2021",1413103840342290432,"The future of money is really sad. You're about to lose your financial freedom AND privacy.Bitcoin fixed this ",32606.42,"United States of America",1621,229,"False","True","2009-04-17 22:46:24","False","False",229,0.33125,-0.1
340,"07/08/2021",1413103810264801280," good project, hopefully in the future it can be even more successful for the teamAirdrop Airdrops Airdropinspector BSC BinanceSmartChain  Haretoken HARE Crypto Bitcoin",32606.42,"",12,238,"False","False","2016-08-21 07:00:50","True","False",238,0.54375,0.4875
364,"07/08/2021",1413103756502200320,"This is perfect for $jejuOur Korean team should see if there's specialized American training he can offer at the marinas in Jeju!Seminar? Branch office set up?Jeju is an island! ",32606.42,"United States of America",43310,1786,"False","True","2009-01-11 18:01:37","False","False",1786,0.5,0.5
367,"07/08/2021",1413103745009950720,"I will giveaway 1 full BTC if bitcoin hits 20k before 15th Julygiveaway Freecoin FreeBitcoin crypto dogecoin Binance BNB",32606.42,"اسلام آباد, پاکستان",139,200,"False","False","2020-12-26 11:50:08","True","False",200,0.55,0.35
370,"07/08/2021",1413103740211453952,"Bitcoin Eyes for a Clear Direction amid the Mist  Blockchain Digital Ledger DistributedLedgerTechnology DLT",32606.42,"Road Warrior",250,104,"False","False","2017-06-12 23:06:29","True","False",104,0.191666666666667,0.05
378,"07/08/2021",1413103728341757952,"   That’s incredibly useful. Just keep it running and it’ll mine all the Bitcoin in the universe, then send the results back in time.",32606.42,"Baile Átha Cliath",903,4869,"False","False","2013-05-24 13:53:04","True","False",4869,0,0.15
408,"07/08/2021",1413103660221878272,"   BNB USDT BSC Crypto Bitcoin BRICK The project is implemented very professionally and has a clear development plan. very professional and experienced       0xD2C7943d8597d753defE013A5e1CdB5a2611d321",32606.42,"0231",92,2900,"False","False","2015-12-24 04:24:23","True","False",2900,0.385833333333333,0.29
414,"07/08/2021",1413103646468886528,"   Bitcoin is an asset, but as a dollar investment, it is zero-sum.  Bitcoin boosters hope or expect the price will always rise but that requires an ever-increasing army of 'greater fools' to buy. A Ponzi scheme.Maybe read this from  by . ",32606.42,"Nigeria",9771,1234,"False","False","2011-02-27 17:21:17","False","False",1234,0.5,0.5
415,"07/08/2021",1413103645101629440,"Until a decade back, Bitcoin was nothing more than a technological buzzword restricted to the geeks. Today, almost everyone knows about it, talks about it, discusses about it. Let us take you through the evolution of the first cryptocurrency in our blog ",32606.42,"",1458,265,"False","False","2020-03-16 03:41:38","True","False",265,0.277777777777778,0.25
419,"07/08/2021",1413103634427125760,"This market is good   Below 30K Bitcoin   Dat wil never happen !  ",32606.42,"netherlands",183,158,"False","False","2009-08-10 20:07:24","True","False",158,0.6,0.875
423,"07/08/2021",1413103620883681280,"   Short term volatility shouldnt be something like 50% drop in a few weeks mate, and what do you say to a merchant who sold something that was 65k worth for 1 bitcoin now that he can't buy his raw materials with that 1 bitcoin anymore? How is bitcoin valuable to that merchant?",32606.42,"",83,168,"False","False","2017-11-01 12:07:22","True","False",168,0.240384615384615,-0.0326923076923077
434,"07/08/2021",1.413103605067e+18,"How many of my fellow South Africans  are running a bitcoin node, and if so, how long did it take you to sync the IBD? Extra points if you can describe your experience",32606.42,"Port 8333",1236,1653,"False","False","2018-02-14 18:38:36","True","False",1653,0.333333333333333,0.15
466,"07/08/2021",1413103551660892160,"El Salvador's   is not the only place where you bitcoin and surf. The Basque Country, south-west of France is another great place for that. Join me on the second edition of the already must-attempt Bitcoin event   ",32606.42,"",3333,570,"False","True","2011-08-15 13:26:09","False","False",570,0.583333333333333,0.266666666666667
470,"07/08/2021",1413103536498425856," so that's the million-bitcoin question than (always has been?):will they continue to print? If, it should get even more crazy, no? Given the amount of ever more fresh debt.Will they instead tax? Than, yes, prices should indeed plunge.",32606.42,"",45,467,"False","False","2008-06-14 18:04:24","False","False",467,0.6,0.175
471,"07/08/2021",1413103535693107200,"Ron Jon &amp; the Big Dog have to courier a bitcoin cold wallet across the u.s. along the way they hire a nerdy computer expert named ""Big Johnson"" and bodyguard alias ""Pacific Sun"" but it's not that easy as they're pursued by the mysterious southern operator ""the Dixie Outfitter""",32606.42,"your toilet friend",66,133,"False","False","2009-03-21 03:22:35","False","False",133,0.505555555555556,-0.0277777777777778
488,"07/08/2021",1413103492269494272,"Bitcoin price will likely shrug off $530M GBTC unlock in July — analysisRead here : bitcoin btc ethereum invest money finance trade btcusd eth ripple xrp fintech technology litecoin moneroFollow us for latest crypto and blockchain n… ",32606.42,"",204,265,"False","False","2020-05-11 13:59:33","True","False",265,0.95,0.25
491,"07/08/2021",1413103485881622528,"Crypto Scams, Rug Pulls, Bitcoin Hacks: Billions Lost When Shit Coins Go to Zero - Bloomberg ",32606.42,"Barnstable Town, MA",1173,2423,"False","False","2010-08-14 16:21:13","True","False",2423,0.8,-0.2
496,"07/08/2021",1413103474879787008," Great project, Don't miss this opportunity, this is definitely going to be HUGE  I'm happy I'm part of this great movement     bitcoin BinanceSmartChain  Crypto HODL SyrusFinance SRFBSC ",32606.42,"Indonesia",282,1549,"False","False","2017-12-18 19:09:03","True","False",1549,0.78,0.56
497,"07/08/2021",1413103474175266816,"  Yep. At the time I didn't know him except for the Pirate party. I stumbled upon his post when I started researching about it after this:  It was very confusing not finding an *official* Bitcoin website from its owners.",32606.42,"〇△□吾唯足知",8235,658,"False","True","2008-10-09 11:35:47","False","False",658,0.52,-0.39
504,"07/08/2021",1413103448229244928," Good projectGiveaway Giveaways GiveawayInspector Airdrop Airdrops Bitcoin",32606.42,"India",11,472,"False","False","2017-01-03 06:25:59","True","False",472,0.6,0.7
505,"07/08/2021",1413103446526357504,"Great project, Don't miss this opportunity, this is definitely going to be HUGE  I'm happy I'm part of this great movement     bitcoin BinanceSmartChain  Crypto HODL SyrusFinance SRFBSC  ",32606.42,"Indonesia",282,1549,"False","True","2017-12-18 19:09:03","True","False",1549,0.78,0.56
530,"07/08/2021",1413103415379513344,"Amazons Hollywood Ambitions Are Very Old-School bitcoin nft global vampiresexkittens  ",32606.42,"Matter Doesn't Matter",59272,13903,"False","False","2014-01-07 23:52:46","False","False",13903,0.15,0.1
534,"07/08/2021",1413103401647362048,"“Everybody I know has gotten rug-pulled.” Billions are lost annually through a variety of cryptocurrency scams. The way things are going—this will only get worse.  via ",32606.42,"United States of America",5297,486,"False","False","2009-03-31 16:09:28","False","False",486,0.8,-0.2
537,"07/08/2021",1413103389676908544,"Amazon’s Hollywood Ambitions Are Very Old-School  nft global vampiresexkittens bitcoin  tiktok artificialIntelligence ai robotics robot eth  neuralnetworks  ",32606.42,"Global",2278,2014,"False","False","2010-04-11 01:37:32","False","False",2014,0.15,0.1
543,"07/08/2021",1413103376053809152,"CryptoNews: | Stellar Launches StellarX | 36% Of Bitcoin In Circulation Is Lost | EOS on Bloomberg |   | Alt Coin Daily | ",32606.42,"United States of America",1440,4564,"False","False","2019-03-29 20:26:15","False","False",4564,0.125,0.125
549,"07/08/2021",1413103357904965632,"linkedin twitter facebook instagram tiktok socialmedia tumblr dogecoin deal gift gifts shoppingstaronline giftideas shop shopping affiliatemarketing bitcoin popcorn Enjoy $10 off Orders of $50+ - Use code IR10 - ",32606.42,"United States of America",67461,6353,"False","False","2012-06-25 04:38:20","False","False",6353,0.5,0.4
551,"07/08/2021",1413103356143443968,"Rather than alter the core functionality of Bitcoin’s blockchain, these types of solutions leave the original blockchain as it is and add a second layer on top to make improvements to its efficiency. lightningnetwork",32606.42,"Global",77598,53789,"False","True","2015-05-02 16:54:25","False","False",53789,0.416666666666667,0.291666666666667
555,"07/08/2021",1413103343279349760,"Buy BTC With Your Credit Card / Fast Crypto Exchange  Bitcoin BTC ETH XRP Cryptocurrency 07:51 ",32606.42,"",10268,3329,"False","False","2013-12-05 23:34:07","True","False",3329,0.6,0.2
556,"07/08/2021",1413103341761093632,"New Wallet, maybe we get a glimpse on the STC Exchange together with this redesign studentcoin bitcoin  crypto education investment LongtermInvesting ethereum ",32606.42,"United States of America",1600,605,"False","False","2014-06-07 23:44:07","True","False",605,0.454545454545455,0.136363636363636
602,"07/08/2021",1413103242305851392,"Binance is  secure and is leading the market, why not trade with it? Sign Up Now!Link: -----&gt; bitcoin binance btc bnb ethereum eth cardano polkadot xrp trx tron coinbase elonmusk tesla spacex trading forex",32606.42,"https://www.urlatlas.info/",79,163,"False","False","2020-11-15 01:52:29","True","False",163,0.6,0.4
625,"07/08/2021",1413103198034796544,"This is a good one!!, color water wow!!nftart nftcollector nft nfts cryptoart NFTartist Ethereum bitcoin  nftarts nftcollectors NFTartist",32606.42,"Thailand ",486,1043,"False","False","2009-10-20 09:28:57","False","False",1043,0.6,1
626,"07/08/2021",1413103197779075072,"Good day to buy some Bitcoin",32606.42,"",285,918,"False","False","2012-02-26 11:59:53","False","False",918,0.6,0.7
633,"07/08/2021",1413103180913815552,"How the Bitcoin Lightning Network FunctionsThe Lightning Network is what’s known as an off-chain or second-layer solution to the scalability problem, and it works on top of the blockchain.lightningnetwork",32606.42,"Global",77598,53789,"False","False","2015-05-02 16:54:25","False","False",53789,0.5,0.5
639,"07/08/2021",1413103162634870784,"Visit Morbex Finance official website here  and be familiar with the project.MorbexFinance Morbex BEX blockchain cryptocurrency technology bitcoin money crypto Binance BNB fintech ",32606.42,"",1141,1176,"False","False","2017-12-02 09:10:40","True","False",1176,0.5,0.375
647,"07/08/2021",1413103146503753728,"Kusama KSM Analysis &amp; Price Prediction THIS IS WHY Kusama WILL HIT HiG...  via  Please look for more Videos at my Youtube channel Bitcoin BTC Ripple XRP Stellar XLM VeChain VET Chainlink LINK ZIL Dogecoin ",32606.42,"",1280,4991,"False","False","2020-06-05 03:32:47","True","False",4991,0.375,0.375
652,"07/08/2021",1413103139708936192,"Join the Bitfari waitlist at  the new civic network created by JoinNow socialmedia cryptocurrency  Crypto Bitcoin BREAKING earlyaccess bitfari fari cityconnect SmartCities smartcontracts stx stacks ",32606.42,"Pittsburgh, PA",4753,498,"False","False","2007-08-16 03:15:42","False","False",498,0.454545454545455,0.136363636363636
660,"07/08/2021",1413103110944346112,"One of the most promising solutions to Bitcoin’s scalability problem is the Lightning Network.lightningnetwork",32606.42,"Global",77598,53789,"False","False","2015-05-02 16:54:25","False","False",53789,0.5,0.35
676,"07/08/2021",1413103076920201216,"This project have many best idea . The team of the best professionals with excellent content believe that this project will be top project in upcoming future. MorbexFinance Morbex BEX blockchain cryptocurrency technology bitcoin money crypto Binance  ",32606.42,"",2225,5001,"False","False","2020-07-05 09:24:09","True","False",5001,0.454166666666667,0.666666666666667
689,"07/08/2021",1413103052186394624,"ShitCoins Go down in up markets. If bitcoin is up and they are down significantly they are shit. Don’t waste your money on shit hoping that someday you’ll have your Lambo because it’s not going to happen! Crypto cryptocurrency cryptotwitter SHIBARMY SAFEMOON dogecoin",32606.42,"United States of America",47,146,"False","False","2020-09-08 03:02:52","True","False",146,0.508796296296296,-0.0976851851851852
690,"07/08/2021",1413103052140257280," Update️️️Daily crypto signals available. Join our telegram channel. Link in the bio!DOGECOIN        bitcoin  90656 ",32606.42,"",108,103,"False","False","2020-02-24 09:26:07","True","False",103,0.4,0.4
712,"07/08/2021",1413103012667707392," Which tells us you are not very good with investment and the concept of Time Bitcoin",32606.42,"home",56,211,"False","False","2020-10-31 15:47:39","True","False",211,0.461538461538462,-0.269230769230769
722,"07/08/2021",1413102986117722112,"Some investors see these articles and these dips and get scared. I see that every time there is an article about bitcoin or Ethereum, doge gets a mention. Same can't be said the other way around. Pay attention hodl dogecoin ",32606.42,"United States of America",900,1804,"False","False","2020-02-23 01:27:08","True","False",1804,0.25,-0.0625
726,"07/08/2021",1413102982439137280,"We have smart community. ",32606.42,"United States of America",43310,1786,"False","True","2009-01-11 18:01:37","False","False",1786,0.642857142857143,0.214285714285714
