"X","Date","TweetID","Text","BTC.Price","User.Location","User.follower.count","UserFollowingCount","User.Verified","Quote.Status.","AccountCreationDate","Default.Profile.Theme.","DefaultProfileImage","TotalAccountLikes","Subjectivity","Polarity"
935,"07/12/2021",1414602250970927104,"It's time to take a closer look at Bitcoin in Tanzania! Get comfy, grab a drink &amp; learn the latest... LocalBitcoins LocalBitcoinsTV CloserLook Tanzania ",33331,"190+ countries 🌎",59716,204,"False","False","2012-06-15 11:30:22","False","False",204,0.9,0.5
937,"07/12/2021",1414602249473433600," good team, potential project, i always support the development team to the moon, thanks for the great gift    KUAPE KUCOIN KCC MEME BITCOIN KUAPEFINANCE",33331,"Indonesia",4931,1390,"False","False","2013-12-10 07:37:23","False","False",1390,0.6375,0.425
942,"07/12/2021",1414602244331278336,"Imagine if Bitcoin could be time-locked for yield, and all the weak hands that emergency unlocked were heavily penalized, and their penalized Bitcoin was redistributed to loyal hodlers?Wow, wouldn't that be an interesting concept. I wonder which project does that.",33331,"The Metaverse",2599,671,"False","False","2019-08-23 04:25:20","True","False",671,0.614583333333333,0.0645833333333333
954,"07/12/2021",1414602233686093824," project looks very interesting. I am interested, and I will support this project until it is successful according to the plan that has been setKUAPE KUCOIN KCC MEME BITCOIN KUAPEFINANCE",33331,"",131,1027,"False","False","2019-08-01 09:28:44","True","False",1027,0.7,0.55
967,"07/12/2021",1414602217471057920,"First time seeing that this FED chart measures M2 in ""1982-84 dollars""Can anyone explain how that over/understates the actual money printing?     bitcoin ",33331,"Canada",472,1750,"False","False","2009-10-03 22:44:22","True","False",1750,0.216666666666667,0.125
975,"07/12/2021",1414602210848100352," Very nice project will be huge soon   KUAPE KUCOIN KCC GIVEAWAY MEME BITCOIN KUAPEFINANCE DEX IDO",33331,"",47,391,"False","False","2020-07-16 12:01:32","True","False",391,0.95,0.59
989,"07/12/2021",1414602186793754624," Would be better if  Thailand wasn't holding my Bitcoin after closing down in that country in 2016.Hey  - how about letting me talk to a REAL person? I have only been trying to reach you for over 4 years!!! I need a contact for a REAL person there.",33331,"Nanotopia - Green Rabbit Game",163,301,"False","False","2020-11-12 01:52:42","True","False",301,0.477777777777778,0.148888888888889
997,"07/12/2021",1414602173581643776," Best project ever Thumbs upI'm very happy to be participating in this projectI hope this project will gain more popularity in the futureI hope I'm the lucky one to join this amazing projectKUAPE KUCOIN KCC MEME BITCOIN KUAPEFINANCE",33331,"",40,440,"False","False","2020-10-19 08:25:26","True","False",440,0.706666666666667,0.686666666666667
998,"07/12/2021",1414602172063371264," suspense thriller *What is Bitcoin ...Is Crypto an investment or a sophisticated pyramid or a scheme to hide profits or illegal transactions -or- worse... ",33331,"South West",2477,2423,"False","False","2010-12-02 19:26:07","False","False",2423,0.7,-0.133333333333333
1008,"07/12/2021",1414602153864302592,"good project and nice post   KUAPE KUCOIN KCC MEME BITCOIN KUAPEFINANCE ",33331,"Indonesia",48,228,"False","True","2020-01-08 03:06:49","True","False",228,0.8,0.65
1013,"07/12/2021",1414602144301285376," I believe this is a faithful project.The projector has a lot of attractions so hopefully the project will be better in the future and will be the best.   KUAPE KUCOIN KCC MEME BITCOIN KUAPEFINANCE",33331,"",113,1051,"False","False","2020-01-13 03:41:14","True","False",1051,0.308333333333333,0.5
1014,"07/12/2021",1414602144263680000,"Digital assets are deceiving in that they appear out of thin air, but there is real power usage behind mining bitcoin. In fact, bitcoin mining today is nearly 15x more carbon intensive than mining an equivalent amount of gold (in dollar terms).(via ) ",33331,"Global",216,222,"False","False","2020-03-11 03:47:34","True","False",222,0.458333333333333,-1.85037170770859e-17
1024,"07/12/2021",1414602134440448000," But for last three months Bitcoin is down by more than 50%. Is that the safety level?",33331,"India",3567,404,"False","False","2010-03-27 18:57:42","True","False",404,0.285185185185185,0.114814814814815
1026,"07/12/2021",1414602133312208896,"This project looks very interesting. I am interested, and I will support this project until it is successful according to the plan that has been set  KUAPE KUCOIN KCC MEME BITCOIN KUAPEFINANCE",33331,"",107,573,"False","False","2015-08-08 03:38:20","True","False",573,0.7,0.55
1035,"07/12/2021",1414602127750557696,"Check out my latest video guys ;)    cryptomatatan crypoforbeginners crypto bitcoin altcoins",33331,"United States of America",223,2130,"False","False","2018-01-13 01:11:46","True","False",2130,0.95,0.375
1039,"07/12/2021",1414602123384213504," Good day, how are you doing guys? We will have a big campaign on Monday, are you guy ready to participate? Guess what?️‍️You are the pioneer in our communityKUAPE KUCOIN KCC MEME BITCOIN KUAPEFINANCE DEX IDO AIRDROP GIVEAWAY",33331,"United States of America",8,420,"False","False","2020-12-21 17:19:47","True","False",420,0.4,0.3
1040,"07/12/2021",1414602122553819136,"Amazing Project Good Luck To All Participant    KUAPE KUCOIN KCC GIVEAWAY MEME BITCOIN KUAPEFINANCE DEX IDO ",33331,"Indonesia",593,1505,"False","True","2010-05-04 03:28:17","False","False",1505,0.75,0.65
1050,"07/12/2021",1414602115914240000,"Buy Crypto With Your Credit Card / Fast Crypto Exchange  Bitcoin BTC ETH XRP Crypto 11:06 ",33331,"",10276,3327,"False","False","2013-12-05 23:34:07","True","False",3327,0.6,0.2
1053,"07/12/2021",1414602113754144768,"This is good projects KUAPE KUCOIN KCC MEME BITCOIN KUAPEFINANCE DEX IDO AIRDROP GIVEAWAY",33331,"",23,329,"False","False","2019-04-30 05:51:15","True","False",329,0.6,0.7
1057,"07/12/2021",1414602109694189568,"Grayscale also publicly filed three Form 10 registration statements on behalf of Grayscale Bitcoin Cash Trust, Grayscale Ethereum Classic Trust, and Grayscale Litecoin Trust.crypto $doge",33331,"United States of America",107,268,"False","False","2019-09-03 13:13:20","True","False",268,0.116666666666667,0.0833333333333333
1064,"07/12/2021",1414602102417018880," Bitcoin For all ichimoku junkies out there. You can see kijun reaction and where price wants to go on higher time frame: ",33331,"Космос",61,495,"False","False","2020-01-04 22:55:59","True","False",495,0.3,0.225
1074,"07/12/2021",1414602090245206016,"HIVE Buys 3,019 New Bitcoin Mining Rigs, Joins Foundry USA Pool: ",33331,"Canada",404,355,"False","False","2008-09-15 14:40:57","False","False",355,0.454545454545455,0.136363636363636
1078,"07/12/2021",1414602085316710400," This airdrop good and good teamKUAPE KUCOIN KCC MEME BITCOIN KUAPEFINANCE",33331,"",106,600,"False","False","2018-09-20 01:40:10","True","False",600,0.6,0.7
1093,"07/12/2021",1414602065863606272,"   Good project$$HAMSTER BinanceSmartChain  Binance  PancakeSwap Bitcoin  ",33331,"Myanmar",60,589,"False","False","2019-04-25 08:07:45","True","False",589,0.6,0.7
1094,"07/12/2021",1414602063703576576,"    Bitcoin is my full time Hobbs but since yesterday, you're my hobby scammer.So do you ?",33331,"El Salvador",2121,1210,"False","False","2020-08-12 10:31:54","True","False",1210,0.55,0.35
1097,"07/12/2021",1414602060771729408,"  This is a great and excellent project and also the reward is great. Thanks for shared this wonderful opportunity. Best wishes for all team members. Keep going and get to the success!Rocket KUAPE KUCOIN KCC MEME BITCOIN KUAPEFINANCE",33331,"Indonesia",698,754,"False","False","2010-08-28 20:04:46","False","False",754,0.666666666666667,0.8
1101,"07/12/2021",1414602058200600576,"     Agreed! let’s churn in more nodes until we reach 100. Now we have to reboot TC ASAP!",33331,"Singapore",702,269,"False","False","2012-05-27 12:48:36","True","False",269,0.5,0.625
1105,"07/12/2021",1414602056606785536,"I have participated in following the guidelines and rules of this airdrop, I hope that many people will be lucky to get a prize from this airdrop.   KUAPE KUCOIN KCC MEME BITCOIN KUAPEFINANCE",33331,"India",40,1143,"False","False","2013-09-06 13:27:03","True","False",1143,0.477777777777778,0.277777777777778
1110,"07/12/2021",1414602052349480960,"The project is implemented very professionally and has a clear development plan. Made by a very professional and experienced team    KUAPE KUCOIN KCC MEME BITCOIN KUAPEFINANCE ",33331,"",183,600,"False","True","2020-04-01 05:00:22","True","False",600,0.385833333333333,0.29
1122,"07/12/2021",1414602030476263424,"XMR is a shitcoin with significant transactional privacy benefitsit will be rendered useless with next-gen Bitcoin privacy featuresuntil then, it will have a place in the world",33331,"pnw (not for long)",1409,339,"False","False","2010-08-17 05:37:59","False","False",339,0.5375,-0.0625
1128,"07/12/2021",1414602023794659328,"  The project is implemented very professionally and has a clear development plan. Made by a very professional and experienced team    KUAPE KUCOIN KCC MEME BITCOIN KUAPEFINANCE",33331,"",183,600,"False","False","2020-04-01 05:00:22","True","False",600,0.385833333333333,0.29
1135,"07/12/2021",1414602016593223680,"linkedin birthdaygift twitter facebook instagram tiktok socialmedia tumblr dogecoin deal gift gifts giftideas shop shopping affiliatemarketing bitcoin popcorn Enjoy $10 off Orders of $50+ - Use code IR10 - ",33331,"United States of America",67542,6497,"False","False","2012-06-25 04:38:20","False","False",6497,0.5,0.4
1142,"07/12/2021",1414602010381283328," Good project   KUAPE KUCOIN KCC MEME BITCOIN KUAPEFINANCE DEX IDO AIRDROP GIVEAWAY",33331,"",86,1247,"False","False","2020-01-08 05:05:54","True","False",1247,0.6,0.7
1143,"07/12/2021",1414602008867209216," Good day, how are you doing guys? We will have a big campaign on Monday, are you guy ready to participate? Guess what?️‍️You are the pioneer in our communityKUAPE KUCOIN KCC MEME BITCOIN KUAPEFINANCE DEX IDO AIRDROP GIVEAWAY",33331,"Indonesia",15,143,"False","False","2018-12-30 10:00:57","False","False",143,0.4,0.3
1146,"07/12/2021",1414602002588258304,"I have participated in following the guidelines and rules of this airdrop, I hope that many people will be lucky to get a prize from this airdrop   KUAPE KUCOIN KCC MEME BITCOIN KUAPEFINANCE ",33331,"",220,778,"False","True","2015-01-17 10:47:29","True","False",778,0.477777777777778,0.277777777777778
1148,"07/12/2021",1414602000428199936,"Good project is a potential. Come on join us.KUAPE KUCOIN KCC MEME BITCOIN KUAPEFINANCE",33331,"Pontianak",207,617,"False","False","2012-04-14 09:27:36","False","False",617,0.8,0.35
1149,"07/12/2021",1414601999136399360," Believe this is a faithful project. The projector has a lot of attractions so hopefully the project will be better in the future and will be the bestCheck it out guys!     KUAPE KUCOIN KCC MEME BITCOIN KUAPEFINANCE",33331,"",25,828,"False","False","2020-07-17 15:12:58","True","False",828,0.3125,0.25
1152,"07/12/2021",1414601997626462208,"  Good news! Hoping this project will succes and grow up, and thanks to dev and team for this hardwork u guys the best we apreciate! Thanks! KUAPE KUCOIN KCC MEME BITCOIN KUAPEFINANCE",33331,"",101,1118,"False","False","2018-07-09 06:14:34","True","False",1118,0.325,0.58125
1158,"07/12/2021",1414601989929848832,"   Can I get a product out of gold? Can I get a product out of Bitcoin?The problem with all the replies is it demonstrates the cultish behavior behind crypto. Any criticism against it is seen as being anti-crypto.",33331,"",67,361,"False","False","2020-11-25 20:21:16","True","False",361,0.7,-0.4
1159,"07/12/2021",1414601989711753216,"  Great and nice project, lets join guys this is an big project    KUAPE KUCOIN KCC GIVEAWAY MEME BITCOIN KUAPEFINANCE DEX IDO",33331,"Indonesia",94,1220,"False","False","2014-12-10 08:26:24","True","False",1220,0.616666666666667,0.466666666666667
1168,"07/12/2021",1414601976474529792," good project, hopefully in the future it can be even more successful for the team KUAPE KUCOIN KCC MEME BITCOIN KUAPEFINANCE",33331,"Indonesia",29,502,"False","False","2020-11-07 18:47:50","True","False",502,0.54375,0.4875
1170,"07/12/2021",1414601972838060032,"Kuape Finance is a team of experienced blockchain and marketing experts in the field, this help us to complete this huge decentralized project.Follow  and visit KUAPE KUCOIN KCC MEME BITCOIN KUAPEFINANCE ",33331,"Indonesia",393,3381,"False","False","2019-07-12 23:59:17","True","False",3381,0.733333333333333,0.433333333333333
1173,"07/12/2021",1414601970124423168,"Good news! Hoping this project will succes and grow up, and thanks to dev and team for this hardwork u guys the best we apreciate! Thanks! KUAPE KUCOIN KCC MEME BITCOIN KUAPEFINANCE ",33331,"",101,1118,"False","True","2018-07-09 06:14:34","True","False",1118,0.325,0.58125
1176,"07/12/2021",1414601965724606464,"Guys, don't miss this opportunity, this project will be a great investment for youClaim your airdropGet ready for the moon   KUAPE KUCOIN KCC MEME Bitcoin KUAPEFINANCE",33331,"",158,1292,"False","False","2020-05-05 15:13:04","True","False",1292,0.625,0.5
1183,"07/12/2021",1414601953745666048,"Join Airdrop KuApe! What's KuApe? Kuape Finance is a team of experienced blockchain and marketing experts in the field, this help us to complete this huge decentralized projectKUAPE KUCOIN KCC MEME BITCOIN KUAPEFINANCE",33331,"",59,390,"False","False","2018-05-14 21:33:49","True","False",390,0.733333333333333,0.433333333333333
1187,"07/12/2021",1414601946929926144," The Most Diversified Decentralized Meme Token Ecosystem For Kucoin Community ChainThis is KuApe Financevisit link:  KUAPE KUCOIN KCC GIVEAWAY MEME BITCOIN KUAPEFINANCE DEX IDO",33331,"",214,1928,"False","False","2016-03-11 11:37:52","True","False",1928,0.5,0.5
1188,"07/12/2021",1414601946321719296," I believe this is a faithful project.The projector has a lot of attractions so hopefully the project will be better in the future and will be the best.I love     KUAPE KUCOIN KCC GIVEAWAY MEME BITCOIN  KUAPEFINANCE DEX IDO",33331,"",117,309,"False","False","2018-10-16 16:58:38","True","False",309,0.408333333333333,0.333333333333333
1190,"07/12/2021",1414601943842844672," a project that I thought would be an extraordinary project.  Projects with full support by a good and professional team.  Very good project for future.  KUAPE KUCOIN KCC MEME BITCOIN KUAPEFINANCE",33331,"Indonesia",17,189,"False","False","2019-07-05 15:43:37","True","False",189,0.525833333333333,0.398888888888889
1207,"07/12/2021",1414601919578869760,"Amazing project with great potential. The team's dedication and ingenuity with excellent fan support will make this the envy of the crypto world. Glad to be part.Join the Airdrop KUAPE KUCOIN KCC GIVEAWAY BITCOIN KUAPEFINANCE DEX",33331,"",113,137,"False","False","2020-09-18 22:35:25","True","False",137,0.93,0.58
1213,"07/12/2021",1414601912809246720,"  It's a great and excellent project and also a great prize. Thank you for sharing this wonderful opportunity. Best wishes to all team members. Keep going and be successful KUAPE KUCOIN KCC MEME BITCOIN KUAPEFINANCE",33331,"",47,363,"False","False","2020-10-01 22:43:25","True","False",363,0.791666666666667,0.891666666666667
1215,"07/12/2021",1414601910741393408,"This project looks very interesting. I am interested, and I will support this project until it is successful according to the plan that has been setKUAPE KUCOIN KCC MEME BITCOIN KUAPEFINANCE",33331,"World",1035,2650,"False","False","2013-04-05 00:42:17","True","False",2650,0.7,0.55
1225,"07/12/2021",1414601898544431104,"I believe this is a faithful project.The projector has a lot of attractions so hopefully the project will be better in the future and will be the best.️️️  KUAPE KUCOIN KCC MEME BITCOIN  KUAPEFINANCE DEX IDO AIRDROP GIVEAWAY ",33331,"",134,405,"False","True","2013-07-22 07:22:01","False","False",405,0.3125,0.25
1229,"07/12/2021",1414601897403551744," you need to some research on hardware Bitcoin wallets. They’re incredibly common in the crypto world. Super cringe segment today.",33331,"127.0.0.1",922,963,"False","False","2009-06-02 07:36:26","False","False",963,0.583333333333333,0.0166666666666667
1236,"07/12/2021",1414601891435057152,"I believe this is a faithful project.The projector has a lot of attractions so hopefully the project will be better in the future and will be the best.    "" KUAPE KUCOIN KCC MEME BITCOIN KUAPEFINANCE "" ",33331,"",237,1807,"False","True","2020-11-04 14:38:07","True","False",1807,0.308333333333333,0.5
1246,"07/12/2021",1414601881117069312,"Hello friends...I have a nice projeck of KuApe Finance,Join guys, this is good project, don't missKUAPE KUCOIN KCC GIVEAWAY MEME BITCOIN KUAPEFINANCE DEX IDO",33331,"Indonesia",174,1487,"False","False","2020-07-14 03:53:35","True","False",1487,0.8,0.65
1247,"07/12/2021",1414601880689385472,"Yup it looks like  are busy buying bitcoin ",33331,"United Kingdom",10295,1662,"False","False","2018-08-18 18:19:21","True","False",1662,0.3,0.1
1255,"07/12/2021",1414601875521945600,"$epay PEOPLE DONT BE BLIND WITH THERE CLAIMS THEY ARE THE FIRST AND ONLY POS IN CRYPTO DYOR THERE IS MANY BY BILLION DOLLAR COMPANIES",33331,"United States of America",162,866,"False","False","2017-01-12 15:56:09","True","False",866,0.625,0.0625
1272,"07/12/2021",1414601857343709184,"Good AirdropKUAPE KUCOIN KCC MEME BITCOIN KUAPEFINANCA ",33331,"Indonesia",441,728,"False","True","2020-01-10 04:38:39","True","False",728,0.6,0.7
1277,"07/12/2021",1414601851530399744,"Best project ever Thumbs upI'm very happy to be participating in this projectI hope this project will gain more popularity in the futureI hope I'm the lucky one to join this amazing projectKUAPE KUCOIN KCC MEME BITCOIN KUAPEFINANCE ",33331,"United States of America",83,576,"False","True","2020-05-28 15:30:25","True","False",576,0.706666666666667,0.686666666666667
1287,"07/12/2021",1414601839333371904,"A good project and strong team, in a predictable and transparent road map, planned and projected. I think in the near future I will see an authentic growth of this project.KUAPE KUCOIN KCC MEME BITCOIN KUAPEFINANCE ",33331,"",68,494,"False","False","2020-01-08 01:58:14","True","False",494,0.518055555555556,0.255555555555556
1289,"07/12/2021",1414601836401553408," Good ProjectLet's join nowKUAPE KUCOIN KCC MEME BITCOIN KUAPEFINANCE",33331,"",43,733,"False","False","2020-04-27 15:23:18","True","False",733,0.6,0.7
1298,"07/12/2021",1414601829002846208," I believe this is a faithful project.The projector has a lot of attractions so hopefully the project will be better in the future and will be the best.I love it. Go moonKUAPE KUCOIN KCC MEME BITCOIN KUAPEFINANCE",33331,"",51,580,"False","False","2020-04-17 13:54:50","True","False",580,0.408333333333333,0.333333333333333
1301,"07/12/2021",1414601824380678144,"Best project ever I'm very happy to be participating in this projectI hope this project will gain more popularity in the futureI hope I'm the lucky one to join this amazing projectKUAPE KUCOIN KCC MEME BITCOIN KUAPEFINANCE ",33331,"",220,778,"False","True","2015-01-17 10:47:29","True","False",778,0.706666666666667,0.686666666666667
1321,"07/12/2021",1414601795528187904," It’s a dip bro a big long dip down the drain, don’t listen to the Bitcoin maxi’s selling down on the dumb money. We heading to 20s soon",33331,"United States of America",128,212,"False","False","2009-11-04 16:36:08","True","False",212,0.315555555555556,-0.147222222222222
1327,"07/12/2021",1414601782886486016,"Hi lets join this airdrop ptojectKUPA FINNACE project very intrested and perfect Joun now dont miss If u want get free monyKUAPE KUCOIN KCC MEME BITCOIN KUAPEFINANCE ",33331,"",292,1338,"False","True","2020-07-17 07:26:58","True","False",1338,0.7,0.533333333333333
1340,"07/12/2021",1414601759062839296,"  This is a great and excellent project and also the reward is great. Thanks for shared this wonderful opportunity. Best wishes for all team members. Keep going and get to the successKUAPE KUCOIN KCC MEME BITCOIN KUAPEFINANCE",33331,"",111,1430,"False","False","2016-08-14 00:39:36","True","False",1430,0.666666666666667,0.8
1341,"07/12/2021",1414601756797931520," Good project    KUAPE KUCOIN KCC GIVEAWAY MEME BITCOIN KUAPEFINANCE DEX IDO",33331,"",86,1247,"False","False","2020-01-08 05:05:54","True","False",1247,0.6,0.7
1342,"07/12/2021",1414601756382666752,"As Hollywood’s Latest Bitcoin Promoter, Spike Lee Highlights Sovereign Potential Of BTC ",33331,"",18293,10227,"False","False","2009-11-04 18:04:28","False","False",10227,0.95,0.25
1358,"07/12/2021",1414601739710263296," a project that I thought would be an extraordinary project.  Projects with full support by a good and professional team.  Very good project for future. KUAPE KUCOIN KCC MEME BITCOIN KUAPEFINANCE",33331,"Indonesia",17,189,"False","False","2019-07-05 15:43:37","True","False",189,0.525833333333333,0.398888888888889
1363,"07/12/2021",1414601735297847296,"  Amazing project with great potential. The team's dedication and ingenuity with excellent fan support will make this the envy of the crypto world. Glad to be part.KUAPE KUCOIN KCC GIVEAWAY BITCOIN KUAPEFINANCE DEX",33331,"",100,932,"False","False","2020-12-04 11:43:52","True","False",932,0.93,0.58
1372,"07/12/2021",1414601727580377088," This project is really good, Very enthusiastic team, Great community, I hope the project thrives, I love your project. KUAPE KUCOIN KCC GIVEAWAY MEME BITCOIN KUAPEFINANCE DEX IDO",33331,"",89,752,"False","False","2020-10-04 09:03:31","True","False",752,0.7375,0.695
1376,"07/12/2021",1414601725684551680,"This is a great and excellent project and also the reward is great. Thanks for shared this wonderful opportunity. Best wishes for all team members. Keep going and get to the success!RocketKUAPE KUCOIN KCC MEME BITCOIN KUAPEFINANCE",33331,"",29,872,"False","False","2020-12-28 23:58:42","True","False",872,0.666666666666667,0.8
1378,"07/12/2021",1414601723168047104,"HIVE Buys 3,019 New Bitcoin Mining Rigs, Joins Foundry USA Pool crypto cryptocurrency blockchain bitcoin ethereum antifud fightfomo ",33331,"United States of America",4435,5007,"False","False","2009-06-17 15:05:02","False","False",5007,0.454545454545455,0.136363636363636
1380,"07/12/2021",1414601721544798208," Great and nice.Join here ASAP.KUAPE KUCOIN KCC MEME BITCOIN KUAPEFINANCE",33331,"Surabaya",38,1294,"False","False","2020-09-17 15:55:23","True","False",1294,0.75,0.8
1394,"07/12/2021",1414601708630470656,"Countdown to Grayscale’s big BTC unlock: 5 things to watch in Bitcoin this week: A decisive month for GBTC market impact is set to begin, with BTC price action still…   |   |  cryptocurrency Bitcoin Forex ",33331,"",6962,15980,"False","False","2015-10-13 01:53:50","False","False",15980,0.1,0.05
1415,"07/12/2021",1414601674904150016,"with the opportunity to take part in this airdrop, I am very enthusiastic because this is an excellent project, let's take it to the moon.KUAPE KUCOIN KCC MEME BITCOIN KUAPEFINANCE",33331,"",39,1210,"False","False","2020-03-07 14:32:30","True","False",1210,1,0.89
1432,"07/12/2021",1414601646726795264," Best project ever Thumbs upIm very happy to be participating in this projectI hope this project will gain more popularity in the futureI hope Im the lucky one to join this amazing project  KUAPE KUCOIN KCC MEME BITCOIN KUAPEFINANCE",33331,"",96,723,"False","False","2020-08-04 10:18:47","True","False",723,0.706666666666667,0.686666666666667
1440,"07/12/2021",1414601632948629504," Another bitcoin wannabe millionaire who doesn't give a shit for the environment.",33331,"Somewhere over the Rainbow 🌈 ",4167,4517,"False","False","2018-12-27 18:52:35","False","False",4517,0.8,-0.2
1463,"07/12/2021",1414601607795208192,"Easy short, hopefully you listened to Santa. As mentioned, I have been partaking in more intraday setups since  seems to be trading in a range.If you followed, congrats!Exited this short now and took profits.BTC Bitcoin Altcoins  ",33331,"Christmas Island",5538,692,"False","True","2020-06-05 16:41:26","True","False",692,0.483333333333333,0.233333333333333
1467,"07/12/2021",1414601600845312000,"I feel this project has a lot of potential. I hope that the project will thrive in the near future.KUAPE KUCOIN KCC MEME BITCOIN KUAPEFINANCE ",33331,"",11,228,"False","False","2020-12-10 13:57:47","True","False",228,0.7,0.05
1471,"07/12/2021",1414601597552709632,"This is definitely going to be HUGE!  as the team has been an inspiration in their innovative approaches towards achieving the project goals and visions , I am so glad to be part of this.KUAPE KUCOIN KCC MEME BITCOIN KUAPEFINANCE",33331,"",14,308,"False","False","2020-06-23 11:20:16","True","False",308,0.85,0.375
1472,"07/12/2021",1414601591588495360,"Amazing project with great potential. The team's dedication and ingenuity with excellent fan support will make this the envy of the crypto world. Glad to be part.   KUAPE KUCOIN KCC GIVEAWAY BITCOIN KUAPEFINANCE DEX",33331,"Jogja",198,1275,"False","False","2013-01-16 08:57:32","True","False",1275,0.93,0.58
1478,"07/12/2021",1414601586043727872,"Forget Bitcoin, Here are Two Cheap Stock Canadian Investors Should Consider  ",33331,"Global",14150,10374,"False","False","2009-05-14 11:39:17","False","False",10374,0.7,0.4
1480,"07/12/2021",1414601583661404160," good project strong team, transparent roadmap, clear plan, please wait for the development of the project to the moon  KUAPE KUCOIN KCC MEME BITCOIN KUAPEFINANCE",33331,"",27,597,"False","False","2020-11-23 16:16:36","True","False",597,0.572222222222222,0.411111111111111
