"X","Date","TweetID","Text","BTC.Price","User.Location","User.follower.count","UserFollowingCount","User.Verified","Quote.Status.","AccountCreationDate","Default.Profile.Theme.","DefaultProfileImage","TotalAccountLikes","Subjectivity","Polarity"
1601,"07/08/2021",1413101077612797952,"The time LeBron took his talents to South Beach and the best one-liners in sports   ️  Bitcoin Sportsbook ",32606.42,"",649,827,"False","False","2016-12-16 21:14:48","False","False",827,0.3,1
1605,"07/08/2021",1413101070579081216,"Amp Analysis &amp; Price Prediction Top Crypto 2021 Amp dump Chromia, CHZ, FTM  via  Please look for more Videos at my Youtube channel Bitcoin BTC Ripple XRP Stellar XLM VeChain VET Chainlink LINK ZIL Dogecoin ",32606.42,"",1280,4991,"False","False","2020-06-05 03:32:47","True","False",4991,0.416666666666667,0.416666666666667
1607,"07/08/2021",1413101065235542016,"Prices of many of the top 10 cryptocurrencies, including Bitcoin and Ethereum, are sliding today, while NFT platform Flow surged by 20%.  ",32606.42,"United States of America",58506,2393,"False","False","2018-05-07 16:39:25","False","False",2393,0.5,0.5
1611,"07/08/2021",1413101060856627200," It’s never too late I believe even though the bitcoin is at the brink of a movement never seen before. Keep buying, keep growing, keep trading. A good repository of information for me has been Robin Moore and I keep saying thanks to the universe for bringing me and her in contact",32606.42,"Trivandrum",10,102,"False","False","2010-12-29 08:00:33","False","False",102,0.466666666666667,0.2
1616,"07/08/2021",1413101054900768768,"  and Michael Saylor are going to go down as two of the most hated people on the Internet BTC Bitcoin",32606.42,"United Kingdom",254,825,"False","False","2019-11-19 17:44:01","True","False",825,0.496296296296296,-0.185185185185185
1625,"07/08/2021",1413101037066588160," Smart ones invest in bitcoin companies  ",32606.42,"United States of America",1162,1457,"False","False","2016-01-02 16:39:03","True","False",1457,0.642857142857143,0.214285714285714
1633,"07/08/2021",1413101024546525184,"WHO PICKED THE LAST TOP OF OIL MARKET,2014, WTI @ $107 PER BB? WHO PICKED BOTTOM AT MINUS -$37 BB, APRIL 20,2020? THE FVCKING TRILLION DOLLAR MAN-THAT'S WHO! WHAT HAVE U EVER PICKED BUT UR NOSE-LOL! JUST HOW SWITCHED ON IS HE REF BITCOIN VS QLA? SEE HERE:  ",32606.42,"United Kingdom",39382,1395,"False","False","2009-08-04 00:25:36","False","False",1395,0.222222222222222,0.114583333333333
1676,"07/08/2021",1413100955781013504,"  Life is like bitcoin. Our souls trace back to the genesis event. My life...a minted token off the master template, nft class. I'm unique, yet I'm connected to the source. Still, I bet your analogy was better. Fortnite for the Soul. Better than chicken soup.",32606.42,"United States of America",276,981,"False","False","2020-02-22 23:50:51","True","False",981,0.59,0.155
1677,"07/08/2021",1413100954241572864," Impresive and great project. I trust this project can be successfully  Airdrop Bitcoin crypto Blockchain Lovelylnu",32606.42,"bandung hard core",36,781,"False","False","2015-01-28 12:22:50","True","False",781,0.85,0.775
1684,"07/08/2021",1413100947534876672,"Very good project cryptocurrency BSC Bitcoin Ethereum ETH Airdrop bounty FarmsSwap FRP AirdropStario ",32606.42,"",81,1145,"False","True","2019-12-12 06:04:35","True","False",1145,0.78,0.91
1697,"07/08/2021",1413100924646666240,"Recall that  said that investing in Bitcoin  is a “less dumb form of liquidity than cash” after the electric carmarker bought $1.5bn (£1.07bn) of the cryptocurrency. ",32606.42,"Money Power Respect",406,110,"False","True","2015-10-22 00:23:49","True","False",110,0.283333333333333,-0.270833333333333
1710,"07/08/2021",1413100904778063872," Are people going to have to sell there stocks to meet margin calls in bitcoin or bitcoin to meet margin calls on stocks??? Could be some epic moves in all markets",32606.42,"",62,361,"False","False","2011-08-06 07:09:45","True","False",361,0.4,0.1
1712,"07/08/2021",1413100900848046080,"Impresive and great project. I trust this project can be successfully  Airdrop Bitcoin crypto Blockchain Lovelylnu ",32606.42,"bandung hard core",36,781,"False","True","2015-01-28 12:22:50","True","False",781,0.85,0.775
1714,"07/08/2021",1413100898499371008,"Excellent financial project with good development prospects.covir is the Best project. I'm happy to be on Board Covir. so it deserves the attention of people from all over the world.Presale blockchain cryptotrading investing cryptocurrency bitcoin trading altcoin",32606.42,"Bangladesh",4079,4744,"False","False","2019-12-03 02:43:09","True","False",4744,0.58,0.7
1735,"07/08/2021",1413100850482978816,"Bitcoin (BTC) Technical Forecast, Charts: Continues Sideways Price Action [Video] ",32606.42,"United Kingdom",2042,794,"False","False","2010-08-04 07:44:32","False","False",794,0.1,0.05
1736,"07/08/2021",1413100849379807232,"If you watched this advert growing up,you suppose to be married with two kid nowBitcoin Nysc wizkid ",32606.42,"",119,366,"False","False","2020-03-27 14:35:56","True","False",366,0.25,0.25
1738,"07/08/2021",1413100846477422592,"How Much Will One Bitcoin Be Worth In 20 Years? $100K? $500K? $1M? ...Attempt to answer a question that many people continually ask themselves. cc       ",32606.42,"",8576,696,"False","False","2009-07-20 06:38:56","True","False",696,0.266666666666667,0.333333333333333
1741,"07/08/2021",1413100844069769216,"  You haven't earned shit. Bitcoin is down 50% from it's highs. Alts down 60-90%. Hex is only down  12% because it's superior to the rest of the garbage in crypto. I don't want you to have fun staying poor. I want you so wallow in it. No broke boi energy over here ",32606.42,"Hexagon on Saturn's North Pole",1123,1853,"False","False","2017-09-07 06:31:54","False","False",1853,0.545833333333333,-0.00833333333333335
1747,"07/08/2021",1413100829838618624,"  south Korea largest exchange is buying every possible icx available in to the market  usually upbit cold wallet holds around 19-22 million $icx but the last couple of weeks they buying huge amounts of icx bitcoin eth bnb trx ada",32606.42,"",1116,394,"False","False","2019-07-26 19:05:40","True","False",394,0.602777777777778,-0.00833333333333331
1749,"07/08/2021",1413100827170934784,"More time, more opportunity: Are three-minute rounds coming to women's boxing?   ️  Bitcoin Sportsbook ",32606.42,"",649,827,"False","False","2016-12-16 21:14:48","False","False",827,0.5,0.5
1753,"07/08/2021",1413100822615965696,"Okay, I think now is a good time to share some potential alpha.Bitcoin USDT ",32606.42,"",892,196,"False","False","2013-10-23 06:52:41","True","False",196,0.7,0.4
1759,"07/08/2021",1413100815644979200,"    The funny thing is that there's more money to be made in shitcoins than any other ones right now. You could invest 100k into bitcoin or cardano right now and make nothing and lose money. If you put 1000 bucks into a shitcoin that does well you could make 100k EASY.",32606.42,"The Moon",68,110,"False","False","2009-03-22 20:05:36","True","False",110,0.629960317460317,0.271626984126984
1766,"07/08/2021",1413100805830414336,"This is cherry picked specifically to paint Bitcoin I’m the worst light possible  Not every mining operation does this &amp; not every coin is mined Mining is called Proof of Work. Staking, which uses 1/10th of the energy, is called proof of stake.Air conditioning is worse…",32606.42,"",430,1109,"False","False","2013-07-31 21:19:52","True","False",1109,0.9,-0.2
1771,"07/08/2021",1413100797278269440," Life is really goodStacks Bitcoin",32606.42,"Somewhere in the Jungle",214,862,"False","False","2017-06-23 10:56:17","True","False",862,0.2,0.2
1785,"07/08/2021",1413100770782744576,"  Yeah I'm fully aware of how Bitcoin is verified.Somehow I have a feeling that it would not be terribly difficult for the Bitcoin core developers too pass something that very subtly weekens Bitcoin.I would feel a lot more comfortable if the development was more anonymous",32606.42,"United States of America",551,676,"False","False","2009-01-27 03:33:57","False","False",676,0.616666666666667,0.119444444444444
1794,"07/08/2021",1413100758157963264," 10K Bitcoin looks good to me lol",32606.42,"Gods Country ",133,743,"False","False","2012-12-25 21:46:40","True","False",743,0.65,0.75
1796,"07/08/2021",1413100754785738752,"Thank you very much for your wonderful feedback we're happy seeing you benefiting from our wonderful platformCONTACT NOW FOR INVESTMENT. cryptocurrency Bitcoin ENG England BinanceSmartChain USA UAE Bitcoin ETC APESNOTLEAVING Crypto ",32606.42,"United States of America",2110,397,"False","False","2013-03-27 19:21:48","True","False",397,0.815,0.765
1805,"07/08/2021",1413100733755543552,"Crypto &amp; Bitcoin exchange  bucket shop market leveraged to the balls by retails after a cybersecurity black swan event that could dwarf COVID crisis :doge  BTCUSD ( too much leverage) I warned about this in the past ",32606.42,"",194,299,"False","False","2020-11-21 03:11:26","True","False",299,0.294444444444444,-0.0722222222222222
1811,"07/08/2021",1413100718010126336,"Did you spot them all? How many BTCs were there? Let us know your answer in the comments below! Trade bitcoin and all your other favorite crypto for as low as PHP 50. Download the PDAX mobile app and start trading today!  ",32606.42,"",2801,206,"True","False","2018-03-05 01:46:58","True","False",206,0.54375,0.25
1815,"07/08/2021",1413100713119465472,"   The supply of bitcoin maybe 20 million but what makes it valuable, what makes it so precious,why are people lining up to buy it, why if it's so valuable does the price of it keep crashing if people want it so much while there's very little of it?",32606.42,"",83,168,"False","False","2017-11-01 12:07:22","True","False",168,0.425,-0.021875
1833,"07/08/2021",1413100686246612992,"Just remember banks love Bitcoin it's easier than storing your money in an offshore account 99% of bankers love stealing your money and destroying country's",32606.42,"",29,208,"False","False","2019-03-06 16:26:39","True","False",208,0.4,0.266666666666667
1859,"07/08/2021",1413100649986895872,"LunaLand is a peer-to-peer digital currency and store of value. It will enable you to easily send money online and be used as a medium of exchange. There is no mint function, supply is limited presale blockchain cryptotrading investing bitcoin trading altcoin cryptonews",32606.42,"",10157,10996,"False","False","2019-04-17 06:52:05","True","False",10996,0.325396825396825,0.120634920634921
1900,"07/08/2021",1413100566834733056,"Live Bitcoin Price: $32,561That's a decrease of 6.92% in the last 24hrs! Perfect time to jump in?! Buy with Binance and save 20% on buying fees FOREVER via the link below...Bitcoin Binance Crypto Doge",32606.42,"United Kingdom",39925,7516,"False","False","2011-03-09 18:59:44","False","False",7516,0.522222222222222,0.378787878787879
1901,"07/08/2021",1413100566700507136,"In the past 5 days we have seen the Lambda, Epsilon, and now Johnson Variant with COVID19All as restrictions are being lifted everywhereThose talking about the variants want us to live in a cage forever, like prisonersNo thank you.",32606.42,"United States of America",10929,11928,"False","False","2019-01-03 23:21:43","True","False",11928,0.375,-0.0568181818181818
1902,"07/08/2021",1413100566419578880,"Bitcoin maximalists know what smartcontract on Bitcoin for themThey love Stacks, period.",32606.42,"Somewhere in the Jungle",214,862,"False","False","2017-06-23 10:56:17","True","False",862,0.6,0.5
1906,"07/08/2021",1413100560497012736," Impresive and great project. I trust this project can be successfully  Airdrop Bitcoin crypto Blockchain Lovelylnu",32606.42,"bandung hard core",36,781,"False","False","2015-01-28 12:22:50","True","False",781,0.85,0.775
1907,"07/08/2021",1413100559847075840,"As with many aspects of tech and society, crypto’s emergence accelerated during the pandemic. Read this article to find out more about what industry experts are saying about cryptocurrency and its future.Dacxi Dacxicoin cryptowealth cryptocurrency",32606.42,"Singapore",1466,338,"False","False","2017-09-28 23:20:19","False","False",338,0.5,0.5
1908,"07/08/2021",1413100558341361664,"Owning Ethereum you REALLLLYare still EarlyBitcoin equivalent to 2017, most likely",32606.42,"cryptosbulls.com",4547,1045,"False","False","2019-12-22 05:35:01","True","False",1045,0.75,0.25
1925,"07/08/2021",1413100519833456640," When it comes to Bitcoin/crypto, you don't trust your government and MSM.When it comes to your health,, you do.I think it would be wise to research more when it comes to your health.",32606.42,"",132,608,"False","False","2019-12-22 08:52:16","True","False",608,0.7,0.6
1932,"07/08/2021",1413100506008809472,"Impresive and great project. I trust this project can be successfully  Airdrop Bitcoin crypto Blockchain Lovelylnu ",32606.42,"bandung hard core",36,781,"False","True","2015-01-28 12:22:50","True","False",781,0.85,0.775
1964,"07/08/2021",1413100458747568128,"Bitcoin Eyes for a Clear Direction amid the Mist",32606.42,"Oracles and Blockchain",4096,396,"False","False","2017-11-21 20:10:50","True","False",396,0.383333333333333,0.1
1976,"07/08/2021",1413100434307174400,"The world of Ycash mining anxiously awaits your arrival !Ycash  cryptocurrency Bitcoin  cryptomining ",32606.42,"",2174,211,"False","True","2019-04-10 14:16:51","True","False",211,1,-0.3125
1978,"07/08/2021",1413100432252145664," Seriously, Bitcoin is the answer to this.",32606.42,"",196,774,"False","False","2008-11-28 13:40:13","True","False",774,0.666666666666667,-0.333333333333333
1989,"07/08/2021",1413100416292724736," Tweet about Bitcoin man oh sorry not effect exactly",32606.42,"San Fransisco",408,249,"False","False","2013-08-04 17:46:06","True","False",249,0.625,-0.125
1996,"07/08/2021",1413100407786774528,"But keep promoting their Bitcoin beta test morons! ",32606.42,"Canada",7519,762,"False","True","2011-11-15 19:33:56","False","False",762,1,-1
