"X","Date","TweetID","Text","BTC.Price","User.Location","User.follower.count","UserFollowingCount","User.Verified","Quote.Status.","AccountCreationDate","Default.Profile.Theme.","DefaultProfileImage","TotalAccountLikes","Subjectivity","Polarity"
1658,"07/27/2021",1419986762936594432,"   bc those organisations have access to the money printers, which bolsters their power &amp; cements the existing broken system. when you have that proximity to the printer, why endorse an asset that threatens to shake up entire fiat farce? not in their interest to adopt bitcoin at all",37943.91,"citadel",540,3368,"False","False","2020-01-26 10:28:37","True","False",3368,0.508333333333333,-0.266666666666667
1667,"07/27/2021",1419986739225972736,"  Great Offer for crypto world.    ",37943.91,"",190,1985,"False","False","2020-08-31 08:56:10","True","False",1985,0.75,0.8
1668,"07/27/2021",1419986738974535680,"    You don't have to trust me at all, as I also don't trust you. That's why I'm running Bitcoin full nodes.That's the beauty of it. Bitcoin solved trust.",37943.91,"Switzerland",413,289,"False","False","2011-06-08 08:44:22","False","False",289,0.55,0.35
1670,"07/27/2021",1419986727008100352," the forgotten Binance packed  will surprise many people in Q4 bitcoin $band Ethereum $eth bnb tron ADA $vet DOGE $doge xrp $coti $rsr $dot $xlm $sxp $pond $zec $xvs $hot matic Crypto $reef $atom $ankr $ont $ctsi $ltc NFT $axs",37943.91,"",970,207,"False","False","2013-06-11 12:11:46","True","False",207,0.675,0.375
1708,"07/27/2021",1419986638659231744,"Great Offer for crypto world.     ",37943.91,"",190,1985,"False","True","2020-08-31 08:56:10","True","False",1985,0.75,0.8
1726,"07/27/2021",1419986594140938240,"LIVE - NEW $4,200,000 Dollar Bitcoin Trade - 25% Market Cipher Discount Marathon  ",37943.91,"",71,338,"False","False","2020-07-09 13:35:26","True","False",338,0.477272727272727,0.136363636363636
1732,"07/27/2021",1419986585483886592,"Congratulations  .Keep investing, keep earning more consistent profitThank you very much for your feedback buddy.. I'm here to give you the bestkeep your investment coming to earn more profit entrepreneur BB23 Bitcoin Binance btc CryptoNews COVID19  ",37943.91,"US",207,1702,"False","False","2020-12-06 09:02:00","True","False",1702,0.3775,0.3775
1738,"07/27/2021",1419986568073388032,"I will be publishing other indicators confirming macro-uptrend later on.Please let me know in the comments if you have any questions. Important: These indicators are MACRO (they can't predict prices in the short term).Note: not financial advice.Bitcoin indicator",37943.91,"Descentralized",641,116,"False","False","2009-01-15 23:02:04","False","False",116,0.335,0.055
1740,"07/27/2021",1419986565691019264,"I am happy to anounce that I have developed a series of Advanced Bitcoin Indicators (experimental yet).The first one is called 'Miami Indicator' (mainly based on onchain data). It predicts macro trends and it confirmed 21July was the bottom of the downtrend (we'll see). ",37943.91,"Descentralized",641,116,"False","False","2009-01-15 23:02:04","False","False",116,0.566666666666667,0.316666666666667
1755,"07/27/2021",1419986537920536576," Bitcoin is the only asset that face mass assaults from governments, religious figures, thinkers, economists... Etc. Yet despite everything, it always comes out top.",37943.91,"",141,439,"False","False","2020-09-27 20:55:10","True","False",439,0.583333333333333,0.166666666666667
1757,"07/27/2021",1419986536309956608,"  Yea buddyHey squack .. Joe..Can anybody tell me what you base your bitcoin price (+ -) on??This morning it says down 2200 (-5%) What closing price is that based on?? thxGo bitcoin",37943.91,"",59,144,"False","False","2011-04-23 04:49:05","True","False",144,0.644444444444444,-0.477777777777778
1761,"07/27/2021",1419986524335181824,"Send a Direct message if you're interested in binary option trading, forex trade and bitcoin Investment, so you can create and have your account managed by a group of professional account managersWith a minimum investment of $500 you stand to earn up too $7200 in a weeks trade ",37943.91,"United States of America",243,4035,"False","False","2019-07-16 23:23:58","True","False",4035,0.333333333333333,0.15
1773,"07/27/2021",1419986500817727488," I never thought of meeting a legit bitcoin trader after been scammed many times at my age but the heavens sent  guided me and help me make a living through bitcoin with my LUNO app , I recommend you to meet her now and also be a beneficiary of good work",37943.91,"South Africa",991,973,"False","False","2019-12-22 08:44:33","True","False",973,0.55,0.6
1774,"07/27/2021",1419986500813529088," I never thought of meeting a legit bitcoin trader after been scammed many times at my age but the heavens sent  guided me and help me make a living through bitcoin with my LUNO app , I recommend you to meet her now and also be a beneficiary of good work",37943.91,"South Africa",991,973,"False","False","2019-12-22 08:44:33","True","False",973,0.55,0.6
1784,"07/27/2021",1419986478990602240,"Congratulations  .Keep investing, keep earning more consistent profitThank you very much for your feedback buddy.. I'm here to give you the bestkeep your investment coming to earn more profit entrepreneur BB23 Bitcoin Binance btc CryptoNews COVID19  ",37943.91,"US",207,1702,"False","False","2020-12-06 09:02:00","True","False",1702,0.3775,0.3775
1791,"07/27/2021",1419986468710256640," You believe in the long-term vision for your investment And you know that in order to create that reality, you need the right knowledge, tools, support, and commitment to your own inner transformation. THAT is why I created The bitcoin mining platform for you. ",37943.91,"United States of America",248,620,"False","False","2019-02-24 10:03:00","True","False",620,0.567460317460317,0.295238095238095
1800,"07/27/2021",1419986455569604608,"  All cryptocurrencies are a scam. Also ETH (I'm not referring to Ethiopia). That's what we have been saying for years It's great that you inform people.Only Bitcoin is legitimate. Blockchain has only been invented to create Bitcoin.",37943.91,"Switzerland",413,289,"False","False","2011-06-08 08:44:22","False","False",289,0.875,0.4
1802,"07/27/2021",1419986450431545344,"   I never thought of meeting a legit bitcoin trader after been scammed many times at my age but the heavens sent  guided me and help me make a living through bitcoin with my LUNO app , I recommend you to meet her now and also be a beneficiary of good work",37943.91,"South Africa",991,973,"False","False","2019-12-22 08:44:33","True","False",973,0.55,0.6
1804,"07/27/2021",1419986448917221376,"   I want to imagine how sad a persons life would need to be to post this idiotic comment... but I also want to know more how pathetic someone's life needs to be to make a fake loser account named ""Bitcoin - Ethereum - defi- web 3.0 to spread fud... oh well",37943.91,"United States of America",91,162,"False","False","2012-07-12 03:51:56","True","False",162,0.866666666666667,-0.433333333333333
1821,"07/27/2021",1419986423214747648," I never thought of meeting a legit bitcoin trader after been scammed many times at my age but the heavens sent  guided me and help me make a living through bitcoin with my LUNO app , I recommend you to meet her now and also be a beneficiary of good work",37943.91,"South Africa",991,973,"False","False","2019-12-22 08:44:33","True","False",973,0.55,0.6
1824,"07/27/2021",1419986413974609920," I never thought of meeting a legit bitcoin trader after been scammed many times at my age but the heavens sent  guided me and help me make a living through bitcoin with my LUNO app , I recommend you to meet her now and also be a beneficiary of good work",37943.91,"South Africa",991,973,"False","False","2019-12-22 08:44:33","True","False",973,0.55,0.6
1841,"07/27/2021",1419986352708456448,"Keep investing keep earning more Profit, thanks for giving us the chance to prove how legitimate we areBitcoin ametock BBK8 bb23 Amazon AcceptDoge AcceptDoge amcstock Trump BTC Algorand AMTrading America Binance  ",37943.91,"US",207,1702,"False","False","2020-12-06 09:02:00","True","False",1702,0.35,0.35
1842,"07/27/2021",1419986352247132160,"If that was the retest and bounce as talked about earlier, then wow Bitcoin looks strong. ",37943.91,"Where the wind takes us",14281,286,"False","False","2012-10-02 12:45:44","True","False",286,0.744444444444444,0.177777777777778
1847,"07/27/2021",1419986339332755456,"Keep investing keep earning more Profit, thanks for giving us the chance to prove how legitimate we areBitcoin ametock BBK8 bb23 Amazon AcceptDoge AcceptDoge amcstock Trump BTC Algorand AMTrading America Binance  ",37943.91,"US",207,1702,"False","False","2020-12-06 09:02:00","True","False",1702,0.35,0.35
1852,"07/27/2021",1419986333766926336,"Man it’s fucked that my insta and Twitter got hacked within 10 days of each other. One was for paid follows (to Russian and Brazilian accounts mainly) and the other was for bitcoin shit.Fuck u hackers, I can sign you out",37943.91,"Ingland innit",27,184,"False","False","2018-07-04 19:51:36","True","False",184,0.356666666666667,-0.136666666666667
1854,"07/27/2021",1419986329501380608,"New Candela Coin Podcast episode is out. We interview the founder of a new meme coin. Listen and give a thumbs up!YouTube: Spotify: Apple Podcasts: cryptocurreny ethereum bitcoin blockchain memecoin",37943.91,"",13005,1048,"False","False","2020-06-11 18:45:41","True","False",1048,0.454545454545455,0.136363636363636
1858,"07/27/2021",1419986320617844736," Yea people are going to get along but in the grand scheme of the world, we don't. My tweet is in relation to what I see on social media. I've called out my name simply for posting my opinions. Whether it's about crypto or covid.",37943.91,"",5846,1408,"False","False","2013-08-04 15:30:23","False","False",1408,0.474603174603175,0.177777777777778
1861,"07/27/2021",1419986317895553024,"  Great Offer for crypto world.   ",37943.91,"",190,1985,"False","False","2020-08-31 08:56:10","True","False",1985,0.75,0.8
1863,"07/27/2021",1419986310639411200," In the long term, Bitcoin will prevail with or without Amazon ",37943.91,"",360,111,"False","True","2020-09-10 15:01:36","True","False",111,0.4,-0.05
1866,"07/27/2021",1419986294097252352," I never thought of meeting a legit bitcoin trader after been scammed many times at my age but the heavens sent  guided me and help me make a living through bitcoin with my LUNO app , I recommend you to meet her now and also be a beneficiary of good work",37943.91,"South Africa",991,973,"False","False","2019-12-22 08:44:33","True","False",973,0.55,0.6
1868,"07/27/2021",1419986287306620928," if  had developed the knowledge/conviction to buy and hold bitcoin instead of fucking about with ""cryptocurrency speculation"", she wouldn't need to write articles like this",37943.91,"United States of America",1049,940,"False","False","2010-04-30 23:42:20","False","False",940,0.55,-0.25
1882,"07/27/2021",1419986263936049152," I never thought of meeting a legit bitcoin trader after been scammed many times at my age but the heavens sent  guided me and help me make a living through bitcoin with my LUNO app , I recommend you to meet her now and also be a beneficiary of good work",37943.91,"South Africa",991,973,"False","False","2019-12-22 08:44:33","True","False",973,0.55,0.6
1889,"07/27/2021",1419986246537990144," I never thought of meeting a legit bitcoin trader after been scammed many times at my age but the heavens sent  guided me and help me make a living through bitcoin with my LUNO app , I recommend you to meet her now and also be a beneficiary of good work",37943.91,"South Africa",991,973,"False","False","2019-12-22 08:44:33","True","False",973,0.55,0.6
1897,"07/27/2021",1419986224559820800," I never thought of meeting a legit bitcoin trader after been scammed many times at my age but the heavens sent  guided me and help me make a living through bitcoin with my LUNO app , I recommend you to meet her now and also be a beneficiary of good work",37943.91,"South Africa",991,973,"False","False","2019-12-22 08:44:33","True","False",973,0.55,0.6
1899,"07/27/2021",1419986221166522368,"Excellent project with very Experienced team,sure this project will be successful &amp; this project will make history in the crypto marketWebsite: Plastic finance ESG Compliant plasticfinance plastic bitcoin plasticwaste environment",37943.91,"United States of America",7000,7682,"False","False","2019-12-04 05:24:50","True","False",7682,0.983333333333333,0.916666666666667
1903,"07/27/2021",1419986214141284352," I never thought of meeting a legit bitcoin trader after been scammed many times at my age but the heavens sent  guided me and help me make a living through bitcoin with my LUNO app , I recommend you to meet her now and also be a beneficiary of good work",37943.91,"South Africa",991,973,"False","False","2019-12-22 08:44:33","True","False",973,0.55,0.6
1908,"07/27/2021",1419986201558269952,"Jeff Bezos isn’t gonna use fucking Bitcoin, people. If he is going to use crypto it’s going to be Bezos-coin, ok? What don’t we get about egomania yet?",37943.91,"United States of America",108,532,"False","False","2020-01-21 19:01:51","True","False",532,0.65,-0.05
1910,"07/27/2021",1419986198412595200," I never thought of meeting a legit bitcoin trader after been scammed many times at my age but the heavens sent  guided me and help me make a living through bitcoin with my LUNO app , I recommend you to meet her now and also be a beneficiary of good work",37943.91,"South Africa",991,973,"False","False","2019-12-22 08:44:33","True","False",973,0.55,0.6
1914,"07/27/2021",1419986193089851392,"Where can I buy shares for those medical face mask or vaccine companies? They must be doing better than Bitcoin by now. COVID19 vaccination",37943.91,"Australia",69,445,"False","False","2009-03-02 12:17:06","False","False",445,0.25,0.25
1921,"07/27/2021",1419986172420501504," I never thought of meeting a legit bitcoin trader after been scammed many times at my age but the heavens sent  guided me and help me make a living through bitcoin with my LUNO app , I recommend you to meet her now and also be a beneficiary of good work",37943.91,"South Africa",991,973,"False","False","2019-12-22 08:44:33","True","False",973,0.55,0.6
1922,"07/27/2021",1419986170268819456,"Bitcoin WebullGet 2 FREE stocks by opening and making an initial deposit of just $5! Get started with Webull today! ",37943.91,"MARS",180,257,"False","False","2009-03-01 01:00:09","False","False",257,0.4,0.2
1927,"07/27/2021",1419986142720626688," I never thought of meeting a legit bitcoin trader after been scammed many times at my age but the heavens sent  guided me and help me make a living through bitcoin with my LUNO app , I recommend you to meet her now and also be a beneficiary of good work",37943.91,"South Africa",991,973,"False","False","2019-12-22 08:44:33","True","False",973,0.55,0.6
1930,"07/27/2021",1419986137356148736,"     you guys are doing some great Bitcoin enlightment work in Slovakia ",37943.91,"Slovenská republika",46,195,"False","False","2018-01-22 20:53:04","True","False",195,0.75,0.8
1934,"07/27/2021",1419986134894006272," I never thought of meeting a legit bitcoin trader after been scammed many times at my age but the heavens sent  guided me and help me make a living through bitcoin with my LUNO app , I recommend you to meet her now and also be a beneficiary of good work",37943.91,"South Africa",991,973,"False","False","2019-12-22 08:44:33","True","False",973,0.55,0.6
1945,"07/27/2021",1419986120775979008,"    ""responsible tech"".....there's a reason why LOTS of merchants will switch to   very soon. Second to none payments solution, without all the downside paypal offers. Blue chip. Bitcoin Ethereum",37943.91,"Zürich, Schweiz 🇨🇭",451,897,"False","False","2018-09-07 03:34:53","False","False",897,0.19,0.1
1954,"07/27/2021",1419986098156081152," I never thought of meeting a legit bitcoin trader after been scammed many times at my age but the heavens sent  guided me and help me make a living through bitcoin with my LUNO app , I recommend you to meet her now and also be a beneficiary of good work",37943.91,"South Africa",991,973,"False","False","2019-12-22 08:44:33","True","False",973,0.55,0.6
1958,"07/27/2021",1419986084088500224,"Go and buy some BitcoinZ on  !Pure crypto pure decentralization  Tesla Cryptocurrency CryptoNews Bitcoin btcz",37943.91,"Slovenija",1498,4937,"False","False","2010-04-01 10:37:44","True","False",4937,0.5,0.214285714285714
1965,"07/27/2021",1419986067122532352,"Be your own bank With Bitcoin.Trade today and learn how to be your own bank. ",37943.91,"United States of America",111,1242,"False","False","2019-05-13 01:05:38","True","False",1242,1,0.6
1981,"07/27/2021",1419986035019337728," BULLWHALE! just LONGED $3,299,263 worth of Bitcoin BTC at $37,810 on Binance Futures",37943.91,"Worldwide",2233,168,"False","False","2020-07-18 19:42:11","True","False",168,0.1,0.3
1988,"07/27/2021",1419986004270780416,"Its bitcoin and we are earning.Trade with us today and attain financial freedom.DM to know more about this. ",37943.91,"United States of America",111,1242,"False","False","2019-05-13 01:05:38","True","False",1242,0.25,0.25
1990,"07/27/2021",1419985997979426816,"Cardano  ETH BTC BITCOINStake and join our Discord for more Cardano  ",37943.91,"United States of America",544,1362,"False","True","2020-08-31 06:14:08","True","False",1362,0.5,0.5
1997,"07/27/2021",1419985984901554176," I never thought of meeting a legit bitcoin trader after been scammed many times at my age but the heavens sent  guided me and help me make a living through bitcoin with my LUNO app , I recommend you to meet her now and also be a beneficiary of good work",37943.91,"South Africa",991,973,"False","False","2019-12-22 08:44:33","True","False",973,0.55,0.6
