"X","Date","TweetID","Text","BTC.Price","User.Location","User.follower.count","UserFollowingCount","User.Verified","Quote.Status.","AccountCreationDate","Default.Profile.Theme.","DefaultProfileImage","TotalAccountLikes","Subjectivity","Polarity"
686,"07/27/2021",1419988828480278528,"   Have you ever thought why he’s telling that to the public? He probably wants more people to buy into Bitcoin to pump the price higher. Why would he do that you’re asking? To take some profits and keep the shareholders happy just a little longer until the company goes bankrupt.",37943.91,"",18,176,"False","False","2020-06-17 11:35:07","True","False",176,0.444444444444444,0.260416666666667
691,"07/27/2021",1419988823019118592," The current price of bitcoin has already made those “story” incorrect and irrelevant.  is a joke.",37943.91,"Mars",51,256,"False","False","2016-06-04 23:30:44","True","False",256,0.7,-0.25
710,"07/27/2021",1419988790421164032,"business businesses earnmoney businesstips businessgrowth crypto cryptocurrency cryptocurrenices dogearmy dogecoin affiliatemarketing claim free btc eth Litecoin bitcoin doge Binance tronarmy ",37943.91,"United States of America",67792,6954,"False","False","2012-06-25 04:38:20","False","False",6954,0.8,0.4
733,"07/27/2021",1419988740932571136,"Lightning Labs is the market leader of the Lightning network, a second layer protocol that solves the core existing issues that prevent bitcoin from becoming a current method of exchange, specifically that it is slow and doesn’t scale at the base layer.",37943.91,"Global",77509,56185,"False","False","2015-05-02 16:54:25","False","False",56185,0.53,-0.13
744,"07/27/2021",1419988711278841856,"URGENT BITCOIN UPDATE! [crazy] ",37943.91,"Deutschland",349025,3350,"False","False","2017-09-04 13:39:49","True","False",3350,0.9,-0.6
751,"07/27/2021",1419988706304446464,"Bitcoin  at the current prices of $37,969is 6.54% of  Golds Market Cap Silver Mcap is much closer",37943.91,"https://www.cryptosbulls.com",4969,1044,"False","False","2019-12-22 05:35:01","True","False",1044,0.3,0.1
755,"07/27/2021",1419988697831903232,"Crypto Top 5 by Smallest 24H Range % BitClout $4.11 (4.07%) Bitcoin SV $10.03 (7.55%) ICON $0.067954 (7.80%) Nexus Mutual $6.79 (7.90%) Crypto com Coin $0.009424 (7.91%)",37943.91,"United States of America",1365,161,"False","False","2018-01-15 02:10:54","False","False",161,0.5,0.5
759,"07/27/2021",1419988690605051904,"The richest statement you could make, less about wealth, more about prosperityBitcoin Blockchain Cryptocurrency Crypto NFTCommunity NFTs NFTArt CryptoArt OpenSea DigitalArt Fashion Stylish Redbubble RBandME Ethereum BinanceSmartChain  ",37943.91,"United States of America",291,794,"False","False","2018-02-23 23:15:46","True","False",794,0.522222222222222,0.277777777777778
775,"07/27/2021",1419988665774665728,"Some equity investors steer clear of bitcoin because it has ""no earnings""But bitcoin sure comes in handy when the Government takes those earnings away with the stroke of a penNo surprise bitcoin rallies 20% as President Xi cracks down on stocks",37943.91,"Calgary",22315,606,"False","False","2013-08-02 15:29:16","False","False",606,0.615277777777778,0.261111111111111
776,"07/27/2021",1419988665594351616," Bitcoin will likely be in hyper growth phase for at least a couple of cycles. Until then, accumulate.",37943.91,"",360,111,"False","True","2020-09-10 15:01:36","True","False",111,0.7,-0.15
785,"07/27/2021",1419988650956402688,"When you tell them to long Bitcoin and they short instead  ",37943.91,"",85272,190,"False","False","2017-08-03 14:10:27","True","False",190,0.35,-0.025
787,"07/27/2021",1419988648062160896," Old news.10% of Tesla btc holding sold to ""test liquidity of bitcoin"".Publically disclosed months ago by ",37943.91,"Australia",184,582,"False","False","2019-12-05 02:48:41","True","False",582,0.2,0.1
794,"07/27/2021",1419988617552928768,"The one where a modern tech giant shows it's no big deal to mark down it's Bitcoin for the SEC'S high-time-preference quarterly reports ",37943.91,"United States of America",69,145,"False","True","2013-08-26 18:13:54","True","False",145,0.457777777777778,-0.0111111111111111
803,"07/27/2021",1419988590180831232,"“We were forced to flee the country — with our immediate family, including my disabled father — after receiving numerous death threats,” Raees Cajee has said. Africrypt bitcoin ",37943.91,"South Africa",527249,11373,"True","False","2007-01-17 12:50:26","False","False",11373,0.333333333333333,-0.166666666666667
809,"07/27/2021",1419988574842273792,"I need Bitcoin to hit a nice 127k thank you ",37943.91,"United States of America",9162,829,"True","False","2008-12-31 20:13:44","False","False",829,1,0.6
811,"07/27/2021",1419988567045115904,"If no be say Bitcoin drop I for dey receive this kind treatment now... ",37943.91,"JUPITVR",986,280,"False","True","2011-08-09 15:40:23","True","False",280,0.9,0.6
821,"07/27/2021",1419988542776807424,"Trading still going on and profits are still being made.Bitcoin is still the number one most valuable investment.Trade it.Invest in it.It is the future. ",37943.91,"United States of America",111,1242,"False","False","2019-05-13 01:05:38","True","False",1242,0.3125,0.25
856,"07/27/2021",1419988478939566080,"Binance is  secure and is leading the market, why not trade with it? Sign Up Now!Link: -----&gt; bitcoin binance btc bnb ethereum eth cardano polkadot xrp trx tron coinbase elonmusk tesla spacex trading forex",37943.91,"https://www.urlatlas.info/",95,160,"False","False","2020-11-15 01:52:29","True","False",160,0.6,0.4
874,"07/27/2021",1419988449977790464,"LTF $btc chartNot looking to buy resistance right here.  Will wait for a clean break or support. $gbtc $coin $riot $eth $doge btc bitcoin cryptocurrency ",37943.91,"",179,264,"False","False","2019-06-05 21:52:35","True","False",264,0.617857142857143,0.326190476190476
882,"07/27/2021",1419988438166777856,"Part of that 1% would be the richest in few years.Don’t sleep on bitcoin.Invest today and attain financial freedom.Be among the percentage that would smile when it goes extremely bullish. ",37943.91,"United States of America",111,1242,"False","False","2019-05-13 01:05:38","True","False",1242,0.3,-0.00625000000000001
883,"07/27/2021",1419988425843912704,"This is acutely a rather unpopular opinion..People are out there making millions by trading crypto..There is a method; and just because you don't have one, doesn't mean that others are gambling trading cryptocurrencies Bitcoin ",37943.91,"United Kingdom",210,192,"False","True","2020-02-06 09:39:35","True","False",192,0.79375,0.14375
901,"07/27/2021",1419988404268376064," Bomb: The stance against bitcoin has diverted investments to other countries.",37943.91,"",818,1056,"False","False","2013-01-06 11:47:48","False","False",1056,0.375,-0.125
923,"07/27/2021",1419988354188288000,"Bitcoin aint looking weak, shorts beware.",37943.91,"Moon",2704,325,"False","False","2020-02-26 12:31:08","True","False",325,0.625,-0.375
929,"07/27/2021",1419988344038100992," And  would say it’s good she died and her bitcoin is lost which lowers the total supply. ",37943.91,"Below the radar,abovethe water",4890,1522,"False","False","2011-03-12 03:30:02","True","False",1522,0.675,0.35
931,"07/27/2021",1419988336157073408,"Bitcoin: Americans know about cryptocurrency but most aren't interested in investing - Yahoo Finance ",37943.91,"",199,2004,"False","False","2017-07-21 13:21:33","True","False",2004,0.5,0.375
936,"07/27/2021",1419988323863384064,"New Research: Has COVID-19 Changed the Hedge Effectiveness of Bitcoin?: The Bitcoin market has become a research hotspot after the outbreak of Covid-19. In this paper, we focus on the relationships between the Bitcoin spot and…  PublicHealth HealthForAll",37943.91,"United States of America",3934,2429,"False","False","2013-04-05 14:58:05","True","False",2429,0.454545454545455,0.136363636363636
942,"07/27/2021",1419988314438971392,"""Things like bitcoin are very ripe and vulnerable to be used by extremists because of the way those technologies work. But the mainstream banking institutions ... owe it to shareholders to make sure they're not allowing extremists to exploit their services,""  ",37943.91,"United States of America",321753,978,"True","False","2011-11-03 22:17:10","False","False",978,0.562962962962963,0.0666666666666667
958,"07/27/2021",1419988290296549376," The accusation is that they misrepresented their business to banks. Potter said when banks realized they were Bitcoin related they got shut down. That means they weren’t being honest that they were Bitcoin related It’s basically a confession",37943.91,"United States of America",11137,720,"False","False","2016-11-08 18:27:37","True","False",720,0.497222222222222,0.111111111111111
963,"07/27/2021",1419988276027535360," I never thought of meeting a legit bitcoin trader after been scammed many times at my age but the heavens sent  guided me and help me make a living through bitcoin with my LUNO app , I recommend you to meet her now and also be a beneficiary of good work",37943.91,"South Africa",991,973,"False","False","2019-12-22 08:44:33","True","False",973,0.55,0.6
971,"07/27/2021",1419988259153793024," I never thought of meeting a legit bitcoin trader after been scammed many times at my age but the heavens sent  guided me and help me make a living through bitcoin with my LUNO app , I recommend you to meet her now and also be a beneficiary of good work",37943.91,"South Africa",991,973,"False","False","2019-12-22 08:44:33","True","False",973,0.55,0.6
980,"07/27/2021",1419988241906913280," I never thought of meeting a legit bitcoin trader after been scammed many times at my age but the heavens sent  guided me and help me make a living through bitcoin with my LUNO app , I recommend you to meet her now and also be a beneficiary of good work",37943.91,"South Africa",991,973,"False","False","2019-12-22 08:44:33","True","False",973,0.55,0.6
987,"07/27/2021",1419988226295672832,"A strong rejecting yesterday from the 40k level, but BTC is staying strong and bouncing back from 36.4K. We need to clear 41.3k as a safety level. Let’s go Bitcoin! Liquidate the remaining shorts! ",37943.91,"United States of America",3609,110,"False","False","2017-08-07 01:42:09","True","False",110,0.4625,0.255729166666667
994,"07/27/2021",1419988215298146304,"Invest with us and experience what it means to invest and earn. Inbox For more inquiringamcsqeeze Binance  Bb23 Cryptocurency Bitcoin  altcoin amcstock believe BabyDoge bitcoinmining binary Covid_19 Bitfinex  ",37943.91,"US",207,1702,"False","False","2020-12-06 09:02:00","True","False",1702,0.5,0.5
1002,"07/27/2021",1419988184352579584,"  For all those who are new to this working from home Bitcoin trading options Here's a little tip:Get a trusted Bitcoin expert and stick to her  Invest and play at similar times each day.Because :In times of chaos, your investment is your anchor to success",37943.91,"",1114,1614,"False","False","2020-05-04 13:17:35","True","False",1614,0.338636363636364,0.0622159090909091
1003,"07/27/2021",1419988178761617408,"This was not the case when I studied bitcoin. The more questions I had, the more excited I became because my concerns were met with valid answers from those in the bitcoin community.",37943.91,"citadel",660,436,"False","False","2010-03-23 06:54:43","False","False",436,0.583333333333333,0.458333333333333
1006,"07/27/2021",1419988174005182464,"In Bitcoin, the new target is 33.800 resistance, if it turns from here, I expect it to peak at 45.500 usd first and then make a correction from there and see 128,000 usds with some positive signals after 42,000 by the end of the year! (Don't follow me now, let me see)BTC",37943.91,"Traveller",15417,701,"False","False","2018-11-11 11:26:20","False","False",701,0.444444444444444,0.223484848484848
1011,"07/27/2021",1419988166417788928," We pay consistently, enjoy your services with us️.  100% safe and paying ️ Easy investment ️ Quick withdrawal WE ARE 100% SECUREDHurry up and message Admin for procedures on how to invest and start earning money here with us today. CashAppFriday Bitcoin ",37943.91,"US",207,1702,"False","False","2020-12-06 09:02:00","True","False",1702,0.583333333333333,0.416666666666667
1013,"07/27/2021",1419988159732060160,"  For all those who are new to this working from home Bitcoin trading options Here's a little tip:Get a trusted Bitcoin expert and stick to her  Invest and play at similar times each day.Because :In times of chaos, your investment is your anchor to success",37943.91,"",1114,1614,"False","False","2020-05-04 13:17:35","True","False",1614,0.338636363636364,0.0622159090909091
1019,"07/27/2021",1419988148910759936,"  ""Whereas Bitcoin, the world’s first cryptocurrency, was created in 2009 with the libertarian goal of circumventing the authority of central banks and nation states, Dogecoin was set up in 2013 as a parody of the ongoing crypto frenzy."" please update slides",37943.91,"",768,2490,"False","False","2011-08-09 20:22:46","True","False",2490,0.291666666666667,0.125
1031,"07/27/2021",1419988135199399936," This project will boom in the near future as it is a new innovative project. Its focus on security and transpiracy which will attract more and more investors to the project.  BEX Morbex BNB crypto money blockchain bitcoin fintech",37943.91,"",572,846,"False","False","2020-07-29 08:58:26","True","False",846,0.496590909090909,0.289393939393939
1032,"07/27/2021",1419988133903482880,"  For all those who are new to this working from home Bitcoin trading options Here's a little tip:Get a trusted Bitcoin expert and stick to her  Invest and play at similar times each day.Because :In times of chaos, your investment is your anchor to success",37943.91,"",1114,1614,"False","False","2020-05-04 13:17:35","True","False",1614,0.338636363636364,0.0622159090909091
1040,"07/27/2021",1419988125808427008," And in meanwhile some entity fixes any dip in US markets every single night.  Now, you tell me who is living under a centrally planning gov, us, or the Chinese.  China is confronting its billionaires' for unfair practices, they kick bitcoin out.",37943.91,"",192,130,"False","False","2020-11-04 01:36:27","True","False",130,0.366071428571429,-0.142857142857143
1046,"07/27/2021",1419988104811847680,"  For all those who are new to this working from home Bitcoin trading options Here's a little tip:Get a trusted Bitcoin expert and stick to her  Invest and play at similar times each day.Because :In times of chaos, your investment is your anchor to success",37943.91,"",1114,1614,"False","False","2020-05-04 13:17:35","True","False",1614,0.338636363636364,0.0622159090909091
1058,"07/27/2021",1419988080728186880," For all those who are new to this working from home Bitcoin trading options Here's a little tip:Get a trusted Bitcoin expert and stick to her  Invest and play at similar times each day.Because :In times of chaos, your investment is your anchor to success",37943.91,"",1114,1614,"False","False","2020-05-04 13:17:35","True","False",1614,0.338636363636364,0.0622159090909091
1067,"07/27/2021",1419988061794930688,"I don't think my downstairs department will be able to handle the high increase of blood distribution if bitcoin decides to have another leg up.",37943.91,"YouTube",3809,1068,"False","False","2018-06-18 06:51:09","False","False",1068,0.5825,0.33
1073,"07/27/2021",1419988036511744000,"  The guy is a full blown bitcoin FUDsterHe creates new altcoiners daily too…",37943.91,"",5343,629,"False","False","2017-09-28 18:25:48","True","False",629,0.334848484848485,0.162121212121212
1078,"07/27/2021",1419988017796853760," Guggenheim could be worth 1 Bitcoin someday",37943.91,"67P/C-G",907,2743,"False","False","2009-09-08 11:16:33","False","False",2743,0.1,0.3
1083,"07/27/2021",1419988004257599488," Hey Peter, me and the team would like invite you to our Twitter Space where we'll introduce Mintlayer, the most ambitious layer 2 technology ever proposed for Bitcoin.At Mintlayer, we're working to empower bitcoin with a sidechain that will enable..",37943.91,"Lebanon",75,3895,"False","False","2011-09-27 16:28:01","True","False",3895,0.625,0.375
1086,"07/27/2021",1419988002080755712," I never thought of meeting a legit bitcoin trader after been scammed many times at my age but the heavens sent  guided me and help me make a living through bitcoin with my LUNO app , I recommend you to meet her now and also be a beneficiary of good work",37943.91,"South Africa",991,973,"False","False","2019-12-22 08:44:33","True","False",973,0.55,0.6
1091,"07/27/2021",1419987998494531584," Lets reclaim the 200 Daily Moving Average Bitcoin ",37943.91,"",360,111,"False","True","2020-09-10 15:01:36","True","False",111,0.2,-0.075
1099,"07/27/2021",1419987985781690368,"  For all those who are new to this working from home Bitcoin trading options Here's a little tip:Get a trusted Bitcoin expert and stick to her  Invest and play at similar times each day.Because :In times of chaos, your investment is your anchor to success",37943.91,"",1114,1614,"False","False","2020-05-04 13:17:35","True","False",1614,0.338636363636364,0.0622159090909091
1101,"07/27/2021",1419987984305303552,"A reliable &amp; best Bitcoin Exchange Development Company – Manual Dofollow Directory Submission Service for Best SEO  bitcoin",37943.91,"",583,662,"False","False","2017-11-19 05:59:58","True","False",662,0.3,1
1102,"07/27/2021",1419987983298662400," I never thought of meeting a legit bitcoin trader after been scammed many times at my age but the heavens sent  guided me and help me make a living through bitcoin with my LUNO app , I recommend you to meet her now and also be a beneficiary of good work",37943.91,"South Africa",991,973,"False","False","2019-12-22 08:44:33","True","False",973,0.55,0.6
1103,"07/27/2021",1419987981050413056,"McDonalds chicken McNuggets are real chicken like  is the real Bitcoin",37943.91,"The paradigm boundary layer",1207,672,"False","False","2019-01-06 23:38:21","False","False",672,0.75,-0.433333333333333
1112,"07/27/2021",1419987967788126208," I never thought of meeting a legit bitcoin trader after been scammed many times at my age but the heavens sent  guided me and help me make a living through bitcoin with my LUNO app , I recommend you to meet her now and also be a beneficiary of good work",37943.91,"South Africa",991,973,"False","False","2019-12-22 08:44:33","True","False",973,0.55,0.6
1119,"07/27/2021",1419987951145127936,"Invest with us and experience what it means to invest and earn. Inbox For more inquiringamcsqeeze Binance  Bb23 Cryptocurency Bitcoin  altcoin amcstock believe BabyDoge bitcoinmining binary Covid_19 Bitfinex  ",37943.91,"US",207,1702,"False","False","2020-12-06 09:02:00","True","False",1702,0.5,0.5
1120,"07/27/2021",1419987947416395776,"  I never thought of meeting a legit bitcoin trader after been scammed many times at my age but the heavens sent  guided me and help me make a living through bitcoin with my LUNO app , I recommend you to meet her now and also be a beneficiary of good work",37943.91,"South Africa",991,973,"False","False","2019-12-22 08:44:33","True","False",973,0.55,0.6
1130,"07/27/2021",1419987929179512832," I never thought of meeting a legit bitcoin trader after been scammed many times at my age but the heavens sent  guided me and help me make a living through bitcoin with my LUNO app , I recommend you to meet her now and also be a beneficiary of good work",37943.91,"South Africa",991,973,"False","False","2019-12-22 08:44:33","True","False",973,0.55,0.6
1140,"07/27/2021",1419987910158389248," I never thought of meeting a legit bitcoin trader after been scammed many times at my age but the heavens sent  guided me and help me make a living through bitcoin with my LUNO app , I recommend you to meet her now and also be a beneficiary of good work",37943.91,"South Africa",991,973,"False","False","2019-12-22 08:44:33","True","False",973,0.55,0.6
1143,"07/27/2021",1419987903405563904,"Whatever regulators do to Tether, it underlines why BTC has so much value in the first place: everything else -- every altcoin, every physical commodity -- has a throat to choke. Only Bitcoin fixes this. ",37943.91,"Subscribe 👉",5418,1197,"False","True","2011-06-18 06:30:51","False","False",1197,0.419047619047619,0.1125
1145,"07/27/2021",1419987893569785856,"The same thing is for reff, I don't know about death, but it is worth paying attention to myself, I am far from the bottom in this process. BTC Bitcoin Crypto",37943.91,"Traveller",15417,701,"False","False","2018-11-11 11:26:20","False","False",701,0.408333333333333,0.133333333333333
1148,"07/27/2021",1419987891585839104,"It may be in a listed state but as said if btc  multi voltelite prevents this, that the dominance has risen so much that at a time this prevented the subs from rising too much. Crypto Bitcoin BTC",37943.91,"Traveller",15417,701,"False","False","2018-11-11 11:26:20","False","False",701,0.2,0.2
1160,"07/27/2021",1419987872774557696,"  For an abstraction like bitcoin I think the ""value"" is in the large network of financially illiterate people and scammers. For commerce, bitcoin is totally irrelevant. If fiat collapses, weapons and violence will determine the currency.",37943.91,"Copenhagen",259,392,"False","False","2010-07-12 14:50:08","False","False",392,0.476190476190476,-0.0952380952380952
1164,"07/27/2021",1419987866118246400,"Make up your mind.Trade bitcoin today before its too late.DM me to know more about trading and bring financially free. ",37943.91,"United States of America",111,1242,"False","False","2019-05-13 01:05:38","True","False",1242,0.65,0.45
1165,"07/27/2021",1419987865602297856,"I LOVE CRYPTO bitcoin ethereum crypto btc eth binance polygon solana kusama polkadot DeFi ",37943.91,"",110,246,"False","False","2018-06-13 17:37:34","True","False",246,0.6,0.5
1171,"07/27/2021",1419987841103368192,"These ETH boys really think PoS is the be all end and act like PoW on Bitcoin isn't a stopping them from going to 0. ",37943.91,"Antarctica",1076,572,"False","False","2019-07-23 22:13:17","True","False",572,0.2,0.2
1172,"07/27/2021",1419987834614784000," I never thought of meeting a legit bitcoin trader after been scammed many times at my age but the heavens sent  guided me and help me make a living through bitcoin with my LUNO app , I recommend you to meet her now and also be a beneficiary of good work",37943.91,"South Africa",991,973,"False","False","2019-12-22 08:44:33","True","False",973,0.55,0.6
1175,"07/27/2021",1419987826687586304,"Huge Bitcoin Outflows On Binance, BTC To Break $40k Soon? ",37943.91,"world",146,248,"False","False","2020-06-21 14:38:59","True","False",248,0.9,0.4
1182,"07/27/2021",1419987818856734720,"  I never thought of meeting a legit bitcoin trader after been scammed many times at my age but the heavens sent  guided me and help me make a living through bitcoin with my LUNO app , I recommend you to meet her now and also be a beneficiary of good work",37943.91,"South Africa",991,973,"False","False","2019-12-22 08:44:33","True","False",973,0.55,0.6
1185,"07/27/2021",1419987817808023552," Regulation would look like Bitcoin’s difficulty adjustment. Rules based, predictable, and not subject to the whims of flawed humans.",37943.91,"United States of America",10856,1325,"False","False","2007-11-03 23:25:09","False","False",1325,0.444444444444444,-0.205555555555556
1187,"07/27/2021",1419987815576834048,"It's estimated 1 out of 3 crypto investors know very little about the fundamentals of crypto. I believe a lot of whales  are ignorant of the fundamentals as well. They just so happen to have a lot of money. BTC Bitcoin Ethereum Cardano VeChain SHIB Safemoon Dogecoin",37943.91,"Tennessee",312,558,"False","False","2009-07-24 18:02:34","False","False",558,0.65,-0.24375
1192,"07/27/2021",1419987809348116480," that is an amazing Bitcoin trade. personally taking some profits and waiting for daily confirmation to add more position. ",37943.91,"",360,111,"False","True","2020-09-10 15:01:36","True","False",111,0.425,0.275
1193,"07/27/2021",1419987802499043328,"  I never thought of meeting a legit bitcoin trader after been scammed many times at my age but the heavens sent  guided me and help me make a living through bitcoin with my LUNO app , I recommend you to meet her now and also be a beneficiary of good work",37943.91,"South Africa",991,973,"False","False","2019-12-22 08:44:33","True","False",973,0.55,0.6
1201,"07/27/2021",1419987786115977216,"Oh Good, Now There's an Outbreak of Wildfire Thunderclouds  nft global vampiresexkittens bitcoin  tiktok artificialIntelligence ai robotics robot eth  neuralnetworks  ",37943.91,"Global",2283,2023,"False","False","2010-04-11 01:37:32","False","False",2023,0.3,0.35
1204,"07/27/2021",1419987783888904192," I never thought of meeting a legit bitcoin trader after been scammed many times at my age but the heavens sent  guided me and help me make a living through bitcoin with my LUNO app , I recommend you to meet her now and also be a beneficiary of good work",37943.91,"South Africa",991,973,"False","False","2019-12-22 08:44:33","True","False",973,0.55,0.6
1214,"07/27/2021",1419987760648183808," My eoy goal is to learn more on Bitcoin because if I didn’t learn anything from you I know I learned that passive income is really life changing!!! I tell people about investing all the time it’s in one ear and out the other!!!",37943.91,"Wherever I need to Be",8658,273,"False","False","2019-11-01 01:26:37","True","False",273,0.358333333333333,0.215494791666667
