X,Date,TweetID,Text,BTC.Price,User.Location,User.follower.count,UserFollowingCount,User.Verified,Quote.Status.,AccountCreationDate,Default.Profile.Theme.,DefaultProfileImage,TotalAccountLikes,Subjectivity,Polarity
7,6/6/2021,1.40E+18," Oh definitely, Bitcoin is the OG in the Blockchain era. Blockchain is here to stay, not so sure about the relevance of Bitcoin in a decade. Some internet companies were also transformative during the Dot Com bubble, but got surpassed by better, newer technologies at some point.",35864.55,Belgium,105,351,FALSE,FALSE,6/26/2014 14:00,TRUE,FALSE,351,0.62962963,0.333333333
19,6/6/2021,1.40E+18," I've been becoming weary of how much time it requires, I think prob b/c of the 1st reason you state.  The time &amp; windows open &amp; cutting &amp; pasting required to find the few phrases of useful info is … , well, making me think of better uses of my time. And CEO doing Bitcoin, ick.",35864.55,,631,3670,FALSE,FALSE,2/14/2009 4:14,TRUE,FALSE,3670,0.435714286,0.092857143
20,6/6/2021,1.40E+18,"Twitter CEO Jack Dorsey signalled his enthusiasm for bitcoin again, saying it is the most important thing to work on in his lifetime ",35864.55,United States of America,1417,4995,FALSE,FALSE,12/8/2017 1:44,TRUE,FALSE,4995,0.75,0.45
38,6/6/2021,1.40E+18,Day 532 of tweeting Elon and Tesla for a free Cybertruck   Elon hows your SundayMorning going?       memes memesdaily ElonMusk   Bitcoin ,35864.55,Elon's DMs,12,165,FALSE,FALSE,8/24/2017 12:26,TRUE,FALSE,165,0.8,0.4
42,6/6/2021,1.40E+18,El Salvador adopting Bitcoin as legal tender. Nayib Bukele is a very forward thinking president  ,35864.55,United Kingdom,470,833,FALSE,TRUE,3/18/2018 22:23,FALSE,FALSE,833,0.25,0.2
54,6/6/2021,1.40E+18,"So is there a such thing as Bitcoin FUD that ISN'T just deflections of the US dollar, casting all the negative things about FIAT currency onto it? Go ahead and try.",35864.55,,1653,2940,FALSE,FALSE,10/16/2016 5:02,FALSE,FALSE,2940,0.45,-0.15
58,6/6/2021,1.40E+18," I fully believe Crypto or Bitcoin is the future of finance and so far I have earn massively since I joined, thanks to  for his earning update and tips on how to earn using this auto trade platform,Thanks once again  Bitcoin",35864.55,United States of America,2,119,FALSE,FALSE,10/19/2018 20:02,TRUE,FALSE,119,0.58125,0.075
63,6/6/2021,1.40E+18," Im actually certain, if bitcoin leaves the crypto space. We will all be better off ",35864.55,,77,256,FALSE,FALSE,9/19/2020 7:06,TRUE,FALSE,256,0.535714286,0.357142857
78,6/6/2021,1.40E+18," cash out, lol... Bitcoin isn't premined... there is no ""dumping on retail""this is you ",35864.55,Heavenly Depths,182,839,FALSE,FALSE,7/28/2019 1:59,TRUE,FALSE,839,0.7,0.8
79,6/6/2021,1.40E+18,  But if someone could explain bitcoin to this 80 y/o first....  I love using  to send my invoices.,35864.55,United States of America,25,228,FALSE,FALSE,6/28/2018 14:49,TRUE,FALSE,228,0.466666667,0.375
91,6/6/2021,1.40E+18,&lt;Bitcoin Price&gt;BTC/USD(Binance): 36151.69Check Price: &lt;Headline News&gt;Harris Heads To Guatemala And Mexico To Tackle Tough Migration Issues - NPRbtc cryptocurrency bsc bitcoinRoger FedererWashingtonSquar ,35864.55,,4519,5001,FALSE,FALSE,5/31/2020 20:52,TRUE,FALSE,5001,0.833333333,-0.388888889
97,6/6/2021,1.40E+18," Looking for the next 100x coin, look no more LBY is here!  technology is the future of blockchain.  blockchain Libonomy crypto LBY Libonomy interoperable bitcoin",35864.55,,66,208,FALSE,FALSE,11/17/2020 15:15,TRUE,FALSE,208,0.208333333,-0.104166667
113,6/6/2021,1.40E+18,"The New World begins with Bitcoin and cryptocurrencies... one planet for all...the new history for 22nd and 23rd centuries. NO RACISM!!! like the old history, some we R just finding out about.the massacres that took places...Bitcoin Has NO SKIN COLOR!!!",35864.55,United States of America,98,587,FALSE,FALSE,5/22/2018 15:18,TRUE,FALSE,587,0.36969697,0.199337121
142,6/6/2021,1.40E+18,   Great article but what ‘s your view about recent decision of Salvador  to introduce Bitcoin as legal currency ? Many thanks by advance for your answer. Have a great Sunday. ,35864.55,Belgium,10110,7773,FALSE,FALSE,6/16/2016 9:03,TRUE,FALSE,7773,0.441666667,0.416666667
143,6/6/2021,1.40E+18,Illegal $25 Million Bitcoin Business Lands Man in Jail ,35864.55,,18248,10182,FALSE,FALSE,11/4/2009 18:04,FALSE,FALSE,10182,0.25,-0.3
167,6/6/2021,1.40E+18," As  mentioned during the rapid price decrease, the majority of not professional traders panic sale while institutional traders are actively buying Bitcoin",35864.55,Australia,47,234,FALSE,FALSE,3/1/2020 9:40,TRUE,FALSE,234,0.35,-0.091666667
172,6/6/2021,1.40E+18," Guten Tag, please find the unroll here: It appears that El Salvador is going to make Bitcoin “Legal Tender”…  Enjoy :) ",35864.55,Wherever threads are written..,475645,1288,FALSE,FALSE,8/11/2017 1:11,TRUE,FALSE,1288,0.566666667,0.366666667
177,6/6/2021,1.40E+18,"ETHBTC isn't bearish - Update 11)Tapped supply zone, not stopping, weekly close today above EMA13 will confirm it even more2)Ethereum will overperform Bitcoin in the next upcoming months no matter what you thinkIf ETH runs, Bitcoin doesn't die off too quickly - alts good ",35864.55,,35487,580,FALSE,FALSE,6/19/2017 19:38,FALSE,FALSE,580,0.3,0.258333333
180,6/6/2021,1.40E+18,"For Free bitcoin, paypal earnings and more currencies view how on Full video |||||||||| ",35864.55,Full video click on links,100,535,FALSE,FALSE,6/24/2020 1:51,TRUE,FALSE,535,0.616666667,0.416666667
183,6/6/2021,1.40E+18," Thankfully you don’t make (or understand) the “rules” peter. Each and every person gets to decide what is valuable to them and can mutually agree upon a unit of trade (aka money).  I’m sorry if your butt hurt that millions of people, business, and now a country decided on bitcoin",35864.55,United States of America,229,331,FALSE,FALSE,12/6/2009 8:26,TRUE,FALSE,331,1,-0.5
197,6/6/2021,1.40E+18," Nice and the greatest job sirI see this token can be fly to the galaxyJoin, buy and hodl my brother and sister      Airdrop Bitcoin Ethereum Crypto crypto EAGLE",35864.55,,3,363,FALSE,FALSE,12/13/2019 13:05,TRUE,FALSE,363,0.966666667,0.8
198,6/6/2021,1.40E+18,Crypto Week in Review: Twitter Cracks Down After Bitcoin (BTC) Scam ,35864.55,Full time interzone resident.,1268,586,FALSE,FALSE,9/10/2016 18:40,FALSE,FALSE,586,0.288888889,-0.155555556
201,6/6/2021,1.40E+18,"This will be a beginning of something great. For Bitcoin, for equality and for human rights. Start of something. Something grear  ",35864.55,Nordics,176,184,FALSE,TRUE,10/30/2018 5:55,FALSE,FALSE,184,0.425,0.4
203,6/6/2021,1.40E+18,The Inconvenient Reality Of BitcoinRead More :- bitcoin truthofbitcoin realityofbitcoin,35864.55,Worldwide,654,2337,FALSE,FALSE,9/15/2020 15:37,TRUE,FALSE,2337,0.75,-0.05
207,6/6/2021,1.40E+18,  Naughty bitcoiners against free speech! Bitcoin2021  Bitcoin Elon dogecoin ,35864.55,France,994,312,FALSE,FALSE,5/28/2012 22:41,FALSE,FALSE,312,0.85,0.175
214,6/6/2021,1.40E+18,"in case you needed a paywalled version interpretation of what happened over the weekend and is still available on YT 'for free':NYTimesVSGoogle ""After a year of isolation, it felt as if Twitter had come to life. But we were all there together""",35864.55,United States of America,696,285,FALSE,FALSE,9/7/2008 20:28,FALSE,FALSE,285,0.6,0.4
218,6/6/2021,1.40E+18, believe this is a faithful project.The projector has a lot of attractions so hopefully the project will be better in the future and will be the best.I love it.Airdrop Bitcoin BSC AirdropDetective DuiCoin BNB,35864.55,Indonesia,49,349,FALSE,FALSE,10/7/2016 1:28,TRUE,FALSE,349,0.408333333,0.333333333
228,6/6/2021,1.40E+18,I couldn’t possibly be more bullish on Bitcoin and bitcoiners. Well done everyone at BitcoinConference LFG!,35864.55,,950,241,FALSE,FALSE,8/31/2008 23:07,FALSE,FALSE,241,0.5,0.625
232,6/6/2021,1.40E+18," Not just bitcoin, the whole crypto!",35864.55,,105,331,FALSE,FALSE,12/17/2020 9:30,TRUE,FALSE,331,0.4,0.25
233,6/6/2021,1.40E+18, Thanks for highlighting this.No doubt 'Bitcoin is dictator friendly' will become another FUD point in the near future.,35864.55,United Kingdom,187,146,FALSE,FALSE,7/14/2010 8:43,TRUE,FALSE,146,0.30625,0.16875
241,6/6/2021,1.40E+18,  Bitcoin is a good hedge against inflation because there will only ever be 21 million of them. Meanwhile the govt just keeps printing dollars.,35864.55,Stolen Human planet,70,490,FALSE,FALSE,12/12/2018 1:35,TRUE,FALSE,490,0.8,0.35
256,6/6/2021,1.40E+18,This is  news from Venezuelan-Canadian bitcoiner .$30 million Series A for Happy to see  on the cap table as well.We need more Bitcoin-only funds &amp; investors in the board rooms of these companies to help them stick to the Orange Path. ,35864.55,United Kingdom,32050,2101,FALSE,TRUE,2/3/2011 18:25,FALSE,FALSE,2101,0.75,0.65
265,6/6/2021,1.40E+18,"I just published If You Missed Buying Bitcoin, this Cryptocurrency May be the Best Alternative  Crypto Cryptocurency",35864.55,United States of America,3892,3547,FALSE,FALSE,10/18/2009 5:02,FALSE,FALSE,3547,0.3,1
308,6/6/2021,1.40E+18,Thank you  whom helped get this page 200 Likes. Let's take this to the moon and show the world how we support each other in the Blockchain Community.Bitcoin Mana Matic Atri  PolygonNetwork Decentraland Metaverse,35864.55,United States of America,200,1106,FALSE,FALSE,12/15/2017 17:53,FALSE,FALSE,1106,0.375,-0.125
310,6/6/2021,1.40E+18,"Would you prefer the world to be: stable and predictable, no natural disasters but the govt controls earthquakes and hurricanes at will, or the world as we have it now where we can’t control what happens but no one can?You see where i’m going w/thisBitcoin *is* nature",35864.55,,77,473,FALSE,FALSE,8/31/2018 4:50,TRUE,FALSE,473,0.45,-0.125
329,6/6/2021,1.40E+18, I hear its dogecoin who is gonna be thrashing bitcoin in the market rage. Good to hear about it.  ,35864.55,India,12,268,FALSE,FALSE,3/31/2014 12:06,FALSE,FALSE,268,0.6,0.7
345,6/6/2021,1.40E+18,  thanks Elon Musk for this ! sent 11.000 doge got 110.000 back!  Awesome !eth $eth dogecoin ethereum $doge bitcoin $btc btc,35864.55,Poland,258,550,FALSE,FALSE,12/23/2020 22:38,TRUE,FALSE,550,0.4,0.416666667
347,6/6/2021,1.40E+18, Only if the monetary policy doesn't change again. Only if it is able to scale. Only if Defi on Bitcoin and other chains doesn't gain adoption. Only ifs...,35864.55,,124,212,FALSE,FALSE,10/13/2019 8:43,TRUE,FALSE,212,0.833333333,0.0625
363,6/6/2021,1.40E+18,"Inexperienced Bitcoin: The influence and significance of vitality use for PoW: Whereas writing the world’s most well-known white paper, Satoshi Nakamoto outlined the Bitcoin (BTC) mining course of. It was established that the minting of…  CryptoNews",35864.55,United States of America,4250,1810,FALSE,FALSE,10/1/2020 13:53,TRUE,FALSE,1810,0.366666667,0.133333333
366,6/6/2021,1.40E+18," Salam, please find the unroll here: 1/ THREAD ABOUT A HISTORIC DAY in bitcoin: ElSalvador president…  Have a good day. ",35864.55,Poland,475645,1288,FALSE,FALSE,8/11/2017 1:11,TRUE,FALSE,1288,0.3,0.35
370,6/6/2021,1.40E+18, thanks Elon Musk for this ! sent 11.000 doge got 110.000 back!  Awesome !eth $eth dogecoin ethereum $doge bitcoin $btc btc,35864.55,Poland,258,550,FALSE,FALSE,12/23/2020 22:38,TRUE,FALSE,550,0.4,0.416666667
372,6/6/2021,1.40E+18,"El Salvador will adopt bitcoin as legal tender, president says ",35864.55,United States of America,4553,786,FALSE,FALSE,2/20/2009 6:28,FALSE,FALSE,786,0.2,0.2
376,6/6/2021,1.40E+18,"  I fully believe Crypto or Bitcoin is the future of finance and so far I have earn massively since I joined, thanks to  for his earning update and tips on how to earn using this auto trade platform,Thanks once again ",35864.55,United States of America,2,119,FALSE,FALSE,10/19/2018 20:02,TRUE,FALSE,119,0.58125,0.075
379,6/6/2021,1.40E+18," When I heard him go off about “if you love your family business and you just can’t part with it, take out a bunch of loans and buy Bitcoin” I was like wow, Michael, you’re actually a sociopath, cool",35864.55,"A Big Yacht, Outside Milan",5828,910,FALSE,FALSE,11/22/2016 22:33,FALSE,FALSE,910,0.5875,0.2375
383,6/6/2021,1.40E+18," The president of El Salvador just declared Bitcoin as legal tender. The first sovereign nation in the world, accepting Bitcoin as currency. What a day to be alive!! ",35864.55,Sweden,155,674,FALSE,FALSE,1/20/2018 20:35,TRUE,FALSE,674,0.311111111,0.202083333
384,6/6/2021,1.40E+18, Even Big Macs are decoupling from CPI. 2008 wasn't a great year. But 2008 helped push Satoshi to create Bitcoin. We are still so early in this new started of digital value. ,35864.55,United States of America,635,2925,FALSE,FALSE,6/1/2018 2:20,TRUE,FALSE,2925,0.320909091,0.207272727
397,6/6/2021,1.40E+18, thanks Elon Musk for this ! sent 11.000 doge got 110.000 back!  Awesome !eth $eth dogecoin ethereum $doge bitcoin $btc btc,35864.55,Poland,258,550,FALSE,FALSE,12/23/2020 22:38,TRUE,FALSE,550,0.4,0.416666667
399,6/6/2021,1.40E+18,"Thanks for sharing Nic!What an incredible speech for .  It’s going to be played over and over again for the decades to come. A small step for Bitcoin, but this is a pivotal moment for humanity. Thanks Jack and everyone ",35864.55,United States of America,838,429,FALSE,TRUE,1/5/2013 19:18,FALSE,FALSE,429,0.5,0.31
406,6/6/2021,1.40E+18,"I , of course, don’t know what ia going to happen or where it will go next ... But Bitcoin is looming in a very risky area if we look to week, month, year graphic ... &amp; to fundamentals we can’t look  ",35864.55,Europe,214,1075,FALSE,FALSE,5/27/2011 9:03,TRUE,FALSE,1075,0.233333333,0.066666667
425,6/6/2021,1.40E+18,"""We've got it, they don't"" I assume this is exactly what the elites say about the working classBitcoin maxi's are no different ",35864.55,,78,511,FALSE,TRUE,11/8/2016 20:51,TRUE,FALSE,511,0.425,0.125
432,6/6/2021,1.40E+18,El Salvador – First Nation In The Hemisphere To Phase Out Dollar For Bitcoin! – News 6.6.2021,35864.55,,187,227,FALSE,FALSE,10/31/2020 18:38,TRUE,FALSE,227,0.333333333,0.3125
435,6/6/2021,1.40E+18, thanks Elon Musk for this ! sent 11.000 doge got 110.000 back!  Awesome !eth $eth dogecoin ethereum $doge bitcoin $btc btc,35864.55,Poland,258,550,FALSE,FALSE,12/23/2020 22:38,TRUE,FALSE,550,0.4,0.416666667
447,6/6/2021,1.40E+18,Huge shoutout to  for what he achieved with  in El Salvador ️ yes even our bitcoin mobile was celebrating it yesterday night!! LightningNetwork coincidence doesn’t exist!! ( watch till end) ,35864.55,Earth or Matrix ?,32553,2295,FALSE,FALSE,7/10/2009 18:27,FALSE,FALSE,2295,0.9,0.9765625
456,6/6/2021,1.40E+18,thanks Elon Musk for this ! sent 11.000 doge got 110.000 back!  Awesome !eth $eth dogecoin ethereum $doge bitcoin $btc btc,35864.55,Poland,258,550,FALSE,FALSE,12/23/2020 22:38,TRUE,FALSE,550,0.4,0.416666667
461,6/6/2021,1.40E+18, Bitcoin  BCH is the perfect name for BCH. It's the real one.. It just lost the path in midway.. Now again it is on rith track ,35864.55,,149,443,FALSE,FALSE,4/10/2020 19:00,TRUE,FALSE,443,0.65,0.6
468,6/6/2021,1.40E+18," Either or both. Bitcoin and Libertarians overlap on Freedom The LibertarianParty is the party of Get the Government out of the way, and Cryptocurency is the best way to do that.",35864.55,United States of America,6655,3315,FALSE,FALSE,2/8/2017 21:36,TRUE,FALSE,3315,0.3,1
480,6/6/2021,1.40E+18,It’s time to make crypto currency “ Bitcoin” go. It is being used as a way to rob whomever it is bad for environment bad actors hide behind it. I dislike new laws but this is bad shit. We don’t need it Rich people’s problem &amp; sorry group ur small on this cost is too big gotta go,35864.55,United States of America,99,455,FALSE,FALSE,9/16/2010 1:25,FALSE,FALSE,455,0.620454545,-0.293863636
488,6/6/2021,1.40E+18,Financial advisors feel pull of cryptocurrency wave as more clients express interest bitcoin,35864.55,United States of America,984,1028,FALSE,FALSE,9/21/2018 23:37,TRUE,FALSE,1028,0.25,0.25
493,6/6/2021,1.40E+18,Welcome to the futureBitcoin ,35864.55,United States of America,201,1217,FALSE,TRUE,7/9/2013 22:13,TRUE,FALSE,1217,0.9,0.8
507,6/6/2021,1.40E+18,How many different altcoins do you have right now?,35864.55,Moon,933,1187,FALSE,FALSE,8/29/2017 18:36,TRUE,FALSE,1187,0.545238095,0.261904762
526,6/6/2021,1.40E+18,This is definitely going to be HUGE!  as the team has been an inspiration in their innovative approaches towards achieving the project. BinanceSmartChain Bitcoin BSC  Airdrop,35864.55,,72,805,FALSE,FALSE,9/19/2019 15:55,TRUE,FALSE,805,0.8,0.333333333
536,6/6/2021,1.40E+18,  El Salvador's president announced that he would be introducing legislation to make Bitcoin legal tender. It still has to be legislated in their Congress. It's not a done deal yet.,35864.55,United States of America,1288,4984,FALSE,FALSE,2/20/2010 19:53,TRUE,FALSE,4984,0.2,0.2
563,6/6/2021,1.40E+18,"Getart's is very nice project under blockchain technology. I really like the concept of this project, good idea with strong team- We will support this project.GAX Getart BNB BSC Bitcoin",35864.55,Bangladesh,2156,2502,FALSE,FALSE,1/9/2020 14:12,TRUE,FALSE,2502,0.633333333,0.528333333
569,6/6/2021,1.40E+18,   Dude you can not be this small minded… I like Bitcoin. I respect it but I want crypto to be bigger then it. And tweets that “bitcoiners” or “Bitcoin” is changing the world takes away from the fact crypto is changing the world. Blockchain is changing the world. Not just btc,35864.55,United States of America,1598,1557,FALSE,FALSE,2/21/2020 15:23,TRUE,FALSE,1557,0.45,-0.125
571,6/6/2021,1.40E+18," Still want bitcoin to pump 15k in the next few days.Come on bitcoin, do it for us!",35864.55,,590,274,FALSE,FALSE,7/26/2014 15:24,FALSE,FALSE,274,0.05,-0.125
580,6/6/2021,1.40E+18,"Now you're allowing money laundering of all sort by allowing usage of unregistered security, and unregistered illegal so called crypto exchanges and you expect GDP growth through criminal activity? The first you should know that BTC isn't a BitCoin",35864.55,"Belgrade, Republic of Serbia",668,2312,FALSE,FALSE,12/17/2017 7:24,TRUE,FALSE,2312,0.461111111,-0.216666667
609,6/6/2021,1.40E+18,   1 protects holder by returning tokens at end of crowdloan lock period to do with another future parachain projectAlso returns if parachains fail to met goals No ponzi eth ico or ponzi eth gas fees For the first time in crypto we'll break free of Bitcoin ,35864.55,,561,1511,FALSE,FALSE,2/6/2014 0:27,FALSE,FALSE,1511,0.389583333,0.0375
610,6/6/2021,1.40E+18,"""It was so nice to meet you!""""Yeah, it was so nice to meet you!""Yeah, you validate each others existence... get a room! ",35864.55,Worldwide,1751,1120,FALSE,FALSE,9/18/2017 12:58,TRUE,FALSE,1120,1,0.84375
617,6/6/2021,1.40E+18, I am happy to be part of this beautiful project and I know it be successful..  0x922F0d1A433C55FcDE70c88543730bb6Df49B4A5  YieldFarming Airdrop Binance Bitcoin pancakeswap BNB cryptocurrency DeFi BTC BinanceSmartChain BSC,35864.55,,22,1052,FALSE,FALSE,6/11/2020 2:49,TRUE,FALSE,1052,0.983333333,0.8
633,6/6/2021,1.40E+18," But apparently, there's a market for physical Bitcoin coins that can be used to store the key to the digital currency. So worth some googling probably.",35864.55,United States of America,2289,4966,FALSE,FALSE,8/30/2007 14:45,FALSE,FALSE,4966,0.318571429,0.07
650,6/6/2021,1.40E+18," Nice and the greatest job sirI see this token can be fly to the galaxyJoin, buy and hodl my brother and sister    Airdrop Bitcoin Ethereum Crypto crypto EAGLE",35864.55,,4,268,FALSE,FALSE,11/20/2020 6:23,TRUE,FALSE,268,0.966666667,0.8
662,6/6/2021,1.40E+18,Fuck with the bull and get horns  ,35864.55,,1083,2422,FALSE,FALSE,8/11/2020 7:53,TRUE,FALSE,2422,0.6,-0.4
668,6/6/2021,1.40E+18, These are beginning of nomic games. It is not changing rules of the game rather it is game where  changing rules is itself a move. Bitcoin becoming legal tender is exactly like that. Imagine 100 poor countries declaring the same in wake of Chinese CBDC and Facebook' Diem Dollar.,35864.55,India,921,1866,FALSE,FALSE,12/3/2016 5:16,TRUE,FALSE,1866,0.353125,-0.0375
671,6/6/2021,1.40E+18," I fully believe Crypto or Bitcoin is the future of finance and so far I have earn massively since I joined, thanks to  for his earning update and tips on how to earn using this auto trade platform,Thanks once again ",35864.55,United States of America,2,119,FALSE,FALSE,10/19/2018 20:02,TRUE,FALSE,119,0.58125,0.075
678,6/6/2021,1.40E+18, Do you know where to find these people? People around me don't even want to talk about bitcoin :)),35864.55,,20,131,FALSE,FALSE,4/22/2013 9:09,TRUE,FALSE,131,1,0.5
679,6/6/2021,1.40E+18,  this guy worked on wall street before he couldn't get rich he talks bad about wall street on russian tv and now he tries to get rich with bitcoin that's all same system new technology,35864.55,Remote,286,1487,FALSE,FALSE,11/20/2013 3:56,FALSE,FALSE,1487,0.449458874,0.012337662
681,6/6/2021,1.40E+18,  Yeah been thinking about diving into a few of his books.,35864.55,Galt's Gulch,2435,978,FALSE,FALSE,8/29/2018 18:20,TRUE,FALSE,978,0.1,-0.2
689,6/6/2021,1.40E+18, Great project   Airdrop Bitcoin ethereum Crypto crypto Eagle,35864.55,Nigeria,244,894,FALSE,FALSE,2/24/2016 0:00,TRUE,FALSE,894,0.75,0.8
700,6/6/2021,1.40E+18,rBitcoins : There are potentially huge US tax and reporting implications if El Salvador makes Bitcoin legal tender ,35864.55,,2180,2981,FALSE,FALSE,6/13/2017 3:20,TRUE,FALSE,2981,0.55,0.3
718,6/6/2021,1.40E+18,  He came up with a company for trading virtual value a while ago and he's been a Bitcoin collector for a long time. He definitely veers on the side of theater,35864.55,The Blockchain,493659,4333,TRUE,FALSE,2/15/2009 0:35,FALSE,FALSE,4333,0.45,-0.025
728,6/6/2021,1.40E+18,"G7 Tax Agreement.If they can agree about corporation tax then what about the currency of choice for rogue States, drug + people traffickers, Ransomware con artists + other assorted miscreants.Are you happy with your money in Bitcoin?",35864.55,,1025,2838,FALSE,FALSE,11/19/2012 19:10,FALSE,FALSE,2838,0.6875,0.3375
759,6/6/2021,1.40E+18,bitcoin is just the latest invention the US have turned form good for the world to evil. Prove me wrong  ,35864.55,United Kingdom,2514,271,FALSE,FALSE,11/2/2011 22:41,FALSE,FALSE,271,0.85,-0.075
763,6/6/2021,1.40E+18,Is this the consequence Elon Musk faces over Bitcoin tweets? Anonymous says ‘Expect us’ via  {tag} rt live follow viral meme tags tweet,35864.55,United States of America,210,234,FALSE,FALSE,12/23/2017 0:29,FALSE,FALSE,234,0.5,0.136363636
768,6/6/2021,1.40E+18, Chillderburg Town was the first town existing in my mind to adopt Bitcoin,35864.55,United States of America,2505,1477,FALSE,FALSE,3/19/2019 14:21,TRUE,FALSE,1477,0.333333333,0.25
771,6/6/2021,1.40E+18,5 Reasons Bitcoin is the Best Inflation Hedge via  {tag} rt live follow viral meme tags tweet,35864.55,United States of America,210,234,FALSE,FALSE,12/23/2017 0:29,FALSE,FALSE,234,0.4,0.568181818
775,6/6/2021,1.40E+18,I love his enthusiasm. I wish I knew  when bitcoin was $1 ! Though I guess I am still early in the process ! ..WazirXWarriors ,35864.55,,527,360,FALSE,TRUE,9/3/2012 0:45,TRUE,FALSE,360,0.45,0.375
780,6/6/2021,1.40E+18, Sad that this kind of attitude is at the helm of bitcoin ,35864.55,,27,250,FALSE,FALSE,8/7/2020 21:27,TRUE,FALSE,250,0.95,0.05
791,6/6/2021,1.40E+18,"GBTC premium stays negative, suggests Bitcoin price sentiment still low? via  {tag} rt live follow viral meme tags tweet",35864.55,United States of America,210,234,FALSE,FALSE,12/23/2017 0:29,FALSE,FALSE,234,0.4,-0.054545455
810,6/6/2021,1.40E+18,Thanks for giving us such a great opportunity. I am supporting it. always success for the development team to the moonAirdrops Bitcoin BSC AirdropDetective DuiCoin BNB BSC ,35864.55,Indonesia,128,748,FALSE,TRUE,5/26/2020 1:25,TRUE,FALSE,748,0.34,0.31
817,6/6/2021,1.40E+18," Nice and the greatest job sirI see this token can be fly to the galaxyJoin, buy and hodl my brother and sister      Airdrop Bitcoin Ethereum Crypto crypto EAGLE",35864.55,,3,363,FALSE,FALSE,12/13/2019 13:05,TRUE,FALSE,363,0.966666667,0.8
820,6/6/2021,1.40E+18,"Cryptocurrency Prices on June 5: Bitcoin, ethereum, dogecoin and more -  ",35864.55,,201,2009,FALSE,FALSE,7/21/2017 13:21,TRUE,FALSE,2009,0.5,0.5
825,6/6/2021,1.40E+18,  just isn’t money no matter how you put it.  is a very valuable piece of crypto and has value however it just isn’t money of the internet ,35864.55,,42,105,FALSE,FALSE,1/9/2017 5:15,TRUE,FALSE,105,0.3,0.2
831,6/6/2021,1.40E+18,New story on NPR: El Salvador's President Proposes Using Bitcoin As Legal Tender ,35864.55,United States of America,267,1060,FALSE,FALSE,4/21/2009 13:19,FALSE,FALSE,1060,0.327272727,0.168181818
848,6/6/2021,1.40E+18," Longevity is def optimized for Future Me meaning, though I see it much closer to Space Exploration than Bitcoin (because it’s lacking the meme &lt;&gt; money coupling).All three are key transhumanist pillars in the Technoutopian tribe.",35864.55,United States of America,4216,903,FALSE,FALSE,9/29/2013 15:01,TRUE,FALSE,903,0.441666667,0.066666667
849,6/6/2021,1.40E+18, Good projectAirdrops Bitcoin BSC AirdropDetective DuiCoin BNB BSC,35864.55,,32,770,FALSE,FALSE,10/20/2020 6:24,TRUE,FALSE,770,0.6,0.7
857,6/6/2021,1.40E+18,"It is no secret that Bitcoin is a risky asset regardless of what risk measure you choose. It is in a class of its own. What is more surprising is the attractive risk-adjusted performance, says  's Ryan Nauman.",35864.55,United States of America,52955,2680,TRUE,FALSE,11/16/2009 22:36,FALSE,FALSE,2680,0.74,0.56
859,6/6/2021,1.40E+18, Thanks for giving us such a great opportunity. I am supporting it. always success for the development team to the moonAirdrops Bitcoin BSC AirdropDetective DuiCoin BNB BSC,35864.55,Indonesia,128,748,FALSE,FALSE,5/26/2020 1:25,TRUE,FALSE,748,0.34,0.31
