X,Date,TweetID,Text,BTC.Price,User.Location,User.follower.count,UserFollowingCount,User.Verified,Quote.Status.,AccountCreationDate,Default.Profile.Theme.,DefaultProfileImage,TotalAccountLikes,Subjectivity,Polarity
1931,7/5/2021,1.41E+18," All the narratives are no longer tenable, or were maybe just stupid to begin with:1. silver to bitcoin's gold - never made any sense2. payments coin - superceded by stables &amp; others3.  testnet - not sure if still relevantetc",33697.84,South Africa,687,2225,FALSE,FALSE,12/18/2007 5:21,FALSE,FALSE,2225,0.944444444,-0.525
1938,7/5/2021,1.41E+18, Thanks!!   0x515791E3B56fB3dd63328Ce89c08F9755773eC0D$bsc $btc BNB Bitcoin BSC EarnBNB BTC,33697.84,United States of America,141,2603,FALSE,FALSE,6/12/2020 23:30,TRUE,FALSE,2603,0.2,0.3125
1942,7/5/2021,1.41E+18, Happy to participateNFT lead the world for sureHappy to be the part of the project look into protocols️ Airdrop NFT Crypto BNB Bitcoin,33697.84,,114,937,FALSE,FALSE,10/9/2020 16:47,TRUE,FALSE,937,1,0.8
1943,7/5/2021,1.41E+18," For all those who are new to this working from home Bitcoin trading options Here's a little tip:Get a trusted Bitcoin expert and stick to him Invest and play at similar times each day.Because :In times of chaos, your investment is your anchor to success",33697.84,South Africa,8,114,FALSE,FALSE,6/1/2020 3:35,TRUE,FALSE,114,0.338636364,0.062215909
1946,7/5/2021,1.41E+18,"  Amount of adoption goes to slow while Bitcoin is going up so i think the metrics will only be a land slide different then fiat system, people not smart enough to see that they need to get minimal 0.024-0.0024 ASAPotherwise the 0,01% becomes only the 1% in the Bitcoin standard",33697.84,Soon Dutch fugitive,70,102,FALSE,FALSE,2/24/2018 14:15,TRUE,FALSE,102,0.592857143,-0.063392857
1950,7/5/2021,1.41E+18,"(A Bitcoin Indicator Just Hit A 9-Month Low, What Does It Mean For The Price?) - Cryptollic -  ",33697.84,Global,1397,4066,FALSE,FALSE,3/28/2015 9:56,FALSE,FALSE,4066,0.49375,-0.15625
1963,7/5/2021,1.41E+18,Congratulations  Thanks for your feedbackGod bless you for trusting and investing with us Bitcoin cryptotrading ,33697.84,United Kingdom,1334,1489,FALSE,FALSE,8/13/2020 17:19,TRUE,FALSE,1489,0.2,0.2
1965,7/5/2021,1.41E+18,Name the person who received bitcoin for spending his fiat dollars  for Laszlo Hanyecz please. This man is an absolute legend for recognizing better money. Weird that when you google anything about Bitcoinpizzaday you only see Laszlo’s name. ,33697.84,,933,3541,FALSE,FALSE,8/2/2020 16:51,TRUE,FALSE,3541,0.85,0.05
1969,7/5/2021,1.41E+18,️Whoa! What a lucky break! Excellent win in the amount of 0.000528098 BFG. My Username: PortableHe betfurysuccess bitcoin staking,33697.84,,25,537,FALSE,FALSE,10/22/2013 12:15,FALSE,FALSE,537,0.744444444,0.738888889
1973,7/5/2021,1.41E+18,The Bitcoin exchange fund flow ratio has just hit a nine-month low. Here is what it might mean for the price of the cryptocurrency. The Exchange Fund Flow ...Read more: ,33697.84,United States of America,5743,4653,FALSE,FALSE,10/17/2018 11:18,FALSE,FALSE,4653,0.495833333,0.0625
1974,7/5/2021,1.41E+18,"Joe Biden wants to crackdown on ransomware according to statements he made on Friday, after hackers hijacked software from a Miami-based IT supplier called...Read more: ",33697.84,United States of America,5743,4653,FALSE,FALSE,10/17/2018 11:18,FALSE,FALSE,4653,0.3,0.35
1975,7/5/2021,1.41E+18,Quick TakeChina&amp;8217;s crackdown on bitcoin mining has led the network&amp;8217;s hash rate to drop by more than 50%.But what caused the negative approach? W...Read more: ,33697.84,United States of America,5743,4653,FALSE,FALSE,10/17/2018 11:18,FALSE,FALSE,4653,0.475,0.258333333
1976,7/5/2021,1.41E+18,"The digital coins are struggling as regulators around the world bring in tough new rules, and because of the unlikely impact of electric car maker Tesla on...Read more: ",33697.84,United States of America,5743,4653,FALSE,FALSE,10/17/2018 11:18,FALSE,FALSE,4653,0.457575758,-0.050505051
1977,7/5/2021,1.41E+18,"Technical setups, coupled with optimistic fundamentals, project Ethereum, would rise sharply against Bitcoin in the coming weeks. Ether (ETH) could rise by...Read more: ",33697.84,United States of America,5743,4653,FALSE,FALSE,10/17/2018 11:18,FALSE,FALSE,4653,0.45,0.125
1978,7/5/2021,1.41E+18,The Bitcoin exchange fund flow ratio has just hit a nine-month low. Here is what it might mean for the price of the cryptocurrency.The Exchange Fund Flow...Read more: ,33697.84,United States of America,5743,4653,FALSE,FALSE,10/17/2018 11:18,FALSE,FALSE,4653,0.495833333,0.0625
1996,7/5/2021,1.41E+18, Airdrop Airdrops Airdropinspector BSC BinanceSmartChain WhaleFall Whale Crypto BitcoinI like this project I will invite friends to join in this project because it is a very good project  ,33697.84,Bangladesh,30,312,FALSE,FALSE,10/26/2016 2:55,TRUE,FALSE,312,0.78,0.91
