"X","Date","TweetID","Text","BTC.Price","User.Location","User.follower.count","UserFollowingCount","User.Verified","Quote.Status.","AccountCreationDate","Default.Profile.Theme.","DefaultProfileImage","TotalAccountLikes","Subjectivity","Polarity"
6,"07/30/2021",1421119642207244288,"Ethereum 2.0 Almost Here? Taking a Deep Dive Into the London Hard Fork by Flipside CryptoThe long-awaited and much-discussed London hard fork for Ethereum has nearly arrivedCoinMarketCap Crypto Cryptocurrency Bitcoin Ethereum",38991.71,"",2279635,1915,"True","False","2013-12-24 16:50:12","True","False",1915,0.470833333333333,-0.120833333333333
9,"07/30/2021",1421119636364578816,"1- Buy Bitcoin2- Hodl to Get Rich 3- Make passive income to stay rich.",38991.71,"Blockchain",648,1833,"False","False","2011-06-02 14:30:34","False","False",1833,0.75,0.375
12,"07/30/2021",1421119633655017472,"  Change in to bitcoin :p",38991.71,"El Salvador",133,649,"False","False","2018-06-23 18:54:54","False","False",649,1,0.75
25,"07/30/2021",1421119611253231616,"Happy Weekend to all Bitcoin Bulls and Bears",38991.71,"",86,301,"False","False","2012-05-24 16:05:57","True","False",301,1,0.8
34,"07/30/2021",1421119591581986816,"The total Bitcoin Options OI increased by 48% in July: from $4.52B to $6.68B. BTC options contracts worth $1.5 billion will expire today on unregulated derivatives exchange Deribit.$4.12B on ;$128M on Options analytics  ",38991.71,"",69496,1469,"False","False","2018-11-01 13:14:08","True","False",1469,0.425,0.15
37,"07/30/2021",1421119569649836032,"Kazakhstan ignores IMF, allows banks to facilitate cryptocurrency  trade Follow  for the latest news &amp; updates.Crypto cryptocurrencies CryptoNews Altcoin  Bitcoin BTC  IMF Kazakhstan",38991.71,"Worldwide",474,254,"False","False","2018-09-18 16:31:10","True","False",254,0.9,0.5
40,"07/30/2021",1421119558698549248,"  Thanks a lot! I have this one already lined up as my primary source of information.I hope to not only connect to the satellite signal through this project but also to some fellow shadowy super coders. The value of Bitcoin lies in the network, after all! resilience",38991.71,"Hypagora",184,1722,"False","False","2018-07-15 20:51:15","False","False",1722,0.591666666666667,0.266666666666667
42,"07/30/2021",1421119552931303424,"Plastic finance ESG Compliant plasticfinance plastic bitcoin ico investment pollution waste plasticwaste environmentThis is one of the great project with a clear road map with experienced and successful team. ",38991.71,"India",1393,1612,"False","True","2020-10-28 21:19:44","True","False",1612,0.596666666666667,0.45
47,"07/30/2021",1421119542688899072,"BitcoinStrong 40% bounce off the 30k lowsAfter 9 green days i a row  is facing some resistance nowIn my opinion 42k is still the most important level to watch Everything below is a dead cat bounce All above is bull market territory ",38991.71,"moon",57341,497,"False","False","2013-05-01 12:58:30","True","False",497,0.46,0.1
48,"07/30/2021",1421119542634373120," Dont worry. You will never be offered a million or a Bitcoin to take the vax. You aren't that important.",38991.71,"",18,282,"False","False","2017-08-02 03:33:11","True","False",282,1,0.4
51,"07/30/2021",1421119534639902720," Price Dips Before Catapulting to New Highs! Institutional Entities Amp up Their Holdingsbitcoin btcprice coinpedianews",38991.71,"",4653,2399,"False","False","2016-12-08 11:12:33","False","False",2399,0.454545454545455,0.170454545454545
62,"07/30/2021",1421119517879521280," Make your own treasury in bitcoin . Buy the dip.",38991.71,"",386,2103,"False","False","2015-08-29 21:59:21","True","False",2103,1,0.6
87,"07/30/2021",1421119449415962624," Green bitcoin engineering has got nothing to do with feminism. Global warming has been the topic of a predominately male engineering environment for decades, and I'm sure if you look at most of the leadership at ARGO et al, will likely have something dangling between their legs.",38991.71,"",218,1412,"False","False","2020-04-13 07:40:11","True","False",1412,0.464814814814815,0.133333333333333
98,"07/30/2021",1421119433796374528,"Believe it or not!! Ethereum can go as high as number 1 cryptocurrency even before Bitcoin!-WHY?- Because within the next 12 months, ETH will experience a Triple Halving.-What is Triple Halving?Open Your Trading Account Now &amp; Learn ",38991.71,"Cyprus",843,939,"False","False","2016-06-19 09:15:00","True","False",939,0.27,0.08
105,"07/30/2021",1421119414653444096,"Bitcoin Ethereum GBTC Grayscale Wealthfront $25B investment firm adds 'riskier' Grayscale GBTC and ETHE for clients  ",38991.71,"United States of America",29096,20275,"False","False","2011-07-06 20:03:47","False","False",20275,0.4,-0.2
108,"07/30/2021",1421119412296241152,"ProFunds Launches First Bitcoin Mutual Fund ",38991.71,"United States of America",13412,12753,"False","False","2009-09-07 03:10:30","True","False",12753,0.333333333333333,0.25
130,"07/30/2021",1421119374224625664,"massive environmental fears… and wild contradictory tweets from Elon Musk… the smartest money in the world has been buying bitcoin and Ethereum",38991.71,"United States of America",500,3335,"False","False","2009-10-24 21:45:39","True","False",3335,0.7,0.05
134,"07/30/2021",1421119369845772288,"If you are Selling your Bitcoin , You are Exchanging Bitcoin  to a Currency that IS LOSING IT’S VALUE AND PURCHASING POWER.THE WORLD WILL ADOPT BITCOIN BECAUSE OF INFLATION.YEAR OVER YEAR ALL Bitcoin DOES IS GO UP IN VALUE VSALL CURRENCIES THAT LOSES THEIR VALUEHODL ",38991.71,"",614,1190,"False","False","2019-03-13 16:14:00","True","False",1190,0.1,-0.3
135,"07/30/2021",1421119365110542336,"If You Invested $1,000 In Bitcoin, Ethereum, Dogecoin And Other Cryptos One Year Ago, Here's How Much You'd Have Now ",38991.71,"United States of America",3195,3251,"False","False","2015-08-07 17:23:40","False","False",3251,0.2875,0.0375
140,"07/30/2021",1421119341681127424,"Stoked for this new weekly series by  - ‘Bullish on Bitcoin’ ",38991.71,"United States of America",205,1219,"False","True","2019-06-30 22:09:16","True","False",1219,0.454545454545455,0.136363636363636
150,"07/30/2021",1421119305589088256,"There are so many shit-fiat currencies, but for some reason bitcoin receives far more scrutiny.  ",38991.71,"United States of America",4381,2426,"False","True","2016-03-01 22:13:00","True","False",2426,0.666666666666667,0.366666666666667
158,"07/30/2021",1421119281207693312," New infrastructure bill has new tax laws around Crypto...Transactions of $10,000+ have to be reported to the IRS. Sound familiar to the rule around $10,000 cash deposits? Solution: Daily DCA Bitcoin",38991.71,"United States of America",370,624,"False","False","2018-01-09 20:55:51","True","False",624,0.361818181818182,0.209545454545455
159,"07/30/2021",1421119277076291584,"In which I make my  debut with a deep dive into the king of cryptocurrencies. Is Bitcoin a good investment? A guide for Canadian investors.  Investing Crypto Crytocurrency",38991.71,"Canada",1256,1043,"False","False","2011-01-28 21:49:21","False","False",1043,0.5,0.35
162,"07/30/2021",1421119268314357760,"  Yeah, that is why a lot of people call bitcoin ""digital gold""Bro, you don't have to be so insulting I bet if we sat down for 30 minutes on the topic you'd actually realize you probably support it. NOT CRYPTO though, that shit is a scam.",38991.71,"United States of America",2792,2352,"False","False","2009-05-24 02:52:50","False","False",2352,0.437777777777778,-0.271111111111111
169,"07/30/2021",1421119252858245120,"good project, hopefully in the future it can be even more successful for the teamCrypto Bitcoin Ethereum ETH Airdrop BSC BNB DuelistKing MysteryBox ",38991.71,"United Kingdom",139,434,"False","True","2010-08-18 08:20:04","False","False",434,0.54375,0.4875
185,"07/30/2021",1421119226056744960,"   I debuted my trading career as a solo trader and lost so much money before getting introduced to mrs Robin Moore by a friend and guess what her bitcoin trading platform has been the best trading investments I've done in a long while my portfolio rose from 1.5 btc to 9.7 btc",38991.71,"Trivandrum",31,152,"False","False","2010-12-29 08:00:33","False","False",152,0.4625,0.4375
187,"07/30/2021",1421119224420855808,"The fact we’re still seeing rapid adoption of crypto assets despite this most recent pullback tells me we’re experiencing a short-term selloff… Not a new bear market.Let me put this in perspective for you…Even though we’ve seen China ban bitcoin mining…",38991.71,"United States of America",500,3335,"False","False","2009-10-24 21:45:39","True","False",3335,0.401515151515152,0.143939393939394
200,"07/30/2021",1421119207324934144,"The Asymmetry of Bitcoin Scams is all Very sad - ",38991.71,"United Kingdom",3320,4252,"False","False","2016-02-19 17:43:08","True","False",4252,1,-0.65
201,"07/30/2021",1421119202413273088,"If you are Selling your Bitcoin , You are Exchanging Bitcoin  to a Currency that IS LOSING IT’S VALUE AND PURCHASING POWER.THE WORLD WILL ADOPT BITCOIN BECAUSE OF INFLATION.YEAR OVER YEAR ALL Bitcoin DOES IS GO UP IN VALUE VSALL CURRENCIES THAT LOSES THEIR VALUEHODL ",38991.71,"",614,1190,"False","False","2019-03-13 16:14:00","True","False",1190,0.1,-0.3
226,"07/30/2021",1421119140362809344,"We live at a time where DOGE is worth more than serious projects like Bitcoin Cash or Polkadot.With a popular political concept there is nearly no doubt that CheCoin will go extremely far. x100 is not a option x1000 is the objective. HODL  ",38991.71,"Chine 中國 🇹🇼 - Yunnan",152,152,"False","False","2010-01-23 21:02:37","False","False",152,0.474074074074074,0.139225589225589
232,"07/30/2021",1421119130112077824,"    Yes. Ideally a chapter out of the Bitcoin Standard.",38991.71,"",628,576,"False","False","2020-07-03 12:14:01","True","False",576,0.5,0.45
246,"07/30/2021",1421119106967773184," Is Fantastic project. I think it is the best project in 2021. I am happy to join this great project. Plastic finance ESG Compliant plasticfinance plastic bitcoin ico investment pollution waste plasticwaste environment ",38991.71,"Bangladesh",6238,6905,"False","True","2019-06-13 14:29:23","True","False",6905,0.59,0.56
287,"07/30/2021",1421119009530040320,"Extraordinarily 2021 that my street's mutual aid WhatsApp group keeps being infiltrated by bitcoin spam.",38991.71,"Brighton",4397,2761,"False","False","2015-11-20 00:29:00","False","False",2761,1,0.333333333333333
310,"07/30/2021",1421118957981880320," Thanks for shared this wonderful opportunityHopefully the project will be better in the future. Crypto Bitcoin Ethereum ETH Airdrop BSC BNB DuelistKing MysteryBox",38991.71,"",75,1011,"False","False","2020-03-04 14:07:51","True","False",1011,0.45625,0.425
313,"07/30/2021",1421118947202568192,"linkedin twitter facebook instagram tiktok socialmedia tumblr dogecoin wedding deal gift gifts giftideas shop shopping affiliatemarketing bitcoin popcorn Enjoy $10 off Orders of $50+ - Use code IR10 - ",38991.71,"United States of America",67853,7040,"False","False","2012-06-25 04:38:20","False","False",7040,0.5,0.4
320,"07/30/2021",1421118936557424640," bitcoin would already be 100k + if it werent for derivs honestly",38991.71,"",557,456,"False","False","2018-02-16 05:46:35","False","False",456,0.9,0.6
327,"07/30/2021",1421118916428959744," MSTR = $6 Billion Market Cap and 105,085 BTC on balance sheet. Less than 1 year involved with Bitcoin.COIN = $50 Billion Market Cap and 4,482 BTC on balance sheet. Has been involved with Bitcoin since 2012.I don't know about you guys but I know who is the clear winner here!",38991.71,"United States of America",1558,184,"False","False","2019-10-10 22:51:40","True","False",184,0.225,-0.0208333333333333
343,"07/30/2021",1421118852809756672,"MICROSTRATEGY TO BUY MORE BITCOIN DESPITE Q2 IMPAIRMENT LOSS bitcoin btc",38991.71,"GenesisBlock",2413,781,"False","False","2019-01-07 15:58:34","True","False",781,0.5,0.5
385,"07/30/2021",1421118745389395968,"Plastic Finance is a crypto project that combines the crypto industry with the business sector as the underlying,  Plastic finance ESG Compliant plasticfinance plastic bitcoin ico investment pollution waste plasticwaste environment cryptounderly",38991.71,"Voronezh, Russia",1075,3996,"False","False","2017-01-22 11:17:29","True","False",3996,0,-0.2
404,"07/30/2021",1421118691836526592,"The headliner raise was crypto infrastructure provider Fireblocks snapping up $310M.Eco, a crypto wallet incubated by Uber co-founder raised a fresh $60M. Exchange Lemon Cash collected $16M to expand across Latin America.Bitcoin rewards company Lolli raised $10M.",38991.71,"India",1442,1486,"False","False","2010-06-25 05:15:42","False","False",1486,0.5,0.3
409,"07/30/2021",1421118688208560128,"hello this is bitcoin speaking how can i fuck up your day? ",38991.71,"Patagonia",119,493,"False","False","2011-04-12 10:09:54","False","False",493,0.6,-0.4
430,"07/30/2021",1421118646294810624,"$lovely launch day! ..$btc $eth $tel $ubx $fjake $inu $hokk $shib $doge $ass $kishu babydoge ShibaSwap Bitcoin Cryptocurency ",38991.71,"Canada",249,859,"False","True","2010-12-04 05:43:04","False","False",859,0.75,0.625
432,"07/30/2021",1421118641064464384,"       Bitcoin...I'm loving it! Bitcoin...it's better than fiat! Carry on and Buy Bitcoin.",38991.71,"Billings, MT",260,714,"False","False","2009-05-23 18:14:53","True","False",714,0.725,0.6875
436,"07/30/2021",1421118627479228416,"More bitcoin ",38991.71,"Moon 🌙",1006,1336,"False","True","2009-03-19 03:36:09","False","False",1336,0.5,0.5
438,"07/30/2021",1421118624857616384,"NSTworld Polish police  said they had uncovered a bitcoin mining operation in their own headquarters in Warsaw. Poland Cryptocurency cryptomining",38991.71,"Malaysia",757285,431,"True","False","2009-07-09 09:04:01","False","False",431,1,0.6
455,"07/30/2021",1421118574534475776,"Good morning. Bitcoin is digital real estate. With none of the impairments for the owners. Even commies should be liking it, cause you won't have rent seeking landlords to milk the vulnerable.",38991.71,"Camp Nou",1445,864,"False","False","2008-04-10 12:42:38","False","False",864,0.35,0.1
462,"07/30/2021",1421118549750427648,"Latest on Bitcoin dogecoin Crypto &amp; more  ",38991.71,"Global",18911,19820,"False","False","2009-03-19 00:14:12","False","False",19820,0.7,0.5
464,"07/30/2021",1421118544188674048,"And finally a small bonus non stock round: Bitcoin ",38991.71,"United States of America",103798,167,"False","False","2020-04-16 16:57:54","True","False",167,0.4,-0.225
467,"07/30/2021",1421118534793506816," Is Fantastic project. I think it is the best project in 2021. I am happy to join this great project. Plastic finance ESG Compliant plasticfinance plastic bitcoin ico investment pollution waste plasticwaste environment ",38991.71,"Bangladesh",6238,6905,"False","True","2019-06-13 14:29:23","True","False",6905,0.59,0.56
470,"07/30/2021",1421118515197657088," Fortunately no as of now n most of my family members n friends are in medical field.  All vaccinated.  Ty for d knowledge u share about Bitcoin .",38991.71,"",26,360,"False","False","2018-05-20 09:15:12","True","False",360,0.4,0.1
497,"07/30/2021",1421118424424407040,"TikTok makes me wanna start my own company and invest all my money into BitCoin and also get a rhinoplasty hahaha it's absolutely crazy ",38991.71,"AUH/MNL",367,634,"False","False","2009-04-15 17:32:28","False","False",634,0.766666666666667,0.0666666666666667
501,"07/30/2021",1421118401993449472,"U.S. President Joe Biden and lawmakers have agreed on the small print of a roughly $1 trillion bipartisan infrastructure package deal with measures to step up tax enforcement round crypto belongings. ",38991.71,"",132,3324,"False","False","2020-01-01 15:17:06","True","False",3324,0.4,-0.183333333333333
507,"07/30/2021",1421118388173213696,"Live Bitcoin Price: $39,007That's a decrease of 2.39% in the last 24hrs! Perfect time to jump in?! Buy with Binance and save 20% on buying fees FOREVER via the link below...Bitcoin Binance Crypto Doge",38991.71,"United Kingdom",39876,7581,"False","False","2011-03-09 18:59:44","False","False",7581,0.522222222222222,0.378787878787879
510,"07/30/2021",1421118382967910400,"Coming to the end, this was good for me.Ethereum bitcoin dogecoin chainlink                       doge crypto tsla news btc  cardano ada ",38991.71,"京都",831,283,"False","False","2010-01-27 13:04:57","False","False",283,0.6,0.7
513,"07/30/2021",1421118377708371968,"If you're not technical enough to self validate and  hold your own keys you probably should stay away from bitcoin. Bitcoin is for anyone not everyone.",38991.71,"1952",41366,2382,"False","False","2011-09-09 19:45:10","False","False",2382,0.533333333333333,0.2
514,"07/30/2021",1421118376617943040,"During ""Be a banker 222 P2Pgarden"" practices you must keep $222 or more cash or bitcoin. After feeling Bitcoin price vibration, you will be a winner. Google: Be a banker 222 P2Pgarden  ",38991.71,"Canada",196,738,"False","True","2020-10-21 22:50:39","True","False",738,0.5,0.5
519,"07/30/2021",1421118362659086336,"In morning bloomberg post a fud news from India and now post a super bullish news from Germany..In short, dont plan your trade on Media reporting until u dont have any experience to deal with fax..Bitcoin ",38991.71,"India",3190,582,"False","True","2010-04-28 09:16:30","True","False",582,0.483333333333333,0.166666666666667
522,"07/30/2021",1421118357324107776," If you like badly written comedy fiction, send a tweet saying you're an investor in Bitcoin startups and looking for business plans.",38991.71,"Cambridge, BOS, CAM. 🏳️‍🌈",3944,607,"False","False","2009-01-13 23:57:36","False","False",607,0.666666666666667,-0.7
529,"07/30/2021",1421118342513889280,"  … despite “kind &amp; gentle” being antithetical to a sysytem based in exploitation &amp; consumption. e.g. How can  extremely eco-destructive bitcoin be considered ‘progressive’ except as yet another way to process monetary 1s &amp; 0s?",38991.71,"",308,582,"False","False","2014-06-06 18:08:18","True","False",582,0.9,0.225
531,"07/30/2021",1421118340911747072,"The sexual tension between them is unreal ",38991.71,"United Kingdom",401,786,"False","False","2016-12-25 21:57:08","True","False",786,0.833333333333333,0.5
534,"07/30/2021",1421118336226627584,"I play and get Cashback!  The more you play on  - the higher Rank and Cashback amount you will get! My Username: User320736 betfurysuccess bitcoin staking",38991.71,"Philippines",64,307,"False","False","2010-03-09 11:15:58","False","False",307,0.633333333333333,-0.0833333333333333
538,"07/30/2021",1421118329377394688,"Worked on needle scales for the first time in a while yesterday. Made good progress on splits, and handstands yesterday but no video.  Watching Bitcoin, but resisting the urge to add more here on this 1.5% dip. Maybe later, but for now focusing on hip flexors and quads. ",38991.71,"United States of America",64,132,"False","False","2020-08-24 09:03:34","True","False",132,0.358333333333333,0.3625
550,"07/30/2021",1421118295013462016,"  there is already a common goal that robs the satanic elitists of their power.. Bitcoin",38991.71,"Tulum",233,586,"False","False","2020-12-11 05:12:14","True","False",586,0.5,-0.3
551,"07/30/2021",1421118287283466240,"By adopting Bitcoin as legal tender, ElSalvador now has economic leverage aginst IMF/World Bank. Who's next?¯\_(ツ)_/¯ ",38991.71,"21 Bitcoin Avenue, Mars",646,1115,"False","False","2013-02-18 18:51:25","True","False",1115,0.2,0.2
554,"07/30/2021",1421118273484173312,"Some lessons for Bitcoin:1) There's real precedent for U.S. gov control2) However, like Prohibition, controlling indefinitely may be a fools' errand3) We operate in a global context - as with trade and gold, importing crypto tech and talent (vs. exporting) likely matters",38991.71,"United States of America",9074,2011,"False","False","2008-05-05 04:58:32","False","False",2011,0.433333333333333,0.0666666666666667
556,"07/30/2021",1421118271567409152,"  Yeah I mean, when you talk energy you talk watt usage, nothing else :) Bitcoin people can try to flip the energy consumption any way they want, but there will always be people spending more energy than necessary to do something that other solutions can do better ^^",38991.71,"",325,665,"False","False","2020-12-24 10:33:46","True","False",665,0.677083333333333,0.177083333333333
558,"07/30/2021",1421118270535520256,"Interesting historical context relevant for Bitcoin -  Americans were banned from storing their wealth in gold, as recently as 1975 (!!!) The Gold Reserve Act of 1934 prevented Americans from holding gold (other than jewelry or some collector's coins) for over 40 years.(1/2)",38991.71,"United States of America",9074,2011,"False","False","2008-05-05 04:58:32","False","False",2011,0.405,0.155
559,"07/30/2021",1421118270451683328,"      Trash is what happens to countries that don't have REAL money due to corruption, Gov't printing money, and big Gov't programs to solve people's problems. Sound familiar? Big cities in USA? Why Bitcoin is needed everywhere.",38991.71,"Marion, IA",68,123,"False","False","2016-10-09 22:50:51","True","False",123,0.295833333333333,0.141666666666667
560,"07/30/2021",1421118265833795584,"Best Bitcoin and crypto wallets for 2021 - CNET ",38991.71,"",1391,103,"False","False","2019-04-02 19:00:44","True","False",103,0.3,1
576,"07/30/2021",1421118231037763584,"First, they discredit it. Then, they plan to build a country’s infrastructure by taxing it. Bitcoin",38991.71,"Worldwide",2166,3665,"False","False","2009-07-04 19:28:02","False","False",3665,0.333333333333333,0.25
587,"07/30/2021",1421118218215776256,"linkedin twitter facebook instagram tiktok socialmedia tumblr wedding dogecoin deal gift gifts giftideas shop shopping affiliatemarketing bitcoin popcorn Enjoy $10 off Orders of $50+ - Use code IR10 - ",38991.71,"United States of America",67853,7040,"False","False","2012-06-25 04:38:20","False","False",7040,0.5,0.4
593,"07/30/2021",1421118215585943552,"Check out this weeks State of Coin: Shadowy Super-Coders Unite, by  ! Be sure to subscribe and share with your friends! Bitcoin btc crypto bitcoinnews ",38991.71,"",293,488,"False","False","2011-04-07 23:14:27","True","False",488,0.888888888888889,0.625
619,"07/30/2021",1421118155674460160,"Bitcoin Retirement Plans | BnkToTheFuture, Celsius &amp; First DigItal Trust | BF LIVE 91    Bittrex Global via via⟶  ",38991.71,"🇺🇸",28039,13365,"False","False","2008-08-25 03:17:30","False","False",13365,0.208333333333333,0.0965909090909091
621,"07/30/2021",1421118149735374848," The shareholders seem happy. You’re the only one who seems upset about it, yet you have no skin in the game. Why are you so upset over something that doesn’t affect you? Bitcoin has benefited Microstrategy immensely. You don’t understand btc but your pension will buy it one day.",38991.71,"United States of America",55,569,"False","False","2017-12-11 13:12:50","True","False",569,0.85,0.1
622,"07/30/2021",1421118149152239616,"Michael Saylor: “Bitcoin Is Digital Real Estate And Is Now Held By More Than 114 Million People, Making It The Most Widely Held Financial Asset In The History Of The World”  CryptoCurrency (from Reddit) ",38991.71,"",2228,1301,"False","False","2012-07-28 03:44:52","False","False",1301,0.283333333333333,0.183333333333333
623,"07/30/2021",1421118148896428032,"AANews BTCEUR BTCGBP BTCUSD BTCUSDT MicroStrategy to Buy More Bitcoin Despite Q2 Impairment Loss  - dumbwire ",38991.71,"United States of America",29096,20275,"False","False","2011-07-06 20:03:47","False","False",20275,0.5,0.5
624,"07/30/2021",1421118146056970240,"Bullish On Bitcoin.That's the new title of my Friday, 2 PM EDT livestreams. I intend to bring on guests every week.Today I am honored to have  joining to share his thoughts on the market.Don't miss it.",38991.71,"Not Financial Advice. ",512564,1114,"True","False","2008-11-12 22:58:17","False","False",1114,0.454545454545455,0.136363636363636
629,"07/30/2021",1421118136653434880," Well done to  for dis amazing project,giving people the power to govern their exchangew  ",38991.71,"Nigeria",23,344,"False","False","2018-01-20 09:08:43","True","False",344,0.9,0.6
638,"07/30/2021",1421118114935173120,"Looks like  wants to put a higher low over the weekend or by early next week. As long as it stays above $36.5k on a closing basis Bitcoin will give another try at mid to deeper $40k area before another pullback.",38991.71,"Crypto Twitter ",14044,919,"False","False","2017-07-11 15:56:56","False","False",919,0.2125,0.0625
653,"07/30/2021",1421118087714152448,"               Straight grinding sir",38991.71,"Thailand",49495,1102,"False","False","2011-10-19 04:32:07","True","False",1102,0.4,0.2
658,"07/30/2021",1421118075567443968,"  A great gemViceToken Vice iceX Crypto etherium Bitcoin",38991.71,"Universe",301,4809,"False","False","2020-11-04 13:45:16","True","False",4809,0.75,0.8
662,"07/30/2021",1421118066822373376,"Hey I joined a network called SurveyJ and earned $146 today! You get paid for testing out new free apps and posting on social media. Sign up with my link for an instant $40 signup bonus!  surveyj cashapp bitcoin",38991.71,"",236,694,"False","False","2019-11-17 05:53:12","True","False",694,0.496969696969697,0.142424242424242
666,"07/30/2021",1421118064549109760,"Well done!  Nice narrative. Try to sell to the people that, if we tax every Crypto transactions, which are mostly based on scams and drug dealing, than our ratings will improve and also we got more tax revenue. You haven't learned anything. ",38991.71,"Tweets are not Financialadvice",4698,2148,"False","False","2018-02-10 10:35:06","True","False",2148,0.666666666666667,0.533333333333333
